1日目,村娘パメラ,占い師,ああ、もう時間なのね……。まあ、屋はさんざん言った通り村っぽく思ってるし、羊は占い外すとして。妙は好印象ね。思考の流れに引っかかりも無いし、>>230>>235のフリーデル警戒してた意識が村っぽく見えるわ。旅はゆっくり議事に目を通してくれてるわね。まだ判断は出来ないけど、>>229見てると自分の意見を言ってくれそうだし、待っててもいい気がしてる。>>250は見てるわよ、私の印象が他
1日目,村娘パメラ,占い師,に比べて落ちる……うーん。服はまだ分からない感じだけど、直近の発言の印象がいいわ。冷静に判断しようとしてくれてる感じ。年は何となく流れに逆らわない感じで、狼仮定敵を作らない動きにも見えたのだけど。>>198下段の意識、>>209下段>>231中段の考え方から、彼なりの意図をもって動いていたのが理解出来たわ。>>225「僕の初日は狼探してない」の一言も納得、占外していいと思う。修は
1日目,ならず者ディーター,村人,>>243修了解。「占い師の自由にさせたい」っていうフリーデルの主張を見ても、占い軸の人なんだろうな。ニコラスは読み込みが間にあわなかった。遅れて登場した割には結構激しい局地戦をしているな、という印象。オットーは狼でも占い無しで捕まえる枠だと思っていたんだけど、ここまでオットーに視線が集まると、さすがにオットー占一択かねえ。【●屋】
1日目,村娘パメラ,占い師,個人的には好きよ、面白いわ。うーん、黒っぽさは感じないけど……あまり白黒取れない感じ、色見たいわね。>>244も見てるわよ。私が我を通しきったのは否定できないわね……フリーダム系の修なら理解あるかと期待したけど、残念だわ。者書農はごめんなさい、もう少し悩ませて……。【●兵○修】で希望を出すわ。@2
1日目,仕立て屋エルナ,霊能者,私的には農夫さんが「上手な人」って思った。狼なら良い位置に回り込むテクを持った人。パン屋に真っ向ぶつかる司書さんも狼としては性急なので白かな？って印象。兵隊さんを面と向かって嫌いっていうのはキリの範囲で気にはなってる。けど兵修間はもう少し様子を見たいかも。少年は無難だけど思考に歪みは感じてない。チップ補正かな？　(笑少女は戦術スキー？もう少し灰や役職との絡みが見たい。
1日目,農夫ヤコブ,人狼,僕はテクニシャン？村の寄り合いでちょっと飲み過ぎたー。とりま【⚫︎屋】です。ちっと精査できてないー。
1日目,少年ペーター,村人,リザ>>256当事者の書が軟化するってことは、「システマチックな非霊ＣＯ箇所占い」を許容する事込みと思ったけど。下手したらそういう流れに村が戻らないだろうかね？「クララ狼ならロック継続が視点作りやすい」は同意。パメ>>259初日なんて言うほどの差ではないよ。リデルの占真贋見たけど、要素的に決めつけすぎかなと。言いたいことは分かるが。@2
1日目,少女リーザ,村人,現時点での希望よのさ。占屋年妙神兵旅者｜長商娘●神屋屋屋屋屋屋｜兵屋兵○書書服服旅※＿｜屋書修※兵＆農オットー白でしょ。こうなゆことは予想ちてたけど。確白できゆのは悪くないかやオットー占でいいとおもうわのよ。
1日目,司書クララ,村人,パメラ>>259そんなに偽に見られてないとは思いますが…兵狼でもパメラの中身はわからないのと対抗>>254が●兵というとこはどう考えてます？ニコラス>>264その「柔軟に」は>>224から引っ張ってきたものであって、そこ以外の考えは>>261の通りです。
1日目,農夫ヤコブ,人狼,これはヒドイ。屋占い止めたくなるねー。占い師sで兵希望が2人いるのが目立つべ。
1日目,仕立て屋エルナ,霊能者,パン屋さんはお話させ続ければいいと思う。占狼狼を言ってた時はちょっと引いたけど、それを初日に言うって事は喋りたがりだからリア忙を犠牲にしてでも喋ってくれると思う。(多分屋>>151ありがと。思考に歪みはなさそうね。神父さん、ならず者さん、旅人さんはまだ精読できてない。ただ、神父さんは結構、灰を型に嵌めて見るタイプかしら？って気がして、喋ってもらいたい枠かな。羊飼いさんは別枠で。
1日目,負傷兵シモン,村人,>>271屋発言でわからない所は突っ込んでいくけどシスターの印象最悪ってところでわからない箇所なんてあるか？言いたいこととしては質ステだ—とかだろ。だから気が早いなってことね。もう一個の方はジムゾンが解説してるしな。エルナ見てるけど心配性なんだろうなって思う。下手に不安をあおる感じでもなくすっぽく感じるな。村目に見ていいんじゃね。オットーが人気だからと言って白とは限らないと思うけど。
1日目,農夫ヤコブ,人狼,いや、でもここまでだと屋狼でも切るだろうから、屋占いで良いべ。ちと寝るべ。
1日目,村長ヴァルター,人狼,ああ、ごめん。リーザ君まとめありがとう揃いすぎててなあ、視界晴れるのはいいが…パメラ君の●兵被りもなんだかなあ。まあ灰雑進めてくるよ【仮決定確認】
1日目,村娘パメラ,占い師,>>280書兵狼仮定、私が狂か真かは分からなくても、取り敢えず落とすのはありじゃないかしら。殴って要素取れれば私の真贋推測もし易くなるし、結局狼占いに護衛寄せられればいいんだから。私は長を狂よりで見てるから、長が●兵でも大丈夫かな……とは思ったけど。確かに気になる点ではあるわね。書の突っ込みはいいな、と思う所ちょこちょこあるのよね。非霊はしてるけど、あまり占いたいとは思わないかしら。
1日目,司書クララ,村人,オットー>>271ええと本気で吊り上げようと思っていましたが？あと>>228は視点漏れとは別の狼仮定であり、黒く見えました。振り返ってみても固い村仮定よりも固くせざるを得ない狼仮定の方がしっくりきたので。ただし村仮定もまかり通るのではあとぶつ切りになってるのは文字制限です。ただ村側なら謝罪します。で回避はありますか？
1日目,少年ペーター,村人,リザ>>279集計お疲れ！ヤコ>>281も分かるけど、この流れだと結局後半吊られる枠かも。今日屋占いでもいいんじゃない？クララ>>280しかし、●兵って死に票って分かりそうとも思うけどね。それでも意思表示するってのは個人要素かね？
1日目,パン屋オットー,村人,喉どうなってるのみんな60くらい持ってるの？@0なんだけど(激怒視界晴らしにも僕占でいいんじゃない？ってことで、決定時間きてないけど勝手に【非霊】回しておくよ。霊の潜伏枠削って申し訳ないけど、炙らなくてよかったよ決定自動了解して夜明けを待つとするかなぁ。パン屋の朝は早いから夜明け後は早めに寝るよー
1日目,旅人ニコラス,人狼,僕的には、白い白いと簡単に言う方が狼的かと思ってしまうよ白に白と言うのは簡単だからねどちらにしても、話題の中心だった屋に色が付けば状況は動いて、屋への視線が意味を持つでしょ>>280 ただ機械的に処理するつもりの相手なら、僕も対話サボるかもねでも話は分かったよ、要は言いたい事は「疑ってるんだからこっちを向け」って事なんでしょう？どっちも個人要素だと思うからこれ以上突っ込まずにそっ閉じ。
1日目,神父ジムゾン,村人,>>249☆んー、屋の黒要素ってゆうたらだいたいクララやヤコブはんが挙げとるとおりになるなあ。久しぶりの参加とのことやし、身構えてしまうんかもしれんけど、疑われることに対して必死過ぎるように見えたな。あと言葉の使い方とかとか。俺の場合、「占い勿体無い」は、明確に色が分かってる対象に使うからなあ。まあ、特に考えずに占い能力を使ってしまうことに(書の白黒関係なく)抵抗がある…というのは理解できる。
1日目,仕立て屋エルナ,霊能者,なんか浅い読みで雑感たらしてごめんね　(*_*;占い希望は統一で非霊が透けてる位置がいいかなって思ってる。黒狙いじゃないけど、非霊が司書さんだけって事は後の皆は霊潜伏に理解や興味があるって認識でいる。私も霊潜伏のメリは知ってるつもりなので今回はそれを活かす進行で臨んでみたいな。あ、パン屋さんと司書さんは本気のキレだと思ってる。戦術への理解が無さ過ぎなのが理由ね。【●書○屋】
1日目,少女リーザ,村人,書>>261★フリーデルのスキユ偽装を感じた理由を聞きたいよのさ。あと、違うというのはどこにかかってゆかちら？
1日目,仕立て屋エルナ,霊能者,あ、パン屋さんの非霊見えた。【●屋○書】に変更。パン屋さんの理論には割と共感する点があって、ここに黒出す占い師がいれば割と議事が動く気がする。パン屋さんのリアルだけが心配だけど、私含めてみんなも推理進むんじゃないかな　(たぶん発表は一分後同時がいいなぁ発表は一分後同時がいいなぁ(大事な事は繰り返しました
1日目,ならず者ディーター,村人,>>291神固さや防御感的なものは確かに俺も感じたな。俺はそこは個人要素と取ったんだが。言葉使いは、人それぞれだからなあ。ジムゾンはニュアンス的な怪しさを感じた、ということなのかな。クララの>>287は本気の黒視っぽいな。書狼屋白だったら悪目立ちに思える。あと、これ思ったんだが、霊潜伏進行だからって「非霊に占いを当てることを第一に考える」って、本末転倒じゃねえかな？
1日目,負傷兵シモン,村人,屋服キレ。屋との切れは他に書あと年も切れてたかな。>>288年そもそも屋以外死に票だと思うんだが。パメラはオットー白く見てるんだからオットー占いはおかしんじゃね。パメラはもう偽にしか見えないんだよな。ノリ陣営しといて真贋気にするとか全部アピだったって事やん。今日全く持って読めてないのはジムゾンかな。よさげではあるんだが今一ピンとこない。>>260で年服旅だと思った理由を知りて—な。
1日目,羊飼いカタリナ,村人,ですよね勝手に潜伏するなら自力で避けろとだから占い師は自由占いしてもいいよ
1日目,神父ジムゾン,村人,まあ、なんでも個人要素で片付けてしまうと推理もあったもんじゃないからなあ。まあそういうことや。ただ、霊回避してこやんかったこと、案外、票が集まってるからアッサリと屋を白視する人がいたことから、現在、屋白ありそうかなあと思ってはいるで。
1日目,司書クララ,村人,リノコまとめありがとう>>279灰全員だとは思わなかったわ。本格的に謝罪しそうだけど、でなければ疑いの深度で絞れそう。あと私は一応>>252で●屋〇旅服でした。意味ないけど今は〇服かな？遠いのでリノコ>>293占評の書きなぐり感と語感のよさから思ったことの言語化能力があって案外慣れてるのでは？（>>246）とで、違うってのはシモンの他国の人～的なのに対するまじめな回答（>>253）より
1日目,少女リーザ,村人,【本決定●屋】・・・でいいのかちら。自由という意見も出てるけろ。リーザ個人とちては●屋でいいと思ってゆわのよ。占屋年妙神兵旅者農書｜長商娘●神屋屋屋屋屋屋屋書｜兵屋兵○書書服服旅※＿＿屋｜屋書修※兵＆農
1日目,ならず者ディーター,村人,>>298神いや、俺は「みんなの上げている屋黒要素は個人要素だから屋白い」と言っているのではなく、>>233>>234の理由で、屋白と予想しているんだが。
1日目,神父ジムゾン,村人,>>296年服旅に占い使おうと考えてたんは単に消去法やね。兵は初回占い除外と言ったものの、あれから書妙農修に対しても使う気が起こらんかったんさ。昼時点でそれほど白さとか見つけれやんかったから候補かな～…ぐらいで、黒要素があってその三人を挙げたわけやない。
1日目,仕立て屋エルナ,霊能者,占い方法どうするの？村長さん、商人さん、村娘さんはセット先と発表する時間を明言してくれると個人的に好印象なんだけど。霊潜伏進行なら自由より統一の方が良いと思う。ごはん食べてくるねー　(^^)/
1日目,ならず者ディーター,村人,>>300妙キリ番おめでとう。票まとめありがとな。【決定異議なし】ここまでオットーが視線を集めちまったら、統一で占うしかねえんじゃねえかな。
1日目,村長ヴァルター,人狼,【本決定確認】リーザ君は本当にありがとうね霊潜伏で自由！とは言わん。●屋でセットで【黒1白3】ね。1分後同時出しでも合わせられるけれど
1日目,少年ペーター,村人,者>>295下段。しかし、ＧＪ出るとでかいからなあ。霊潜伏って、作戦として練り上げられてる途中なのかな。俺たちはまだ霊潜伏の事を１ｍｍも知らないのかもな。兵>>296「屋以外死に票」そりゃそーだ。百歩譲って書だよな。今度、霊潜伏＆自由占いもやってみねえ？ジムゾンは相関関係を見てたから、中盤以降ハマるマンになるかもなあと思った記憶。【決定了解】＠０
1日目,司書クララ,村人,占い方法は統一の発表方法は黒1白3でまとめも各占の喉もないのでこれ以上話し合えません。ペーターくん>>288パメラにはそこまで偽だとは思わないといいましたが占は明日見ると決めてたので見えてないんですよね…とりあえず●兵は中身なんであれそういう真アピではないと思います。要素としては弱いですが、ああいう弱音というかをぽろっと出してしまうのは狼でない印象はあります。
1日目,行商人アルビン,狂人,>>303服霊潜伏である限り統一が良いと思う。【●屋セット済み】発表も黒１白３のままで良いと思うよ。ずっと張り付いてるから、対応はできるよ。
1日目,村娘パメラ,占い師,>>296兵うーん、やはり兵とは話が噛み合わない気がするのよね。自分を疑う相手を疑い返したくなるって、そんなにおかしいかしら？　灰にいる2狼は、隙あらば私を落としたいと考えててもおかしくないと思うんだけど。……まあいいわ。分からなければ、占えばいいんだから。今回は霊が潜伏続けてるから、統一の決定に従うわよ。気は進まないけど……【●屋セット済み】発表は【黒1白3】に合わせるわ。@0
1日目,少女リーザ,村人,書>>299回答ありがとうよのさ。フリーデルがスキユ偽装狼だとすゆと序盤の動きが不要に思えゆよのさ。
1日目,少女リーザ,村人,ん？表がおかちかったよのさ。占屋年書妙神兵旅者農服｜長商娘●神屋屋屋屋屋屋屋屋屋｜兵屋兵○書書＃服服旅※＿＿書｜屋書修＃服＆旅※兵＆農
1日目,仕立て屋エルナ,霊能者,ごはんmgmg…少女さんはお疲れさまでした。【黒1白3】の流れ了解。キレイにまとまって安心です。
2日目,村娘パメラ,占い師,オットー、目を瞑って。このお鍋の中から好きなのを一つ、お玉で掬ってね。……選んだ？これは何かしら、赤い物が見えるけど……ああ、イチゴジャムだわ。汁を吸ってすっかりふやけてるけど、多分ジャムパンだった物の成れの果てね。ジャムパンを食べる【オットーは人間】よ。
2日目,村長ヴァルター,人狼,やあやあ、オットー君。おいしい鍋があるよ、食べていくといい！【オットーは人間】
2日目,仕立て屋エルナ,霊能者,これはパン屋さん確白ね
2日目,行商人アルビン,狂人,南蛮渡来の水晶玉をオットーに向けてみれば・・・白いパンが見えた。【オットーは人間でした】
2日目,ならず者ディーター,村人,【判定確認】推理合っていて良かった。確白になったのは何よりだ。
2日目,村長ヴァルター,人狼,オットー確白おめでとう割られなくてよかった。おやすみ**
2日目,パン屋オットー,村人,白確ごちそうさまだよ【もろかくー】しゃちくってる僕にまとめをぶつけるとはなかなかおにちくな村民さんたちだね。票のまとめとかは僕がやろっか…遅れたらごめんだけどげるとー
2日目,少女リーザ,村人,【判定確認】ここに黒出す占い師がいたや一気に真目が上がったけろ、そううまくはいかないわね。オットーはまとめまかせゆわのよ。おやちゅみ。
2日目,負傷兵シモン,村人,判定確認。オットー確白ね。ぶっちゃけて言うとガチで黒く見えたし、こっからライン追えるから楽だわーって思ってた。まあ何だ、昨日白く見つつ占ってるやつが怪しいじゃね。ドヤ顔披露したりするとさらに。>>309娘疑い返しだけなら黒要素だぞ。だからおかしいことだと言っておこうか。大体疑問あるなら解消すればいい。
2日目,少年ペーター,村人,【屋確白確認】まあよかったんじゃない？狼視点、真狂判明してないってのも含め。オットーは忙しいかもしれないけど、極力（暫定）まとめよろしくね。出来れば、オットーは返しのノリがよさそうだったんで色々議論してみたかったけどね～。なんで偽判定に対しての説明を長々としたのか。。。ｹﾞﾙﾄｰ
2日目,村娘パメラ,占い師,やっぱり屋は白だったわ、まとめよろしくね。これで灰のみんなの視界も晴れたんじゃないかしら……？まあ、私も取り敢えず寝るわ。おやすみなさい。**
2日目,司書クララ,村人,人でしたか…しかし狼は黒出さないんですねオットーごめんなさい、まとめお願いします
2日目,負傷兵シモン,村人,>>320妙うん？よくわからないんだが、白相手に黒出したやつの真目が上がるのがいい事なのか？よくわからんな。俺も寝るとしよう。
2日目,少年ペーター,村人,シモン>>325リザは、>>279でオットー白かもの雰囲気を醸していたから、偽黒は出しにくいと踏んでたんじゃないかな。なので、真黒を期待してたんだろうと。遡って、リザ>>279が偽占への牽制とも取れるな。この見えない敵との駆け引きをしてる感じはリザ村めに見える。シモンはこーゆー、ぱっと疑問に感じる事が浮かぶのはすごいよなっと。僕なら見過ごしてしまうわ。んでは、今日はおやすみ～**
2日目,行商人アルビン,狂人,これでオットーさんは晴れて白確になりましたね。村の皆の視界も少しは開けてきたと思いますね。オットーさんには今日のまとめをお願いしたいです。忙しいとは思いますが。それでは、お休みなさい＊＊
2日目,パン屋オットー,村人,っていうか確白好きじゃないんだけどなんで割らないんだよ(憤怒まぁ集まり方から割りにくいだろうけど、割らなかった理由ってなんだろね。パン屋は白確したら狼利行為を行いそうだったから？はたまたその逆だけど不安煽るため…って疑い続けるとキリないからフラットに考えようあと>>324書★なんで割るのが狼なの？狂人より狼が割りそうだと思った？しゃちくってるから今日の帰りは9時くらいになるよ
2日目,パン屋オットー,村人,…そういえば、夜明け前のヤコブがちょっともんにょりしたんだけどリズは「票の集まり方から屋白っぽい」的なことを言ってたよね。ヤコブは「屋狼だとしても切る場面」って言ってたねリズの見ると騙は黒出しにくいと思うんだけど、ヤコブのは黒が出ても何ら違和感がないって騙りに伝えちゃってると思うんだよねこの場合農狼が狂人に、だけどさ村なら思っても言わないかなぁと>>農★どういう感覚で言ってた？
2日目,神父ジムゾン,村人,日が変わってた。確白は善き哉！ちなみに、もう屋が白と分かったわけやけど…二人から黒が出たら問答無用で屋黒、黒出した二人のどちらかが真と見たなあ。一人から黒なら、真目上がってたかは微妙やなあ。今後そうなったらその占いは偽決めして即吊りするかもしれんで。白確したら狼利追いそう…は考えすぎかと。割るのは狂やと狼が思っていたら、割れるかどうかは狂次第なわけやけど、狂は屋がミスリーしとるかどうか
2日目,神父ジムゾン,村人,…なんて分からんわけやしなあ。そうそう、農による「屋狼なら切る場面」というのがあったからこそ、狂人が誤爆を怖れて偽黒を出せんかった…のかもしれんよ。ほなまたー**
2日目,司書クララ,村人,ちょっとダメそうなので一度寝てから考えます。オットー>>328深く考えてませんが屋白か…→じゃ屋白知ってた狼はなんで黒出さなかったんだ？です
2日目,ならず者ディーター,村人,>>328屋初手は割らないのがセオリーってオットー自身が>>124で言ってるじゃんかwwwまとめ大変だろうけど、よろしく頼むぜ。確白まとめに対する考え方は様々だと思うけど。夜明け早々、確白が「ここ疑ってます」みたいな見解を見せてしまうのは、対象が村だった場合を考えると、控えた方が良いかなあと。疑問点を星飛ばしするのは全然構わないと思うが。あくまで個人的な見解だけど。
2日目,ならず者ディーター,村人,ペーター>>326は、内容を見ると、ぶっちゃけ実質的には「シモンは気付かないのかもしれないけど、こういうことだろう」って言っているように見えるんだが、文面では「シモンすごい」なんだな。正直、兵を持ちあげているように見える。>>330神★「一人から黒なら～即吊りするかもしれんで」の真意が分からない。真黒＋狂狼２白のケースは薄いと見る？
2日目,パン屋オットー,村人,パン屋の朝ははやい…ふわーあ>>332書:成る程ね、狂特攻のほうが多いイメージだったから狼が割るっていうのがわからなかったよ>>333ディタ割れる時割れるじゃん？正しい結果が2つは出るとは思ってたけどさー。まぁあとはエピを見るしかないかぁさて、そろそろ準備しよう。次は夜に会おう〜
2日目,村娘パメラ,占い師,んー。兵>>321の「疑問あるなら来いよ」って感じは、結構好きなのよね。そうね……兵は私を偽だと思ってるのよね。>>221私が灰視点だからおかしい、という主張よね。「人それぞれだとは思うが気にする対象としては自由か統一かだと思うな。あと自分が噛まれやすいかどうかとかもか。結局パメラ意見はそこら辺とずれてる印象」と言ってるけど。これ最初に「人それぞれだとは思う」と、「色んな占い師がいる
2日目,村娘パメラ,占い師,」という可能性を提示しておきながら、兵の個人的には「(真の占い師ならば)気にする対象は自由か統一、自分噛まれやすいかどうか」だと思っていて、結局「(兵の考えからずれている)私は偽」って結論になってる気がするのだけど。まあ、兵はどうにも、自分よりスキル低い人に厳しい様に見えるわね。兵は私を狂狼どっちと見てる？>>321「疑い返しが黒要素」って言ってるけど「偽要素」じゃないのね。という事
