2日目,司書クララ,村人,商人さんは理路整然と考えてくみたい。内容も簡潔のまま思考開示はしてる。ただ占候補について発言が見当たらないのは娘吊ってからなのかな。>>534辺りからすると敢えてフラットにするため今は考えないようにしてるみたい。ただ、現状でも能力者真贋見れるとこあると思うよ。パッションだと妙な堅さを感じるけど、そこんとこは喋り方なんだろうね。占いだけど、【●青○商】で出すよ。
2日目,パン屋オットー,村人,服希望多くないか。昨日、パメラロックしてた俺が言うのもあれだけど。希望変えるとしても誰にするか。者が気になって来たけど、老にチクチク言われてたのがライン切りかラインか。修>>565　農狼だとしたら、狼陣営は気遣いというか優しい人がいそうと思ってる。漠然としてるけど、狼像ね。
2日目,仕立て屋エルナ,村人,遅れてごめん。それとニコラスとモーリッツ質問返答ありがとうね。理解したよ。▼パメラ▽モーリッツニコラスの黒出しは狂だとしたら結構勇気が要るものだと。そしてニコラス単体でそこまでの勇気とパメラ白の確信が持てていたとは思えず。狼だとしたらもうちょっと助言受けていてもよさそうに思う。というか信用勝負の占い師にニコラスを出すのが謎。ニコラス真寄りです。
2日目,青年ヨアヒム,村人,屋>>566 あれ、スマン間違えた。老と打ったつもりが村と打ってた。修>>565 何て言うか、村人ってのは自分が白って分かってるからこそうっかり黒要素が出てしまうもの、って思うんだけど商の場合全然黒が見えなくて逆にそこを隠してるように思えるんだよな。んでやっぱり自由ダメ？懸念分かってもらえてるのにダメかー。じゃあこの先逆に統一を続けるメリットってあるか？その懸念分かってても？@1
2日目,村娘パメラ,人狼,占いは【●神○書】で。●と○は逆でもいいですわ。私が挙げたGSの、老を除いた黒寄り二人ですわね（老は▼希望）。今日もし私が吊られるとしたら襲撃と合わせて二人の人間が死んでしまいますもの、占い先は確白より黒探しにして、早く潜伏狼を見つけてほしいです。
2日目,シスターフリーデル,人狼,>>562ヨアヒム　霊食いとか何ソレ縄浮いておいしいです。マジレスするとそもそも２−２はライン戦か、占破壊のどっちかにしてくるわけで、ライン戦時は占占斑斑白の団体戦陣形とかよくあるんだぜ。斑→吊り鉄板という思考硬直が残念だな。この硬さで自由占い希望なのがピンと来なくなってきた。>>571　おう。まず、護衛関係に触れるのは控えるが、わりと平気だと思うこと。2−２の片占いはノイズ。この２点な。
2日目,パン屋オットー,村人,あーごめん！迷ったんだけど、このまま服占いでいいのか疑問に思えて来た。俺が早くに希望出しすぎて重ねられてるのかもしれないとも思い。●服とりけして●青にする！第二希望の○書はとりあえずそのままで。
2日目,仕立て屋エルナ,村人,●ジムゾン。戦術論の印象しかない。昨日●ヨアヒム○パメラとしているけど、娘狼なら占第2希望って微妙にライン切りとしてあり得る形だと思う。>>512　手数を心配するんだったら寧ろ、モーリッツは占っておきたいと考えるのが思考として自然だと思う。
2日目,仕立て屋エルナ,村人,ん～、▽モーリッツは取り消させてもらうよ。昨日占希望を最後にパメラに入れたのはモーリッツだったのを思い出した。霊能者とのラインを見て再考したい。
2日目,村長ヴァルター,人狼,>>574 オト、お前さん、あんまりヨアについての考察がなかったように思うんじゃが、黒いと睨んどったんかの？だとしたらどういうとこがかの？
2日目,旅人ニコラス,占い師,／兵旅┃長農┃娘┃老屋者商神修青司仕妙●妙仕　司　　神　仕仕仕修者妙仕青神○　屋　者　　司　　者司　長　商商これで、あってるかな？妙が希望まだだが灰のみでも能力者込みでも仕が最多のようなので今日は仕を占う。＠2
2日目,パン屋オットー,村人,長>>577　もっともなツッコミだと思う…。老の事ばかり考えてたら灰見る時間がなかった上に、服の天然っぽい言動を見て、暫定で出してた●服をどうしようか迷い出した。で、青の出してくれた表見たら服希望が結構多いから、ホントにこれでいいのかなと焦った。正直、そう黒く見てる灰がいない。老は別として。青の発言は見てるけど、あえて言うなら賢いステルス狼懸念。＋服に重ねられたかもという衝動的な気持ちで、ここかも
2日目,パン屋オットー,村人,！？と。……ごめんなさい、占い希望自体ちょっと今日はナシにさせてもらっていいかな。灰考察ちゃんとできてないのに、適当とまでは言わないけど勘みたいなのに任せて出すのは無いよな…。ごめん。
2日目,行商人アルビン,村人,>>565修：襲撃される可能性がある。っていう回答は求めていないようだね。占い結果をあやふやにするため、ラインも曇らすため、今日の襲撃は霊のどちらかが抜かれる可能性があるのは事実じゃないか。
2日目,シスターフリーデル,人狼,クララ：読みにくい班の一員。んもう…！気負いのない感じと、きちんとログを読んで狼を探してる感の発言は白め。喋らせとけば、もやっとがあれば見つけられそうでもある。放置エルナ：老旅ロックの理由がわかると、凄い白要素に見えた。この空回りは人ならではっぽい。ただ老旅から妙疑い、占い希望になった理由は結局よくわからんままなんだが…灰考察待つ。オットー：放置でいいだろ。2−２なら灰襲撃必定だしむにゃむにゃ
2日目,シスターフリーデル,人狼,あまり触れたくなかったんだが、誰も考えてないみたいだから一応言っとく。つうか、これはシモンの口から言われるべきだったと思うんだが。[娘白旅狂で、今夜シモンが抜かれて霊判定両白ってのが一番痛い形]だぜ。娘黒なら１狼吊れてるから旅抜かれてもダメージ強くないからいいんだが。占襲撃が入るとパメラの色が補強される期待値ってのもあって吊るとしても後回しがいいんだが、伝われこの思い。
2日目,負傷兵シモン,狂人,希望はほぼ出揃ったな。者青の表から俺の希望が抜けてるのは何のいじめだ。仕３妙２修２青２神２老１者１で多数決統一なら【●エルナ】だな。時間も時間なんで了解しとくわ。吊りはまあ逆らっときます。今日は考察を優先したが、パメラ庇いきれなくてごめん。ちなみに発表順は【占→霊】だろ。農はいつ来るかわからんから霊発表のタイミングは長に任せていいと思う。俺旅生存前提だが占発表順はもう同時でなくていいだろう。
2日目,仕立て屋エルナ,村人,そうそう。昨日の●リーザの理由を一応説明しておくと、老旅狼と仮定していた時の話だけど、老旅狼なら老がブレインの可能性はあると思ってた。騙りの怪しいのを止める人は居なかったのかしらと思ってね。それと5COになってから発言がなかったから、どう立ちまわったらいいのか迷ってる狼というセンはあるかと思ったの。
2日目,仕立て屋エルナ,村人,モーリッツが狼と仮定すれば昨日のCOは村長が「霊能力者」と発言したのを受けて信用勝負に持ち込めると思ってCOしてきた。村騙り発言はヤコブが霊COしてきた場合、まず間違いなくヤコブ真で村長狂だろうから、ヤコブがCOしてきたら村長撤回しろよっていうメッセージね。で実際はヤコブがCOしてきたけど村長は撤回せず、モーリッツは苦しい理由で撤回しなければならなくなり、狼陣営の受けるショックは大きいよね。リーザ
2日目,旅人ニコラス,占い師,屋が希望変更してた上にその後戻してたか・・・色々とミス多くて本当すまん。農事情を考慮すれば占先でいいだろうが兵狂考えるとおれはすでに狼1匹だしてるわけだし後にしたいかな。結果落とすまでは箱にいるよ。
2日目,仕立て屋エルナ,村人,はこの状況でどう立ちまわるべきかと迂闊なコメントを避けてるのかなと。相当状況が動いてるのに発言が出てこなかったからね。
2日目,パン屋オットー,村人,何かもう色々ごめん。ニコラスについて考えてた事落として寝ます…。狂だとしたら、今日の黒出しは確かに勇気ある？狼でもしっくり来ないという意見も何となく解る。そういう状況からはニコラス真か？とも思うんだけど、娘黒が見えたのに占い第二希望が○屋って。客観的に見ても、あれがライン切りには見えないと思うんだけど俺の主観？黒引いたのに考察の広がりが見られないって確か修が言ってたと思うけど、同意する。偽だと
2日目,パン屋オットー,村人,したら、黒確の危険性を犯してでも自分の信用優先してしまった狂人かもと思ってる。何か信用取りにやたら自信が無いように見えるので。周りが黒いって言ってる人に黒出したみたいな。もしくは、狼視されてないからと普通に黒出したか。ただ、上手く立ち回れてない真という可能性もあるとは思うので、偽決め打ちはまだためらう。霊とのラインも含め、もうちょっと見て考えたい。リーザは回答ありがとう。読んでるよー。
2日目,パン屋オットー,村人,旅>>587　戻すと言うか、灰を精査できてないんで俺の希望を数えないで欲しいと言ってたよ。ありえないわと自己嫌悪。ホントごめんなさい。明日早いんで夜明け待たずに寝ます。
2日目,村娘パメラ,人狼,>>584シモン　悪いのは偽黒を出させてしまった私ですわ。怪しすぎてごめんなさい…。潜伏している卑劣な狼たちを見つけ出して吊ってくださいませ！！！そして物凄く今更ですが。ヤコブさん。環境的にもお気持ち的にも大変でしょうに、ゲームに参加してくださって、本当にどうもありがとうございます。
2日目,仕立て屋エルナ,村人,灰考察。ジムゾンは占い希望で言ってるから割愛するね。アルビン:>>280　これに結構共感してただけに、>>461　モーリッツを狂と見てるのが違和感。狂が撤回を求めるってちとよくわからない。考え方の変化があったのかしら、★＞アルビン　上記、説明プリーズ。オットー:発言に黒さは感じてなかったんだけど急にあたしの占希望を取り下げて第2希望からも外すのはどうしてかな。気になるところ。
2日目,シスターフリーデル,人狼,パメラ：どうも質問にズレた回答をしたり、丁寧に思考開示しようとして蛇足と不足のために疑い集めたりと損なキャラ。白でも黒あり得る範囲。今日のパンダ判定受けても昨日とテンション変わらない一本調子な感じは人外っぽいが性格…？思考開示はしてくれるし、考察もそうおかしな歪みはない。発言から読めそうだった。吊り決まりっぽいんで、俺も明日霊考察してライン情報生かせるよう頑張るわ。
2日目,青年ヨアヒム,村人,えーと、じゃあ最後に【▼娘】って事で良いのか？【セット確認】で今日の喉はおしまいだー。また明日ー。@0
2日目,司書クララ,村人,【決定確認したよ】占い先は仕立て屋さんかー。余り発言追えてないし、占い先になっちゃったので占結果待つよー。今日はヨアじゃなくて神父さんどうしたのかな、忙しそう。議事読み込めてないみたい、なので占先は発言の量だけ見た感があって、それはブレてないっぽい。
2日目,少女リーザ,村人,エルナ、悩ませてしまったみたいでごめんなさい。今週はほんとに時間がとれなかっただけなの。私は、今現在占旅のみを自分の主張の根拠にしてます。今夜の結果次第では考え直さないといけないのかしら。パメラゴメンね！占いの結果が重要になると私は思ってるから、意見は変えないつもり。
2日目,村娘パメラ,人狼,吊りは避けられませんのね…。本当に、軽々しくパンダ吊りとか言った昨日の自分をぶん殴って引きずり回してやりたいですわ…。うーーーっ！そして、【私は狩人じゃないですわ】
2日目,仕立て屋エルナ,村人,ちょっと灰考察全部は今日無理ぽい。ごめん。先に他のところを。パメラは単体での判断が難しい。占決定後の発言とか、判定発表後の発言とか臭いけど、>>367　私は私が人間って知ってますから、とかは不慣れな人が模範解答的な事を言おうとしてる感じも受ける。ラインが見られれば組み合わせから考えやすくなるだろうし、そこから判断したい。
2日目,老人モーリッツ,村人,発表順は、旅が一黒引いてるから、兵→旅で。霊に関しては、2人とも登場時間遅いし…エルナが白確したら指示するんでいいんじゃないかと思う。斑だったら、来た順でよくね？シモン狂人な気がするんで。ただ、護衛優先度だと、リデルと同意見じゃ。まあ、農は空けとけじゃな。者>>540その自らの手を汚さん感じが狼臭いし、「狼が厄介なやつ吊り～」って考え、わし狼or狼に騙りじゃったら厄介なやつ吊りにわし該当せん。
2日目,村長ヴァルター,人狼,【オットーの●○撤回】【●▼決定】【娘非狩CO】確認したぞぃ。･･･ふむ。セットも完了じゃ。発表は旅偽の場合も考えて、やはり占⇒霊の順番が儂的にはいいのぅ。農の事情もあるしの。
2日目,行商人アルビン,村人,>>593仕：少し口足らずでしたね。正確に言うと、「狂と思っている」ではなく、「狂とも思っている」ですね。狂と断定しているわけでなく、狼の可能性、村の可能性も十分あるといこと。確かに、もう一度考えてみると、狂が長に撤回を求めるパターンはおかしいですね。このときは(>>461)単純に老は長が狼だと考え、撤回させる伏線をつくったのかなと単純に考えてしまったのですが、この考えはほぼありえませんね。
2日目,少女リーザ,村人,パメラが狼じゃなかったらどうなるんだろう？旅は狼？狂？そして、霊の判定はどっちが信頼できるのか。。。
2日目,仕立て屋エルナ,村人,占い師候補について。ニコラス真寄りに見ているのは前述の通りね。補足としては、>>432　とか狂だったら言わないと思うよ。【決定確認】恥ずかしいやら疲れたやらで申し訳ないよ～。占い対象にもなってる事だし判定発表までは起きてます。
2日目,シスターフリーデル,人狼,アルビン：今日は娘老仕＋俺の考察しかないのか。白要素挙げてる相手がいないってのは経験上黒印象。こういう村人もいるっちゃいるんだが。そもそも昨日からの多弁占い希望がな…自分のことだから余計なんだが、多弁怖いとか言われてもそれ俺の黒要素なのか？本当に狼探してるか？という。ぶっちゃけ、慣れたが。判断には困る。霊判定は占の後でいいだろ。愛するヤコブは明日だろうし。パメラは自主的非狩ありがとう。
2日目,少女リーザ,村人,そして今日は誰が狼に襲われるのか。。。
2日目,村娘パメラ,人狼,遺言。占い：シモ真、ニコ偽霊能：全く不明潜伏：モリ、神父、クララ
2日目,旅人ニコラス,占い師,遺言代わりに老について老狼だとおれ視点すると能力者に潜伏1名・娘となる状況になる今日の流れからも読めるとおり老への不信感がすごい老が奇策のＬＷというのは無理があるとおもうからこれはないと思う
2日目,村長ヴァルター,人狼,権力、ばんざーい！
3日目,負傷兵シモン,狂人,生きてた！てかアルビン？なぜ？とりあえず天国のゲルト教えてー。【エルナは人間だよ】
3日目,旅人ニコラス,占い師,水晶球よ、仕事の時間だ。エルナの本性をさらけ出してくれ隠された本性を暴きだすむむむ！見えてきた。・・・エルナって結構着やせするタイプなのね
3日目,旅人ニコラス,占い師,【エルナは人だったよ】眼福眼福、水晶にこんな効果あったとは（ﾆﾔ発言については霊結果でそろうまでひかえる
3日目,仕立て屋エルナ,村人,＞ニコラスえっ、何それ服透けて見えたりすんの？とかいうのはさておき、判定はどっちなのかはっきりしてほしいです。
3日目,仕立て屋エルナ,村人,タイミング悪。■1.あたしをまとめ役にしますか？しませんか？ヤコブの発表は遅くなるのかしら。
3日目,村長ヴァルター,人狼,ちょっとニコラス、その水晶、寄贈せい。権力者としての命令じゃ。さてさて、パメラも調べねばのぅ。ん～、どれどれ？ほほぅ、ほぅ！ほぅ！【パメラもなかなかナイスバディの人間女性じゃ】生きてるうちに××したかったのぅ！
3日目,少女リーザ,村人,アルビンさん。。。なぜ彼が的に？狼に不利な発言があったのかしら？エルナの疑いは晴れたっぽい?
3日目,シスターフリーデル,人狼,あ？アルビン？…アルビン？思わず二度見する展開だな。GJ避けにしても…？な襲撃筋。占判定確認。エルフは可能ならまとめ役を頼みたい。ロックオンする時は皆の意見も聞いてな。あとは昨日のやり残しの灰考察だけして寝る。実は今日は仕事三昧デーでコアタイムから決定まで居られるかどうか不明瞭だ。できるだけ時間はみつける。
3日目,仕立て屋エルナ,村人,早すぎかもしれないけど議題作っておくね。■2.能力者考察■3.灰考察■4.●占い希望■5.▼吊り希望
3日目,村長ヴァルター,人狼,【エルナの確白】確認じゃ。まとめ役はいた方がよかろうの。決定時間が遅い村じゃし。儂はこれから旅と誰が繋がってるか注意して議事録読みつつそのまま寝る。
3日目,仕立て屋エルナ,村人,■6.アルビンが襲撃された理由□7.モーリッツの処遇これは個人的な追加議題です。村の現状では必要な議論じゃないでしょうか。白と思うか、狂と思うか、狼と思うか、具体的な理由を添えてもらえたらうれしいです。
3日目,シスターフリーデル,人狼,長→兵ライン確認ジムゾン：１dは伸び代ありそうって言ったが、クララと違って伸びて来なかったな。昨夜は無茶苦茶ってレベルじゃない同意。　どんまい。>>512のピンポイントで黒い灰を狙わないと、という危機感と>>544の占希望の残念さの乖離が気になる。コアタイムに沈み込む感じは赤ログに時間割かれてる？と穿りつつ、黒め灰>>620エルフ[意見]　■6は灰と仕はやらないべき。やるなら細心の注意を。
3日目,負傷兵シモン,狂人,おっさんパメラに何するんや！てことでヴァルター真だろうな。村長狂だったりすると俺が権力を振るうことになるが、襲撃からして霊内訳真狼は決め打ってよさそう。てかヤコブ狼か…まあ無理しないで。エルナは、フラットに見てくれることを祈りつつ、ひとまずまとめ役まかせるよ。アルビン襲撃は謎いなあ…。意見食いというほど発言力あったっけという感じなので狩狙いかなーという話はあまりやらないほうがいい気もする。
3日目,仕立て屋エルナ,村人,■6は取り消し。□モーリッツの処遇を□6とします。襲撃の考察については各自任意で。
3日目,負傷兵シモン,狂人,パメラはおつかれ。墓下を楽しんでくれ。修>>482>>583生きてるくせに…って感じだが、襲撃懸念がないわけがない。だがそれを口にしたところで襲撃されないわけじゃないだろ。>>583の状況はもちろん危惧してた。1dで言ったと思うが最悪の展開だ。かといって班吊りを阻止できるかというと正直微妙かなと。で、最悪の展開を迎えたとき、娘白主張は必要なさそうだから考察出すことを優先したんだよ。
3日目,老人モーリッツ,村人,…アルビン襲撃とは…パメラの黒要素じゃ…（真顔）■エルナまとめ役で。アル襲撃理由のう、人狼視点で一番狩人っぽかったとか、ネタでパメラの後追いさせたとかって感じじゃろうかね。それと、狼陣営余裕有る印象じゃな。ついでに、シモンの微狂要素かのー。あんまりアルビン狩人っぽかった感じせんので、GJ避けるだけならエルナでも良かったような気が。偽黒出してほしかったのか？って感じはするのう。ってこれわしの黒要
3日目,老人モーリッツ,村人,素じゃん…今のナシ。あと、襲撃されてるんじゃから襲撃考察はしてええ。GJ出てる時に狩人がGJ先知ってる/知らない視点漏れ起こすのを防ぐためGJ出た時は襲撃考察しちゃいかんって言うのよ。襲撃されてる考察したからって狩人透ける要素にならん。さすがに「やっぱりアルが襲撃されると思ってたよ！」とか言い出すやつおらんし。てゆうか、細心の注意払えっていうのはええけど、どういうのがダメな例なのか具体的に言わん
3日目,負傷兵シモン,狂人,老>>626　狩候補である人達がアルビンの狩要素を探したり探さなかったりとかは狩非狩透けそうでよくないよね、と思う。モーリッツの処遇ね。今灰吊り希望を出すなら昨日から継続で▼老だけど。狂とはあまり思ってないな。寿命が延びたんで他の灰を合わせてもうちょっと見てみるつもりではいる。てか、俺としてはヤコブから黒が出たら今日は▼農を推したいかな。村視点でもヤコブお仕事終了だし。つか猛烈に眠い。@1
3日目,司書クララ,村人,あたいもう意識が途切れてる。とりあえず【仕立て屋さん確白】【そんちょーさんの娘白】確認したよー。仕立て屋さんはそのまままとめ役に入るのかな。商人さんが襲撃されたのかー。うむむ限界なので寝るー。
3日目,農夫ヤコブ,霊能者,【パメラは狼】でした。
3日目,シスターフリーデル,人狼,おはよう。昨夜は華麗に寝落ちた。ディーターすまん…日中時間見てやる。印象としては1dより白めに移行してた。農→旅ライン確認。ヤコブ愛してるぞ。>>627シモン　能力者全ロラ前提なら仕事終了だが、ライン決め打ち視野なら村視点で仕事終了確定とは言えんな。ニコラスと共同作業でもう１黒引くまでが仕事だ。お前が斑吊り許容で占-霊ラインつけたのは対抗霊を吊りたいからだったのか？
3日目,神父ジムゾン,村人,おやまぁ、占いで確白を出しながら、灰噛みですか。考え得るパターンとしては、1.)占:真狂　で、狂に黒出しを期待するメッセージとして噛んだこの場合、旅人どのに2連続で黒出しさせてしまうと、その時点でほぼ旅人どのが用なしになってしまうわけでして、2COの現状、狩人の護りも固定できてしまいますし、あまり狼に良い状況にはならなさそうですから、【真:旅　狂:兵】でしょうかね。
