プロローグ,楽天家ゲルト,村人,人狼なんているわけないじゃん。みんな大げさだなあ
プロローグ,旅人ニコラス,村人,一番乗りィ
プロローグ,少女リーザ,霊能者,二番なのだー！
プロローグ,少女リーザ,霊能者,む、断崖の村…という事は紐なしバンジーをすればみんな幸せになれそうなのだよ？……あい、きゃーん、ふらーい？おー、まいごっと！■1.コアタイムまちまちなのだー！■2.仮/本決定 時間希望21時仮決定だとウルトラハッピーなの。■3.やりたいこと/やりたくないことみんなで仲良く狼さんをやっつけるのだ！□4.自己紹介リーザなのだよ！リーって読んで欲しいの！
プロローグ,少女リーザ,霊能者,リーのお母さんがみんなに書いた、よーごしゅう？なのだ！わからない事があれば此処を見るといい、ってエロい人もいってたのだよー？【】重要事項を強調する為に使用。ＣＯとか。■議題　＠残り喉（＝発言数） ●占い希望　○占い第二希望▼吊り希望　▽吊り第二希望★質問　☆質問返答　▲襲撃
プロローグ,農夫ヤコブ,村人,おちおち畑も耕せないなあ…… 
プロローグ,少女リーザ,霊能者,CO:ｶﾐﾝｸﾞｱｳﾄ 自分が能力者である等の発言FO:ﾌﾙｵｰﾌﾟﾝ 占霊初日COLW:ﾗｽﾄｳﾙﾌ 最後の狼GS:ｸﾞﾚｰｽｹｰﾙ 白（村）っぽい人～黒（狼）っぽい人を順に並べた表SG:ｽｹｰﾌﾟｺﾞｰﾄ 狼が自分の身代わりに吊らせる村人まとめサイト http://wolfbbs.jp/便利ツール http://wolfbbs.jp/%A5%C4%A1%BC%A5%EB.html
プロローグ,少女リーザ,霊能者,ヤコブさん、ヤコブさん！バンジージャンプなのだ！[…は、崖の先を指している。]
プロローグ,少女リーザ,霊能者,なんて話をしてたらリーはもうねむねむさんなのだよ…ふみゅう…おやすみなさい、なのだ！
プロローグ,農夫ヤコブ,村人,やあ、霧が濃いからね。少しのあいだ休ませてもらうね■1.コアタイム夕方にはこれると思うのだけれど……■2.仮/本決定 時間希望みんなに合わせるよ■3.やりたいこと/やりたくないこと楽しくやりたいなあ。流行り病には気を付けるんだよ？□4.自己紹介ヤコブさ。普段は美味しいお野菜を作っているんだよ
プロローグ,農夫ヤコブ,村人,妙>>8　こ、この村はそんなことが流行っているのかい？僕は村の外れに一人で住んでいるからね……おや、もうおねむかい。おやすみ、良い夢を見るんだよ
プロローグ,旅人ニコラス,村人,■1.多少ブレはあるけど21時から0時くらいかな。■2.21:00/21:30で。■3.子供を護る■4.可愛い子がいる匂いがしたので訪れてみました。
プロローグ,旅人ニコラス,村人,それと、さっきの地震の直撃食らって箱が故障してね・・・明日明後日までは鳩しか使えないかもしれない。もし質問など見逃してたら指摘してくれると嬉しいよ。
プロローグ,シスターフリーデル,人狼,バンジーは紐無し派ですわ
プロローグ,農夫ヤコブ,村人,旅>>13　大丈夫かい？さっきの揺れは大きかったらしいね。村の外れまでは届かなかったのだけれど……。サポートなら任せてくれよ？出来る限りのことはするつもりだよ
プロローグ,農夫ヤコブ,村人,おや！いらっしゃいシスター。外は危ないからね
プロローグ,シスターフリーデル,人狼,お迎えありがとうございますヤコブさん。ニコラスさんは心配ですわね…先程の地震は長かったですものね、私も及ばずながらサポートにまわりますわ
プロローグ,シスターフリーデル,人狼,■.1夕方から夜にかけてかと思われますわ■.2お任せします■.3皆さまが楽しく出来ることが何よりだと思いますの□.4この村にはスリルを求めてきましたの。退屈な日々にグッバイ、ですわ
プロローグ,旅人ニコラス,村人,二人ともありがとう、本当に助かるよ。とりあえず朝になったら箱の修理を試みてみるさ。さて、そろそろ休ませてもらおうか。また明日、いや今日。
プロローグ,農夫ヤコブ,村人,外は人狼がいるんだってね？怖いなあ……。村の人、宿に集まってくれると安全だろうねふああ……。僕ももう寝るよ。おやすみなさい。みんなも、いい夢をね
プロローグ,村長ヴァルター,村人,村長だ。……ふーっ、煙草が上手い。
プロローグ,村長ヴァルター,村人,■１．１９～２３時＋鳩■２．60min前/30min前　合わせるぜ。■３．楽しいのが一番だ。流行り病と体調には気をつけて。■４．煙草が煙かったら言ってくれ。どうにも止められなくてな。(　ﾟДﾟ)y━・~~＜……ふぅ。
プロローグ,村長ヴァルター,村人,ニコラスさんは平気かね。直るといいな。
プロローグ,司書クララ,狩人,図書館の番人、クララですわ。
プロローグ,青年ヨアヒム,村人,やあ。おはよう、みんな。
プロローグ,青年ヨアヒム,村人,■１．0時から5時くらいは寝ているけど、その他は顔を出すくらいならいつでもできるんじゃないかな。■２．と言うわけで、決定時間は合わせられると思う。■３．恐らくだけど、バンジーは紐が無いとちょっと危ないと思うんだ。できれば紐つきでやりたいな。■４．人狼騒動なんて久しぶりに耳にしたから、みんなについていけるか若干不安だね。がんばるよ。
プロローグ,青年ヨアヒム,村人,うーん…あとは肺考察をすればいいのかな？でも最黒は村長だと思うんだけどね。吸い過ぎは注意だよ。他は…あんまり黒そうな人がいないね。特にリーザはまだ煙草はダメだよ。大きくなれないからね。
プロローグ,司書クララ,狩人,■⒈19時〜24時■⒉おまかせ■⒊流行病には注意なのですわ■⒋読みたい本がある方は本をお貸ししますわ
プロローグ,少女リーザ,霊能者,おはようなのだよ！起きたら新しい人がいっぱいでうれしいのだ！この村は悪い人を吊る、のは可哀想だから崖から突き落とす…っていうのだ！…そっちの方が痛い？知らない知らない！
プロローグ,少女リーザ,霊能者,それにしても、なにやらもくもくしてるのだよ…！けほっ、けほっ！うー、目がいたいいたいなのだ…
プロローグ,シスターフリーデル,人狼,村長さんあれほど煙草はお止めくださいと言っておりますのに…リー大丈夫ですか？よしよし崖から突き落とすのは賛成ですわ。その方が楽しそry
プロローグ,農夫ヤコブ,村人,おや、人が増えているね。おはよう！みんな人狼が本当にいるかは分からないけれど……。いるとしたら僕も戦わなければね。クワでこう……グサッと！妙>>29　先人はなぜこんなところに村を作ったんだろうか……ひ、紐なしバンジーってやつかい？なんだか人狼が可哀想に思えてきたよ……。あ、シスター以外だね長>>22　こらッ！子どももいるのに煙草は駄目だよ！吸うなら外に出て吸ってね
プロローグ,旅人ニコラス,村人,こーのー大空ーにー翼をーひろーげーとんでー・・・行けるかっ！
プロローグ,村長ヴァルター,村人,愛煙家は肩身が狭い。一芸やるから見逃してほしいぜ。ほれ、輪っか輪っか。　　　　　　　○　　　　　　ｏ( ﾟДﾟ)y━・ﾟ  ﾌﾟｶｰｯ
プロローグ,村長ヴァルター,村人,これでも駄目ならバンジーにチャレンジだあああ あ　　あ　　　　あ　　　　　ぁ　　　　　 ぁ　　　　　　・　　　　　　 ：
プロローグ,少女リーザ,霊能者,修>>31 だ、大丈夫なのだ！リーは強い子！農>>32  さぁ、リーが生まれたときにはもう立派な崖さんだったのだよ？おせ、おせ…！長>>35[次の日の朝、村長 ヴァルター が無残な姿で発見された。]嫌な事件だったのだよ…
プロローグ,農夫ヤコブ,村人,妙>>36　へえ、そうなのかい？僕もこの村ができたわけは知らないんだけれど……。この断崖の村は、その昔バンジージャンプの魅力にとりつかれた人狼が作ったのかもしれないよ？人狼は人知れずバンジージャンプの魅力を広めたくて、村を作り、崖でバンジーをし続けた……なんてね
プロローグ,旅人ニコラス,村人,犯人を断崖絶壁に追い詰めるのってロマンだよね
プロローグ,羊飼いカタリナ,村人,早まるのはよせーっ。
プロローグ,羊飼いカタリナ,村人,あ、議題は夜に答えにくるよー。
プロローグ,農夫ヤコブ,村人,カタリナさん、いらっしゃい。羊は狼に食べられるといけないから、宿の一室に入れておこうね
プロローグ,羊飼いカタリナ,村人,思いのほか早くできたからおいてくー。■1.まちまちだけど日付けが変わる前にはおやすみだよー。昼間は鳩さんからちらっ。■2.おまかせー。■3.楽しく楽しくー。健康大切ーっ。□4.カタリナだよー、羊さんもふもふ。
プロローグ,羊飼いカタリナ,村人,農>>41 おー、羊さんを部屋に押し込むぞー。でも人狼さん、羊さん食べてお腹一杯になって帰らないかなー、なんてっ。
プロローグ,農夫ヤコブ,村人,羊>>43　こら！羊が可哀想だろう？でもそうだねえ、僕は狼じゃあないけれど、少し美味しそうだね……ハッ！？駄目だよ！？確かに美味しそうだけれども、羊はしまっておこう！
プロローグ,シスターフリーデル,人狼,あら、ラム肉ですか？美味しそうですわね(にっこり)
プロローグ,農夫ヤコブ,村人,この村のシスターはずいぶん活発だなあ…… 
プロローグ,旅人ニコラス,村人,リーザちゃんかわいいなあ
プロローグ,羊飼いカタリナ,村人,＠ 'ェ' ＠メェ〜メェ〜。ラムより牛さんを食べよーっ。羊さんはあったかいよー、冬には必需品だよー。
プロローグ,農夫ヤコブ,村人,旅>>47　き、きみは幼女趣味なのかい？羊>>48　牛肉なら鍋が食べたいなあ。水炊きが一番好きなんだよねえ。羊毛のマフラーが欲しいな、カタリナさん
プロローグ,羊飼いカタリナ,村人,農>>49ステーキ！ステーキ食いたい！マフラー？…そーいえば仕立て屋さんに作ってもらったのがー…あった！はい、どーぞ。[もふもふマフラー]
プロローグ,農夫ヤコブ,村人,羊>>50　カタリナさん、肉食系ってやつかい？わあ、マフラーありがとう！（まきまき）とっても暖かいよ。仕立て屋にもよろしく言っておいてね
プロローグ,旅人ニコラス,村人,羊はいいね。ペットによし毛を刈ってもよし・・・食べてもよし。無駄がないね。>>49農いやいや、【僕はロリコンではない】よ。僕はただ子供達の純粋な笑顔を守りたいだけさ(にっこり
プロローグ,農夫ヤコブ,村人,旅>>52　つまり……ヒーローかい！？それはいいね！これからも子どもの笑顔を守ってくれよ！そう言えば今日は、人狼の他に鬼も出るらしいじゃあないかい。宿の外には豆を撒いておこうね
プロローグ,シスターフリーデル,人狼,そういえばそうですわね。ヤコブさん、豆を少しくださる？鬼役はどなたになさいましょう…
プロローグ,農夫ヤコブ,村人,修>>54　はい、シスター。（渡し）大豆は畑の肉なんだよ！鬼役はそうだなあ、ヴァルターでいいんじゃないかなあ。煙いし。ヒーローのニコラスが鬼役してくれるならいいんだけれどねえ
プロローグ,旅人ニコラス,村人,リーザちゃんか・・・百歩譲ってペーターくん(今居ないけど)に豆を投げられるなら喜んで鬼役やるんだけどなぁ
プロローグ,農夫ヤコブ,村人,少年趣味でもあるのかい、ニコラスは……僕が豆をぶつけてあげよう、それっ！（バッサアア）おや、マスごとひっくり返してしまったよ……
プロローグ,旅人ニコラス,村人,ち、違うショタコンでもない！ただ可愛い子供達と仲良くいたたたたた痛い痛い豆痛い！
プロローグ,シスターフリーデル,人狼,察しましょうヤコブさん、ニコラスさんはきっと、そういったあれなのですわ(目逸らし)あらあら、楽しそうですわね。では私も…そぉ～れっ☆(升を投げる)
プロローグ,旅人ニコラス,村人,ちょっ、升はさすがに反そっ・・・[あたりどころがわるく、にこらすはきぜつしたようだ]
プロローグ,農夫ヤコブ,村人,おや、ニコラスはくたばってしまったのかい？やれやれだ。でも、これはこれで鬼をやっつけたことになるのかな子どものいない時にやっつけてしまったから、また新しい鬼役を探さなきゃあねえ
プロローグ,少女リーザ,霊能者,おにはーそと！ふくはーうち！おかねもーうち！こんばんはなのだ！
プロローグ,青年ヨアヒム,村人,やあ、こんばんは、みんな。そうか、今日は節分なんだね。せっかくだから鬼と一緒に人狼も豆を撒いて追い払っておいてくれると嬉しいね。
プロローグ,青年ヨアヒム,村人,それにしても…豆が散らかって酷い有様だな。子供たちは余程熱心に豆を撒いていたんだね。まるで枡ごと引っ繰り返したみたいだ。仕方がないな、僕が片付けておこう。…おや、大きな豆だと思ったらニコラスじゃないか。こんなところで寝ていたら風邪を引いてしまうよ。全く困った人だな。確かここに毛布が…あったあった。せめてこれをかけておくといい。
プロローグ,老人モーリッツ,村人,ふむぅ、朝かのう婆さんや？
プロローグ,老人モーリッツ,村人,■1.コアタイム　まちまちじゃな■2.仮/本決定 時間希望　それぞれ60分前、30分前じゃの。余裕を持ちたい故。■3.やりたいこと/やりたくないこと　仲良くやれればよいの。□4.自己紹介　……ところでお茶はまだかね？
プロローグ,農夫ヤコブ,村人,青>>64　ああ、すまない。それは僕も……いや、なんでもない。ニコラスは目が覚めるまで寝かせておこうか老>>65　いらっしゃい、モーリッツ。モーリッツも年の数だけ豆を食べないといけないねえ
プロローグ,青年ヨアヒム,村人,やあモーリッツ、おはよう。でも朝じゃなくて夜なんだ、まだね。お茶くらいなら僕が淹れてくるよ、座って待っているといい。でも何だね、今の所この村は食事を出す人がいそうにないのが不安なところだ。
プロローグ,青年ヨアヒム,村人,やあヤコブ、こんばんは。ちょうど今お茶が入ったところだよ。モーリッツの分と２杯あるから良かったら君もどうだい？ニコラスには困ったものだね。まあ、きっと旅の疲れが残っているのだろうね。
プロローグ,農夫ヤコブ,村人,青>>69　わあ、いいのかい？ありがとう！それじゃあいただくよ。ニコラスは、そうだね、そういうことにしておこう……食事は僕が作ろうか？美味しいものを作るよ！[ギトギトした何か] [ネバネバした何か] [ツルツルした何か]見た目は悪いかもしれないけど、味はきっと大丈夫さ！
プロローグ,村長ヴァルター,村人,[…は匂いを嗅いだだけで気絶した。]
プロローグ,羊飼いカタリナ,村人,ご飯なら私もおいてくよーっ。つ[ステーキ]
プロローグ,村長ヴァルター,村人,今夜開始は確定か。嬉しいね。願わくばフルメンになってほしいものだ。俺が食事を……あ、フライパンが爆発した。
プロローグ,村長ヴァルター,村人,とりあえず、豆だけは大量に炒ってあるから皆持っていくといい。俺はそれをつまみに酒でも飲むぜ( ﾟДﾟ)っ旦＜湯呑みで
プロローグ,青年ヨアヒム,村人,ありがとうヤコブ、いただくよ。…！…う…これは……頑張って作ってくれたんだね、ありがとう。とてもおいしそうだったよ。カタリナがステーキを作ってくれたみたいだし、そっちもいただいてみるよ。付け合せに豆もあるみたいだしね。珍しい組み合わせだけど…うん、おいしいよ、ありがとう。
プロローグ,旅人ニコラス,村人,10年前に死んだ死んだひいひいばぁちゃんが川の向こうで手を振って・・・はっ！夢か！
プロローグ,青年ヨアヒム,村人,おはよう、ニコラス。よく眠っていたみたいだね。でもそんなところで寝ていると体を壊してしまうよ。それにしても、曾曾お祖母さんは１０年前に亡くなったのかい？相当長生きしたんだね…。そういえば、もう夜が明けるのか。時間間際でもう何人か来るのかな？そうだと嬉しいね。
プロローグ,村長ヴァルター,村人,村興しの為にバンジーしながら村の宣伝でもしてみるか？(；ﾟДﾟ)y━・~~｡o０（自分がやらされないよう気をつけよう）
プロローグ,旅人ニコラス,村人,あ、ああ・・・おはよう、みんな。毛布ありがとうヨアヒム。それにしても僕はなんでこんな所で寝てたんだろう・・・よく思い出せないな・・・むう、なんか頭が痛い。開始まであと一時間ほどか。出来る事なら大人数でやりたいね。
プロローグ,農夫ヤコブ,村人,賑やかな方が楽しいからね。ズサーしてくれないだろうか……旅>>79　ニコラス、[ギトギトした何か]はどうだい？美味しいよ？（多分）
プロローグ,ならず者ディーター,村人,くぁぁ…良い昼寝だったぜ。
プロローグ,村長ヴァルター,村人,やぁいらっしゃいディーター。一本いるかい？葉巻もあるからな。
プロローグ,シスターフリーデル,人狼,ディーターさんいらっしゃいあらあら喫煙者がお増えになるのはリーに悪影響になりかねませんわ
プロローグ,ならず者ディーター,村人,■1.コアタイム夕方から２２時半頃までだな。■2.仮/本決定 時間希望合わせるぜ。■3.やりたいこと/やりたくないことまぁ、仲良くしようや。□4.自己紹介寝足りねぇな。
プロローグ,シスターフリーデル,人狼,ズサーまだまだ募集中…ですわ。
プロローグ,ならず者ディーター,村人,>>82おうおう悪ぃな、いただくぜ。>>83ガキんちょどもはいねーようだから、一本くらい許してくれや。
プロローグ,村長ヴァルター,村人,少しは愛煙家が増えて良かったよ。ほら、火。
プロローグ,シスターフリーデル,人狼,>>者、長もうっ仕方がありませんわね…私が見逃したこと、ジムには内緒ですわよ？
プロローグ,旅人ニコラス,村人,・・・子供が居ないならいいけど、もしリーザちゃんの前で葉巻でも吸おうものなら熊をも怯ませた正義のニコラスキックをお見舞いしたあとリーザちゃんの肺に土下座して貰うから覚悟してね(爽やかスマイル
プロローグ,村長ヴァルター,村人,感謝するよフリーデル。……ってニコラス肺？！リーザではなくリーの肺になのか？！
プロローグ,木こりトーマス,村人,人狼に豆まきは効くのかね？
プロローグ,村長ヴァルター,村人,銀の豆、銀杏でも撒くか？
プロローグ,木こりトーマス,村人,【議題回答】■1:18:00～23:00■2:21:30/22:00■3:楽しくいこう■4:木こりの日々は忙しい>>92是非とも撒いてくれ
プロローグ,パン屋オットー,狂人,僕の顔を食べなよつ［あんパン］
プロローグ,村長ヴァルター,村人,続々と人が来るな。そして同時に食べ物が増えてゆくｗｗｗ
プロローグ,青年ヨアヒム,村人,やあ、何人か増えているね、こんばんは。人狼は鼻が利きそうだから、銀杏を撒くのは効果があるかも知れないね。ただ、人間にも効果がありそうなのが困りどころだね。食べ物が増えるのはありがたいね。途中まで本当にこの村は食事が出ないんじゃないかと心配していたんだ。
プロローグ,神父ジムゾン,人狼,こんばんはわたしはジムゾン･･･女性が大好きだこの村は女性が多いね･･･とても良い事だしばらくお世話になるよ
プロローグ,宿屋の女主人レジーナ,占い師,ずさっとな。今ちょっとばたばたしてるので席とりだけー
プロローグ,旅人ニコラス,村人,じゃあせっかくだし僕からも一つ。[ホワイトロリータ]・・・ブルポンから発売中のチョコレート菓子さ。他意はないよ。
プロローグ,木こりトーマス,村人,人も食も増えていくまるで何かの予兆のようだ...
プロローグ,神父ジムゾン,人狼,【議題回答】■1:21:00～■2:おまかせするよ■3:女性と楽しく･･･男性とは少し距離を置きたい■4:わたしは女性が大好きだ･･･さきほど言っていたね
プロローグ,少女リーザ,霊能者,正義の味方アンパソマンなのだ！？ずさーいっぱい、ご飯もいっぱいで嬉しいのだよ！
プロローグ,青年ヨアヒム,村人,こんばんは、ジムゾン、レジーナ。そうだね、身内の欲目というやつかも知れないけれど、この村は美人が多い。見ているだけで楽しいよ。気が付けばもうあと一人なのか。あと１５分、どうやら全員集まりそうだね。よかった。
プロローグ,神父ジムゾン,人狼,>>98レジーナさん、よろしくお願いいたしますお美しいあなたとご一緒できて、わたくしは幸せです
プロローグ,村長ヴァルター,村人,あと一人ズサってくれたら本当に嬉しいな。食事もたくさん、これは素晴らしいね。(　ﾟーﾟ)y━・~~
プロローグ,少女リーザ,霊能者,ニコラスさんからは何か危ない匂いがするのだよ…[くんくん]
プロローグ,ならず者ディーター,村人,続々と集まってきたな。あと一人だが、さて。
プロローグ,シスターフリーデル,人狼,リー！あんまり近づいちゃ駄目ですわ（ササッ
プロローグ,宿屋の女主人レジーナ,占い師,■1:20:00～00:00■2:1時間前に仮決定が出ていれば、それで。■3:仲良くやりたいね。■4:レジーナだよ。あたしは食事作るのは苦手なんだ。他の人に丸投げするよ。
プロローグ,シスターフリーデル,人狼,フルメンかもーーーーん！ですわ
プロローグ,宿屋の女主人レジーナ,占い師,>>104あらあら。嬉しいねえ。そんな事を言われるのは久し振りだよ…こちらこそよろしくね、神父さん。
プロローグ,神父ジムゾン,人狼,>>102リーザちゃん、よろしくお願いしますたまには教会におこし下さい飴玉あげますから　っ[飴]あなたは、将来有望な女性です>>103ヨアヒム、あなたの目つきはいやらしいですね･･･教会で身を清めに来なさい･･･わたしは相手をしませんが
プロローグ,羊飼いカタリナ,村人,おー、ちょっと羊さんと戯れてたら人がいっぱいーっ。よろしくねー。
プロローグ,少女リーザ,霊能者,修>>108 ふえぇ？ニコラスさんは危ない人なのだ？神>>112 わーい！飴さんちょうだいなのー！
プロローグ,旅人ニコラス,村人,人が増えてきたね。良いことだ。ジム、美しい女性が好きなのは男として当然だし結構なことだが…もし今のリーザちゃんにちょっかいをかけたら巨岩にもヒビを入れた秩序のニコラスパンチを食らわすからね？
プロローグ,旅人ニコラス,村人,あと僕は危なくないよ…でも避けられても構わないさ。遠くから見守ってるだけで十分なのさ…
プロローグ,木こりトーマス,村人,あと五分フルメンくるか...?
