1日目,神父ジムゾン,村人,えーっと、とりあえず。■4.今夜の占い先ですが、適度に喋って適度に大人しいということで、パメラかヨアヒムあたりがいいかな、と。■5.せめて初日は統一占いが良いかと。確定白は狼の噛み先が2占で占い師を噛むのが序盤に難しい現状と合わせて、真占い師に噛みが行くのを、一手遅らせてくれる可能性もありますし。
1日目,シスターフリーデル,人狼,で、２−３確認。撤回余地あんのはモーリッツ老くらいか。正直、モーリッツ老の発言は「偽乙www」って印象だったんで、この人村騙りでもおかしくはないと思うがな。２−３確定なら明日から霊ロラ×３で良くね？狼がロラ協力する気ないなら占いは各4回出来る。自由占いでいいだろ。って、モーリッツこのやろうw折角作った発言だから落としてやるw
1日目,行商人アルビン,村人,>>288 兵確かに、時間軸では兵の発言時は占2-霊3ではなかったのを確認しました。しかし、狼としての可能性があれば、それは得策ではないというのが僕の考えです。>>290 娘一番、気になるところですからね。
1日目,神父ジムゾン,村人,占い先はかなり勘ですみません。ぱっと見、多弁のうちフリーデルは白っぽく見えて、オットーは微妙、という感じなんですけど、LWはそれなりに大人しいところに居るかな、と思いまして。あああ、それにしてもこの怒濤の展開のストレスで、優しさ貯金箱の中身に手を付けたくなりますよ@7
1日目,ならず者ディーター,狩人,>>296 じいちゃんｗｗ霊村騙り考えなかった俺涙目だぜ笑あっと、色々言ってなかったが【CO全般確認済み】だぜー。
1日目,仕立て屋エルナ,村人,>>288 シモンだってヤコブがCOするまでは普通に2-2だったじゃん！>>296　モーリッツこの発言によってとりあえず老旅との組み合わせで灰を考えてみるね。
1日目,村長ヴァルター,人狼,今戻ったぞぃ。議事録読んでくるからちょい待っとくれぃ。
1日目,司書クララ,村人,戻ってきたよー。あ、本当だ2回霊COしてるー。あたいの鳩あたいとちがって頭がわるいからきっと前のこと忘れちゃったんだ！モーリッツ翁と、農夫さんの霊COを確認したよ。農夫さんメタとか聞こえてきたえけど、偽も真もありうると思うよー。あ、>>258パン屋の人が言ってるね。と思ったら翁が撤回してるのね。
1日目,行商人アルビン,村人,もう、じーちゃんが怪しすぎて困るんだけど
1日目,パン屋オットー,村人,うおおおおおいっ！！！じーさーん！！！（血涙）あーちくしょー喉使いすぎた！結局2-2だし老狼や狂の目も考えないとだし、うがー。喉少ないけど反応せずにはいられない。占いはこうなると統一？落ち着いて考えないと＆喉少ないんで、しばらく潜る。@7
1日目,負傷兵シモン,狂人,モーリッツが村騙り？タイミング的にねーよと思ってたんだがな。もう目的がよくわからんわ。つか俺@5なんだがどうしてくれる。ディタが一貫して村騙りの可能性を考えてなさそうだったのが、黒いかもしれんと思ってたが真っ白になった。先に希望出しとくと●パメラだな。理由はこのへん>>300　思考がブレている気がする。2-3で自由占いわぁいとか思ってたのに2-2なら統一占い希望が多そうだな…。
1日目,シスターフリーデル,人狼,これで２−２確定か？３CO目のヤコブにはアドバンテージがつくが…ヤコブが狼なら、村騙りが混じってるとわかって真印象狙いでCOしたって線があるか？ちょっと脳みそ溶けてるんで明日吟味する。農＝非狂とは思う。占いはどっかで言ったが、２−２なら統一がいいと思う。ちょっと今からわかりやすく理論立てて自由占いのデメリを解説するのは難しいんだが…占・霊結果が全てノイズという悲劇にもなりかねんと言っとく。
1日目,神父ジムゾン,村人,ってモーリッツさん!!2-2ってことは、狼は結局二匹潜伏ですか。いやまぁ、モーリッツさんが狼でなければの話ですが。うーーーん、とりあえずモーリッツさんは占わずに吊った方がいい気がしますし、中庸っぽい人に、やはり一匹は隠している気がしますので、占希望先は変化なしにしておきますが。@6
1日目,仕立て屋エルナ,村人,灰についての雑感。発言が見えてきた人だけ。者:楽しんでる感が共感できて疑いづらい。老旅との組み合わせで言っても >>284あたりがかなり素っぽいね。白寄り。尼:割と慎重そうな彼…いや彼女が狼ならこんな作戦とらない気がする。>>302モーリッツこのやろう、は吹いた。屋:尼と同じ理由で彼が狼でもこの作戦はとらない気がする。>>156を逆手にとってという可能性はあるけど単体として黒くない。
1日目,旅人ニコラス,占い師,だあぁぁぁぁぁ、【老の霊撤回確認】これ全部推理一から組みなおしじゃねえか・・・・。面倒なことになったな・・・希望とか考えとかまとめたいからちと希望後回し。
1日目,村娘パメラ,人狼,>>296　モーリーツーぅぅぅううｗｗ【長の撤回無し宣言確認しましたわー】てことは2-2で全員撤回無しですのね。簡単な形にはなったけど展開はやすぎて頭パンクしそうですわこんちくｓ2-3について一生懸命考えてた私の努力は何なんですのぉー！>>300>>311シモン　ブレているのは自分でもわかってますわ…。一日目はまず確定情報作って、二日目以降から真贋見極めも兼ねて自由がいいかなと思ったのです
1日目,司書クララ,村人,なんか翁の撤回であたまがごちゃごちゃになってるのかな、能力者内訳がちょっとこんがらがったー。あと占の希望時間近いよー。■5.農夫さんが顔を出してくれたので改めて統一でいいと思うよ。農夫さんが来れない状況なら、CO回りきらなくなるので自由というのも一考の余地はあると思ったよ。
1日目,仕立て屋エルナ,村人,●リーザ発言が出てこない。モーリッツがブレインだとしたらこの辺りが灰狼であってもおかしくないと思う。
1日目,旅人ニコラス,占い師,霊からみる雑感農が狼だとすると占：真・狼　霊：真？狂？か占：真？狂？霊：真・狼と透けるわけだ。最初のパターンならこれ狂人どこいった！！フラグだしどっちもわざわざ表に出る必要性がない。農が狂人だとすると、なぜ占いのほうに来ないのかがわからん。状況証拠は農が真よりにはみえるが長に人外臭があるかといえばそれも微妙だからなあ。長が人外なら早期に2-2出して狼陣営におれが非狂だとみせたかった可能性が
1日目,老人モーリッツ,村人,霊撤回への反応、結構みんな大騒ぎじゃのう。こういう時、おおげさに「村騙りとかないと思ったよ！」と驚くのが人狼、とか思うとるんじゃけど、これじゃ人狼ばかりじゃ。人狼のほうも本気で驚いてるってパターンも有るじゃろうかね。狼２騙りじゃとすると、ヤコブ人狼っぽ…いや、村長真とかないじゃろ…メタかのう？反応が白いのはアル。うんうん、その気持ち解る。と言う感じで。撤回の反応からはよくわからないけどジムゾン
1日目,旅人ニコラス,占い師,が一応はあるか。霊の内訳は真・霊とみ長＞農で見るのが状況的には無難そうだがこれはむずかしいな・・
1日目,村長ヴァルター,人狼,【モリの撤回確認】人気にちょい嫉妬を感じるわい。印象ベースの灰考察じゃ。はっきり言って言いがかりレベルのものもあるぞぃ。青屋仕修娘：よく喋るの。まぁ初日は戦術論がメインなので白黒印象はまだあんまりないが、この辺のグループは発言で判断できそうじゃ。今後要チェック。
1日目,村長ヴァルター,人狼,妙書神商：発言ちょい少なめ。あまり目立たないかの。>>304のジムが言うようにLWは大人しめってのも印象論としては共感してしまうので気になるグループ。老：現時点での印象は村＞狼＞狂かのぅ。消去法的考えで、狂なら撤回するメリットが理解できん、狼だとすると悪目立ち(狙ってかもしれんが)･･･ということで村印象じゃ。
1日目,老人モーリッツ,村人,もいちいち白い。ジムゾン白いとかネタじゃなくマジじゃからラッキーじゃ。あとは、ものっ凄い勢いでわし狼FA！！！ってなってるエルも…白い…ような気もする…。考察したく無くて、小手先でやってる予感もするが…その行動に関して言えば…ちょい白目。●ディーター。精査しとらんけど、なんかシモンが村騙り危惧ちっともして無かったって言うとるし。内容薄いのが単体でも薄ら黒いし。○フリーデル。せっかく作った発言
1日目,ならず者ディーター,狩人,そろそろ占希望時間…なのか？結局何時になったんだ？プロの時間でいいのか悪いのかわからないんだぜー●先は青年で。>>227今更の質問だが▲先迷うも迷わないも白確、白寄りから食われてくのは最初は仕方ねぇと思うけどな、どうなんだろ？俺の考えたりねぇのかもわかんね。むしろヘタに食い先迷って能力者に勝負…なんてのもないだろーけど、まぁ食い先考えても仕方ない部分あんじゃねぇかとか思うんだよな。
1日目,ならず者ディーター,狩人,↑の質問と合わせて、夜顔出してねぇから白だ黒だの印象が良く見えない…てのもアレな理由だなーまぁリザと迷って●青ってことで。第二希望は似たような理由で○少女だぜ。@5
1日目,シスターフリーデル,人狼,とりあえず、熟読できないんで違和感あっても拾えてない可能性高いが、パッション含みで。オットー：放置継続。エルナ：★>>306[疑問]なんで老旅と組み合わせ？ここを狼視ってことか？　全体に、沈み込もうという意識がないのは前衛狼or前衛村人。今日占う対象じゃないと思う。ヨアヒム：発言が読みにくいが、思考開示の意思は汲み取れる。様子見可能。
1日目,村娘パメラ,人狼,（続）けれど、二日目に占い師が襲撃されたらただの統一占い一回で終わってしまうんですよね。だったら統一で狩人に占い先守ってもらった方がいいのかしら…？ってやってるうちに仮決定時間過ぎてます！？今のところは●リーザを挙げておきますけどこれからまた考えますわ！＠７
1日目,仕立て屋エルナ,村人,まとめ役がいないからこのまま決定まで流れ込むのかな？一応みんな、統一占いか自由占いかの希望は出揃ったのかな？占い師候補のお二人は判定発表が遅くなりそうだったら事前に言ってくれるとうれしいな。>>327　シスフリマジレスしろってこと？
1日目,村長ヴァルター,人狼,能力者についてじゃが、状況的に儂には農：狂＞狼と思っとる。>>327 フリ 横じゃが、>>296で老が農真の場合(確率的にレアかも？)を意識して動いていたってのがひっかかったんじゃないかの。儂もひっかかった。
1日目,旅人ニコラス,占い師,遅れてすまん。考えがまとまった。占い希望：●商　思考の流れとしても推理にしても違和感は感じないのだがおれは占の内訳は真・狼でみてる。潜伏狼の一人はおれのやりやすいように動く気がした。そして老があやしいなど真実を見抜いているのだが中身を知ってるからでは？と疑問もある。確定人だったとしても考え方に信用はできるのでおれが死んだ後に村を導いてくれるとも思えるしおれは商を希望する。
1日目,老人モーリッツ,村人,>>324～だから落とすっていう思考が狼臭い。村騙り居るか居ないか解りませんよアピしたい感で狼臭い。他に気になるのは、ヨアヒムじゃ。自由占い推すのはええが、それって能動的に動かないと実行されんことが多いものじゃから先に言ってないことに違和感有るのじゃ。それと、狩人食われたら占い師抜かれるってのが、強い狼が占騙りに出ないこと知ってる感じ。屋尼にも言えることじゃが、理由を付けて話しすぎて、こじつけ
1日目,司書クララ,村人,じいちゃんは何だろう、一応農夫さんが不在のことを見据えてそういうことしたのかな。>>207気遣いとかもあるし。なんかぴんと来ない。仕立て屋さんは発言数の割りに単発が多いの、稼いでる感じはしないけど。でもこのゆるさは情報積み上げていきたそうに見えたんだけど、自由占い上げてたのはよくよく考えれば2-3のときだった。薄めた感が残るから白くは無いよー。
1日目,老人モーリッツ,村人,>>324～だから落とすっていう思考が狼臭い。村騙り居るか居ないか解りませんよアピしたい感で狼臭い。他に気になるのは、ヨアヒムじゃ。自由占い推すのはええが、それって能動的に動かないと実行されんことが多いものじゃから先に言ってないことに違和感有るのじゃ。それと、狩人食われたら占い師抜かれるってのが、強い狼が占騙りに出ないこと知ってる感じ。屋尼にも言えることじゃが、理由を付けて話しすぎて、こじつけ
1日目,村長ヴァルター,人狼,能力者についてじゃが、状況的に儂には農：狂＞狼と思っとる。理由は農：狼で2-2の状況は、霊構成が真＆狂(大体こう)or村(レア)に見えるはずじゃが、ここから霊騙るメリットが良く分からんのじゃ(誰か分かる人おったら教えとくれ、権力者からのお願いじゃ)で、占い先じゃが、パッション含みで●神○妙かの。
1日目,老人モーリッツ,村人,っぽい。なんていうか、理論武装がんばったら武具が重すぎる、みたいな感じ。オトはかなり気になるが黒いところも白いところも両方たくさんあるで、もしや一番人っぽいかもしれんと思うとる。あと、リザも気になるけど、気にするまでも無い気もしておる。白でも黒でも吊られそうじゃん？的な意味で。白じゃったらがんばれー。わしの方が10倍がんばれじゃが。ってニコラスｗおまｗわしにライン付けたいのか？エルナさんの
1日目,老人モーリッツ,村人,おっしゃる通りにやってるんじゃなかろうか？みたいな気もしたり。ていうか、リザの話しとって、何でリザとわし両狼の方向性になるんかなぁとかふと気づいたり。てゆうかわしブレインタイプに見えるんじゃったら、わし狼の可能性かなり強めに見る辺りが考えとらん印象もー…エル「白目…かも…しれん…」撤回しとくわ。さて、わしも占機能が完全な物なんじゃったら、多数決で統一のほうがいいと思うぞい。集計してくる@5
1日目,シスターフリーデル,人狼,アルビン：短文羨ましす。微妙感漂うし実のある発言が少ないが、>>275>>279あたり見極めようという姿勢は人要素。様子見。モーリッツ：騙った理由が意味不明。>>296ヤコブ真霊なら確定させよう、とか。ならヴァルターをどうする気だったんだ？村を徒に混乱させたという結果そのものは要素とらず。狼だとしたらひどすぎる動きなので人臭はある。質問の回答は見たが霊騙り中なのでスルー御免。リーザ：不明
1日目,負傷兵シモン,狂人,>>320>>324 老単に老村騙りはみんな考えてなかっただけじゃないか？だってＣＯ順がほぼ最後なんだもん…。説明見たけど未だに意味がよくわからないぞ。ディーターの村騙り危惧ないのって黒いか？能力者内訳は老が村or狼で真狂-真狼か、老が狂で真狼-真狼もわりとあるかもしれん。長農ともに非狂要素があるから霊内訳が真狂ってのはあまり考えていないが、霊に狂がいるなら長＞農かな。
1日目,村長ヴァルター,人狼,●神の理由は何というか思考が見えにくいからじゃ。さっきの発言と矛盾するが、数えて見たら意外と喋っておった、ジム。それにも関わらず>>301＆>>304での占い先の選定理由が単純な発言数というところがちょっとひっかかったわけじゃ。○妙の理由は発言数もそうじゃが、数少ない発言の中で自分の思考を見せようという動機が感じられない点じゃな。>>240、>>244、>>286とかの。
1日目,司書クララ,村人,りざ占い挙げてる人居るけど、この発言数だと判断つかないねー、でも占希望があるよー。よくよく見るとディーターのりざ第二希望理由がよくわからないの。パメラはパッションで出方が慌ててた感がしたのー。なのでちょっとじっと見ちゃいそうなの、占暫定でここ考えてるの。■4の中での～を考慮した自由占いだと、例えばなぜ票少ない方選んだーとか、色々質問出せると思うの。
1日目,行商人アルビン,村人,老を狂や狼と仮定して芋づる式に狼の尻尾を掴もうと考えてみた。しかし、屋の>>156もあり、この一連の不可解な行動をすれば吊られてしまう状況化なのは自明の解。よって、老が狼側なのかもはたまた疑問なんですよね。まあ、明日の吊り手、筆頭と考えているのは変わりません。
1日目,シスターフリーデル,人狼,>>320エルフ　おう。今の俺に察しろとか無理。>>330ヴァル　あ？…わからん。パメラ：そうおかしなことは言ってない。リーザ占いの理由は寡黙？微妙ディーター：与えられた状況に適応しようとしてる感じはするが、2−３見て内訳とかメリデメリに注目より、まずそこから村として今どう動くべきかに意識がいかないのが村視点から逸脱か。ジム・クラ：喉枯れ省略　伸び代ありそうで占いは消極的　●者で
1日目,村娘パメラ,人狼,○モリ　CO撤回したのがヤコブCO後（しかも時間たってから）っていうのが、狼仲間と相談して村騙りに作戦チェンジした人狼のような気もしましたわ。本当にただの村騙りの可能性も考えて第二希望。●リザ　白っぽく見える狼だったらかなりやっかいですわね。明日からは占い結果や吊りなんかで情報が増えますから、今日を逃したらリザを占うタイミングを失う気がして怖いです。
1日目,仕立て屋エルナ,村人,>>343　シスフリまあ明日もあるから、>>296　を100回読んでみてよ。@2
1日目,行商人アルビン,村人,●リーザは反対。メタ要素を含んでいるので理由は言いません。確白（狂の可能性含む）を作れるのは今日までなので、まとめ役を兼ねて多弁を占ってほしい。というか、多弁に狼はいると思っています。
1日目,行商人アルビン,村人,ちょっと離席します。帰ってきたら●を提出します。@4
1日目,村長ヴァルター,人狼,>>346 アル、ちょっとこの発言を解説してくれんかの？アルは真狼-真狼でLW多弁と考えているんかいの？それとも2潜伏狼が両方多弁にいると考えているんかいの？
1日目,旅人ニコラス,占い師,／／：兵青商仕娘神司老占方：自統統自統統統統／：兵老者娘旅長占：娘者青妙商神
1日目,ならず者ディーター,狩人,>>341○妙「夜顔出してないから白黒の印象が見えない…」の辺が「似たような理由」にかかってるんだぜ。ここらへん判断つかねぇしなー単純にじいちゃん占って結果見てみたい遊び心もちょびっとあるとか戯言ってみたりもするが>>343シスター…可憐で男前なお前が好きだ！メリデメリから作戦読めねぇかなって思ったんだが2-3にテンション上がり過ぎて能力者考察やら灰考察やら占い方法とか落としてねぇな、反省@4
1日目,パン屋オットー,村人,ないとは思うけど老占いだけは反対な。老狂なら無意味だし、占わず吊り候補。正直、頭の中が「どうしてこうなった！(AA略」状態で焦る。0時過ぎてる上に文章雑でごめん。修：上手く言葉にできないというか整理できてないんだけど、凄く気になる人。発言から見て行けるとは思うんで今日の占いじゃなくていい。者：>>259とか白く感じた。それだけに老>>324が黒く見えた。神：所々説明不足な感じが疑い怖れない
1日目,パン屋オットー,村人,非狼っぽい。妙：今日はできなかったけど、質問とかして発言引き出したいな。むしろ狼なら仲間がアドバイスして喋らせる気がする。って意味で単独感商：何かよく解らない。と思ったけど、増えた発言見ると掴めそうな気も。青：発言に特に怪しく感じた部分はなかったけど、スキル高そうと見てるしもっと喋れそう。遅くなるとあったんでこの後の発言に期待。娘：口調が演技っぽいと言うか感情隠しに見えて、損してそうな印象
1日目,旅人ニコラス,占い師,んで、仕から質問とんでたのな。メインＰＣ使えなかったんでまともにログおえてなかったわ。>>295 最初にもいったがおれは確定情報のほうを優先したい。信用勝負では相手の力量次第では負ける可能性があると思ってたし、狂人と狼を道ズレにしたほうが、2-2のライン線よりは村からしたら確定事実がわかって有利とみてた。
1日目,パン屋オットー,村人,。発言ざっと見た感じではそこまで引っかからなかった。と思ったけど、>>344の妙占い希望が微妙。理由が寡黙ならまだしも、白っぽいって評価が不思議。服：発言細切れっぽいのが気になるけど、プロからそうなんで性格要素な気も。特に引っかかる点はなかった。司：怪しい訳じゃないんだけど、なんか掴めない感じ。【●娘○修】娘は、妙占い理由が白っぽい狼警戒ってのが疑問。寡黙村に占い当てたい狼じゃないかと思った
1日目,パン屋オットー,村人,。修は、今日占いじゃなくていいと思うんだけど、他にそこまで気になる人がいなかった。商>>346そのメタの内容が想像できるんだが、それは省いて考えるべきだと思うぞ。俺のプロでの発言読み返してくれないか。@3
1日目,負傷兵シモン,狂人,占発表は夜明け後すぐならできるよ。あまり遅くなると寝てしまう恐れがあるとだけ言っておく。＼|商神兵仕老者旅長修娘屋書青妙農集|屋娘娘妙者青商神者妙＿＿＿＿＿計|修青＿＿修妙＿妙＿老＿＿＿＿＿
1日目,老人モーリッツ,村人,＿商兵服老者娘旅長書尼娘屋青神農妙|楽●※娘妙者青妙商神★者＿＿＿＿＿＿＿○＿＿＿尼妙＿＿妙＿老＿＿＿＿＿＿＿※屋、尼　　★娘？希望出し見たら娘の妙票の入れ方が気になった。クララが指摘しててクララの印象アップ。
1日目,神父ジムゾン,村人,>>346えええ、メタ要素ですか。うーーーん、追求していいものかどうか。で、とりあえず占い先に優先順位つけてなかったので、●ヨアヒム　○パメラ　でお願いします。まぁ微々たる印象の差なのですが、ちょこちょこ喋りつつ、ひたすら中庸の発言という気がしたので。積極的に対立関係作るタイプの狼なら、多弁の方にいくかな、と少し思いました。
