2日目,少女リーザ,村人,商>>522★書>>424が白くなゆ理由を教えてほちいわのよ。ニコラスを占うのは反対しておくわのよ。申し訳ないけろ、今の発言状況的に残す選択肢をとる気はないわのよ。もちよん、明日発言が伸びたら考え直すし、来てほちいよのさ
2日目,シスターフリーデル,狩人,ニコラス占い反対はわからなくもないけど、狼だと思えるところを占うのはありだと思うのよねだって黒が出たほうが絶対にいいじゃないってのが私の意見
2日目,少年ペーター,村人,娘>>526確白の屋も>>490とは言ってるね。悩んだけど、誤爆推理は避けてとおれないな。。。ヴァルター・アルビンへ＞農の「おかえりー」は灰狼ではなく、騙り狼に対するものである可能性もある。その場合、時系列的にはパメラ狼と思う。なので、ジムゾンやニコラスに拘らず、占い先を決めて欲しい。リザも言ってるが、ニコラス狼ならどこかで吊られんじゃないかとも。
2日目,行商人アルビン,狂人,>>527妙農暴発の直前に発言が伸びてないからと下げた行為を狼同士でやるかなと。もし両狼ならLW候補は農の方だろうと考えたから、それはやらないだろうとみました。
2日目,農夫ヤコブ,人狼,うちのカーチャンを騙り狼呼ばわりするのはやめていただきたいべ。
2日目,少年ペーター,村人,羊は、ディーター占えって言ってたの、言語化欲しいなあ。
2日目,少女リーザ,村人,修>>528ニコラスが狼なや村が負けゆことはほぼないよのさ。それよりは疑いの集まっていない位置に狼がいても勝てゆ進行をすゆのがいいと思うわのよ。ジムゾン占うのもやっぱりよくないと思うわのよ。疑いの集まり方からして、ここから白が出ても囲いの疑いが出るだけよのさ。ここを占うなや統一占にすゆべきよのさ。
2日目,シスターフリーデル,狩人,>>533妙あーなるほど、それは理解しました。そして納得もしました。そうなるとニコラスやジムゾン占いは悪手ですね
2日目,農夫ヤコブ,人狼,やれやれ、墓下でもしばらく羞恥プレイか。
2日目,少年ペーター,村人,ヤコ>>532ヤコ自身は送り狼だったりして？(俺も若い頃はー　棒リザ>>533最下段がぽっとついてくるのは村思考としてリアルに見えるね。これがなければ旅や神をＳＧお取り置きしたい狼の思考との可能性もあるが、統一だと確白の可能性があり、ＳＧが削れる。【●者】希望かな。消去法的だが、一番オーソドックスなという意味で非狼が取りにくい。
2日目,少女リーザ,村人,商>>530回答ありがとうよのさ。両狼なやヤコブがLW想定は納得よのさ。確かに切り演出っぽくはない下げ方に見えゆわのよ。切り演出なやもう少し明確な要素を持ってきそうよのさ。オットー、エルナ＞占結果の発表方法はどうすゆのかちら？
2日目,少年ペーター,村人,エルナはのどないね。遺言可能なら、占い先を明言してもらいたいね。んで、【２分後同時発表】でいいんじゃない？まあ全員遺言出来てるなら、好きに発表でもいいと思うけど。オットー指示あるなら優先で。＠０
2日目,行商人アルビン,狂人,もう役職出揃ってるし、遺言は必要ないと思う。2分後発表は了解。
2日目,神父ジムゾン,村人,年は農と切れとる思うけどなあ。年の▼羊の件は逆にlwでできたら度胸ありすぎっていうか悪目立ちやろ。普通に切り捨てて▼農て出す場面やで。狼に気遣いした村やと思う。妙も白位置におきましょか…で、ニコラスしかおらんなあ。ちなみに統一しても確白ならん思うで。ヤコブはんのﾈﾀからして狼がワイに黒打ちは目に見えるしの。まあ意味あるか分からんけども狂対策として>>538【２分同時】発表でよろしゅう。
2日目,村娘パメラ,占い師,えーと、発表時間の指示無いんだけど……と言うか年>>538、そういう提案はもっと早く……！！じゃあ【2分後同時】でOK、遺言はしておくわね。
2日目,村娘パメラ,占い師,【ペーター占うわ】
2日目,村長ヴァルター,人狼,シモン占う占い理由本命の旅神は縄届くので、とりあえず除外農起点で気になったところ。クララ君が指摘していた>>373で兵白仮置きはまだ分かるけど、>>347で兵白だった理由には弱いと思ったんだよね。娘>>403でスッと引いたあたり兵娘切りも見てて、>>347で娘狼から視線逸らそうとしているようにも見えた。単体は白く見えて迷ったけど、他に特別気になる人もいないからラインで
3日目,村長ヴァルター,人狼,【シモンは人間】だよねー。発表方法とかありがとう、ぎりぎりで反応できなかった
3日目,村娘パメラ,占い師,ペーター、目を瞑って。このお鍋の中から好きなのを一つ、お玉で掬って……って、きゃあああ！？ひ、人が出てきた！？……あ、貴方はまさか横浜の佐○木投手！？鍋の中に入ってるなんて、どうしてこんな事に……。ハマの大魔神と握手する【ペーターは人間】よ。
3日目,行商人アルビン,狂人,占い結果出します。【年は人間】でした。
3日目,村長ヴァルター,人狼,あーペーター君占った方が良かったかなリナは単純に狩人狙いかねとりあえず▼旅で寝る
3日目,行商人アルビン,狂人,占い理由年をＧＳ下位においている人が多かった事が最大の理由です。バランサー的な動きをする人は黒く見えるのかなと思いながら占ったら人間と出ました。
3日目,村娘パメラ,占い師,白だったわ……残念。占い理由は、者>>334の指摘が気になったのよね。兵は>>397で「年はすりより？でも理由無いよな」って言ってるけど、私から見れば理由あると思ったの。だって兵の占真贋間違ってるんだもの。「年は攻撃力の高いミスリーダーの兵にすり寄って、私や他の村人を落としてもらおうとしてるんじゃないかしら？」と感じたので、年占ったの。神や旅も悩んだけど妙>>533に同意で外したわ。
3日目,負傷兵シモン,村人,エルナ結果出さんのかい。分かり切っていようとそこは出した欲しい。ペーター疑われてる流れがようわからんかった。
3日目,少女リーザ,村人,【諸々確認】カタリナ噛んでくえゆのね。残さえたら判断に困ったかや助かゆわのよ。狩人を噛んで明日安全に占いを抜くという思考なのかちら。ペーター狼なや占われゆ可能性は高かったし、GJのリスクを冒しても占を噛みに行くんじゃないかちら。ここはほぼ白で見ていいわのよ。おやちゅみ。
3日目,仕立て屋エルナ,霊能者,【羊無残確認】【農夫さんは人狼】【長→兵白　娘→年白　商→年白確認】羊襲撃とは狼さんGJね。リソース消去に役立った。死ぬ気でいたから議題考えてなかったの。ごめんねー。後で出すわ。あ、私を偽視する人がいたら頑張ってね。
3日目,少年ペーター,村人,ヤコとリナはお疲れ。っては？▲羊とかどういうことですか。狼そんな余裕ないでしょーよ。占い抜かないの？ＧＳ出すの忘れてたな。白　妙兵＞修書旅＞者神　黒別枠　羊アルビンと、パメラも僕に白出しなのね。把握。
3日目,行商人アルビン,狂人,まだ6縄あるので、SGとして旅神吊ってから占いローラーしても一縄残るので、旅神外しの占いも有効だと思っていました。それでは、お休みなさい。＊＊
3日目,負傷兵シモン,村人,因みに真視してる所の占いが意外すぎてはぁって感じだ。理由って相手起点やん。それ俺頼結ばせようとしてるだけやん。というかさ村のGS的に俺なんか白でいいだろ。
3日目,神父ジムゾン,村人,▼旅→▼神→▼商→▼長→▼娘でいくわこれ昨日▼旅すべきやったな。服いきてて黒でたら詰みやったわ。
3日目,村娘パメラ,占い師,カタリナとヤコブはお疲れ様。まあ、カタリナに言いたい事もあったけど……言わないでおくわね。取り敢えず寝るわ。**
3日目,ならず者ディーター,村人,【判定確認】こりゃヤコブじゃない所吊った方が良かったね。今更だけど。ペーター２白か。そして村長、兵占なの？
3日目,仕立て屋エルナ,霊能者,パン屋さん忙しそうね。確白で良かった。議題■1.羊襲撃から見るLW像■2.占候補の内訳推理と理由■3.灰考察■4.占い方針／補完希望あるか否か。兵>>550　亀レスでゴメンね。一応、喉残量とか気にするタイプなので文字数は最大限使いたいの。＞妙　発表時間まで気が回らなくてゴメンねー
3日目,少年ペーター,村人,ヤコが自分で言ってたとおり、あれって狩りじゃない可能性もあるのになあ。というぼやき。兵>>550斑になったらまた新たにがんばろうと思ったんだがナーやはりヤコ狼だよね。過去の自分を見ているようで辛かった。では今日は寝ますわ。
3日目,パン屋オットー,村人,やぁごめんね、階段登ってたら足がつって訳がわからないうちに転げ落ちたよ(憤怒怪我はなかったけどばたついて夜明けはこれなかったよ…！申し訳ない(◞‸◟ )【もろかく】エルナ助かるよー
3日目,ならず者ディーター,村人,>>559服■1.勝ちに来てるね。いいじゃん■2.のちほど■3.のちほど■4.自由続行で良いんじゃないかな
3日目,パン屋オットー,村人,ヤコはお疲れさま。かーちゃんによろしくだねリナはまぁいいや。噛まれる箇所でしょぐれすけってくれた人に多謝神＊白：兵修書者年服羊>妙>旅>：黒妙＊白：書修兵＞者年＞神旅：黒者＊白：（修）≧兵≧妙神書（羊）≧年（旅）黒年＊白：妙兵＞修書旅＞者神　黒ニコ人気だね
3日目,神父ジムゾン,村人,これは狼は占い騙りをlwとして生き残りにかけとるんちゃう？恐らく生存力ないんやろう。旅狼仮定のハナシやけども、▼旅→▼神したあと、「旅や神に本当に狼おるんか？」って不安にさせつつ、灰吊り狙うとかやな。旅狼なら占いなんて噛んでられへんやろ。そして騙狼VS黒出された村というのを狙っとるんちゃうかな。まあここで黒は出せへんやろね。仕事終了で手順的に吊られるさかい。んで偽黒出すんは、なるべく吊りやすい
3日目,神父ジムゾン,村人,偽黒出すんは、なるべく吊りやすいとこがええはず。となると、村のgs的にも白い位置(吊れにくいとこの)兵に白出した長が狼濃くなってきたかいな。まあどこでも吊れにくい位置や思うけど。というわけで、××占いしたら偽決め打ちする！っていう占い制限設けるのがええと思うで。どやろ？さて、ワイは旅以外が白置きできるかを再精査していきましょかな。**
3日目,村長ヴァルター,人狼,兵占いは>>529とかも見てて邪推が働いたね…でも可能性潰せたし、私としては占ったことで後悔とかはないよ。あと補完占いはしなくていいと思うね、妙>>551に同意で。狼●年で囲いにいく考えがあるくらいなら占い抜いてきてたと思うよ吊り方針は旅神+占ロラでいいと思う。頭凝り固まってて申し訳ないけど。今度こそ寝る**
3日目,少女リーザ,村人,おはよう。まじゅ連絡しておくわのよ。ごめんなさい。急用が入ってしまって今晩はあまり時間が取れないよのさ。２２時過ぎくらいからは参加できゆと思うわのよ。鳩からのぞけると良いけろ、万が一を考えて現時点の希望だけ出しておくわのよ。【▼旅●者】ニコラスについては襲撃筋かやちょっと違うような気もちてるし考え直す可能性はあゆよのさ。
3日目,少女リーザ,村人,襲撃考察すゆわのよ。まじゅ、カタリナは意見噛みすゆ位置れはないち、ほぼ狩人狙いと見てよさそうよのさ。すゆと狼は占い師を噛みたいという意図が見えてくゆわのよ。狩人が護衛すゆ位置は占い師くやいだから。ニコラス、ジムゾンが狼なや、占い師を噛まないと思うわのよ。勝ち筋として占の決め打ちでの生き残りを狙うと思うわのよ。またニコラス、ジムゾンは占位置でもないかや、占を噛む必要性はそもそも薄いよのさ。
3日目,少女リーザ,村人,逆に言えば占い師を噛めば生き残れそうな位置にLWがいちょうだわのよ。ただ、ここに関しては明日以降の襲撃も見ていく必要がありそうよのさ神>>556は神狼なら勝ち筋を完全に捨てた手順を提案してゆわのよ。狼なら全力で白アピしないと生き残れないし、どうせ誰かが提案すゆなら自分かやしておこうと考えた可能性はあゆけろ、この手順が採用される可能性はそこそこあゆし、ジムゾンが狼なやなかなか度胸あゆわのよ
3日目,少女リーザ,村人,「カタリナを狩人読みして噛んだ」かつ「狼は占い師を噛みたい」と言うのが正しければパメラの非狼要素になりそうだわのよ。妙>>344羊>>345かやカタリナがパメラを真で見てゆことがわかゆよのさ。狼がパメラ以外の占い師を噛みたいなや今日襲撃があっても良かったと思うわのよ。もちろんカタリナのパメラ真視はブラフの可能性もあゆけろ、GJ出ても縄は増えないしチャレンジのリスクはそこまで高くないよのさ。
3日目,少女リーザ,村人,襲撃がなかったことから狼はパメラを真で見ている→パメラは狼ではないと言えるんじゃないかちら。アルビンは商>>530の考察は悪くないけろ、やっぱり考察が伸びてなくてあまり真には見えないよのさ。対抗の２人もそこまで伸びていゆとは思わないけろ。村長はシモン占は狼を囲う気があまりないように見えゆかや非狂ポイントあげゆ。
3日目,少女リーザ,村人,占の第２希望は【○修】で提出しておくわのよ。修>>443は白いとは思うけろ、いじゅれだれかが指摘すゆなやラインを切っておこうと思った可能性は否定できないよのさ。フリーデル単体ではリーザと考え方が結構違ってて、思考が読みづらいし占で見極めゆのはアリと思うわのよ。修>>451で「おかえりーから考察していいのかな」ととまどっていゆ点は人っぽくはあゆよのさ。
3日目,少女リーザ,村人,発言のタイミング的にもヤコブの「おかえりー」の相手がフリーデルの可能性は十分あゆわのよ。者>>562★カタリナ襲撃が勝ちに来てゆってどういうことかちら？基本的には神>>556の手順で進めていけばいいと思うわのよ。ただ占いロラをすゆと明言しておくよりは決め打ちも視野に入れて狼にプレッシャーを与えておくのがいいと思うわのよ。
3日目,少女リーザ,村人,占い師は妙>>570妙>>571かや真：村長、狂：パメラ、狼：アルビン真：パメラ、狂：アルビン、狼：村長のどちらかだと思うわのよ。アルビンの真もまだ切れるほどではないかや、アルビン真なら灰考察を深めに出してくれゆとアルビンが見やすくなって灰としては助かゆよのさ。占方針は自由占い続行でいいわのよ。補完は必要ないよのさ。
3日目,少女リーザ,村人,ところで明日あたり狩人COってありなのかちらね。占い師は噛まれてもある意味縄が浮くち、霊はお仕事がほぼ終わってゆ。特に護衛が必要な位置がないかや確白として使うのもアリじゃないかちら。噛み筋が固定されてしまうデメリットもあゆけど。狩人COのタイミングについては確霊のエルナに任せゆかや考えておいてほちいよのさ。灰は反応しないれ。
3日目,司書クララ,村人,【挨拶は基本】ということでおはようございます。まー一番考えるべきは旅神が狼でない場合について、です。「そう見えている」だけで少なくともどちらかは巻き込まれているので必要です。ジムゾンは他灰の白上げをするといってましたが、多くの人を対象とした白上げはとても目が曇りやすいと思うので、真占い師見据えての考察・議論が分かりやすくていいと思います。
3日目,パン屋オットー,村人,おはよう、寝坊したパン屋だよ狼からしてみたら初手で灰LW1って結構きついよねその割には今回の襲撃、アドバンテージは狩人(らしきなにか)落とせたくらい昨日の段階で占われそうな箇所の白要素だと思うなぁ。そして直接占を狙いに来ない時点で、信用が拮抗している箇所が真狂なんじゃないの？(どっちに護衛つくか狼も読めない)僕なら▼農のタイミングで護衛ついていなさそうな占噛むんだよね。ベグ的な意味で
3日目,神父ジムゾン,村人,おはようさん>>575霊は仕事は終わってないで灰狼吊れて黒出れば詰みにできて、狼の逃げ道潰せる重要な役や。もしも、旅白やったら旅神に狼がいなかったという情報　を早く得れることにもなるしな。だから自由護衛やろう。まあ面白くするのなら(強い灰狼が生き残っておるのかも？？っていう)ドキドキ感味わうエア護衛ありやけども、そんな手抜きするのも狼に失礼やと思うしなあ。
3日目,パン屋オットー,村人,あとは羊の真視が傾いていたから、そこを噛むため(そこを真に見せるため)とか？まだよくわからないなぁ。あとで考えようじゃあまた夜にでも
3日目,少女リーザ,村人,兵>>555この発言は狼が囲ってくれた狂人に対して言う発言には見えないよのさ。兵長両狼でのライン切なやあり得なくはないかちら。村長が白なやシモンは白と言えそうよのさ。こういうのを考えゆと霊軸でいくのも悪くないかもしえないわのよ。
3日目,司書クララ,村人,あと一応触れておきますが、初回に狼を吊り上げただけなので負けの目は十分残されています。†禁断のおかえり考察†>>440の内容は短文故件の被おかえり相手の帰宅時間はヤコブの前の発言が>>437より21:10～21:21となります。ここに当てはまらない人は単体では修妙長兵年（私がこの判断をしただけなので皆さんも確認）。この中に占候補は村長しかいないので対象が娘か商だった場合は灰狼位置は分かり
3日目,司書クララ,村人,りません。ので、結局は1d2dを総洗いして探すのが大事ですね。その後の進み方から兵修（羊服）は非狼で見てます。ちなみに以前上げた、娘が「言いたいことを言う」性格だと誤爆後の鈍さの説明がつかないので下がってます。村長は>>445>>462>>505と、農誤爆があった後にも関わらずくどいくらいに占いの方に意識が持っていかれてるのでかなり好印象です。なお兵占いは除く。
3日目,神父ジムゾン,村人,ああ、なんかズレとったな。護衛先のことやなくて、狩coタイミングについてやな。吊られそうになったらするでええんとちゃうかな。明日COするかどうかも…別にせんくてええかと思うなあ。(非狩ブラフ)返信不要や。>>576(どーも巻き込まれにいったジムゾンや)了解したで**ワイは経験少ないさかいスキルは低いんやで。エルナとか誤解しとったみたいやけど全く慣れとらんのさ(ハードルを下げていくスタイル)
3日目,司書クララ,村人,甘めの結論で言えば、娘を人っぽく見てたので商狼ですか？となってますが精査。占より霊のほうが重要、とまでは言いませんがもう1狼を見届けるまでは霊機能重要ですよね。お仕事終わってないので頑張って生きてください。【▼旅】で仮提出しときます。
3日目,少女リーザ,村人,書>>581上段で警戒心を出していゆとこよは村っぽいよのさ。書>>582村長の印象がいい、には同意すゆわのよ。
3日目,少年ペーター,村人,おはよ。僕視点は、襲撃と判定出しのアンマッチで混乱中。狼ズは、昨日の（確霊）エルナの反応から、僕吊りの可能性をみたくならないのかなあと。少なくとも、今日は僕以外の所を占っておけば、まだ今日1日は僕に視線集まってたと思うんだけどね。年を占い対象にするのが一手早いかも。さらに娘狼なら、▲商にして旅神年を吊りにくる手はあったんじゃないかと。
3日目,少年ペーター,村人,パメラ見直したけど、パメラの考察の流れ的には僕以外占うのは強引に見えてしまうか？どのみち（一定の支持者がいる）パメラが白出しした先は吊られにくくな？だろうし。にしても、▲羊はなあ。。というのはある。あとは多分夜に〜**
3日目,村娘パメラ,占い師,羊襲撃は狩人候補狙いだと思ってるわ。ちょっと忙しくてざっとしか見れてないけど、兵はやっぱり白っぽいわ。>>555「俺なんか白でいい」が、白である故の意識が出てると思う。妙ってまとめ役気質よね。票まとめも率先してやってくれてたし、考察読んでると頭が整理されてくる感じがする。まとめ役向きであるのと色とは関係無いけど、妙狼なら、このやり方続けてると自分の首締まるだけな気がするから。占わな
3日目,村娘パメラ,占い師,くても後で捕まるんじゃないかしら。年の考え方は私と大分違うし、違う観点から狼探してもらえてありがたいわ。たしか昨日の年の占い希望は者だったわよね、者良く見てみたいと思うわ。後は夜になりそう**
3日目,シスターフリーデル,狩人,おはようございますうーん狼どこなんでしょうかねペーター占いとシモン占いですか……両方とも人間だと見ていたので、そこかーって感じですね……ヴァルターのペーター占いのほうが良かった発言は少し真かもなーとか思いましたどこが狼なんだよーとか思いながら今日はニコラス吊りでいいのかなとか思ってます
3日目,神父ジムゾン,村人,占い決め打ちでプレッシャーをかけるという思考があるようやけど、占騙り狼吊れて、霊結果で黒が出る(続く)→占ロラストップで灰吊りというのも大きいんとちゃいまっか？ワイはリーザを高く期待してしまっとるんで、今朝の狩出し提案とか霊仕事終了扱いはちと不穏。【統一で●妙】ところで、者はなんで注目されとるんや？まあ統一占いなら可やけど、者のGSで(羊)の位置を黒目に置いたとこが▲羊する狼像に合ってないで。
3日目,神父ジムゾン,村人,娘>>588首しまるだけとはいえ、灰に使える縄は意外と少ないで。まあ占いで、村全体が白置きできない位置とかが確白生産されれば逃げ道はなくなるけどもさ。妙狼で、▲服なれば、おそらく▼旅神+占い3　で縄5消費されて、残り1しかないやろ。占わなくても後で捕まる～は危険やと思うけど(そもそも占が怖くない狼なら当たっても構わんかもしれん)。
3日目,少女リーザ,村人,本当らわのよ！占い吊りで霊結果黒が出たやロヤストップできゆのは見落とちてたよのさ。ごめ～ん、うっかりちてた。てへぺよたら、リーザは灰吊りで黒が出たや詰むという点にはあまり重きをおいてないよのさ。最終的に狼を吊りやすい形に持っていくことを目指してゆよのさ占いの色については考察れ詰めていけゆかや霊結果をあまり重視しなかったわのよ。それでロラストップのメリットを見落とちてしまったのかもしえないよのさ
