4日目,少女リーザ,占い師,シモン狩人だったんじゃない？って事についてだけど、>>535で本決定を確認した上で発言残してるんだよね。もし狩人なら、言うんじゃないのかなって思うんだよ。
4日目,少女リーザ,占い師,あ、でも「狩人回避が起きても問題ない」って言ってるなら、いいんだね！【ニコラスが人間だった】よ。黒全然出せなくてごめんなんだーー！！！
4日目,少女リーザ,占い師,理由は、昨日わたしのなかで灰の人達を並べてみたとき、1番つられなさそうな位置にいて、ステルスされたらタチ悪いなって思ったのがニコラスだったから！！正直昨日のＬＷ発言で、これもうパメラ狼じゃない？って思ったのが本音なんだよ！でも、パメラは正直皆が吊ってくれそうに思ったんだ。だからパメラ占うよりも、ステルスあり得るニコラスに決めたの。もう今日は占えないと思ってたしさ！！！
4日目,旅人ニコラス,村人,ぽぽー【リーザさんの判定確認しました。】いっそ黒出しとかあったら俺視点分かりやすかったんですけど…まあ真偽についてはまた考えますね。★妙＞今日白引きなら狩り回避とか気にする必要無くないですか？考えに見落とし有ったらすいません
4日目,少年ペーター,村人,>>711 神 昨日僕は屋が狩人なのを疑っていた子だよ。有り得ないと思いつつも、兵が狩人或いは人、狼と同時進行で考えてしまっていた。兵狩だと仮定して、狼は兵が狩人なんて判るはずがないから霊襲撃の必要性はないし、人と考えるには、霊襲撃の理由がないし。消去法で狼なんだとようやく納得できたんだって事を>>709で書いたつもりだった。【リザさんの判定確認しました】
4日目,羊飼いカタリナ,村人,ごめん寝落ちてた。【状況確認】青食いねえ…一応の占い機能破壊ってとこかなあ。とりあえず妙真決め打つなら灰ロラで縄足りる訳だけどどうでしょう。って言う状況だから、狼が余裕位置にいるとか、そういう次元ではもはやなくなった感じだよね、いや余裕位置って言ったら俺かクラかって話だろうけど。
4日目,羊飼いカタリナ,村人,つーか妙狼でヨア食うなら昨日でいいじゃんって思うわけで。妙狂なら昨日の襲撃時点では狼視点でも占い真贋付いてなかったから襲撃外した、って可能性は残るけど。このことから農狼も割りだせそう。って訳で妙は吊る必要無し。そもそもほぼ真で見てるけどね。この襲撃はミスリード狙いでしょう恐らく。農が「対抗が襲撃されたからって偽視されてる」みたいなこと言ってたからやり返した、みたいなのも案外ありそう。
4日目,羊飼いカタリナ,村人,もう狩人対抗回していいだろ。昨日も言ったけど狩人伏せとくメリットはオト村騙りで、真狩人がオトでＧＪ出すことくらいしかメリットないんだから。対抗出りゃロラって確実に１狼吊れるから悪い話じゃない。それとオト狼で狩人出ないこと見越してＣＯしたんだとしたら、兵狩見抜いてたことになる。今俺達が兵の狩人要素見て見抜けなかったのにそんなことあるか？ってことな。
4日目,羊飼いカタリナ,村人,ここで屋狼の狩人騙りについて考える。それはもちろん吊り回避、というのが大きな理由としてある訳だ。２ー２という形は、占い師に信用差あろうとも「パンダだからライン見たい」という理由で吊られガチだから。でも霊が片方欠けてる以上、パンダ吊りってそれほどのメリットはないんだよな。ってことは信用度高い妙から白判定受けてる時点で狩人騙りしないでも吊り回避は十分可能だったはず。
4日目,羊飼いカタリナ,村人,としたらあり得るのは狩人引き出して妙を襲撃…という狙いなんだが、昨日の段階で相当数の灰の非狩が透けてたと思われる。にも関わらず灰襲撃どころか青襲撃、このことから狩人引っ張り出しの線もなさそう。ってことから考えて、屋狼で狩人騙りするならば、兵狩見抜いてないとメリットらしいメリットが見当たらない。でも多分それもない。だからこの屋は村だ。
4日目,羊飼いカタリナ,村人,>>722待った、屋狼なら妙襲撃する意味ないわ。そもそもだから狩人引き出しする必要はないってことだな。簡単に言えば、屋狼で「霊襲撃」と「狩人騙り」は両立し得ない、ってことな。で、ごめん今日は帰り遅くなる。
4日目,ならず者ディーター,村人,鳩頑張れ。雑感。昨日の時点で対抗がない。屋狼なら兵狩か潜伏。でも潜伏したって昨日の農吊り無駄の可能性があるから狩は対抗すべき。兵狩は、俺の感じた不慣れ感が事実なら、吊られそうになったら遺言に狩だ、くらい言いそうだと思う。しかしそれはないからここは狩じゃない、と判断した。結果、妙真屋狩、つまり農狼と…俺昨日踊りすぎじゃね…。
4日目,ならず者ディーター,村人,鳩が倒れそうだが、忘れてたからもう一度。【リザの判定確認】あとは昨日ので分かってると思うが、一応回す意見もあるようだから。【俺は狩人じゃねえ】農狼として自爆行為した理由は、散々言われてる通り、霊結果出さず混乱させる為だろうな。それ以外の理由が分からん。あとは箱前で。
4日目,パン屋オットー,狩人,昨日はごめんなさいね。【状況確認】この襲撃は何というか…アタシと妙視点で青狂農狼確定させてる上に、村視点でもアタシ狩確定させてるようなもんでしょ。というか、なぜリーザがオットー本物ならって、偽ありえるみたいな言い方すんのよwロジック。占狂で判断ついてなかったとしても、占襲撃する気なら昨日の狩COは悪手。せっかく妙狂が真視されてるのに兵狩でなきゃ青護衛鉄板。屋狼なら兵狩以外ないのは結果論。
4日目,パン屋オットー,狩人,ちなみに、昨日の非狩透けの多さから潜伏狩がいたならあえて非狩っぽく振る舞う手もあったと思うけど、真狩視点で屋狼妙偽が確定してるんだから真である青護衛しないのはありえない。で、青襲撃ってことは屋狼妙偽に見せたい襲撃なわけで年と羊は少なくともその襲撃に沿わない動きしてるわけで。書は屋疑いの動き見せたけど…うーん…農CO忘れの時点でね…。者娘かしら？
4日目,神父ジムゾン,村人,当然パメクラを占ってくれると思っていたら、なぜかニコラス占いだった件。まともに情報が出たのがリーザさん視点ないような気がしますね。ボアヒムさんが勝手に情報出してくれた感じです。まあ、今日は私が大人しく死んでおくので適当に頑張ってくださいリーザさん。
4日目,神父ジムゾン,村人,オットーさんの狩人引っ張り出しの話の横槍ですが、狩人引っ張り出しの最終的な目的はボアヒムさん襲撃ですので、昨日の時点で灰に狩人がいない以上、ボアヒムさん襲撃で目標が達成されているわけです。狩人騙りすなわち狩人をボアヒムさんの味方にしているわけですからね。奇数進行ですのでボアヒムさん襲撃は安定打とも言えるでしょう。ただ三日目に青噛めばいいじゃんと言う話ではあります。
4日目,神父ジムゾン,村人,全然関係ない話なのですが、出た判定が白判定ならそもそも狩人回避なんておこらないのではないですか？リーザさんって不思議な方ですね。7つ葉のらぎを差し上げましょう。
4日目,少女リーザ,占い師,脳内纏め！！！！わたしの白：ジムゾン・オットー・ニコラスとりあえず死んでしまった人で白だと思ってる人：エルナ狂人：ヨアヒム狼：ヤコブ＋シモンが狼ならあと１人、違うならあと２人
4日目,少女リーザ,占い師,灰で残ってる人：クララ、ペーター、パメラ、ディーター、カタリナ灰の中で今のところこの人は白いって思ってる人：カタリナ、ペーター今日も自由占いでいいのかな！何かごめんね！！でもほら、多くて５分の２で黒がいるわけでしょ！そろそろ頑張るっすよーーー！！！
4日目,ならず者ディーター,村人,何か書くのに時間とった。妙真。基本、純粋にこう考える事にした。邪推しても俺には現状のシンプルを飛び越えるだけの考えが思い浮かばない。農狼の場合。兵狼か村か、については俺はまだ迷いがある。村を混乱させる一方占いで斑、農吊りでもまだ灰に2w。これは十分あると思う。仮にだ、もし屋狼としても（ペタの言葉借りるならネガティブ考察）、どうせ灰に狼居るんだよな。だったら灰吊りだ。
4日目,旅人ニコラス,村人,帰宅。外出中ずっと考えていたんですが、正直こんがらがっています…全然情報増えてないんですよね。灰狭まらないしリーザさんの真偽わかんないし襲撃は意味わからないし…愚痴はやめます。どこから手を付けていいかわからないんですがとりあえず能力者内訳の各パターン洗いなおそうかなと思ってます。
4日目,少女リーザ,占い師,ジムゾンが言ってる狩人回避起きてもっていうのはジムゾンが言ってた言葉引用しただけで要するに別に判定出してもいいんだね言うぞーって意味で言っただけだもんさーー！！何かいろんな可能性を深く考えもせずに喋ってたんだ！実はオットーが偽物で、「じ、実は本当の狩人はわたしだー！」みたいな人がいたりしたらどうしようみたいな。でもそれがあったとしても何の意味があんだろね？別にない？
4日目,ならず者ディーター,村人,一先ず妙真として、旅は考えなくていいかな、と。思ったので残り4名から吊り選抜。・年　昨日のは思考垂れ流し感があると感じたな。ネガティブからポジティブへのチェンジもこれに当たる。どこだようわああってなってる所とか村目線。・羊　ブレない。今までと俺考察と違う所引っ張りだすと、>>330辺りで嬉しさ表現だとかって狼なら知ってるんだから言わないよな。その程度偽装できるし、盤面見えてる狼、という解釈
4日目,ならず者ディーター,村人,も可能とすればここだと思うがな。・書　農書狼なら>>212のうっかりは起こりにくい。赤で霊騙りするって発言があったらねーよって凄く今更な白要素拾った。それ以外特にこれっていう要素は無い。・娘　昨日皆がめっちゃつっこんだが、lwは視点漏れに感じるんだよなぁ。微黒要素、程度とは言え他に比べて現状大きな差だと思う。で、相対的にGSがこうなる。黒　娘＞羊≧書＞年　白以上より今日の希望は▼娘
4日目,ならず者ディーター,村人,強い黒じゃねぇけどさ、妙真で生きてるなら下から削ろうぜ、と思ってる。妙偽でも灰吊りしたいし。占いは自由希望だ。白でも黒でも判断材料だ。この後ばたばたし始めるから、下手すると23:30頃までまた見れないんだ。それまでにみるようにする。まずは投下しておくぜ。
4日目,少女リーザ,占い師,でも、ヨアヒムが殺されたんだからヨアヒムを吊る手が浮いたって事で前向きに考える事にするよ。あと色々考えても判らなくなるから、オットーは本物！もうこれは前提にしようと思うんだよー。今日の襲撃はわたし、ないしはオットーを偽物として見せる為のものとしか思えない。これもその前提でもう決め打つ！！！！
4日目,少女リーザ,占い師,で、自由占いで内緒だからあんまり色々喋らない方がいいのかな、ここらへんが加減判らなくて喋りづらいんだけど、とりあえず吊りは▼娘で推すんだよ！！！ディーターがすぐ上で言ってるのとかぶるんだけど、昨日のＬＷ発言が視点漏れに見えるのと、それを指摘された時の返しの冷静さっていうか言葉の少なさが逆に背筋ゾッとしたからだー！！お、お前が狼だー？！
4日目,旅人ニコラス,村人,今日も思考垂れ流しになります。おかしいところや、「分からない」としてる所で、こうだろ？って思うところがあったら、よかったら安価引いてください。まずリーザさん狂の場合。狼陣営は、農屋灰-妙。この場合、１ｄの霊噛みは、狼視点真偽判断がついていないため、パンダ吊りでオットーさんが吊られるのを防止するため。で説明できます。ですが、オットーさんが狩人ＣＯするのが意味わからないんですよね。
4日目,旅人ニコラス,村人,吊り逃れにはなりません。対抗が出ない可能性より、出てロラられる可能性の方が大きいです。…そのロラを意図していた？という可能性はどうなんでしょうか？他、狩人を炙り出す意図、では説明がつきません。何故なら、信用度的にも、昨日の判定的にも、狩人が護衛するなら妙安定。ヨアヒムさんが黒だしし、オットーさんがCOした時点で狼視点妙偽が分かっていますから、わざわざＣＯする必要はありません。
4日目,旅人ニコラス,村人,つぎリーザさん真の場合狼陣営は、農灰灰-妙兵黒は俺まずないと思ってます。霊噛み＋青黒出しの噛みあってなさは、狼と狂人の連帯が取れなかったで説明つきますけど青噛みの意図が謎なんですよね…１：狂噛みで村の吊り手を1手増やしている上、２：青噛み＝狩人は屋or兵という方程式が成立する以上、狼が狩騙りして信用勝負の目も潰えてしまいました。敵に塩送りまくりです。
4日目,旅人ニコラス,村人,１は全く理由が分かりません。２は、狼が全員非狩してしまい、狩人候補として出られる者が居なかった。あと、この方程式に気づいてなかった？という可能性は？…ないですよね…俺は恥ずかしながら皆さんに指摘されるまで気づきませんでしたので、ちょっと思ってしまいました。まあそれは置いといて、こんだけのことして、全然議論が妙偽の方向に進んでいかないのも疑問なんですよね…
4日目,旅人ニコラス,村人,あ、すいません、>>743誤字です狼陣営は　農灰灰-青の間違いです。妙偽に議論誘導できないなら、正直素直に屋→妙と噛んだ方がよかったと思うんですよ。どの位置に狼が居ようと。残り2噛みは神→襲撃無しで灰狭まりませんし。理由としては、村の空気が妙真になってたので目立たないためにひっこめた、というのが考えられますが。作戦建てる時点でその可能性を予想できず、妙偽論調になるといいな、で青噛む狼って…
4日目,ならず者ディーター,村人,ちょっと時間ができたから箱にちょい戻りした。気になったから聞く。★旅>>742　「護衛するなら妙安定」って、今回の襲撃（青襲撃）の時の真狩が取る行動の話か？それともこれは、屋がCOする意味がわからないに付随する内容か？あと★リザ狼の可能性無い理由は？これから投下だったら悪い。
4日目,旅人ニコラス,村人,すいません、食事に行っていました。妙真ならパメラさん狼だと思うんですよね。理由としては、・他に狼っぽい人が見つからない・俺の考える青噛みする狼像↑と一致しすぎ>>746☆仮定の話ですね。屋狼が狩人COしなかった場合、今日の護衛先は妙になっていたと思うので、青抜きたいだけなら狩人は放置でオッケーだったってことです。☆すいません、妙狼パターンについてはこれから考えます。
4日目,村娘パメラ,人狼,鳩からとりあえず【非狩】一撃離脱。考察は帰ってから。
4日目,パン屋オットー,狩人,ジムゾンが言ってる辺りは基本的に結果論だと思うのよねぇ。狩COしたところで今回みたく非狩反応出てくるかは村によるし、潜伏真狩が非狩ブラフ張らないとも限らないし。青なんて信用低い上に黒出し占なんだから素直に喰っとけばいいのよ。【娘】今日まだ来てないのね。エルナの指摘>>417で返答が>>483「能力結果すら出てないのに発言だけで真決め打ち→偽だと思う方吊りなんて」…アンタ霊ロラの意味分かってる？
4日目,パン屋オットー,狩人,ローラーよ？霊両方吊りが前提よ？ここ、農狼ってこと踏まえると僅差で服の方が信用勝ってたし、純粋に農吊り嫌がってた仲間狼っぽい。で、3日目の襲撃に対する反応>>544も妙襲撃予想してたなら他の人みたいに「何でエルナ！？」ってなると思うのに妙に冷静なのよね。2dで占狂霊狼って内訳予想だったんだから、農狼が自分が吊られかねない襲撃したってポイントにもすぐ気付いて触れないのは村っぽくない。あとはみんなに
4日目,パン屋オットー,狩人,ツッコまれまくってる>>632「最後のLWを皆で探そう」がまあ視点漏れだとするとパメラLWってことになるのかしらね。説明にはそんなに納得いかないけど、視点漏れなのか何なのかは判断つかない。あとは狼要素といえば昨日の失速感よねぇ。忙しいのかも知れないけど、1d2dで喉使い切ってるのに3dは11発言に留まってる。発言数だけじゃなくてね、>>387「2日目以降の能力結果を元にラインで黒探すのがベター」
4日目,パン屋オットー,狩人,と言いつつ3dでせっかく情報いっぱい落ちたのに襲撃結果くらいしか能力者考察に反映されてないのよね。で、ラインで狼探してない。狼探ししてない。妙真でも青真でも、ライン見てないじゃないの。ここ最黒よねぇ。襲撃筋から見ても服襲撃→兵黒隠したかった。青襲撃→襲撃されない屋狼の流れにしたかった。で、灰の動き見てて屋狼の流れがほぼ出てないこと考えると「農兵娘＋青」でFAなのかしらねぇ。あ、娘来たｗ
4日目,パン屋オットー,狩人,まあ何というか、者と書もこれから見てくるけど年と羊はないわねぇって感じ。書も農CO忘れるわけは…ないと思うから白でいいかなぁと思ってるけども。ということで、農兵娘＞＞農娘者って感じで今のところ見てるから【▼娘●者○書】ってとこで希望出しておくわ。あとリーザ、青が村騙りでもなければアタシが真狩よ！ｗ アタシが村騙りする意味も必要性も皆無だし村騙りなら遺言撤回するわよ！ｗｗ
4日目,旅人ニコラス,村人,リーザさん狼の場合狼陣営は、妙屋灰-農このパターン、中々うまく追えません。理にかなってない所はつっこみお願いします。この場合、服噛みの意図はやはりパンダ吊り避けなわけですが、そうすると屋狩ＣＯの動きと噛みあいませんね。それに、素直に青噛んで判定隠せばいいんですよね。服噛みに致命的なデメリがあるわけではないので、敢えて？ということは有りますが。
4日目,旅人ニコラス,村人,しかし、それならば３ｄで噛まないのでは？２ｄは信用度的に青噛みは簡単ですが、３ｄはオットーさんがＣＯしたばっかりに（真狩人居るなら）青鉄板護衛になってしまい、たとえ村が非狩りすっけすけだったとしても、ＧＪの懸念は消えない危険な賭けになっています。なぜ２ｄ→３ｄで心変わりしたのか、その説明がうまくつけられません…
4日目,旅人ニコラス,村人,狼：妙屋兵はオットーさんの狩人ＣＯ自体が３狼が表に出ることになり、かつ対抗が出たらロラられるという危険な賭けになってしまうので、無いかな、と思ってます。村の非狩りすっけすけになったのは２ｄ、オットーさんのＣＯ後ですから。妙真パメラさん狼として、相方は誰だろうと考えたんですが、クララさんは素直に屋→妙で来る気がしますし、青噛みしたら腹くくって妙偽誘導をかけると思うんですよね。
4日目,旅人ニコラス,村人,こういうふらふら？な方針では噛みにこないと思います。ペーターさんは独自路線な方なので、狼だとすれば、この噛みにくるのもあり得ると思いますが、昨日今日にかけての動きは非常に村人的で、まさに情報が増えて推理が伸びているって感じなんですよね。その上青噛の意図と動きがあわない。
4日目,旅人ニコラス,村人,カタリナさんもそうですね。単体で白く、動きもあわない。敢えて、「この噛みなら○○狼は無いだろう」枠を狙ってきた、というのが考えられるとしたらココですが、村が妙真決め打つと、相方一人吊られた時点で狼詰むんですよね。そう考えると、積極的に妙真決め打ち材料を出してるカタリナさんは無いかな、と。
4日目,司書クララ,村人,こんばんわ。(げそ)疲れたわ。。まぁ、出先だけど今日もやるだけやるわ。今日の襲撃が納得行かないわ。今日の妙は素晴らしく偽臭いんだけど、兵狩の可能性除ければ状況は妙真を言ってる。妙屋偽見えてて青護衛しないとかどう考えてもあり得ないわ。兵狩人の可能性とか・・・あるの？回避しない狩人とか信じられないんだけど。。
4日目,旅人ニコラス,村人,ディーターさんも…決め打ちされると詰み、が見えてる狼っぽくはないんですけどね。さらに言うと、昨日話してて村っぽいな、と思ったんですよね。…消去法的にはここになってしまいますが、あんまり信じたくない。ちょっと兵黒パターン考え直してまた結論出します。
4日目,旅人ニコラス,村人,>>759兵狩り無いという根拠は、回避しない、ということだけですか？俺、シモンさんはこの国の空気をよく知らず、人狼のセオリー「狩人はCOしてはならぬ」を厳守した可能性があると思ってるんですよ。どうなんでしょう？俺は他の部分から妙真に思考を伸ばしたんですが、俺の考えどう思いました？素晴らしく偽くさい、をもう少し詳しく解説していただけませんか？
4日目,パン屋オットー,狩人,ディーター見てて希望先とかガン無視してたことに気付いた。まあ、アタシあんまりラインなんて当てにならないと思ってるけど。希望出しからのラインは後でまとめて見てくるわ。【者】そういえば質疑回収できてなかった。回答ありがとうね。>>513 言ってる意味分からないのはアタシが？それとも屋娘二人とも？ジムゾンがまとめてたと思うけど、それ読んでも理解できなかった？スキルに関しては抽象的なのは認めるけど、
4日目,パン屋オットー,狩人,誰が不慣れっぽいとか、この人経験値高そうって大体見てて分からないかしらね。まあ者自身が不慣れっぽく見えるから、判断つかないのかも知れないけど。それでね、言ってることが分からないと思ったなら「もっと噛み砕いて分かりやすく説明してくれ」とか言わないの？私から見ればね、ディーターは「言ってること分からないからお前狼！」って暴論吐いてるわけ。そこはまず理解してもらえる？で、アタシが何でこういうこと聞いて
