プロローグ,楽天家ゲルト,村人,人狼なんているわけないじゃん。みんな大げさだなあ
プロローグ,青年ヨアヒム,人狼,こんにちはー。
プロローグ,青年ヨアヒム,人狼,誰か来ないかなぁ。僕だけじゃあ、心細いなぁー。さすがにゲルト君と僕２人だけじゃ、狼は倒せる気がしないよ；
プロローグ,司書クララ,霊能者,こんにちはー自警団募集の張り紙を見て来ましたー
プロローグ,司書クララ,霊能者,（って、えぇーまだ2人だけ！？しかも1人はうとうとしてるし）
プロローグ,司書クララ,霊能者,とりあえず募集要項にあったアンケート置いていきますね。■１.詰め所に来れる時間帯■２.仮/本決定時間の希望■３.やりたい作戦やりたくない作戦□４.自己紹介
プロローグ,司書クララ,霊能者,■１.不定期だけどまめに来れると思います。■２.なので皆さんのご都合にあわせますー。■３.あんまり面倒なのは好きじゃないですね。いや、やりたい人がいるならやりますが…。□４.村のお役に立てればと来ました←建前|超えられない壁|本音→誰かいい人いないかなぁ…。
プロローグ,青年ヨアヒム,人狼,ああ、やっと一人来たね！良かった～。クララちゃん、宜しくね。自警団かぁ。クララちゃん、見た目によらず腕っぷしがあるようだね。僕、安心しちゃうなぁ～。僕はもやしっ子だからね。情けないことだけどね;
プロローグ,青年ヨアヒム,人狼,早速、クララちゃんのアンケートに答えるよ。■1.昼間、もしくは夜中だね。鳩さんの調子も良いから、まめに来れるよ。■2.仮決定8時、本決定11時が助かるよ。■3.特に拘りはないね。□4.可愛い子が大好きだなぁ。デートに誘いたい。(僕にそんな勇気はないけど;)
プロローグ,司書クララ,霊能者,あら、だって狼と戦うとかなんとか…男はみんな狼とか、そういうことかしら。
プロローグ,青年ヨアヒム,人狼,あはは、じゃあクララちゃんにとっては僕も狼なのかな？でも、確かに男はみんな狼なのかもね。クララちゃん、夜道には気をつけて帰るんだよ。
プロローグ,青年ヨアヒム,人狼,うーん。なかなか人が集まらないようだね。僕はいつまで狼に怯えなければいけないのだろう。クララちゃん、今日は一緒に宿に泊まろうよ。夜は、怖いからさ。
プロローグ,司書クララ,霊能者,そうですねー、じゃ3人でお布団並べて寝ましょうか。あ、もちろんゲルトさんが真ん中ですよ？
プロローグ,青年ヨアヒム,人狼,クララちゃんは、ゲルト君のほうが好みなのかい？それとも、僕が怖いから？あはは、冷たいなぁ。でも、そんなクララちゃんも可愛いと思うよ。あ、夜は狼と間違えて僕を殴ったりしないでくれよ。君のパンチは怖いからね。
プロローグ,司書クララ,霊能者,（この人やっぱり色んな意味で狼かもしれない！誰か助けて～～）
プロローグ,旅人ニコラス,狩人,ふむ、この村で一番安全そうなのはここだな。自警団募集って書いてあるし。
プロローグ,旅人ニコラス,狩人,げ、アンケートか。適当に答えておこう。旅人だし。■１．不定期■２．任せる■３．任せる□４．めんどくさ……旅人。以上。
プロローグ,旅人ニコラス,狩人,む、これだと印象が悪いか。いや、まあいいか。ヨアヒムとクララは仲が良さそうだな。いいことだ、たぶん。
プロローグ,旅人ニコラス,狩人,む、これだと印象が悪いか。いや、まあいいか。ヨアヒムとクララは仲が良さそうだな。いいことだ、たぶん。
プロローグ,旅人ニコラス,狩人,大事なことなので二回言ってしまった。まあ、ここは若い２人に任せて、のんびり外を見て回るか。
プロローグ,青年ヨアヒム,人狼,ようこそ、旅人君。仲良くしてね。旅人君は、めんどくさがり屋さんなんだね。長旅で疲れたのかな？お疲れ様。ところで、クララちゃんが僕を嫌っているみたいなんだ。愛情の裏返しかなぁ？
プロローグ,司書クララ,霊能者,あら、今度は旅人さん…（なんかこの人も無愛想な感じね）じゃ、ヨアヒムさん＞旅人さん＞ゲルトさん＞私の順で。もっと間に入ってくれる人が来てくれないと、安心して眠れないわ…！！
プロローグ,旅人ニコラス,狩人,うむ、仲良くするか。みんなよろしく、だ。だが俺はめんどくさがり屋じゃないぞ。そう、あれだ、冬に向けて体力を温存してるんだ。そして、あれだ、ヨアヒム。押してダメなら引いてみろという言葉があってだな。つまりそういうことだ、たぶん。
プロローグ,旅人ニコラス,狩人,>>22いや、別の部屋に泊まればそれでいいような……。まあ、いいか。宿代が大変だからな。めんどくさいし。
プロローグ,青年ヨアヒム,人狼,>旅人君 そうか、冬ごもりなんだね。僕も体力温存しようかな。あと、押してダメなら引いてみろ、ね。アドバイスありがとう。だけど、可愛い子がいるとつい声をかけたくなるんだ。君も男なら、分かるはずさ。
プロローグ,青年ヨアヒム,人狼,>>22あはは、冷たいね！部屋が楽しくなってきたね。ちょっと狭いけど。僕＞旅人君＞ゲルト君＞クララちゃん男に挟まれて寝る、旅人君が少し可哀想だね。ゲルト君の位置が、羨ましいね。交換して欲しいよ！
プロローグ,旅人ニコラス,狩人,いやいや、むしろかわいい女の子から声かけてきてもらえた方が嬉しいだろ？　いや、そんな経験はないが。だがこう、にじみ出る男らしさというか、そういうものが備わっていればあるいは。というか、かわいそうと思うなら俺と場所換わってくれよ。ちょっとクララに近づけるし、そっちの方がいいだろ。なあ？
プロローグ,青年ヨアヒム,人狼,>旅人君 うーん、僕にもそんな経験はないよ。残念だ。あと、待つくらいなら、クララちゃんに好みを聞いたほうが早くないかい？良い方法を思いついたよ。僕と旅人君とゲルト君の3人で、クララちゃんを囲むように寝るんだ。男3人が周りにいれば、狼も平気さ！
プロローグ,旅人ニコラス,狩人,たしかにそうだな、ヨアヒムいいこと言った。というわけでクララ、好みの男のタイプを教えてくれ。個人的には緑の人とかおすすめだぞ。……ただ、男三人で囲んで寝るのはさすがにどうかと思うぞ。なんつーか、見た目があやしすぎる。
プロローグ,司書クララ,霊能者,わ、私はオットーさんやヤコブさんみたいにちゃんとお仕事してる人がいいなって…恋愛抜きに、人間として（ﾎﾞｿｯ（やばいやばい、この人達絶対やばい！誰か助けてー！！）
プロローグ,旅人ニコラス,狩人,おい、二ート青年、なんかひどいこと言われてるぞ。残念だったな。……え？　いや、俺は仕事してるぞ、うん。なんつーの、職業旅人っていうか、そういう感じで。あ、あれだよ、吟遊詩人ってやつだよ。まあ、今日は得意な詩が全部出張中だから披露できないけど。
プロローグ,青年ヨアヒム,人狼,うん、残念だ。僕もちゃんと働かないとね、あはは。旅人君の詩も、いつか聞かせてくれよ。（オットーと、ヤコブか。奴らが来たら、何て言ってやろうか。）
プロローグ,司書クララ,霊能者,（募集用の張り紙に書き足しておこう）「この村は男狼がいっぱいです。女性陣は力をあわせて戦いましょう！」
プロローグ,旅人ニコラス,狩人,いやいや、狼じゃないぞ、紳士だし。むしろ愛の狩人だから。なあ、ヨアヒム君？
プロローグ,青年ヨアヒム,人狼,そうだなぁ。こんなにもクララちゃんに嫌われると、ちょっと悲しいよ。でも、「この村は男狼がいっぱいです。女性陣は力をあわせて戦いましょう！」と張り紙に書き足してくれたようだよ。これは嬉しいね。女の子がいっぱい来る予感がするよ。
プロローグ,司書クララ,霊能者,じゃ、もう一言書いちゃおうかな。「紳士的で素敵な男性も大募集！」こう書いておけば、きっとパメラさんがやって来ますよ♪
プロローグ,司書クララ,霊能者,ヨアヒムさん＞別に嫌ってなんか…ないですよ？あ、でももう少し離れてください！（ぐいぐい）
プロローグ,青年ヨアヒム,人狼,パメラちゃん、楽しみだ！嬉しいね。ありがとう、クララちゃん。冷たい態度の中にも、ちゃんと僕への愛を感じるよ。僕、狼が怖いんだ。もう少し、近くに行ってもいいかな？（ぐいぐい）
プロローグ,旅人ニコラス,狩人,ははは、狼とかヨアヒムが怖いんなら、俺の方に寄って来てくれてもいいんだぞ、クララ。むしろウェルカムだ。
プロローグ,司書クララ,霊能者,…寝ているゲルトさんの体を楯にして、すみっこで小さくなってます。
プロローグ,青年ヨアヒム,人狼,おや、クララちゃん、そんなに怯えなくてもいいのに。ゲルト君だって、狼かもしれないんだよ？危ないから、こっちにおいで。旅人君、今夜は君と一緒に寝る事になるのかな？しょっぱいね。
プロローグ,旅人ニコラス,狩人,ああ、しょっぱいな……。クソ、ゲルトめ、自分だけいい思いしやがって。今度ひどい目にあわせてやる。ヨアヒムが。
プロローグ,青年ヨアヒム,人狼,ふあぁー、おはよー。昨日は旅人君、一緒に寝てくれてありがとう。>>42 そうなの？！；僕がやるんだ、そこは；僕はヘタレなんだよ。襲う事なんて出来ないよ。まだ、ぐっすり寝ているんだ。そっとしておいてあげよう。
プロローグ,老人モーリッツ,村人,お前らァ。クララちゃんをいじめちゃいかんぞォ（よぼよぼ喰らえィ、ワシのえくすかりばぁ（＝木の杖）！
プロローグ,司書クララ,霊能者,おじいちゃん、よかった助けてー！
プロローグ,旅人ニコラス,狩人,>>43 ああ、うん、どういたしましてだ。しかし、男に言われても嬉しくない台詞だな。よし、ヨアヒムがやらないなら俺がひどい目にあわせてやろう。まずはあれだな、額に肉とか。っと、なんだ爺さん、元気だな。というか、誤解だ、爺さん。俺はクララをいじめてなんかいない、むしろ仲良くなりたいわけだ。……いやまあ、どっちかというと、いじめたいタイプではあるが。
プロローグ,司書クララ,霊能者,（ゲルトさんが酷い目にあったらヨアヒムさんの仕業ね。ﾒﾓﾒﾓ）
プロローグ,シスターフリーデル,占い師,女性が助けを求める声が聞こえたようなので参りましたガ、気のせいデショウカ？気のせいデスネ。額に肉は全く問題アリマセン。私の鋼の拳の出番が無い事を祈りますデスヨ。
プロローグ,村娘パメラ,人狼,この村に変体がいないだなんて皆大げさだなぁ
プロローグ,旅人ニコラス,狩人,おお、女の子が２人も！　よし。名乗るほどの者ではないが、旅人だ。ぜひともよろしく。
プロローグ,シスターフリーデル,占い師,《人物データ読み込み完了》ニコラス、申し訳アリマセン。私に女の子という表現は適当ではアリマセン。身体の半分以上が機械で出来た身デスカラ。…どこが生身かの詮索はご遠慮願いマス。皆様よろしくお願い致しマス。
プロローグ,青年ヨアヒム,人狼,お爺さん、宜しくね。エクスカリバーか、頼もしいことだよ。って、あはは、痛いよ。お爺さん。おお、美女が2人も来たね！仲良くしてね。あれ、おかしいな？もしかして、皆で僕を敵視（変態視）しているのかい？大丈夫だよ、何にもしないさ。
プロローグ,老人モーリッツ,村人,ふぉふぉ。杖を振り回したら疲れて眠ってしまったわい。改めて、ワシは正義の味方モーリッツ、人呼んで現代のドン・キホーテじゃ。宜しく頼むぞ皆の衆。
プロローグ,司書クララ,霊能者,パメラさん来てくださったんですね！シスターも…えと、シスター型ロボット…？額に文字を書くのが流行なのでしょうか。じゃ、つ【中】
プロローグ,老人モーリッツ,村人,おお、アンケートがあるぞぃ。■１.不定期じゃな。爺はにーとじゃから、結構いつでもちょくちょく来れるぞい。比較的夜が来易いかのぅ。■２.皆の都合に合わせるぞ。■３.こちらも皆に合わせるつもりじゃ。□４.ワシについては先程の通りじゃ。それから、こっちが愛馬ロシナンテ。赤兎よりも早いともっぱらの噂じゃな。
プロローグ,老人モーリッツ,村人,つ【喧嘩上等】【愛】【・】好きなのを選ぶと良い。パメラとフリーデルも来ておったの。宜しくな。
プロローグ,シスターフリーデル,占い師,■１.不定期デス。朝箱を使えるのは１０時以降となりマス■２.仮決定１０時、本決定１１時■３.なるべく理解に努めマス□４.サイボーグデス。泳げませんノデ水には沈めないでクダサイ。
プロローグ,青年ヨアヒム,人狼,>>56 ロシナンテ、可愛いね。いい馬だ。（これは、ロバじゃないのか？）お爺さん、僕も書いていいかな？つ【愛】うん、ゲルト君。かっこ良くなったね。いいね。
プロローグ,シスターフリーデル,占い師,つ【髭】だんだん書くスペースが少なくなって来マシタ。賑やかになって参りマシタガ、もう少しデスネ。人数が揃う頃にはゲルトの顔は真っ黒デショウカ？
プロローグ,青年ヨアヒム,人狼,そうだね、リデルちゃん。美女も多く集まったことだし、僕としてはかなり嬉しいんだけど、狼を倒すにはもう少し集まって欲しいよね。まぁ、僕は気長に待つさ。ゲルト君の顔が、面白いことになってきたね。リデルちゃん、君は優秀なサイボーグだ。センスがある。そして、可愛い。
プロローグ,老人モーリッツ,村人,つ【すてきまゆげ】（ふんふん、落書きは楽しいのぅ）あ、爺はヨアヒムにやれって命じられてるから、仕方なくやっておるのじゃ。許せよゲルト。この分だと、開始はまた明日になりそうだの。ふぁ～あ、眠いの。寝てて良い？
プロローグ,老人モーリッツ,村人,ででっでっでで。ででっでっでで。（ターミ●ーターのテーマ）フリーデルよ、良いことを教えてやろう。人間は駄目と言われたことを猛烈にやりたくなる生き物なんじゃ。…件のロボットは水にぬれるとどうなるんじゃろうな。（wktk
プロローグ,農夫ヤコブ,村人,とりあえず参加 from 鳩また夜に来ます
プロローグ,青年ヨアヒム,人狼,>>61 あはは、皆の悪戯は僕の悪戯〜。うん。寝てて良いよ、お爺さん。おやすみなさい。（皆！お爺さんの額に文字を書くチャンスだ。）そうだね、開始は明日になりそうだね。でも、今夜は安心だ。こんなに人がいるんだ。ただ、僕は昨日のようにしょっぱい夜は過ごしたくないね。
プロローグ,青年ヨアヒム,人狼,おお、ヤコブ。宜しくね。うん。また、夜話そう。（大変だ、旅人君。イケメン候補その１、ヤコブが来てしまったよ。どうする？）
プロローグ,シスターフリーデル,占い師,カ、可愛…！？可愛いというノハ、クララやパメラの事を言うのデス！私なんかには余りに勿体無い言葉デス…！！…内部に浸水すると、発火しマス。私も危険デスガ皆様も危険デスノデどうか自重ヲ！（自身に防水スプレー噴射）
プロローグ,司書クララ,霊能者,ヤコブさん、来てくださったんですね。シスターは水が苦手なのですか。わかりました。つ【ビール】【紅茶】【機械油】好きなのどうぞ～。
プロローグ,旅人ニコラス,狩人,おー、ヤコブも来たのか、よろしく。って、ちょっと目を離したスキにゲルトが面白いことになってるな。ははは。>>65 （たしかにまずいな、ヨアヒム……よし、ここは共同戦線といこうじゃないか）
プロローグ,旅人ニコラス,狩人,>>66いや、フリーデルはかわいいぞ。うむ。俺が言うんだから間違いない。もちろん、クララやパメラもかわいいな。いや素晴らしい。この宿に来てよかった。
プロローグ,青年ヨアヒム,人狼,>>66 あはは、リデルちゃん可愛い〜。>>68（旅人君、了解。とりあえず、ヤコブの様子を見よう。ただのイケメンか。それとも僕達と同じ、紳士なのか。見極めるんだ、敵か味方なのか。）
プロローグ,負傷兵シモン,村人,ひょっこり。
プロローグ,負傷兵シモン,村人,これから飲むから、また夜に宿に戻るﾆｮﾛ
プロローグ,青年ヨアヒム,人狼,おっ、クララちゃんがビールを用意してくれたようだ。ありがとう。今日は暑いからね、助かるよ。旅人君、お爺さん、ヤコブ、良かったら一緒に飲もう。僕はどうしても聞きたい事があるんだ。>>51 リデルちゃんの発言だ。彼女は「半分は生身」らしい。...気にならないか？
プロローグ,青年ヨアヒム,人狼,おお、シモン！よく来てくれたね。宜しく。シモンは兵士だ。きっと村の良き力になるよ。シモンも良かったら一緒に飲もう...って、もう行ってしまったようだ。残念。まぁ、僕は先に飲んでるよ。シモン、待ってるよ。（シモン...思わぬイケメンが来た。君は紳士か？そうであることを願う。）あと、１人かな？楽しみだ。
プロローグ,ならず者ディーター,村人,農夫COだべおらも畑耕すど！
プロローグ,ならず者ディーター,村人,とりあえず名乗りを挙げてみたべまた夜に来るでよ
プロローグ,青年ヨアヒム,人狼,ディタ、宜しくね。よし、これで明日から狼退治が出来るね。君が来てくれて良かった。ディタ、農夫だったのか。もしかして、畑を耕すと女性に好かれるのかな？じゃあ僕も...外は暑いな。僕は畑を耕すのはやめとくよ。ディタ、夜にまた会おう。
プロローグ,仕立て屋エルナ,人狼,おや、ようやく人が集まりだしたみたいだね！ボクも参加するよ！詳しくはまた後でっ。
プロローグ,旅人ニコラス,狩人,（兵士に農夫だと……！　職持ちとは、なんという強敵だ）ふむ、シモンと農夫ディーターか。よろしく頼む。>>73 ああ、そうだな。俺もそこは気になった。ただ、どこが生身か詮索するなって言われてるしなあ。本人に直接聞くわけにもいかない。うまく確かめる方法があればいいのだが。
プロローグ,シスターフリーデル,占い師,クララの差し入れ、嬉しいデス！紅茶をいただきマス。水に浸かるのは駄目デスガ、水を飲む事は出来マスノデ。アルコールは…動作確認をしていないので分かりマセンガ。>>73ヨアヒム＆>>79ニコラス…解剖は痛いので嫌デスヨ？
プロローグ,旅人ニコラス,狩人,おお、続々と人が集まってきているようだ。よろしく、エルナ。>>80 か、解剖？！　あ、……ははは。いやいや、何のことかな、フリーデルちゃん。おおー、美味しそうな紅茶じゃないか。うん、いいね、紅茶。俺もクララにもらってこようかな。はっはっはっ。
プロローグ,シスターフリーデル,占い師,どうやら明日には始まるようデスネ。楽しいゲームになる事を心から願いマス。（イケメン…先程からよく聞きますガ、私の辞書には登録されていない言葉のようデス。男性を指し示す言葉という事は推測可能デスガ、ムムム。旧型はアップデートも手動で面倒なのデスヨネ…）
プロローグ,仕立て屋エルナ,人狼,■１.んー。基本夜？時々朝？みたいな。まあでも決定時間にはいます。コアずれは起こしません！■２.いつでも良いです。■３.投票COはどうもイマイチ好きじゃないですけど村の意向には従うつもりです。□４.クリーニングは[めいどクリーニング☆]まで！
プロローグ,シスターフリーデル,占い師,ニコラスは私を解剖しないデスカ、それは安心デス！紅茶美味しいデスヨー♪この時期だとアイスティーも良いデスヨネ。私は柑橘系のフレーバーの紅茶とか好きデスヨー♪（フリーデルはスキップしながら去っていった）
プロローグ,青年ヨアヒム,人狼,エルちゃん、宜しくね。君はもしかして「ボクっ娘」なのか？可愛いね。うん、やっと人が集まり始めたんだ。僕は最初どうなるかと心配していたよ。でも、これで安心だ。（旅人君、リデルちゃんの言葉>>80を見てくれ。アルコールは動作確認をしていないそうだ...これを利用出来ないかな？）...リデルちゃん、ビール一緒に飲もうよ？
プロローグ,旅人ニコラス,狩人,>>85（ほう……なるほど興味深い。ならば、俺にいい考えがある）おーい、フリーデル、紅茶にブランデー混ぜて飲むとうまいらしいぜ。一回試してみないか？
プロローグ,司書クララ,霊能者,そうそう、紅茶にフルーツはよくあうんですよね。この村は畑が多いですから、フルーツも新鮮で美味しいですし。シスターとは気が合いそう♪（…機械油はこっそりしまっておこう）人が増えて良かったです。宿の女将さんいないようなので、食べ物飲み物も自分達で用意した方がいいですかね。
プロローグ,司書クララ,霊能者,あーーー紅茶にブランデーはダメです！こっち、こっちのジャムにしましょう。ねっ！！
プロローグ,旅人ニコラス,狩人,>>88 な、なにい？！　あ、いや、濃いめの紅茶にな、酒とジャムを混ぜて飲むのがうまいんだって。マジで。これ旅人情報だから。クララも試してみるといいぞ、うん。
プロローグ,司書クララ,霊能者,>>89じー…下心なんてないですよね？（ヨアヒムさんとニコラスさんの言うことには気をつけなきゃ！）
プロローグ,青年ヨアヒム,人狼,リデルちゃん、確か君は旧型のサイボーグなんだよね。アップデートは大変だろ？アップデートを簡単にする良い方法がある。「紅茶に酒を入れる」ことだ。どうやらカフェインと、アルコールが良い潤滑油となるそうだ。もし君がアルコールが苦手なら、お口直しにジャムを入れると良い。
プロローグ,仕立て屋エルナ,人狼,おなかすきましたー。夕飯でーす。【ステーキ】【みそ汁】【ご飯】【サラダ】
プロローグ,旅人ニコラス,狩人,はっはっはっ、俺に下心なんてあると思うかい、クララちゃん。お、エルナ。なんだかステーキセットな夕飯だな。うまそうだ。
プロローグ,司書クララ,霊能者,鳩さんの体調チェックですー。具合悪かったらごめんなさい。今夜はステーキですか、豪勢ですね！いただきまーす。ウマウマ♪
プロローグ,老人モーリッツ,村人,ふぁ～あ、おはよう皆の衆。って、すごい増えとるがな。賑やかなのは良い事じゃ。もっとどんどん入ってきてくれると嬉しいのじゃ。たまには脂っこいものも食べたくなるよね。ステーキいただきますじゃ。
