プロローグ,楽天家ゲルト,村人,人狼なんているわけないじゃん。みんな大げさだなあ
プロローグ,少女リーザ,村人,人狼なんていゆわけないよのさ。
プロローグ,神父ジムゾン,村人,ジムロンなんておるわけないやん。みんなおおげさやなあ
プロローグ,羊飼いカタリナ,村人,寒い
プロローグ,旅人ニコラス,人狼,海の幸がうめーら？
プロローグ,村娘パメラ,占い師,牡蠣が食べたい。そうだ鍋をしよう。[…は土鍋につゆを沸かし、具材を放り込み始めた。]
プロローグ,羊飼いカタリナ,村人,鍋はいいねえ。料理下手でも格好がつく。[…はその鍋にチョコレートを投入した。]
プロローグ,神父ジムゾン,村人,闇鍋パーティやん！[…はその鍋にハバネロを投下した]
プロローグ,村娘パメラ,占い師,どうしてこうなった。ちょっと早いけど、今日のお昼は闇鍋ね。みんなも食べていいわよ、どうぞどうぞ。具材の持ち込みもまだまだ待ってるわよ～。
プロローグ,少女リーザ,村人,リーザ、甘いもの大ちゅきよのさ。[…は鍋にシロップを投入した]
プロローグ,ならず者ディーター,村人,鍋か、いいねえ[…はだし昆布を投入した]
プロローグ,少女リーザ,村人,人が集まゆのが早くて嬉しいわのよ。フユメンになゆといいな。
プロローグ,村長ヴァルター,人狼,おや、お昼は鍋かい？それにしては甘い香りが漂っているような…
プロローグ,少女リーザ,村人,そよそよお昼ご飯食べゆわのよ。[…は鍋を一口食べた]
プロローグ,少女リーザ,村人,アッチョンブリケ！
プロローグ,村娘パメラ,占い師,みんなひどいわwwww>>11ディーター、貴方は私の癒しよ……(今更だしの味なんてしないけど)>>13いらっしゃい、村長さんも食べる？こないだセ○ンイレブンで売ってたLO○Kハバネロチョコに似た味がするわよ。
プロローグ,旅人ニコラス,人狼,鍋かぁ、牛すじ煮込みはうめーよ[…はサイレントヒル牛の牛筋を塊で投入している]
プロローグ,羊飼いカタリナ,村人,ボンカレーはどう作ってもうまいのだ
プロローグ,旅人ニコラス,人狼,カレーは文化
プロローグ,少女リーザ,村人,羊>>18先生！
プロローグ,旅人ニコラス,人狼,ぴn……リーザちゃんは可愛いです
プロローグ,神父ジムゾン,村人,もり●が　のピノは美味いでー
プロローグ,神父ジムゾン,村人,リノコが可愛いのには同意するわ
プロローグ,ならず者ディーター,村人,カタリナ、その手があったか
プロローグ,司書クララ,村人,晩飯のなべはまだかのう？
プロローグ,神父ジムゾン,村人,色はどー見てもカレーやなどれどれ…[…は、味見した]
プロローグ,神父ジムゾン,村人,アマッタルイン！からの嫌な痛みが！
プロローグ,仕立て屋エルナ,霊能者,あまりよくわかってないけどいいかしら?
プロローグ,村長ヴァルター,人狼,やあやあ。こんなものを拾ってきたよ■1．コアタイム■2．仮決定時間・本決定時間の希望■3．やりたいこと/やりたくないこと□4．自己紹介とか何か一言
プロローグ,負傷兵シモン,村人,闇鍋・・・
プロローグ,村長ヴァルター,人狼,おやシモン君いらっしゃいこの鍋はなかなか珍妙な味がするよ。
プロローグ,仕立て屋エルナ,霊能者,とりあえずきょうは寝ｲﾃﾃよねがんばぞー
プロローグ,仕立て屋エルナ,霊能者,なんかうまく言えてない今日はもう寝るむよ明日からガンバルです
プロローグ,村長ヴァルター,人狼,■1．21時前後かな■2．本1時間前、仮30分前■3．仲良く鍋をつつきたいねえ□4．よろしく
プロローグ,司書クララ,村人,闇鍋には柑橘系のものを入れるとギリギリ食べられる範囲になるはずですよー[…はなべにみかんの皮投入]
プロローグ,司書クララ,村人,あら村長これはどうも■1．このくらいの時間■2．一時間/三十分前■3．なかよく□4．毎日なべでも構いません
プロローグ,負傷兵シモン,村人,闇鍋は恐ろしいぞこの怪我だってな・・・
プロローグ,パン屋オットー,村人,パンだ！！パンを入れるんだ！！！！[…は鍋に両手いっぱいのパンを放り込んだ。]し、汁を吸ってパンが肥大化している…！？
プロローグ,村長ヴァルター,人狼,仮本が逆になってしまったエルナ君はお疲れみたいだね、ゆっくりおやすみ。
プロローグ,パン屋オットー,村人,オットーだよ、おにちくしょうのパン屋仕事で精神がギリギリですぐにメンタルリセット必要になるよ明日は時間取れるけど、明後日からはこれくらいの時間に2.3発言してとっぷり考えると思うよ。省エネだよ。
プロローグ,パン屋オットー,村人,村長ありがとう、短パンが素敵だね■1．21時ごろに帰宅するよ。それから考えるよ■2．本決定に間に合うようには希望出すよ■3．ゆるふわしたいなぁ□4．闇鍋って怖い話あって震えるよね
プロローグ,パン屋オットー,村人,やぁ、鍋の汁をほどよくパンが吸い込んでるよいただいてみようかな…もぐm…う"っ[…は無残な姿で発見された。]
プロローグ,少女リーザ,村人,村長さん、議題ありがとうよのさ。■１．２０時以降。更新直後はすぐ寝ゆー。■２．１時間前・３０分前■３．楽ちくやりたいわのよ。■４．こう見えても１８歳のレレイよのさ。見た目はころも、頭脳はおとなよのさ。
プロローグ,村長ヴァルター,人狼,オットーくーーーーん！！！なんてことだ…この村から犠牲者が出るなんて…くそう人狼め！許さんぞ！
プロローグ,羊飼いカタリナ,村人,どうしてこんなことに……
プロローグ,行商人アルビン,狂人,いかがわしい物ばかり売っているアルビン商会だよ。渡した人が飲んだ人に惚れてしまう惚れ薬とか、闇鍋でも胃を壊さない胃薬とか・・・でも、闇鍋にパンを入れすぎて、膨れて喉に詰まったのはどうにもならないよ。
プロローグ,行商人アルビン,狂人,■１．２０時以降。更新直後はすぐ寝ゆー。■２．１時間前・３０分前■３．凸は嫌いだ。■４．鍋はやっぱりゆずぽんでないとね。
プロローグ,農夫ヤコブ,人狼,京野菜について熱く語る村はここですか？
プロローグ,少女リーザ,村人,あと３人でフユメンよのさ。
プロローグ,少女リーザ,村人,・・・と思ったらあと２人らったわのよ。
プロローグ,農夫ヤコブ,人狼,万願寺とうがらしって、実は外国野菜だべ？
プロローグ,行商人アルビン,狂人,京野菜（きょうやさい）は、京都府で生産され京都の雰囲気を醸し出す京都特産の野菜。2009年現在では、一般的に京の伝統野菜やブランド京野菜を指す。（wikipediaより）需要が少ないから京野菜としてブランド化できる野菜です。美味しいんだけどさ。
プロローグ,農夫ヤコブ,人狼,さすが、商魂逞しいべ。
プロローグ,農夫ヤコブ,人狼,闇鍋には普通の唐辛子を山盛り入れておくべ。
プロローグ,パン屋オットー,村人,帰ってきたよ、三途の川からねやぁみんなこんばんは、良い夜だね万願寺とうがらしって外国産のものを京都で掛け合わせたものだったと思うなぁ。串焼きが本当においしいよね
プロローグ,行商人アルビン,狂人,万願寺唐辛子大正末期から昭和初期にかけて京都府舞鶴市万願寺地区にて伏見系のトウガラシとカリフォルニア・ワンダー系のトウガラシを交配して誕生したものと言われている。（wikipediaより）でも、辛みの少ないシシトウの方が安くて美味しいよ。
プロローグ,ならず者ディーター,村人,これは、即日始まるのか？こいつは嬉しいねえ！フルメンだともっと嬉しいな。ズザー待ってるぜ！昆布だしのチョコレートベースの唐辛子が効いた鍋か。まあ…死にゃあしねえだろ
プロローグ,少年ペーター,村人,闇鍋の闇は深い。。。
プロローグ,少年ペーター,村人,［…は、闇鍋にハマの大魔神を投入した］鍋だけに火消しとか、そういうん。。
プロローグ,ならず者ディーター,村人,ここは謀略の村だからな。鍋に何を入れるか、知恵比べだぜ
プロローグ,少女リーザ,村人,者>>57万が一のことがあっても先生がシウツで直してくれゆわのよ。
プロローグ,シスターフリーデル,狩人,ナベナベナベ
プロローグ,シスターフリーデル,狩人,私が鍋だ！！
プロローグ,神父ジムゾン,村人,ムクリ…おお、フルメンやなあ！よろしゅう！
プロローグ,少年ペーター,村人,議題回答するね■1.21:00−24:30■2.60分前／30分前■3.明るく明るく楽しくね
プロローグ,神父ジムゾン,村人,鍋COとは…非対抗！
プロローグ,少年ペーター,村人,［…は、闇鍋にDHを外して大●谷を投入した］鍋だけに（ry。。。
プロローグ,シスターフリーデル,狩人,はてしなくつーづくなべ奉行の戦いわーここから始まったのねー
プロローグ,シスターフリーデル,狩人,私を煮込んで！！
プロローグ,神父ジムゾン,村人,■1.20時～更新時あたり■2.60分前／30分前■3.協力プレイして、殺伐とし過ぎないことやな□4.鍋のしめってゆうたら、雑炊やろ[…は米を投入した]
プロローグ,少年ペーター,村人,リデル＞非対抗ただの素鍋です
プロローグ,シスターフリーデル,狩人,とーどかなーい鍋への気持ちー
プロローグ,シスターフリーデル,狩人,対抗鍋COいないの……？私は鍋確定ね
プロローグ,ならず者ディーター,村人,こりゃ嬉しいぜ！フルメンだな！
プロローグ,神父ジムゾン,村人,素麺COや
1日目,楽天家ゲルト,村人,ふぁーあ……ねむいな……寝てていい？
1日目,少女リーザ,村人,【非占】霊は占い師の人数によって潜伏も考慮すゆわのよ。おやちゅみ。
1日目,ならず者ディーター,村人,よろしくな！とりあえず【非占】だけ回しとくぜ！あ、【非鍋】もまわしとくか。
1日目,負傷兵シモン,村人,始まったな【非占い】霊回しもするのか？おれはどっちでもいいぞ。
1日目,シスターフリーデル,狩人,まあみんなおちついてくれ鍋である私から提案がある潜伏占い師やろう！！！
1日目,神父ジムゾン,村人,地獄の底から戻ってきたでー！占い能力置いてきてしもたー【非占】や。あんまり要素取りは得意分野じゃないさかい、序盤はのんびりと議事を眺めさせてもらいましょか。
1日目,ならず者ディーター,村人,>>80修え？すまん、プロローグのうちに言ってくれればな…潜伏進行とか、ワクワクするな！
1日目,神父ジムゾン,村人,>>リデル潜伏したい占いがおるんかしらんけど、どうしてもしたいなら流れ的に非占いすればええんとちゃう？ただfoになるんとちゃうかなーまあ占いは出てくれー派さかい。
1日目,パン屋オットー,村人,おっと、寝過ごすところだったよん？潜伏やるの？
1日目,少年ペーター,村人,始まりました〜。【非占】（エア）■1.まとめ役：確能＞確白■2.占霊CO：とりあえず占い回しの流れ？みなさん約1週間よろしくです！
1日目,農夫ヤコブ,人狼,潜伏かーとりあえず鍋だけ回しておくべ。非鍋
1日目,負傷兵シモン,村人,潜伏はやだな。それ考慮して動くのも馬鹿らしいし。もう俺回してるしな。独断潜伏しようとしてもめんどくさいからやめてくれ。だから俺は今日COしない占い師は信じないぞ。
1日目,シスターフリーデル,狩人,ｱｱｱｱｱもうCOハジマッテルノネ潜伏占い師案はなかったことに…………私が潜伏占い師だ……！ﾃﾞﾃﾞｰﾝとも言える能力も持ってないです要するに……わたしのーおなべのなーかでーナカナイデクダサイー
1日目,パン屋オットー,村人,4人非占透けちゃってるのねなんだかんだ夜明け後の潜伏案ってきついよね。僕はそういうのノリノリでやりたいんだけど残念。やりたくない人がいるならやめとこう【非占】霊に関しては占の枚数出てから考えればいいと思うなぁ
1日目,村長ヴァルター,人狼,おお、始まってる【占いco】潜伏とかしないよ
1日目,農夫ヤコブ,人狼,ほな【非占】どすえ。
1日目,神父ジムゾン,村人,占い潜伏案や霊のcoについてはオットー>>89に同意するわ。んで村長のCO把握したところで俺は寝させてもらうでえ！
1日目,シスターフリーデル,狩人,鍋確定から進言すると能力者は能力者の思うようにCOしたり動いて欲しいな鍋CO回りきってないから自称確定だけどよろしくね鍋的には歌いたい気分だから歌うねおーなーべーはーさーいーこーうーだー
1日目,少年ペーター,村人,占い師は回す流れになったんだね。取っ掛かりが何も無いのもはなしづらいから良かったんじゃない？【ヴァルの占CO確認】あとは回りきってからかな。ぼちぼちと寝まーす。テンション高いリデルに色々と期待したくなるね〜w
1日目,ならず者ディーター,村人,【村長の占CO確認】まあ…占COが出た以上、占いは回そうか。霊潜伏には含みを持たせておきたいな。1dの鍋の具材に、[自分で釣ったフグ]を投入するぜ！フグって美味いよな！
1日目,シスターフリーデル,狩人,今日からうきうき鍋祭りだよぉ！！鍋と鍋が年に一回出会う祭典そう、祭典なの……鍋は仲良く皆で突っついて食べようね！！おかわりは自由だよ！！鍋的にはこの赤い鍋と、白い鍋がおすすめ！！変わったものが食べたい人は黒い鍋なんてどうかな！！
1日目,負傷兵シモン,村人,村長の占いCO確認している。フリーデルは何で一分も過ぎてから潜伏案を提案して>>98の反応になるんだ。CO回しないと思った？オットーの反応もなあ。>>84、>>89の流れがよくわかんね。>>84の時点でCO回し見えてねーとかあるのか？この辺りよくわからない奴らだわ。CO回しは進まねーみたいだしねる。
1日目,行商人アルビン,狂人,３CO目で出たかったんだけれど、これ以上引っ張っても仕方がないので、【占いCO】します。後は、COが出揃ってから考えますか。凸を真剣に考える必要があるかも。**
1日目,シスターフリーデル,狩人,私的には開始直後から文章うちはじめて即投下したんだけどね遅かったみたいだよねまあそれが怪しいと思うなら疑ってねそしてコマーシャル挟みます！！お祭りの鍋と鍋をあわせてナベアワセナームーお鍋のフリーデル今ならなんと鍋の祭典中！！ご参加の方にはなんと鍋がついてきます！！
1日目,村娘パメラ,占い師,[…がお玉で鍋をかき混ぜていると、目の前に楽天家 ゲルトが現れた。]あらゲルト……えっ、それを私にくれるの？ありがとう、鍋の具材を持ってきてくれたのね。何かしらこれ。　丸くて、透明で、固くて……。このままじゃ食べられそうにないけど、煮込めば柔らかくなるかしら？[…は土鍋に水晶玉を入れ、ぐつぐつ煮込んでいる。]【占CO】
1日目,司書クララ,村人,［非占］霊潜伏も面倒くさいので［非霊］します遅ればせながらフル麺おめでとうございます。
1日目,村娘パメラ,占い師,いえーい、>>100取ったわ♪私も3CO目に出たいと思ってたのよね……みんな、引っ張っちゃってごめんねー。あ、仮/本決定は22:45/23:15で大丈夫よ。このまま撤回とか無くて占3COなら霊潜伏がいいと思うわ、だって面白s……(ゴホンゴホン)護衛を占いに回せるものね。占方法は自由が好きだけど、統一でも大丈夫よ～。
1日目,司書クララ,村人,占い3coみました。本格的に霊潜伏する可能性が出て来ましたが足並み揃えられずごめんなさい。ただ自信のない潜伏は狼へ逃げ道を与えかねないのでさっと出てきて欲しいです。
1日目,負傷兵シモン,村人,なんか動いてた。娘商のCO確認3CO目がよかった理由が欲しい。あとパメラは霊潜伏希望で自由占いなん？
1日目,負傷兵シモン,村人,クララよ。それ催促する必要なくね？自分で考えるっしょ。占い方法は占い師がしたい通りさせてやりたい。皆が自由できるってなら自由でそうじゃないなら統一で。自由の場合は霊は出ることになって統一ならどっちでもいい。回避については本人の判断に委ねるが、基本はありの方向だな。
1日目,村娘パメラ,占い師,って、書が>>101でもう非霊してる(´・ω・`)霊潜伏面白そうなのに～。出来れば他のみんなはこのまま黙ってて欲しいんだけど。>>104兵私、2-2はあまり好きじゃないのよね、出来れば狼にプレッシャー与えたかったの。後からCOした方が推理もしやすいし。あ、そうか、うっかりしてた。霊潜伏なら自由はあまり良くないわね、思い出したわ。もし霊潜伏になるなら統一希望でお願いするわ～。
1日目,羊飼いカタリナ,村人,あ、始まってるね。ここまでの流れを把握。やっぱり潜伏は難しいし、狼に逃げ道を与えたくないよね。【狩人CO】
1日目,パン屋オットー,村人,【占3CO把握】ふーん、3CO目に出たかったんだね。アルとパメ。じゃあここからはスライドは出ないだろうし、村長が撤回しなければ3COでいいんじゃないかな霊伏せなら統一希望かな。クラが占柱になれそうだね。初回占勿体無いけど偽占に圧かけられそう
1日目,村娘パメラ,占い師,>>107羊はっ！？えーと、これはネタと受け取っていいのよね！？
1日目,ならず者ディーター,村人,【商娘の占COも見たぜ～】シモンはガチだな～。まあ、この村はRP村じゃなくってガチ村なんだけどさ。>>97兵まあシモンの言う通りなんだけど、修狼仮定相談時間稼ぎな訳で、修長でもない限りそこは修黒要素という訳じゃないんじゃないか？屋の>>84も狼仮定時間稼ぎなんだろうけど、村仮定でもそういう反応しても別におかしくないだろうなあ、とは。それより羊>>107の方がな、っていうwww
1日目,負傷兵シモン,村人,>>107羊え？霊の間違いじゃなく？パメラに追加で聞きたいこと。なんで2-2が嫌なんだ？
1日目,司書クララ,村人,カタリナのは霊の間違いでしょうオットーのそれ私から白でる視点漏れですよね？
1日目,負傷兵シモン,村人,>>110者シスターに関しては別にそこ黒く見てるわけじゃねーよ。探るために置いただけ。オットーに関しては不同意だな。別に時間稼ぎとは思はんが思考の流れは追えねーかな。
1日目,パン屋オットー,村人,わぁお、素敵なCOきてるね>>107霊能の間違えうっかりモフモフ羊飼いじゃなかったら鳩を叩き折ってお客様センターに苦情入れたくなるやつなんだけど他に話す内容がないよね>>112クララ霊伏せの流れで非霊オープンして他に霊出るように促す箇所に偽占が黒打つの厳しいんじゃない？って言ってるの
1日目,負傷兵シモン,村人,クララの突っ込みいいね。視点漏れだね。なんで白仮定で話すのかわかんねーや。何となく反応も取れたからもう寝よ。
1日目,負傷兵シモン,村人,と思ったら気になる発言を・・・オットーは何でクララを白前提で語ってるんだってことだよ。そうじゃなきゃ占い勿体ないって言葉出てこねーだろ。クララの突っ込みはそういうことな。
1日目,神父ジムゾン,村人,まあ、落ち着こか(寝る寝るサギ)カタリナの件は一旦置いておこや。占いも無駄。狼じゃないなら噛まれるやろ。対抗もでやんでええで。狩炙りとかあるしな(非狩ブラフ)ただ思考開示はしてってくれや。んで、霊は潜伏でええんとちゃうかな。ここまで見てシモンは動きがいいから今のところ占い当てたくないなあ。
1日目,パン屋オットー,村人,え？なに？僕の発言ってそこまで話し合われてるの？説明するのもアレかと思ったけど、①あわてて更新する②直近の潜伏案(2個上くらいまで)を見る③脊椎反射する④全体見て「あーね」ってなるなんだけど。昨日のラストあたりの議事も読んでなかったしなぁんー、「勿体無い」は「非霊箇所占だから」なんだけどね。白仮定した覚えはないけどなぁ。偽が占結果騙りにくいって話だよ。
1日目,村長ヴァルター,人狼,おや、【商娘の対抗確認】だよ。【撤回しない】対抗印象は商狂娘狼かなとパッションこれなら自由でいいかね、自信有るとは言い難いけどやらせてもらえるなら頑張るよ。霊は自由にやるといいさ修>>93★対抗占いの潜伏も許容だったってことかい？とりあえずこれだけ。シモン君がガツガツしてていいねと思いながら就寝**
1日目,村娘パメラ,占い師,>>羊あ、ちょっと驚いただけだから、悪気は無いのよ。ネタとか言って言葉が悪かったらごめんなさいね。>>111兵そこは、前世で2-2やって負けた記憶があるってだけね。あんまり強い理由じゃないわ。3CO目まで待ったのは、狼陣営を迷わせたいって気持ちが大きかったわね……。確かに兵は動きがいいわね。書の突っ込みに対する屋の>>118も見てるわ、うーん……そうね、寝てからまた考える。**
1日目,ならず者ディーター,村人,>>113兵フリーデルに探るためか。了解。オットーは「寝過ごすところだったよ」がちょっとなんか引っ掛かったんだけど、思考自体は>>84「潜伏やるの？」からの>>89「4人非占透けちゃってる」ので非占、で村仮定で思考は追えると思うが。「占い勿体ない」はなあ。「勿体ない」の理由が視点漏れかどうかなんだけど。>>118「偽が占結果騙りにくい」って、どういうことなんだろうな。そこは謎だが。
1日目,パン屋オットー,村人,やっぱり占は3CO目に出たいって発言がイマイチピンとこないんだけど、どうなんだろう？「3CO目」じゃなくて「最後に」じゃないの？占がCO保留するのって、占枚数を増やすためでしょ。占2枚が狼狂だと、狼から見た場合狼真に見えるよね。そこには真狼狼の盤面を作れる環境がある。狼が2騙を出した時点で真がCOすることでCO順からの信頼と、狼のあぶり出しってメリットが生まれるんだよね？
1日目,司書クララ,村人,オットーにとって狼を占いに当てるよりも偽占に圧をかけるのを優先しているのも問題。私狼だとその限りではない上占3COで内訳真狼狂とみると>>12下段が謎。>>118でもシモン一人につつかれてこの反応なので防御感。ということでオットーも霊/非霊回しませんか？仮にオットーが霊で潜伏されても不安ですし、非霊なら「もったいない」ですが占柱も考えます。
1日目,パン屋オットー,村人,だから占がCO保留にした時は最後まで待たなきゃ効果は薄そうだと思うんだよね。そこらへんにポーズを感じるんだけど僕の感性の問題かなぁ>>アル、パメ★占4枚は考慮なし？あと上の読んでの感想も欲しいなぁあー、>>121ディタは説明不足だったかも？占内訳がどうであれ、非霊箇所には騙が偽結果つけにくいと思うんだよね。霊が潜伏し続けて初手で落ちないのが条件だけどね
