4日目,少女リーザ,人狼,伺わせ、とても人間ぽいの。周りを良く見てしっかりと話しかけ議論する姿は、狼探すぜ！！と言った気迫に満ちておる。ただ、ちと尼への疑いと羊吊りが強引なのが誘導色が有って怖いかの。兵の考える「戦術論疎い狼」像にそって猛進してるんだとは思うんじゃが。あと2d突然死対策を意識していたことが、吊り手数保持＆ロラ推奨の思考に見え、その後の霊襲撃とイメージがあまり合わないのじゃよな、兵は。
4日目,村娘パメラ,村人,ぜんぜん、時間取れてないよ、今日。うにぃ～希望：●エルナ○シモン　▼クララ▽カタリナ吊は戦術論以前の勘定が含まれてます。
4日目,少女リーザ,人狼,ディタ占真狂ならかなり白め。者狼とすると、非CO状態の人が商神（この場合両方白）の2人のみを残した状態で、1COの書の真狂もわからないままに非占CO。狂の位置が確信できてない限り、自分から占確定させてることになる。しかもCO保留状態の神の存在を無視とか、どんだけ占確定に興味ないんじゃろ？と言った感じ。占真狼なら書か神、いずれかの仲間が占を騙る事は知っていると思うので確定の勘違いは変。演技の余地
4日目,少女リーザ,人狼,も絶対に無い分けではないが……どうも素っぽい反応が多く、状況白と見ておる。気になりどころは、初日からの農狼予想。>>236「全潜伏＝占われない自信のある狼＝農怪しい」>>675「村とは思えない＝狼」などなど、ワシには、ちと理由が理解できないせいか、やや結論ありきな意見に思えたかの。ただ1d占CO周りで白っぽく見られてただけに、この農ロックに狼としてのメリが無いのがある意味白いの。
4日目,少女リーザ,人狼,個体印象のみならぶっちゃけあまり白くは思っとらんが、状況白が強いかの。リナ寡黙な羊飼い。3d意見内容から、議事は読める。そこに気になる点を見つけられる。考察する意思はある。2d駆け込み突然死回避。おそらく白黒によらずの都合。登場時の感じから突然死の概念があんまりないのかの？ここらへんは単独感が強い。発言内容からの色はなし。書ライン情報なし。
4日目,少女リーザ,人狼,青ライン。2dで青が農白くみて、旅羊を吊り候補扱いにしておるの。農吊りの流れに乗れば羊生きるのでここは切れ要素あり。神ライン。>>525「羊より農を吊りたい」疑わず吊らずだけど、なんだか単に視界の外っぽくもある。3d旅への個別質問だしの丁寧さから、ここ繋がってたらめっちゃサポートしてあげてそう。そこらへんは繋がってないと思わせる部分。判断不能。狼か？と言われるとすごく微妙じゃの。
4日目,少女リーザ,人狼,娘／神ライン白なんで状況否定要素でるまで、あんまり気にするつもりが無かったところ。3d視点確定情報を得てからの発言の伸びがふつうに白いの。ワシが最初に感じた不透明さも、質問を繰り返していくうちに理解できたんで、あまり気になる所が無いの。あえて言うなら>>678表のことはわすれてー！！…くらいかの。尼抜いての印象は白：娘＞者服＞兵羊　羊は実質判断不能じゃの。■3白狙い占で●者○服▼羊▽兵　
4日目,司書クララ,人狼,おそくなったーーー。今から議事沈んでくる、けど。【修の狩人CO見た】【▼●修除外把握】あ～。なんかもう、はちゃめちゃね、この村。いや、面白いからいいけど、昨日の分から読み直すから、ちょっと時間頂戴。【▼娘】は、まず間違いなく提出。ここは譲らないわ。
4日目,少女リーザ,人狼,／服兵羊者尼娘妙書＿●尼妙尼兵者服者＿＿○者＿＿妙服兵服＿＿▼羊羊＿妙羊書羊娘＿▽尼者＿羊者羊兵＿＿
4日目,神父ジムゾン,占い師,ようやっと戻れた。パメラのここ数日のおなか減ったアピに反応するよ！アルビンもいないしね！つ【芋羊羹】こんなことなら昨日ニコラスに発言割いたんだから占わなければよかったと思いつつログ呼んでくる。今のところ希望は▼羊●妙○者かな。カタリナごめん！
4日目,神父ジムゾン,占い師,時間ないしスピード重視。＿兵尼者妙神●妙服妙者妙○＿＿＿服服白占い希望はこうか。ディタとパメラは>>890見て白占い希望出してほしい！
4日目,村娘パメラ,村人,議題にも答えてないよね。ごめんなさい。能力者考察は、昨日、参照ね。襲撃については、微妙…。まず、ペタ襲撃。仮説として占や爺を襲うのが怖かったのではと思われる。また、ローラに手数をかけさせるといった作戦とは無縁。
4日目,村娘パメラ,村人,白占、白占、白占、白占、白占、白占…。●者、○妙で！
4日目,ならず者ディーター,人狼,鷹より。白占いならエルナで。>>921 カタリナについて第二希望に挙げたのは>>902で裏に狼が見えなくもなくなってきたからだ。
4日目,仕立て屋エルナ,村人,ただいまやで～…ってなにこの展開！？思わず茶あ吹いたわっ！【尼狩CO確認】【尼以外の希望提出了解】【お爺鳩暴走確認】えーと、頭動かん。議事録もざっと読んでうちに質問来てるぽいから時間許す限りそれ答えるかな。尼狩人COか…。神の白狙い賛成。うちもそれで出す。GSからだと【●妙○兵▼羊▽者】でヨロやで。
4日目,神父ジムゾン,占い師,ってかあれだ。【今日自由占いでもありのような気がしてきた】ダメかな。あと、自分で出しておいてアレなんだけど今日「判断しづらいから▼羊」はない。んなもんあとででいい。今日吊るべきは怪しい人。それで白引く確率上がるはずだから！だから一旦▼羊は取り消すよ！
4日目,村娘パメラ,村人,次にアルビン襲撃。もし襲わなければ、次かその次あたりに確実に吊られていたはず。つまり　　「狼は、狩人にできるだけ早く退場して欲しかった。」ことが、窺い知れる気がする。あるいは、深く考えなかったか。
4日目,村娘パメラ,村人,つまり、灰狼は危険位置ってことね。|∀･)･････ つ【芋羊羹】|　)))つ【芋羊羹】|彡ｻｯ
4日目,村娘パメラ,村人,私はジムゾンが真だと知っているので　【自由占い賛成】他の人は別の意見があるかもだけどね。
4日目,旅人ニコラス,村人,／妙尼娘服者兵神書羊●者者者妙兵妙妙○服服妙兵妙   者▼羊羊書羊妙羊   娘▽兵者羊者羊者
4日目,司書クララ,人狼,読みきれない・・・ていうか何だこの展開。白占いかと思ったら、ジム決め打ち進行とか・・・負けてられない。が、考察間に合う気がしない。警告よ、パメラ放置は村負けを意味するわ。私を信じられないというのは最早手遅れ気味だから言うけど、盤上整理でも良いから吊っておきなさい。後で泣きを見るわ。ていうか、この進行なら私自由占いでいいかしらね？いい加減自分の推理が合ってるかどうか一人くらい確認したいし。まぁ
4日目,旅人ニコラス,村人,【仮決定▼カタリナ●ディーター】
4日目,司書クララ,人狼,隠すことに意味ないし。現状は【●妙○兵】ね。正直シモンが狩人かもって思ってて前占いから外したのだけど、大体狩人変な潜伏臭漂わせているし。狂人疑惑発言が無くなったという差で兵が一歩遅れで私の希望ね。今日私が…というかもはや襲撃で死ぬ気がしないのだけど、一応盤上整理という意味合いでの統一は【▼羊】かな。流石に後半に残しておけない。中盤の今に何かしらの処理をすべきだわ。出来れば吊っておきたいけど。
4日目,旅人ニコラス,村人,ごめん遅れた。でも今は箱の前にいる。【自由占い反対】
4日目,羊飼いカタリナ,村人,占いは白だと思う人を挙げればいいんですよね？●ディーターさん○エルナさんでお願いします。。
4日目,神父ジムゾン,占い師,＿兵尼妙神娘者服●妙服者妙者服妙○＿＿服者娘＿兵加筆修正。>>928みて一瞬そうかなと思ったけど、２日目は突然死懸念もあったから関係ないし、狼にカタリナいたら誰でも切ってると思う。ニコラス来たー。【仮決定●は了解】
4日目,旅人ニコラス,村人,うお、第1希望は者と妙が同数になった。カオス。第2希望までいれりゃ妙だけど。てかみんな羊吊る気満々だけどいいの?ああ、本決定ももうすぐじゃんどうしよ。
4日目,シスターフリーデル,狩人,【仮決定了解】だけど神>>938ならば●服▼者の意見。私は>>481から占真狼と思うので1d者の占確定発言は白く思えず。でも占いになるならそれはそれで同意。つ【芋羊羹】ミ（さっ！　もぐもぐ）
4日目,旅人ニコラス,村人,神と羊、吊り希望を出して食えレ
4日目,羊飼いカタリナ,村人,あんまり自分の中でも整理できていないですが。。しかたがないので▼パメラさんでお願いします。。。
4日目,負傷兵シモン,村人,【仮決定了解】ニコラス殿、独断でいいから本決定出していいと思うでござる。
4日目,神父ジムゾン,占い師,▼エルナかなぁ結構迷ってるんだけどね>>950クララ狼ならシモンとか白いと思うよ
4日目,仕立て屋エルナ,村人,☆尼>>882羊発言見て年は尼疑ってたん？とうちも思ってざっと年尼のみの発言を見たんだけどそれ程絡みはない。けども年の「考察が深くなれば見えてくる物が～」てのに注目。あの時点で黒視まではしていなかったと思う。でも年の言葉通り尼考察は熟読してみようと思って現在にいたる。って感じやね。
4日目,旅人ニコラス,村人,独断だと私羊以外を吊りに出しちゃうけどいいの？
4日目,シスターフリーデル,狩人,＞エルナさん>>955 返答ありがとうございました。なるほど…。遺言になるか、残されるか。☆老>>875へ返答を。灰に1狼を考えるなら：者＞兵。者は>>950の通り。兵は、頑なな狂占騙り戦術論が書狼を隠したいのかも？と。書兵は意図的なライン切り愛してるかも？と（神>>954への返答兼）。まー書非狼なら見当違いだし、他のひとの意見見ると、どちらにしろハズレっぽいですが。
4日目,旅人ニコラス,村人,ああやばい、胃が痛い。【本決定●リーザ▼カタリナ】独断は無理。モーリッツごめんなさい。
4日目,仕立て屋エルナ,村人,【仮決定了解や】自由占いか…。うーん、やっぱここまで混乱してると確定情報の方が狼探す方としては整理しやすいんやけど。そして、時間もなければ頭も動かない…。
4日目,神父ジムゾン,占い師,割と霊能襲撃って頑張ればつまないし不慣れともあんまり思ってない。リナリーザとか一瞬あんのかなとかおもう。>>948見るとほとんどの人シモン白いと思ってないよね。エルナリーザディタで拮抗。
4日目,仕立て屋エルナ,村人,【本決定了解や】何うちのこのタイミングの悪さ。ニコはんはお爺鳩暴走での急なまとめほんまお疲れ様や。そしてそのお爺はきっと箱前でもがき嘆いていると予想。
4日目,ならず者ディーター,人狼,本決定了解。セットした。
4日目,神父ジムゾン,占い師,【本決定確認】【セット済み】リーザよりディタのほうが素白そうで不安が少ないんだけど…
4日目,少女リーザ,人狼,ニコラス、急のまとめ、本当にお疲れさまじゃ。【決定了解】じゃよ。
4日目,羊飼いカタリナ,村人,むう。。村人の皆さんごめんなさい。。。
4日目,シスターフリーデル,狩人,【本決定了解】旅の鳩が暴れなくて良かった…。
4日目,司書クララ,人狼,てか>>945は【▼羊】じゃない、【●羊】【●了解】【▼反対】【▼娘よ】いや、盤上整理としては賛成なんだけど…あぁ、どうすれば…
4日目,神父ジムゾン,占い師,１ｄヨアGS白:修>兵>>娘>服>>者>農=妙=老>羊=旅>商:灰●商２ｄ●娘○兵▼旅▽羊３ｄ●旅▼者
4日目,神父ジムゾン,占い師,リーザ２ｄ【●娘○旅▼農】３ｄ●旅▼青４ｄ●者○服▼羊▽兵　
4日目,神父ジムゾン,占い師,クララ●兵○妙▼妙▽農or羊●兵●アルビン○シモン
4日目,仕立て屋エルナ,村人,＞神父さんでも、神父さんの●希望妙じゃなかったっけ？
4日目,神父ジムゾン,占い師,ニコラスまとめご苦労さん。上のはとりあえずメモ帳にあるのをコピペした。
4日目,神父ジムゾン,占い師,>>971うーん、そうなんだけどあの時点でとりあえずってことで出した後に考えが変わった。
4日目,旅人ニコラス,村人,死ぬかもしれんし私も遺言。私はアルビンが潜伏占いだったと思ってる。すなわちフリーデル真狩人で占い師両方偽（狼狂）。で、残る狼がディーター。商についての考察不自然
5日目,負傷兵シモン,村人,orz...決定確認言おうと思ったら...フリーデル殿、人、か...心が折れそうでござる。てゆーかなにこのカオス投票。拙者、ちゃんと羊に投票したでござるよ。
5日目,ならず者ディーター,人狼,俺なんでこんなに投票されてんの？昨日セットミスしたからあわよくば吊ろうとした？？狼狂3いるってことはなさそうだけど…。
5日目,司書クララ,人狼,フリーデル…ね、じゃあアルビンは何者だったの？この票はなによ…【全員投票先を明示してくれる？】【私は間違いなくパメラに入れたわ。】カタリナは最後にパメラどうの言ってたからこの二票かな。【発表順指定してくれる？】おなかすいたから発表だけしてご飯食べに行きたいの。
5日目,仕立て屋エルナ,村人,フリさん……これは何、狼に踊らされてるってことか？ほんまや。投票バラけ過ぎ…。【うちはカタリナ投票したで】えーと発表順は？お爺もニコもいないん？
5日目,ならず者ディーター,人狼,俺もちゃんとカタリナに投票したはず。鷹からなのでもしかしたら自分投票かも知れないが…。フリ真は想定内。襲撃する意味は帰ってから考える。占い噛む気ってことだよな。
5日目,村娘パメラ,村人,突然、村娘協会からの呼び出しが入ったので、本決定見れませんでした…。投票先はクララです。今の状況でディータに入れたのは、どんな意図があろうと信じがたいなぁ…。
5日目,旅人ニコラス,村人,モーリッツいないの？じゃあ【発表はクララから】やべ、テンパっててどこにいれたかわかんない。羊だと思うけど。
5日目,旅人ニコラス,村人,■1．能力者考察■2．灰考察■3．今日の吊り、占い希望（第2希望も）こんなものかな。占い希望はもう不要かもしれない。
5日目,司書クララ,人狼,鳩に切り替え。ご飯行くからまた後でくるわ。【リーザ人間だった。】ふぅ・・・推理はまる大はずれね。この調子じゃシモンの推理も危ういかしら・・・ジムゾンは白だしよね・・・
5日目,神父ジムゾン,占い師,リーザ、ようこそ。ささ、こちらへ。この月の石でできた机いいでしょう？さーディナーにしましょうか。え、ディナーの前にリンゴが食べたい？まあいいですけどディナーの前のデザートはよくないですよ？(リーザはリンゴをしゃくりとかじるとおいしさのあまり唸っている。おや、震えて…耳と…尻尾が…！)【リーザは人狼だった！】こんなに人狼引いてうれしくないと思ったことはない。ホロローン…腹いせに尻尾モフモフ。
5日目,負傷兵シモン,村人,>>977に大爆笑したでござる、決定無視をなぜそんなに堂々と言えるでござるかwww もうクララ殿らしすぎ!! 盛大な推理ミスで折れた拙者のハートを、癒してくれてありがとうでござる。今なら「ろっきゅん」もかわいく見えるかもしれぬな。すまぬ、灰に埋めるべき内容でござるが、どうしても礼が言いたくて。
5日目,神父ジムゾン,占い師,みんなちゃんと投票先回しましょうねー【私はカタリナに投票】>>983だったら先に発表してるからわかるでしょうに。ジム☆ゾン泣いちゃうぞ…気を取り直して議題追加。■４エルナシモンディタから１人白を決め打って■５襲撃考察
5日目,村娘パメラ,村人,ん？神父、白狙いじゃなかったの？黒ひいて「こんなにうれしいことはない」の？★解説お願いします。
5日目,負傷兵シモン,村人,へ？ リーザ殿パンダ??とりあえず当人の発言を待ちたいでござるな...
5日目,神父ジムゾン,占い師,■４は最終日はエルナシモンディタで灰の殴り合いだから。もしくは意図的襲撃ミスで誰かまとめ役１人残してくれるかもしれないけどね。まとめ役１人残ったら単純に票数えないでその人の意見がちゃんとしてるかも考慮して。(ぐぎぎ昨日第１第２入れ替えとけば。でもディタ狼でない保証はないけど)■５は流石にもう狩人ＣＯする人いないでしょうしね。…もし居て、本物なら詰むんで出てくるように。【▼リーザセット済み】
5日目,少女リーザ,人狼,判定確認したぞい。クララ、これで真とかマジひどいぞ。真なんでこれ以上強くは言わんが、もう少し人に信用してもらうと言う意識を持ってくれ。ワシは【投票はリナにいれた】ぞい。書真神偽／娘狼じゃな。神狼なんて無いと思ったが、見直さんといかんかもしれんな…。そうじゃ、シスター、リナお疲れさまじゃ。つ【ほうじ茶】【メロン羊羹】【漬け物】
5日目,老人モーリッツ,村人,鳩暴走、本当にすいませんでした！特に、ニコラスは急に任せることになってしまって…。それで…明日・明後日も同じ用事が続きます。で、今日の感じだと予想以上に帰りが遅そうです。（発言、今更なのも申し訳ない＞＜）今度こそ鳩を使いこなせるという自信がないです…。もちろんせいいっぱい気をつけはしますが、ニコラス明日・明後日とサイアクまとめ役やってもらうってのは可能でしょうか？（汗
5日目,旅人ニコラス,村人,うう、なんとかします。
5日目,老人モーリッツ,村人,ごめんなさい…鳩が暴走しなければいますんで！＞＜　鳩の注意点、まとめサイトなどで確認しときます！おって謝罪。【僕の吊り先ディタでした】…。というのも今朝>>828の勢いで一旦セットしてたのを変えてなかったもので…。あと、【発表確認】。以上、中の人モードで失礼しました。神娘ラインvs書妙ラインですね！老＜はっ、ワシは何をしゃべっとったんじゃ…？
5日目,負傷兵シモン,村人,改めて吊り手確認。羊の白黒もよくわからんゆえ、油断せぬよう残狼陣営3を仮定するでござる。明後日を迎えるためには、今日明日に狼陣営1斬り必須。占は狼のロラ手伝いを期待し、今日はパンダのどちらかを吊にすべきでござろう。今日村側を吊ったとしても、明日挽回できるでござる。安全策もな。
5日目,仕立て屋エルナ,村人,兵>>994うちも吊り手数と今日▼はどこかをずっと考えてたわ。色んなパターン考えたけども、確かにそれが一番、明日誰が襲撃されたとしても色々情報は落ちそうや。＞旅老へ大変やと思うけど、灰、占い師候補、斑の発言を読んで、旅老は今日は出来るだけの指示を出してほしい。うちは神妙二人とも白に見てた。どちらを信じるか。今日までの議事録で答えが出るかわからん。だが無論思考停止はせんよ。
5日目,司書クララ,人狼,なめられてるのかしら。これは。若干憤りを感じないでもないけど。まぁいいわ、【諸々確認】【▼娘SET済】判定だけを見たら、場を引っ掻き回しにきた狼かと思ったのだけど、パメラの反応を見る限り狂人かしらね。>>987 パメラ視点でジムゾンは真確定なのにね。疑問を向けるのはどういうことかしら？まさかアルビンをいまさら潜伏疑惑？無い無い。これはポーズで誰かを疑わなければいけない、という狼の心理漏れで
5日目,司書クララ,人狼,しょう。さらに、狼視点今日白確を望んでいたはず。にもかかわらずここで黒出されて、ちょっとイラっときたんじゃないかしら。流れ的にリーザが白確すれば正直狼の勝利一直線だったしね。まぁ、なぜ黒出したのか…と言われると、正直遊ばれてる？と最初思ったわ。この時点で黒を出すメリットは無いわね。多分勝負を楽しんでるんじゃないかしら？そういうつもりなら受けてたちましょ？後悔させてやるから。>>990妙：そ
5日目,司書クララ,人狼,ういうわけで、よろしくね？こんな茶番にあなたも参加させられて良い迷惑でしょうけど、もう少し付き合ってもらうわ。ただ、白考察は前も言ったけど得意じゃないの。黒考察も外れてたけど。それほどあなたをフォローするつもりは無いわ、自力でがんばってね？ひどいというけど、いまさらあいてと同じ土俵で戦うつもりは無いので。私は私のスタンスでいかせてもらうわ。ごめんなさいね？>>985兵：守る必要あるの？白か
5日目,司書クララ,人狼,黒か曖昧な相手に投票するくらいなら、黒に入れるわ。確かに流れ的につれることは無いでしょうけど、だからといって羊に投票する道理はないしね。ルールは守る。けど、譲らないものもあるわ。第一、昨日も私パメラに入れたけど？今ならかわいく…ね。あなた前にツンデレ系男子がどうの言ったじゃない。うそなのね？だましたのね？…そう。じゃ、寝る。明日こそ早く帰ってちゃんとまとめるから、またね。バーイ。@14
5日目,村娘パメラ,村人,んっと。クララが真占であったなら、今日が正念場。リーザたんが吊られないように白要素を探して上げていくべき。それをしない真占がいます？この態度、みなさん、どう思いますか？真占の態度ですか？明日こそ早く帰ってって…。
5日目,村娘パメラ,村人,★ジムゾン>>963で「リーザよりディタのほうが素白そうで不安が少ない」とまで言いながら、一転「黒ひいて嬉しい」おねがい、ここの心境の変化をみんなに説明して。なんか作戦があって白狙いを提案したんでしょう？真なんだから説明しなきゃだよ。
5日目,村娘パメラ,村人,あ、勘違い。ジムゾン、嬉しくないって言ってる。ごめんなさい。取り消します…。
5日目,負傷兵シモン,村人,パメラ殿>色々やりあった拙者に言わせてみれば、クララ殿らしいなーとしか。明日って例えば13時に来るんでは。彼女の態度の件はわかっているので、拙者としてはむしろリーザ殿の黒主張の方をお願いしたく。クララ殿>ぬはは。上記の通り、今更娘票を偽要素と言うつもりはないでござるよ。ってか拙者のデレターンが...
