プロローグ,楽天家ゲルト,村人,人狼なんているわけないじゃん。みんな大げさだなあ
プロローグ,司書クララ,村人,谷底の村の、村はずれって…宿は崖の近くにあるってことですね。
プロローグ,旅人ニコラス,狩人,こんな……ところに……村？か？
プロローグ,旅人ニコラス,狩人,眠気……に負けそうだ……。議論の希望時間帯だけ……伝えておく……。[夜]……だ……。よろしく……頼む……。
プロローグ,行商人アルビン,人狼,おにぎりー！おにぎりはいらんかねーっ！
プロローグ,青年ヨアヒム,村人,落石注意ってところだね
プロローグ,神父ジムゾン,村人,こんな国はもう見捨てるしかないんだ、こんな国はもう滅ぼせ！今はただスクラップアンドスクラップ！全てをぶちこわすことだ！！
プロローグ,神父ジムゾン,村人,諸君、考察なんかしたって無駄だ！この国は、あれこれ考察することが村の勝利につながるような、もはやそんな甘ちょろい段階には無い。村側、人狼側、そんな事は問題ではない。現在、この国を支配するシステムは極めてシンプル、すなわち…、素白派が生き残る、ただそれだけだ！
プロローグ,神父ジムゾン,村人,この発言を見ている国民諸君。諸君の大多数は、私の敵だ！私は諸君の中の、少数の素黒に呼びかけている。素白発言を白印象と見なす村を覆うパッションと、確定白の立場に甘んじてお役所仕事で吊り決定を出すまとめ役……。我々素黒が、いよいよもって生きにくい世の中が作られようとしている！
プロローグ,神父ジムゾン,村人,２日目に、斑がいても関係ない。奴ら素白派はこう言うだけだ。「いやそいつ発言が素白いから人だろ。それよりも発言黒いジムゾンから吊ろうぜ」３日目に、霊対抗がいても関係ない。奴ら素白派の言う事は決まっている。「霊能、どっちも白いよね。霊機能潰すよりまずジムゾン吊って判定見てみるのがいいんじゃない？」考察の内容でなにかが変わると思ったら大間違いだ。しょせん、決定は奴ら素白派のお祭りに過ぎない！
プロローグ,神父ジムゾン,村人,我々素黒にとって、発言の感触からの白黒判断ほど馬鹿馬鹿しいものはない。素白い奴を白視して希望から外していったら、素白が勝つに決まってるじゃないか！
プロローグ,神父ジムゾン,村人,私はこの国の、素黒に対する迫害にもう我慢ならない。素黒の諸君、素白派を説得することなど出来ない。奴ら素白派は我々素黒の声に耳を傾けることは無い。奴ら素白派が支配するこんな国は、もはや滅ぼす以外に無い。
プロローグ,行商人アルビン,人狼,自分と同じカラーの人が見えたんで思わず追いかけてきたんだけど、全然人いねーじゃん。商売あがったりだぜ。旅疲れの人にゃ、おにぎりとお茶！…と思ったのに、殆ど自分で食っちまった。
プロローグ,神父ジムゾン,村人,じゃあ、どうして私がこの村にやってきたのか。この話は長くなるから…、また明日じっくり説明することとする。見逃さないように。諸君。これを機会に、政府転覆の恐ろしい陰謀を、私と共にこの谷底の村から進めて行こうではないか。
プロローグ,行商人アルビン,人狼,つか、シンプアツいな。落ち着いておにぎり食えよ。素白飯に素黒の海苔巻いてあんぜ。どーよ、この調和？
プロローグ,神父ジムゾン,村人,>>13アルビン、おはよう。では、おにぎりとお茶は、いっぱい喋って腹が減った私がありがたく頂戴しようではないか。
プロローグ,神父ジムゾン,村人,>>15圧倒的な質量の素白に、それをとりまくか弱く哀れな素黒…。まるで素黒の苦難を暗示しているかのようではないか。だが私は負けはしない。そしてこのおにぎりのように、咀嚼し嚥下しつくしてやるものである。(モグモグ)
プロローグ,神父ジムゾン,村人,事前に話しておいたほうがよさそうな内容を提示しておこう。■1.主な参加可能時間■2.仮・本決定時間の希望■3.投票CO、言い換え、その他今の内に話しておきたい提案□4.自己紹介など
プロローグ,神父ジムゾン,村人,■1. 深夜はいない。それ以外は適宜参加するだろう。■2. まずは1時間ずつ時間をおいて仮10:30、本11:30を提案してみる。■3. 特にない。投票COをムリにしたいとは思わないが、手立てがあり収拾がつきそうならやってもかまわん。。□4. 素黒に人権を！
プロローグ,パン屋オットー,狂人,おはよう、みんな！パンが焼けたから、とりあえず食べてくださいな。
プロローグ,シスターフリーデル,村人,神父様すばらしいですわ！今日も惚れ惚れするほどの素黒さですわ！この谷底の村が全ての始まりとなるのですわ！ 
プロローグ,パン屋オットー,狂人,■1. 深夜は無理かな。あとはたいてい大丈夫。■2. 神父の提案の時間帯で問題ないと思われ。■3. 投票COに関しては、その必要性を説明、優位性を公開して納得すれば乗るかもね。□4. パンうまいよ、パン。
プロローグ,神父ジムゾン,村人,>>21おお、もう来てくれたか。同志フリーデルよ。貴女の存在は、絶望に満ちた素黒の運命を照らす暗夜の灯火だ。貴女の美しさと、それゆえにより一層高まる素黒さに、心から期待しているぞ。ハレルヤ。
プロローグ,神父ジムゾン,村人,オットー、黒パンを焼いてくれ。黒糖を入れて仕上げた奴だ。その素黒くも甘美な味わいは、苦痛と悲嘆に満ちた私の心にも、いささかの平安をもたらしてくれるに違いない。
プロローグ,パン屋オットー,狂人,うぃ、神父様。不景気だからお客様のリクエストには応えていかないとね！黒パン焼けるまでこれ食べてて。新商品だから感想聞かせてくれると嬉しいです。つイカ墨パン
プロローグ,シスターフリーデル,村人,腹黒、素黒、白いのは肌だけと言われ続けた幼少期。絶望の淵にあった私を救ったのは神父様、他でもない貴方の他者に媚びぬ見事なまでの素黒さなのですわ！あぁ、ハレルヤハレルヤ！素黒に未来を！
プロローグ,負傷兵シモン,村人,身も心もぼろぼろの二等兵シモンだぜ。どうせオレは使い捨てさ…。素黒を救いをもらたす村はってのはここか？ジムゾン、君は俺の神なのか……？
プロローグ,負傷兵シモン,村人,■1.チェックはほぼ終日可能。考察をするのは夜中心になりそうだ。■2.仮10:30本11:30でOKだ。が、明日の10:00~11:00が不在なので、仮決定時にはいない。本決定・夜明け前には来れるので、異論・賛成が遅れるのだけ事前に了承願いたい。■3.根本的には奇策好きだが、思いつかなくて無難な提案しかできない（＜素黒要素だ！）。きちんと説明してもらえれば無碍な反対はしたくないと思っている。
プロローグ,負傷兵シモン,村人,□４．我が教祖ジムゾン様に惹かれてきました。あとパンの匂いにも…。素黒さなら負けないぜ！
プロローグ,パン屋オットー,狂人,シモさん、おっはー。素黒な村にようこそ！つメロンパン
プロローグ,負傷兵シモン,村人,あ、メロンパン！あ、オットー。(逆だろう)おはよう、そしていただきます！ガツガツ･･･う、うまっ！空っぽの胃袋に甘みが染み渡るぜ！う･･･み、みず・・・・・・・・・
プロローグ,パン屋オットー,狂人,うはwwメロンパンに印象負けww水がほしければ、井戸はあっちですよ～（はぁと）落ちないように気をつけてね（にやり）@15
プロローグ,パン屋オットー,狂人,そして、狼の前に睡魔に襲われてきたので仮眠～。パンの仕込みの後は眠いのだ…
プロローグ,神父ジムゾン,村人,(イカ墨パンを頬張りながら)おお、よく来た、同志シモンよ。戦いに傷つき、疲れ、素黒の運命(ｻﾀﾞﾒ)に陥った君の境遇は察して余りある…。しかし、それは敗北を意味するのか？否！始まりなのだ！私が君に、恐怖を超えていくための、怒りと悲しみと希望をあげよう。だから、もう一度立ち上がり、そして戦うのだ。あきらめてはいけない。いつか来る贖罪の日を、生きて迎えられるまでは。
プロローグ,負傷兵シモン,村人,すいません･･･ひもじくて･･･orz井戸・・・？井戸遠い・・・・・そしてオットーも遠くへ・・・・[シモンは井戸へ向かって必死へ這っている]
プロローグ,負傷兵シモン,村人,ああ、神の声が聞こえてきた････o0(ジムゾン、おはようございます)そうだ、頑張れ俺！負けるな！[シモは井戸の縁にしがみつき、中を覗き込んだ]
プロローグ,シスターフリーデル,村人,■1.昼から夕方ですわ！朝は確認して希望出し程度ですわ！■2.仮1100/本1200希望ですわ！■3.特にないですわ！□4.（……そんなに素黒くなれるか逆に心配になってきた…）いえ、何でもない…ですわ！
プロローグ,神父ジムゾン,村人,そして…。【私 が 神 だ】 (…略称的に。だがそんな余計な情報は、口の中で密かに言うに留める)…さあ、この水を飲みたまえ。そして渇きを癒す感覚と共に、私の導きを受け入れるのだ。
プロローグ,負傷兵シモン,村人,ああ、水だ･･･水・・・・・・・[シモンは朦朧としたまま水を飲んだ]ああ、神の背後に女神が見えるぞ・・・・・o0(フリーデルおはようございます)　　　　　　　　　　　　　【　シ　モ　ン　復　活　】
プロローグ,シスターフリーデル,村人,遅ればせながら、パン、シモン、その他の方々もおはようございます。うふ、シモン、女神だなんて…懐柔っぽくて吊りたくなっちゃうような素敵な素黒さですわ！
プロローグ,負傷兵シモン,村人,というわけで改めて皆様よろしくお願いします。プロからなんて素黒い俺、、orz本当に救いは見出せるのでしょうか。。。@12
プロローグ,行商人アルビン,人狼,しょーがねぇなぁシモン、このおにぎりも譲んぜ。つ[梅][かつお]おっ、リデルもオットーも来てたんか。赤字覚悟でおにぎり振る舞う気分にもなれるってもんだぜ。議題答えとくぞ！■1.深夜ＮＧ。素白な肌は大事だかんな。18～23時ならバリ議論いけるぜ。仮決、本決は鳩から確認するつもりでな。■2.尼に同じく11時本12時だ。
プロローグ,行商人アルビン,人狼,■3.投票COは村側に確実な利点を確認出来るケースじゃないと認めたくねぇな。あと俺も実際詳しく知らねーし、やっぱ説明は欲しいよな、うん。□4.おいオットー、パン屋って事はまさかお前ぱんつくった事あるのか？どうなんだよ？
プロローグ,負傷兵シモン,村人,アルビン、おはよう&よろしくお願いします。おにぎりいただきます。甘いモンの後にはしょっぱいものだよな･･･旨！アル、仮・本、鳩参加って･･･初っ端からすげぇスリリングな発言(笑)ゾクゾクするぜｗ
プロローグ,宿屋の女主人レジーナ,占い師,きたよ
プロローグ,負傷兵シモン,村人,レジ、素黒の村へようこそ！これで開始確定か♪さて、何人編成になるかな･･･　@10 
プロローグ,ならず者ディーター,霊能者,邪魔するぜー
プロローグ,ならず者ディーター,霊能者,■１　不定期にならず者ってるぜ■２　あわせるんだぜ■３　こだわりのないならず者ってるぜ
プロローグ,ならず者ディーター,霊能者,シーチキンおにぎりがすきなんだぜーでもまあ梅にぎりで我慢してやらぁ
プロローグ,負傷兵シモン,村人,ディタ、ようこそ。よろしくお願いします。大事なこと言い忘れてた。ごめん、俺、【今日の12:30～13:30も離席】。夜明け後の議題回答とか、1時間位遅れる。明日からは夜明け前後の時間は絶対確保する。ごめん。
プロローグ,老人モーリッツ,村人,ここで華麗にわし登場。
プロローグ,老人モーリッツ,村人,■1.不定期に徘徊■2.仮22：30　本23：30■3.特になし。臨機応変にいきたい□4.飯は？飯はまだかー？
プロローグ,ならず者ディーター,霊能者,じーさん、ココ昼更新村だぜー大丈夫かいな
プロローグ,負傷兵シモン,村人,モーリッツ、ようこそ。よろしくお願いします。･･･って、仮・本希望時間･･･!!ここの夜明け12:30だぜ！？お、俺のおむすび分けるから落ち着こうぜ！o0(何か理由があっての希望なら開示してくれると嬉しい）
プロローグ,老人モーリッツ,村人,うおおミスったわい■2.仮10：30　本11：30これじゃ！これでよいのじゃ！
プロローグ,老人モーリッツ,村人,シモンの食いかけじゃとっ!?落ち着くためにも有難くいただこう（モグモグ）
プロローグ,負傷兵シモン,村人,書き間違いか。なら、よかった。o0(大丈夫か？もし夜更新と間違えたとかならキツくなる前に言っちゃった方がいいと思うが）爺・・・食いかけでもいいのか。咄嗟に差し出して反省してたのにｗ
プロローグ,老人モーリッツ,村人,今の時間参加できるからそこは問題ないのじゃ。もうすぐ飯の時間じゃ飯はまだかのう。
プロローグ,負傷兵シモン,村人,爺、了解。返答ありがとう。そうか、そんな時間か。俺はさっき色々食わせてもらったから大丈夫だが・・・。オットーかアルビンが来てくれるといいな。もしくはあと二人？ｗ　@30min
プロローグ,神父ジムゾン,村人,ほほう。集まってきたな、集まってきたな。クックックゥ…。来たれ、あと二人！
プロローグ,村娘パメラ,人狼,もう、お爺ちゃんったらボケちゃて。ご飯なら、3日前に食べたでしょ。
プロローグ,神父ジムゾン,村人,パメラ、よく来た！そして素晴らしく直球の黒さだ。うむ、実に良い。
プロローグ,村娘パメラ,人狼,■1.朝と昼と夜中くらい？■2.仮10:30/本11:30希望■3.この国の投票COは、既に暗号に近い気がして乗り気じゃないけど、どうしても使いたい人がいるなら、譲歩してもいわよ。
プロローグ,負傷兵シモン,村人,パメラ、ようこそ。よろしくお願いします。女性4人目･･･ｖ家庭的な香りに癒されてる俺。ジムの笑い方が黒い･･･さすが素黒神。
プロローグ,行商人アルビン,人狼,よ、爺ちゃん。まずは話の前にコレだな。つ[イクラ][焙じ茶]イクラにぎりなんて贅沢ってか？いや俺、老人にゃ優しんだよな。…っておいディーター、ひげに米粒ついてんぜ？自分で取れよ。俺がとったら絵面がアヤシいだろ。ホモじゃねーんだから。
プロローグ,老人モーリッツ,村人,おお、パメラやそうじゃったわ。うっかりしておったわい。
プロローグ,負傷兵シモン,村人,爺さんそれで納得するのか！3日前だぞ！
プロローグ,神父ジムゾン,村人,さあ、さあ、あと一人だ。クゥクゥクゥクゥ…！ズザー来い！
プロローグ,老人モーリッツ,村人,旅の商人さんや、わしはこの谷底から出ないからのう。海の幸はめったに食えないんじゃ。ありがたやありがたや（モグモグ）
プロローグ,ならず者ディーター,霊能者,アルビンは俺のヒゲが触りたいのかそうかそうか
プロローグ,行商人アルビン,人狼,シモン、鳩からでも精一杯生き抜いてみせんぜ。心配かけてすまねえ。礼だ、食えよ。つ[鮭][牛カルビ]奮発してやんぜー。…絶対赤字だな今日の売上。ま、議事みて考察ガチ落とせんのは18～23時になっちまうけどよ。こちとら商売、時間限られてんなら効率勝負だ。
プロローグ,負傷兵シモン,村人,ジムが鳩に見えた罠。（＜笑い声≒鳩の鳴き声）あと一人、来るかな、来るかな～？ｗ
プロローグ,負傷兵シモン,村人,アルビン、その潔さに感服だｗいい勝負にしような。[鮭][牛カルビ]頂きます。旨！旨！旨！
プロローグ,行商人アルビン,人狼,ちっ…しょうがねぇなディーター。こ…こ、こっち向けよ。取ってやっから…う、うぶっ！？
プロローグ,負傷兵シモン,村人,アルとディタがいちゃついてるのが若干気になるが、、俺は夜明けを待たずに離席します。遅くとも14時帰還予定。【落】
プロローグ,行商人アルビン,人狼,ディーターてめぇ、今俺のほっぺに何しやがったァ！？ちゅって音したぞ、ちゅって！
プロローグ,村娘パメラ,人狼,□４．おまじないとか妖精さんとかが大好きな普通の村娘だよー。えー、神父様ー。わたしは素黒くないよー。変なこと言うと、ご飯に毒を盛っちゃうぞ♪っ《お味噌汁》《岩魚の塩焼き》《マンドラゴラの煮付け》《白米》《イモリの丸焼き》
プロローグ,ならず者ディーター,霊能者,アル？いっとくが俺は左 側 専 門 だ か ら な！
プロローグ,老人モーリッツ,村人,谷底だからのう。なかなか見つからないのかも知れぬ。
プロローグ,神父ジムゾン,村人,男色か…。それもまたよし。苦しみを乗り越え、迫害を乗り越え…、そしていつか、立派な素黒となるがいい。パメラ>>77なるほど、そうか。よく分かったとも。同志よ。
プロローグ,村娘パメラ,人狼,【アルビンとディーターの掛け算を確認】クララさーん
プロローグ,行商人アルビン,人狼,落ち着け、俺。刻も迫る事だし、皆の為に人数分用意しとくぜ？つ[おにぎり人数分]中身は言わねえが、当たりが出れば夜明け後に能力を身につけられるはずだ。霊視や占い、守護なんかのな。楽しみにして１人１つずつ選べゃ。
プロローグ,神父ジムゾン,村人,《マンドラゴラの煮付け》をつまみつつ、@1を使って叫ぶ。ズザーよ、来い！
プロローグ,村娘パメラ,人狼,あと一人、カムヒアー早く来ないと神父様が呪っちゃうぞー
プロローグ,少年ペーター,人狼,ｽﾞｻﾞｰ
1日目,楽天家ゲルト,村人,ふぁーあ……ねむいな……寝てていい？
1日目,少年ペーター,人狼,プロも確認せずｽﾞｻﾞｰしてみた。後悔はしていない！
1日目,老人モーリッツ,村人,子供が突っ込んできおった！
1日目,少年ペーター,人狼,ってまにあってないしい。よろしくねー。■１．纏め役について■２．COについて■３．占い先！
1日目,行商人アルビン,人狼,うぉ、何だこのガキ？！危ねえからあんま走り回んなよ。ほら、おにぎりでも食え。それから赤髭のおっちゃんは危ねーから近寄んなよ。
1日目,神父ジムゾン,村人,【祝・プロ更新なしフルメンバー達成】素晴らしい！よく来たペーター！「まにあってない」とは>>87のことか。いや、むしろそれがいいだろう。
1日目,少年ペーター,人狼,でもその前に僕はプロ議題を。■1.更新前後にもいるけど主に夜だよ！ コアが合わなかったらごめんねごめんねー■2.ここだと仮11本12くらいかな？■3.このシステムで投票COは見苦しいと思うんだ……好みの問題だから別にいいのだけど。□4.何の変哲も無いいたいけな男児だよ！ へ？ 黒？ ぼ、僕はまだ子供だから黒くなんて無いよ///
1日目,村娘パメラ,人狼,ぺタ君、来たーーー。もう、かわいいなあ。[ぺタ君の頭を胸に抱きしめて、ぎゅーー]あ、占霊は初日にCOでいいんじゃないかな。3日目第一声も投票COも、不確定要素が出て好きじゃないし。纏め役は、霊が確定したらその人。確定しなかったら今日の占い先は多数決で。でも、纏め役欲しいからって、白狙いの占いは好きじゃないよー。■１と２はこんな感じでー。
1日目,神父ジムゾン,村人,よし。では、さっそく素黒の私が村の勝利に貢献する方策を提案しよう。それは…。【初回で私を占う事だ！】ぶっちゃけて言えば、私が確定白のまとめ役になって政府転覆を目指す、これしかない！ 
1日目,宿屋の女主人レジーナ,占い師,フルメンバーで始まったみたいだね。よろしくだよ
1日目,神父ジムゾン,村人,斑となるのもまた本望だ。能力者判断に関わるとなれば、いかな素白派でも私の発言を「素黒い」という感覚論だけでスルーする事はできなくなるからだ。私は斑で吊られる事など恐れぬ。否、喜んで能力者情報の礎となろう。何より恐れるのは艱難辛苦の上の無為な処刑死。終盤になって、尽力の思考を凝らし、推敲を重ねて発言に込め…、あげくに「やっぱり素黒いから吊り」という末路。これこそが最も耐え難い苦しみなのだ！
1日目,神父ジムゾン,村人,神父ジムゾンに悪意の占希望を！神父ジムゾンにやけっぱちの占希望を！何となく、時間ないから、で適当に占希望を出すなら私に出せ。私以外の誰かに希望を出すなら、後日の考察になりうる質量を伴った理由は必須としたい。言っておくが、これは【自占希望ではない】。断じて違う。もちろん、私自身は私以外の誰かを占希望にあげるだろう。
1日目,ならず者ディーター,霊能者,おっすおすおす【俺っちが霊能者だぜー】仮11時45分　本12時10分　あたりでどうかね
1日目,ならず者ディーター,霊能者,方針：占い師のCOとかは任せるよ護衛範囲？まあ狩人が生きてりゃなんとかなるだろガンバレ狩人！村人の諸君も狩人臭ぷんぷんだしてよろしく！
1日目,行商人アルビン,人狼,■１．まとめか。霊か占あたり、とにかく確定白ならいいんじゃねえか。■２．投票が微妙なら、FOかな。ぶっちゃけあんま希望はねーんだよな。■３．投票してまとめ役が総意取って、仮決までに一旦決めてそこからまた意見…ってな流れが分かりやすいと思うぜ。神父ルならぬシンプルってやつだよな。
1日目,神父ジムゾン,村人,【ディーター霊確認、非対抗、時間ＯＫ】もう一つ。私には、初日の時点で人狼の気配など分からん。初日から狼に占いを当てられれば村には大いなる福音だが、自分にその能力が備わっていないと自覚した以上、いかんともしがたい。よって私は、今日明日くらいの占いは、ひとえに素黒の人権救済を目的に希望したいと考えている。まあ、その相手が本当に狼だとしたら、それはそれでめでたい。
1日目,シスターフリーデル,村人,あっ、はじまってる！全然気が付かなかったですわ、ええ…これっぽっちも様子見なんてしていないですわ！■１：確白になった人なら誰でも。できるまでは多数決で～。決定出す人がいなくても仮とか少なくとも本決定の時間には皆から一言でも【票の結果から誰々投票】みたいな【決定確認】に代わる言葉があるといいよね。多数決自体に問題はないと思うけど、居るのか居ないのか分からない雰囲気は好きじゃない。ですわ！
