プロローグ,楽天家ゲルト,村人,人狼なんているわけないじゃん。みんな大げさだなあ
プロローグ,老人モーリッツ,人狼,疑心暗鬼の村～あゝ懐かしき昼メロ編～第０話（オープニング）：「たまにはロリコンも良いよね！」
プロローグ,老人モーリッツ,人狼,ちゃちゃちゃらちゃ～ちゃ～♪ちゃちゃんちゃ～んちゃ～んちゃ～ん♪ふふんふんふんふ～ん♪製作費の関係により、オープニングテーマは爺のセルフ鼻歌でお送りします。
プロローグ,青年ヨアヒム,村人,こんばんはー。…ロリ？え、何？ロリコンの集う場所なの？…来る場所間違えたかな…
プロローグ,老人モーリッツ,人狼,───ワシの名はモーリッツ。モテカワスリムで恋愛体質の愛されジジイ♪長年連れ添ったバアさんが霊界に旅立った今、このワシを止めれるものなど誰もおらん。80年前のバアさんにそっくりなロリーザ、初恋の面影を宿すパメラ、赤頭巾にゃんにゃんのカタリナ、あとテキトーな女性陣たちを見るたびにスピリチュアルな感覚がワシのカラダを駆け巡る。
プロローグ,老人モーリッツ,人狼,老い先短いジジイの頼みじゃ！いま一度！いま一度だけでいいから、ワシに最後の春を見せてくれぃ！ふおおおぉぉぉぉ！と叫んでいたらロリコン2人目が登場。だいじょうぶじゃよヨアヒム、おぬしも立派なロリコンになれる。わしゃ、そう信じとる。（澄んだ瞳をキラキラ）
プロローグ,老人モーリッツ,人狼,老いてますます盛んとは、まさにワシのことである。夜の百人斬りは任せしぇとけ。うむ、このワシを斬れるものはおるか！
プロローグ,村長ヴァルター,狂人,うむ、諸君こんばんは。私は村の治安維持のため不埒な者は村長として手ずから介錯する気なのだが……だれだね？不埒な発言をしている者は？
プロローグ,青年ヨアヒム,村人,あれー…　手紙に書いてあった場所ってここだと思ったんだけどなぁ…他に宿屋が無いか探してくるよ。あ、村長さんこんばんはー。
プロローグ,老人モーリッツ,人狼,（ジャーンジャーン）げえっ！村長！待てあわてるな、これはゲルトの罠じゃ。
プロローグ,村長ヴァルター,狂人,うむ、ヨアヒムこんばんは。この村にはここしか宿屋の機能を果たす施設はないぞ。モーリッツ殿は何やら慌てておるが……まぁ、今はよい。私も妙な手紙で呼び出されたクチなのだが、同封されてた以下の文書はまだ開示されてないようであるな。ふむ。ここに張り付けておくか。■1.宿に来れない時間■2.希望する決定関連の時間帯■3.何らかの主張しておきたい事（言い換えや投票ＣＯ等、システムに触れる事）
プロローグ,老人モーリッツ,人狼,不肖モーリッツ進退きわまれり。もはやここまでのようじゃな…･･･ワシとて漢じゃ。覚悟はできとる。最後に一度だけ、黒ニーソのロリーザを拝むことができたら潔く責任を取ろう。ニーソ、黒のニーソックスウウゥゥゥ！！■1.夜に徘徊／■2.仮21半、本22半くらい／■3.ルールを守って仲良く楽しく。投票COやら遺言とかは、なんのコダワリも無いよーん。
プロローグ,老人モーリッツ,人狼,ちゅーわけで、ワシ夜の歓楽街に出かけてくるぞい。そう、目を血走らせながら探すは妙齢の女性陣。おなご、おなごはおらんのか…！もはやこの年になればつるぺたむちむち何でもござれ、もってけセーラー服に私の本気見せちゃいます。ハレハレユカイなドームですよドーム！だっふんだ！じゃあな、アバヨ！
プロローグ,村長ヴァルター,狂人,ちなみに私の返答はこうなるな■1.就寝時間帯である深夜24時以降から朝にかけては来れない。それ以外で職務故来れない時は前もって伝えよう。■2．本決定は夜明け30分前までに、とは思うが別にきっかり決める必要もあるまい。事前告知は欲しいがな。■3．言い換えはそもそも混乱の元である故やりたくないという主張と、あと投票は不埒な者を吊りあげるためのものという考え故投票ＣＯは好かん。
プロローグ,村長ヴァルター,狂人,モーリッツ殿の不埒さは目に余るが、今のところは村にこのような手紙を撒いた元凶とその噂の根源の特定と断絶が優先であるな。ふむ、私も一旦席を外すとしよう。まだ少々職務が残っているのでね。
プロローグ,羊飼いカタリナ,狩人,こんばんわー
プロローグ,羊飼いカタリナ,狩人,■1、んーだいたいこのぐらいから顔だして、夜明け(更新)とともに寝るよ。■2、好きにすればいいんじゃないかなあ？決定を出すなら、30分くらい前にあればいいんじゃない？■3　基本なんでもOK.個人的には個人戦を希望♪
プロローグ,青年ヨアヒム,村人,こんばんは、カタリナ。そしてただいま、僕。んー、やっぱりここ以外に宿らしき場所は見当たらなかったよ…　あ、質問に答えるね。村長さん、ありがとうございます。■1.基本はこの時間かな。遅くても０時には寝るよ。■2.仮決定２２：１５　本決定２２：４５がいいと思う。■3.ややこしい事はあまり好きじゃないなぁ…　何をやるにしろ、分かりやすく説明してくれる事前提だね。えっと、あとは…みんな仲良くー！
プロローグ,旅人ニコラス,村人,アミーゴ！人狼がでるという噂を聞いて、はるばるメキシコからやってきたぜ！
プロローグ,旅人ニコラス,村人,村長さんの質問にも答えておくぜ■1.参加できる時間は基本的に18～24時くらい■2.皆にあわせるよ■3.投票COはずるい気がするから、やりたくないな□4．手紙ってなんだい？ オイラは知らないなぁ
プロローグ,青年ヨアヒム,村人,老>>6　おじいさーん。僕はロリコンじゃないよー確かにリーザの事は僕も好きだけど、それはラブじゃなくてライクの方なんだ。…だから、リーザがここに来た時の事を考えるとすごく心配。リーザ、頼むからここには来ちゃダメだよ…あ、ニコラスさんこんばんはー
プロローグ,村長ヴァルター,狂人,ふむ、諸君こんばんは。カタリナと旅人殿が来たのか。旅人殿はこの噂に乗じてきたということですか？人を喰い殺す化け物の噂だというのに、それはずいぶんとモノ好き……もとい、勇気のあるお方ですな。私もリーザの安否は心配であるな。彼女の元に召集の手紙が舞い込んでいなければいいのだが。
プロローグ,旅人ニコラス,村人,>>21ヨアヒムさん、こんばんわ。いざという時は2人でモーリッツさんを止めましょう。>>22村長さん、はじめまして。オイラは臆病なんだけど、大の怖い物好きなんですよ。こればっかりは性分なんで仕方がねぇ。
プロローグ,青年ヨアヒム,村人,お帰りなさい村長さん。お仕事お疲れ様です。長>>22　そうですよね…あんな素直で良い子が人狼やロリコンに襲われでもしたら…　すごくすごく不安です…旅>>23　ありがとうございます！　僕一人じゃダメかもしれないけど、ニコラスさんと一緒ならおじいさんを止める事が出来そうな気がします！
プロローグ,村長ヴァルター,狂人,>>23　ふむ、怪談話が好きなタチであるということであるな。ともかく滞在するのであればしばらくの間よろしく。>>24　真の変態ならおそらくペーターも危険域であろうな。ふぅ、まったく……子供が安心してであるけないふしだらな村になってしまっているとは、村長として情けない……。それでも優先度は変態より命の危険の噂であるがな。
プロローグ,村長ヴァルター,狂人,……（うとうと　ハッ）ふむ…少々眠気が強いので、本日はちょっとはやめにお暇させていただこう。明日の朝また来る予定であるから、その時に会議が始まっていればその時もろもろこたえる。では諸君、良い夜を。
プロローグ,青年ヨアヒム,村人,ふあー…　僕も眠い…　けど、もう少し起きてるよ…村長さん、おやすみなさーい…
プロローグ,神父ジムゾン,村人,どうも皆様、こんばんわ。この村に、罰当たりにも人狼が現れるとの主のお告げを受けたのですが･･････スデに別の意味で罰当たりなお方がおられるようですな（汗■１．参加できるのは21時～25時まで。■２．仮決定23時、本決定２４時希望■３．特にこだわりはなし。でも個人戦は個人的に苦手なのでちょっとイヤかも。
プロローグ,青年ヨアヒム,村人,……（こっくり…こっくり…がくん！）ふぎゃっ？！…うあー、寝てた…　今日は始まらないかもしれないね…ちょっと残念。あ、あと…　長>>25　人狼なんて本当にいるかどうかもわからないのに、それでも僕たち村人の為にこうやって率先して調べてくれているじゃないですか。誰も村長さんを情けないだなんて思ってませんよ。
プロローグ,青年ヨアヒム,村人,あ、神父様こんばんはー　お疲れ様です。まだ誰か来るかなー？でも、リーザは来たら危ないからダメだよー
プロローグ,旅人ニコラス,村人,神父さんこんばんわ。村に神父さんがいれば、心強いぜ。
プロローグ,神父ジムゾン,村人,こんばんわ、ヨアヒム君。良い夜ですね。まあ、モーリッツ老のおふざけにも困ったものですが、そこは同じ村人。実際に事に及ぶようなことはないとおもいますよ。･･････万が一、そのようなことになれば、こちらとしても少々きついオシオキを考えなければなりませんが。(ﾎﾞｿﾘ
プロローグ,神父ジムゾン,村人,こんばんわ、ニコラスさん。微力ながらも村の平和に貢献できればと思っております。フフフ、若い頃、異端審問を行った時の血が騒ぎますなぁ
プロローグ,青年ヨアヒム,村人,旅>>31　そうだね！　神父様がいれば、たとえ人狼に襲われたとしても教会にお金を寄付したら生き返らしてくれるからね！神>>32　はい。外は少し曇っていますけど、ジメジメしていなくてとても過ごしやすい良い夜です。>>33……今すごく不穏な発言があったような……　異端審問…？えっと…お手柔らかに？
プロローグ,旅人ニコラス,村人,神>>32着々とモーリッツさんの包囲網が出来上がってきてる。おおっと、他の人にも挨拶しとかないとな。カタリナさん、こんばんわ。モーリッツさん、こんばんわ。
プロローグ,旅人ニコラス,村人,人狼さんがいつ見れるのか、わくわくするな。今日は枕元に靴下をかけて置く事にするよ。
プロローグ,木こりトーマス,霊能者,俺は木こりをやめるぞ！
プロローグ,神父ジムゾン,村人,青>>34　申し上げにくいのですが、死者の復活は主にのみ許された奇跡。未熟者の私では、とてもとてもそこまでの力はありません。ご期待に沿えず、申し訳ない。　私ができるのは、せいぜい死者が安らかに眠れるよう、祈りの言葉をささげることだけです。アーメン。
プロローグ,神父ジムゾン,村人,っと、これはトーマスさん。こんばんわ。･･････何があったかは聞きませんが、とりあえずヤケを起こさぬよう（汗
プロローグ,青年ヨアヒム,村人,樵>>37　なんでじゃぁぁぁぁぁぁぁぁっ！！
プロローグ,ならず者ディーター,人狼,ずさー。
プロローグ,木こりトーマス,霊能者,おう！みんな元気そうだな！理由！？木こりなんてやってても嫁が来ないからだ！なに！？人狼！？そんなもんは知らん！
プロローグ,青年ヨアヒム,村人,…あ、ごめん。ついうっかり。トーマスさん、こんばんはー神>>38　あ、ごめんなさい、冗談です。…死んでしまった人を生き返らせる事なんて、誰にも出来ませんから…　不謹慎でした、すみません。
プロローグ,青年ヨアヒム,村人,ディーターさん、こんばんはー　ズザーお疲れ様ーあー…　嫁で思い出したけど、この村女性成分が限りなく少ない…　このままだと逆ハーレムになる…！！
プロローグ,神父ジムゾン,村人,ディーターさん、こんばんわ。そろそろ残り１０分ですが、果たして今晩人狼は現れるやら･･････ｺﾞｸﾘ。木？>>42　大丈夫です。主の愛は皆等しく平等です。ガチムチマッチョがお好みの婦女子もきっといますよ。むしろ確実な収入源を持つ男性の方が結婚には有利かと･･････。
プロローグ,ならず者ディーター,人狼,とんだ変態が紛れ込んでるみたいだな。■1.不定期。更新時刻はたまに鳩の時もあるんだぜー。■2.仮22:30本23:00■3.流れに任せる。
プロローグ,木こりトーマス,霊能者,夜はなるべく宿にいるようにする！あとはみんなに任せる！これから親方に、木こりをやめさせてくれと頼みに行かねばならん。簡単にはやめれないかもしれない……俺が帰ってこなかったらあとのことは頼んだ！
プロローグ,神父ジムゾン,村人,青>>43　主は謙虚なる者を喜ばれます。あなたに祝福あらんことを。･･････まあ、どうしてもという際には、Lv×Lv×100Ｇで･･････（ゴフンゲフン）
プロローグ,ならず者ディーター,人狼,明日は空いてるし、少人数で始まるのは構わないな～。入れるやつ居たら入ってきてくれ。女少なすぎてモリ爺涙目になりそうだがな。
プロローグ,ならず者ディーター,人狼,おっと。挨拶が遅れたな。みんなよろしくだ。
プロローグ,青年ヨアヒム,村人,神>>48　祝福されたー　わーい。って…　地獄の沙汰もなんとやら、ですか…　神父様がちょっと黒く見えて来ました。これが噂の神父補正？
プロローグ,青年ヨアヒム,村人,樵>>47　じゃあ、無事に帰ってこれて尚且つ人数が男９：女１で始まった場合はトーマスさんが女装して女成分を補強してくださいね。
プロローグ,青年ヨアヒム,村人,って、あー…　始まらなかったかー…残念。
プロローグ,神父ジムゾン,村人,青>>51　いえ。私。いっつも失敗して消め･･････昇天させてしまうんですよねー（爆　それとヨアヒム君。トーマスさんが本当に女装して帰ってきたとして、何をどうするつもりですか（汗　同性愛（ソドミー）は主の御心に反しますよ。
プロローグ,神父ジムゾン,村人,気長に待ちましょう。人狼がでないことは、本来喜ぶべきことなのですから。
プロローグ,青年ヨアヒム,村人,神>>54　なるほど…つまり、さ迷える魂を天国に導いてあげるんですね。神父様白要素発見。あと、トーマスさんが女装する事により女性成分が増え、結果おじいさんが喜びます(ｷﾘｯ
プロローグ,青年ヨアヒム,村人,神>>55　そうですよね…　やっぱり平和が一番ですよね。のんびりできる今が幸せー
プロローグ,神父ジムゾン,村人,青>>56ヨアヒム君･･････この村の住人はモーリッツさんだけではないのですよ。目を閉じて、思い描いてみなさい。トーマスさんがパメラの服を着て、「ウフ（はあと）」としなを作っている姿を。･･････その姿を、我々は見なければならないのですよッッ！！
プロローグ,神父ジムゾン,村人,と、失礼。興奮の余り、パメラさんを呼び捨てにしてしまいました。パメラさん、そして我が主よ、お許しを･･････[十字]
プロローグ,青年ヨアヒム,村人,神>>58 んんんんん？　さっきから秘伝の書（まとめサイト）で見比べているんですけど…　上半身裸よりはいいと思います！！ 上半身裸よりはいいと思います！！っていうか、パメラが「ウフッ（はぁと）」なんて言う訳ないじゃないか。大袈裟だなぁ。
プロローグ,司書クララ,人狼,こんばんは、皆さん。本を読んでください、本を。つ【日本文学大全】この本は読むだけでなく、重みと厚みを生かして護身用にもお使いいただけます。が、汚してはいけませんね。
プロローグ,青年ヨアヒム,村人,あ、クララさんこんばんはー護身用ですか…　リーザにプレゼントしようかなぁ…
プロローグ,神父ジムゾン,村人,おや、クララさんこんばんわ。本ならば私、聖書を毎朝朗読することを日課にしておりますよ。･･････と、ところでこの本、重すぎて私持てないんですが（汗　一体何ページあるんですか！？
プロローグ,司書クララ,人狼,まずは、プロ議題にお答えします。■1わりと不定期ではありますが、更新時間にはちゃんといます。■2仮22:15本22:45を希望します。■3あまり好みはありませんが、個人戦よりはみんなでやりたいですね。
プロローグ,青年ヨアヒム,村人,……！！　し、神父様…　さすがの僕でも裸エプロンのトーマスさんだけは見たくないです…（ガクガクブルブル）想像したらすごい破壊力でした…ごめんなさい、僕が間違っていました、ごめんなさい…
プロローグ,司書クララ,人狼,>>62ヨアさんええ、リザちゃんにもプレゼントしてくださいな。可愛い女の子の嗜みですので。>>63神父様それは大変けっこうなことですね。やはり本は素晴らしいですわ。この本の重みの秘密には降れてはいけませんわ。ウフフ…
プロローグ,司書クララ,人狼,あら、誤字がありましたね…>>66降れては→触れては、ですわ。
プロローグ,神父ジムゾン,村人,わかっていただけて幸いです、ヨアヒムさん･･････誰も裸エプロンなんて言ってないんですが、気にしないことにします（遠い目書>>66　･･････人狼が現れる前に、モーリッツさんの墓を作ることになるやもしれませんなぁ･･････。
プロローグ,司書クララ,人狼,神父様>>68  あら、何故でしょう？モリ爺様が襲ってこない限りこの本の出番はありませんわ、護身用ですもの…ただし、先制攻撃が最大の護身であることは確かですね～…@15
プロローグ,司書クララ,人狼,あ、■3で言い忘れてましたが、私、村騙りはあまり好きではありませんの…止めはしませんが、きちんと説明は求めますわ。村にとって有用な動きであることを願いますわ。
プロローグ,旅人ニコラス,村人,席を離している間に人が増えたみたいだな。こんばんわ、トーマスさん、ディーターさん、クララさん。樵>>37早まっちゃいけませんぜ。親方とよく相談した方が良いですよ。
プロローグ,青年ヨアヒム,村人,書>>66　ありがとうございます！　良かった、これでリーザが来てもちょっとだけ安心だ…　さすがに人狼相手には効果はないかもしれないけど、ロリコン相手になら勝てる…！！神>>68　僕もどうしてそんな考えになったのか…　謎だ…あと、トーマスさん、ごめんなさい…
プロローグ,旅人ニコラス,村人,書>>61クララさんから役立つ事を聞いたよ。オイラは図書館から推理小説でも借りてくるぜ！
プロローグ,旅人ニコラス,村人,オイラ、そろそろ宿屋で休む事にするよ。テキーラを飲み過ぎちまったよ。
プロローグ,司書クララ,人狼,ニコさん>>71ええ、こんばんは。はるばる遠い所からようこそですわ。メキシコにも素晴らしい本があるのかしら？ヨアさん>>72ええ、犯罪者からはどんな手段を使っても、身を守らなければなりませんわ…。そう、どんな手を使ってもね。(…は舌なめずりをしながら笑う)
プロローグ,神父ジムゾン,村人,さて、今夜は人狼の現れる気配もないし、私もこの辺で失礼させていただきます。皆様、良い夜をお過ごしください。
プロローグ,司書クララ,人狼,祝日本代表勝利！私、実はアクティブにサッカーも好きですわ☆見る専ですが…私もそろそろお暇させていただきますわ。もちろん、枕は【六法全書】ですわ。それでは、また明日ですわ。
プロローグ,老人モーリッツ,人狼,村民が増えたのは嬉しいことなんじゃが。なぜ女性陣が少ないのじゃ！？（クワッ）モーリッツ、渾身の叫びであった。
プロローグ,老人モーリッツ,人狼,何故だか、ワシがまるで変態であるかのような扱いじゃな。ワシは変態じゃないよ。仮に変態だとしても、変態という名の紳士だから安心して良いぞ。さあ、ロリーザをはじめとする女性陣よ、こぞってワシの胸に飛び込んでおいで！（ゝω・）ｖキャピ
プロローグ,老人モーリッツ,人狼,トーマス>>37「俺は人間をやめるぞ！ ゲルトォーーッ！ 俺は木こりを超越するッ！ゲルトお前の血でだァーッ！！」と叫んで、吸血鬼になっちゃうの？しかしのう、平和が何よりじゃよ。時間を止めたりロードローラーだったりナイフ投げたりするのは、ほどほどにな。
プロローグ,老人モーリッツ,人狼,さーて、奥ゆかしくもお茶目な我輩は、日本文学大全のなかの一章「ドグラ・マグラ」を鼻歌まじりに口ずさみながら、夜の歓楽街を徘徊でもしてくるか。包囲網を突き破り、不肖モーリッツいざ参戦。たまにはロリコンも良いよね！（しゅびだば～）
プロローグ,村長ヴァルター,狂人,ふむ、おはよう諸君！この村には不埒を良しとしない良き人々がいて本当に有難いよ。まぁ、その分少々血の気は多いが……変態や命の危険に比べればどうという事はない。ああ、どうという事はない。人は意外とそんなに死なないから、多少神父様の異端審問の拷問を受けようが、クララの本を力任せに溝打ちにしたたか殴りつけられてもせいぜい「とっても痛い」程度である。
プロローグ,村長ヴァルター,狂人,手紙には10人以上いれば夜明けとともに人狼探しが始まると書いてあるが…ふむ、昨日の夜明けの段階では9人だったのだな。という事は今夜の23時15分から本格的に人狼に関するうわさについて突きつめることになるのか。わしはそれまで類似のうわさが出た村の参考文献を読んでくるよ。たしかクララの図書館においてあった筈だな
プロローグ,羊飼いカタリナ,狩人,な・・・日本が勝った・・・だと・・・はやぶさも帰還するし、なんか日本にいい事が起きすぎている気がするよ。揺り返しが怖いよ・・・選挙、やはり選挙？・・・
プロローグ,村長ヴァルター,狂人,おはようカタリナ私はワールドなカップの話についてはうといのだが、勝ったのか。それは喜ばしい事であるな。選挙に関しては国民一人一人の良識だろう。まぁ、良識を操れる存在がいるというのがいつの世も恐ろしい事であるのだがな。
プロローグ,羊飼いカタリナ,狩人,ガクガクブルブル怖いよー。狼さんは村の世論を操作するらしいしねー。村長さんはちゃんと村民協議会を開いて、問題を討議してね？会議を速攻で閉めてすぐに投票とかしないでね？
