1日目,少女リーザ,人狼,する。考え過ぎ？神：>>163を見た時、能力者COのフラグ立てかなと思った。狼が準備してたとも、村人だから気軽に書けたとも取れるから迷う。あとね、凄く気楽そう。装って思考隠してるのか普通に村人か…灰。羊：喋り方とかからフリーダムな村人って感じがするんだけど、もし狼なら、こういう人が詳細な考察を始めるとギャップで好印象になるのを狙ってるのかなーとか。灰。司：黒要素はないけど白要素も特にない感じ
1日目,少女リーザ,人狼,がするの。落ち着いて考えてる人だなって印象。もっと発言を見て判断したい。年：なんとなく白っぽいなと思うんだけど、特に根拠は見つからないの。明日からの発言も見て考えたら分かるかも。老：質問の仕方とかネタの返しとかが上手いなって印象。もっとやれるけど、初日だからステルスしてるのかなー？って感じたよ。だからと言って黒いかと言われれば微妙なんだけど…狼ならLW狙ってそうって感覚で黒より。青：ゆるい感
1日目,少女リーザ,人狼,じのキャラだけど、発言内容はもっともな感じ。屋の防御感について質問してるのが「そんな所気にするんだ？」って不思議に感じたんだけど、屋の答えが私の想像（ちょっとでも疑われてると感じたら即反論！みたいなの）と違ったから、やっぱり普通に気にする所だったのかも…と迷い。灰。屋：ネタの返しが上手いなって思う。防御感みたいな独自の用語っぽいのが出てくるのはスキルが高そうな印象。どちらかと言えば白より…かな。
1日目,青年ヨアヒム,人狼,クララ>>294で一気にクララさんが白く思えるよｗ狼なら触れてくれーなんて言わないよ。ジムゾン＞あ、わざわざ補足ありがとー。それをはっきり言ってくれたおかげで分かりやすくなったよ。シモン喉枯れかぁ…早め喉枯れとかは議論の余地をなくすから僕は好きじゃないなぁ…。
1日目,少女リーザ,人狼,こうやって並べると黒寄りが老だけになったの…。ん〜とりあえず●老で。でもなんだか老希望多い感じだからあえて外すべき？○青とかも気になる…○神でもいいかも。揺れるよぅ。@1
1日目,村長ヴァルター,人狼,昼間の村長業務の疲れが出てうたた寝かましてる間にCOが回りきっているな。結局3-1か…一番嫌な形だが、なってしまったものは仕方ないか。しかしよりによって対抗がアルビン君とフリーデル君とはな。ほかならぬ私がこの村における行商権と布教権を認可した者たちが人外側の者だったとは私も節穴だな。2つとも取り消してそれぞれカタリナ君とジムゾン君に認可証を与えるか…いやその2人が確実に人間という保証もないのか。
1日目,シスターフリーデル,占い師,灰考察です、ちなみに私の考察方法は「白消去法」なので灰考察は村や単独要素ばかりです、そこはご了承願いたいです妙：まず>>154が狼だとしたら目立ちすぎるに同意です。純粋に村のためという姿勢は見えます。>>271の反省も村っぽい。とりあえず今日は占いから外していいかと年：神父様指摘の>>229>>230で確認と非対抗が分かれてるのは気になりますね。私は気になるので聞きます。★分かれている理由って
1日目,シスターフリーデル,占い師,ありますか？全体的に素白を感じるんですがこれといった村要素はまだ無い感じ。ただヨアさん>>237にちょっと同意したので様子を見たいです。青：>>236で探しにくい事を、>>247>>284とか質問の飛ばし方等を見ると、狼探しをしている印象があり。もう少し様子を見たい人です、今のところ占い必要は感じない屋：>>241のすぐに灰に目を切り替えてる点は村っぽい感じ。狼探しの姿勢がちょっと伺える感じ
1日目,シスターフリーデル,占い師,>>257防御感は分かる。ただちょっと全体的に一歩引いている感がしてそれが気になってる。灰は見てるけどかじりついてない感じただヨアさんの評価>>291に同意、様子見がいいけど、占うなら反対はしません兵：リズさんに言われたからだろうけど>>209とかで纏めをしている感じは村っぽい印象。>>210で提案を自在に変えてるところも村っぽい印象がしますリズさんの次に目立ちすぎな印象がしますので外しです
1日目,シスターフリーデル,占い師,書：全体的に印象薄ですが、ちょっぴり>>266や>>267で狼を探している印象がします>>286気になるところに質問を落としているといった印象ですね。もう少し様子を見たいです羊：皆さんもだいぶ指摘されてますが、>>167は狼ならやりにくいんじゃ？という印象が私も感じますただ灰でもっとも発言が少ないんですよね。でも寡黙には感じない。明日もこの調子なら占うなりなんなりしたいですが。今日は外したい
1日目,シスターフリーデル,占い師,神：>>277>>278とかで意見は言ってらしゃいますけど印象が薄い。けど単に発言が少ないからこうなってる印象な感じがします。明日もこの調子なら判断付かないので占ってしまいたい感じです。今日はとりあえず様子見かなぁ。ちなみにスリーサイズはｺﾞﾆｮｺﾞﾆｮ。老：どうも狼探しをしている印象が一番しない方。灰考察はクララさん>>306に同意ですね。どうも全体的に一歩引いていて。判断が付きにくいですね。
1日目,シスターフリーデル,占い師,これといった村要素も見あたらないので占って見たいです。とりあえずこんな感じですね、以上から占い希望を『●老』で出しておきます。って気づいたら老希望固まってますね。う～んこの辺の最終決定はパメラさんに依存したいです。一応第二希望として『○神』を出しておきます。やはり灰考察しましたが結構発言から判断出来そうな方が多いですね、判断しやすそうなのでうれしい限りです。とりあえず少し休憩します。ふー、
1日目,パン屋オットー,村人,>>291青　突き詰めて考えていくと防御感ってのも感じるほうのパッションだと思うけどね。個人的な指標かな。面白いかねー、ありがとう。議事録読み返してみたらぼくなんかずれてるみたいだと気づいた笑きっとこのまま行くけど。>>306書　いや、そうだよね。初日からがっつりいく司書さんだったらぼくほれちゃう！本来のスキルに対して出し惜しみしてる、みたいな不自然な感じはしないからいいかなと思う。　　　　
1日目,パン屋オットー,村人,今日は戦術論に多く喉割きした人もいるから、灰考察は明日聞きたいね。結果として村が混沌としたりしなかったし、ぼくは戦術論の話を深めてみてよかったかなって思っています。さて、パメラは22時ごろに顔出しって話だったね。もう少ししたらくるかな。リザちゃんのシモシモ→懐柔しようとしてるに吹いた。シモシモ、バレバレ、ぼく愉快！
1日目,村長ヴァルター,人狼,言うまでもないだろうが、まとめはパメラ君にお願いしたい。突っ込み共々期待しているよ。灰を見直しているが、まだ発言が伸びていない者からこの時間にもう喉嗄した者までいるのだな。もしかしたら質問を投げっ放したまま占い希望に挙げるかもしれないが今日のところは容赦してほしい。皆も言っているようだが、戦術論回りの動きが目立つのはリーザ君とロリコン君だな。ロリコン君の同時刻CO案は狂狼の連携を断つ目的で提案
1日目,村長ヴァルター,人狼,していたのはわかる。だが結果的に3-1になったのを見ると早いううちから仲間が占騙りに出ることが決まっていた上でぬけぬけと提案していた狼の線も浮かんだが…さすがにこれは穿ちすぎかな。リーザ君はロリコン君よりは感覚的に目立って見えるのだが、プロの私の発言を見て考えていた流れがあるのはわかる。>>179の制止は仲間を待っている狼としてはあからさますぎると感じた。2人とも今日は占希望からは保留しよう。
1日目,神父ジムゾン,狩人,ヨアヒムは激モリツどんを食べたとか超黒いズラ…。まぁヒムは特に白黒を感じなかったズラ。クララは空気化しているのを嘆いてるのがやや白要素ズラ。モリツは白視多めな感じは狼故なのかなーと軽く。というか私は>>156の最初の議題回答でも能力者の自由希望を表明してるのに希望がはっきりしないとか嘘だろーと言いたくなるズラ。そんなこんなで●老○年。クララ>>308そこは一文なんだから切り離しちゃダメズラ。
1日目,青年ヨアヒム,人狼,リーザ＞返答ありがとうね。自分の場合だったら、を考えての結論ね。真ならいいなぁって事だけど、商狂、ないしは狼の可能性はどれ位見てる？オットー＞防御感って聞きなれないから面白いっておもったよー。ずれが生じているって、僕には分からなかった。ありがとうねー。希望は●ジムゾかなー。補足で考えは分かったけど最初から言えばいいのにって思ったり。そこら辺は思考隠しに思えなくも無い。
1日目,司書クララ,村人,神>>301 占い師じゃない私視点からは>>164が襲撃懸念に見えたんですよね。で、ここ占い出てきそうだなあと思ったので余計にそう感じたのかもしれません。>>327　整形失敗しました。実にすみません…。兵>>303　お答えありがとうございます。確かに確定情報が落ちるのはありがたい。ただ、確霊に護衛が取られる率があがる為、占い抜かれやすい陣形なのに変わりはないのであまり嬉しくないですがね。
1日目,村娘パメラ,霊能者,みなさんこんばんは！　遅くなってごめんなさい。とりあえず、出来る限りまとめ役頑張りますからよろしくお願いしますね！一応今のところのみんなの占い希望はおじいちゃんが多いみたいですね…次点は神父様。今のところは【●老がいいと思います。】少しでも灰色は減らしたいですしね。
1日目,司書クララ,村人,妙>>310　>>329の通り、3-1は占い抜かれやすい構成の認識でOKです。と、リズちゃんは全体的に村側の素直な心情（灰考察や>>315での揺れ具合）を感じていることと、多弁域なので占いからは暫く外してよいかと。青>>314　エアーになるの嫌なんですよ！ｗ　屋>>323　オトさんをほれさせることが出来なくて残念です。ああ、オトさんのヨアさんへの返答が白いですね。
1日目,パン屋オットー,村人,あ、議事録読み返してて気づいたけど、>>289老　カタリナは｢理由がない」という意味で「あるわきゃない」って言ってると思うよ、羊が。>>330パメラこんばんは、確霊まとめ大変だと思うけど応援してます。>>326長　ぼくの営業権はどうか取り上げないでくださいお願いします。ちなみに村長さんの占い希望は誰なのかな？仮決定が出てるけど、喉に余裕があったら教えて欲しいです。
1日目,司書クララ,村人,周りとの感覚のズレってわりと狼気にすると思うんですよ。でもそれを気にしない感じが白いなあと。感覚ですが。で、パメラさん来ましたね。まとめよろしくお願いします。で、仮決定は●老でいいのでしょうか。明日以降の希望出し時間や仮・本決定の時間なども決めていただけるとありがたいです。＠3
1日目,老人モーリッツ,村人,占い希望をまとめてみたぞい。パメラ使ってくれ。／｜年羊商屋老兵書妙修神青娘｜長占｜老老老老神書老老老老神老｜　　　　　　　神　　　年　神屋＞そういう意味なのかの？うーむ、もやっとするがありがとう
1日目,シスターフリーデル,占い師,＞パメラさんそれは仮決定でいいでしょうか？仮決定ならば【仮決定：●Ａ】といったような感じで書いてくださると助かります。それと希望を表にして纏めたりしてそこからいろいろと判断して票が少ないところに決定を当ててもかまいませんよ。だけどそれなりの理由は提示してくださいね。
1日目,老人モーリッツ,村人,ワシ大人気じゃな。みなに言われとるがわしってそんなにミステリアス？わからんところがあったら質問・恋愛相談はいつでも受付とるぞ。それとワシはこれでも全力じゃといっておこう。占いはもったいなくも思うが、ワシの自業自得じゃしな。
1日目,村長ヴァルター,人狼,ペーター君は喉嗄れ寸前か。前のめりすぎるようにも思うが、積極的に狼を探そうとしている様子は伝わってくるな。主張もはっきりしているし、ここも今日は候補から外していいだろう。☆>>251議題回答を見れば私がもともと潜伏希望だったのはわかると思う。第一希望の「能力者任せ」はつまり自分の好きなときにという意味だったが、占いで狼を見つけた時か偽物が偽黒判定でCOしてきた時を想定していたよ。議題回答の時に
1日目,村長ヴァルター,人狼,はっきり言わなかったのは、本当に潜伏策が通ったときに透けるのが怖かったからだ。COした理由は偽物が出てきた上非占COもかなり回たことで、村の方針がFOになったと判断したことだ。村に逆らってまで独断潜伏はしない、これも>>204あたりで表明している。襲撃を逃れて狼を見つけたとしても、そもそも私を真と信じてもらえなければ意味がないからな。む？もう私以外は全員占い希望が出ているのか？みんな早いな！
1日目,パン屋オットー,村人,>>334　多分おじいちゃんを黒きめ打てるほどの理由がない＝カタリナのパッションなんだと思うんだけど。カタリナ来ないと真相はわからないけどね。>>333クララ　あー、そうなのかな。いや、天然狂人化とノイズになるのは避けたいから、ある程度すり合わせていかないとと思ってるよ。村人の役割として吊られちゃいけないし。村の人たちがつっこんでくれるだろうから、とりあえずはわりとノーガードでいこうかと。
1日目,村娘パメラ,霊能者,助言、ありがとうございますシスター。えっと、じゃあまだ２２時なので【仮決定●老】にさせていただきます。今から２３時までの間におじいちゃんからの心動かされる発言がなければこのまま本決定とさせていただきます。
1日目,神父ジムゾン,狩人,モリツの表見たけどすごい偏りズラ。仮決定確認ズラ。占い師の発表順はとりあえずCO順希望ズラ。モリツ＞私は>>156でも能力者の自由意志に任せるのを希望しているのに>>200の希望がわからないとはどういう事ズラ。事と次第によっては髪隠しに…。
1日目,行商人アルビン,狂人,【仮決定了解】モリさんは>>334でオトさんの言葉に納得してしまうあたりが踏み込みが浅い、>>336占い１手無駄手の焦りが感じられないためこのまま本決定でも反対しません。あ、オトさん>>296思考が読めないんじゃないんですよ。色が見えないんです。狼でも村人でもオトさんはきっとぶれないスタンス、そのくらいの実力はあるんだろうなーと思っています。あとパメさん、発表順お願いします。
1日目,シスターフリーデル,占い師,【仮決定了解です】【一応すでに占い先セット済みです】希望通りなので問題ないのですが、表>>334を見たら思った以上に老に集まってるので、ちょっとここ狼は薄いかなぁ～と思ってます。ただ判断が付かないのは確かなので占う意義はあるかな、と思っています。＞パメラさんあとはクララさんが>>333言っていることや、モリジイさんが>>334やっている事をまとめ役は基本やっていけばいいですよ、
1日目,青年ヨアヒム,人狼,クララ＞気持ちは分かるな。じいちゃん大人気。考察が薄いのが原因なのかな。仮決定出ているけど、分かりにくいしここ占いでもいいと思う。人気過ぎるとは思うし、思考を隠してそうって点ではジムゾの方が当てはまりそうだけど。あと明日はなるべく喉枯れとかは起きないで欲しいなぁ。僕も気をつけるよ。
1日目,村長ヴァルター,人狼,>>334見たが過半数の希望がご老体なのか。対抗も2人ともだな。発言を見直したが特に黒要素と感じる部分は見つからないな。強いて言うなら同時刻FOへの賛成に、ロリコン君に対して言ったのと同じ心配があり得るくらいか。ただ「なら白いのか？」と問われるとこれも悩むな。発言が質量ともに中庸域なせいだろうか。と書いていたら【仮決定確認】はずれっぽい気はするがこの票数は無視もできないか。セットは合わせた。
1日目,パン屋オットー,村人,>>342アルビン　あー、ごめん、読み取り間違いだね。つっこんでくれてありがとう。色のほうね。【仮決定了解です】ぼくは●神でだしてたけど、老も正直現段階だと思考とか読みにくいのでここもありかと。反対はしません。
1日目,村娘パメラ,霊能者,ごめん、二人の発言を普通に見逃してた…（汗）クララさんもおじいちゃんもありがとうございます。【明日の希望出し時間は２１：３０、仮決定は２２時、本決定は２３時】そして【明日の占い発表順は今日ＣＯした順番】でいいですかね？
1日目,老人モーリッツ,村人,>>341神＞>>200「自由意志に任せる」とはいうが「能力者なら潜伏希望」「宣言が回り始めるなら協力」「同時刻COも反対はしない」などから、「どれでもOK」って言っているように感じたという話じゃな。ワシの髪は既に、時間という魔物に奪われた後じゃ。
1日目,司書クララ,村人,【仮決定了解です】／｜年羊商屋老兵書妙修神青｜長●｜老老老神神書老老老老神｜＿○｜＿＿＿＿＿神＿青＿年＿｜＿パメラさんははまとめですので希望表からは外しました。あとズレもなおしました。多分ズレはなおっているはず。モリさん商修の占い候補から希望挙げられてるんですよねー。というか、自分自身も希望挙げてるので反対する理由がないのですが。
1日目,羊飼いカタリナ,村人,＠・ω）●爺言いだしっぺの僕が言うのも何だけど、ここまで票かたよるとは思わなかった（笑）【仮決定了解ー】僕は神父さんはそこそこ白いと思うけどなー。真っ先に疑ってる対象としてペタを上げたのは好印象だし、おじじは白視多めですねってーのも、がっつり同意なんだよね。
1日目,シスターフリーデル,占い師,【本決定了解です】【発表順も了解】【もう一度確認をして占い先セット完了】パメラさん頑張ってくださいね、応援してますクララさん>>349、私から見ればずれてないですよー。ちょっとだけ対抗内役予想を。今のところ、内役は[狼狂]で見ていて商狼　長狂、で見てます理由としてはＣＯ順もあるんですが長狼の場合ちょっと前に出なさすぎな印象がするんですね、それは発言が遅かったからという理由もあると思いますが
1日目,シスターフリーデル,占い師,それで消去法で商狼。ってかんじです。元々騙る気満々だった狼が騙りに出てきたと思ってます、十分それはあり得ると思いますし。あとどうにも>>338の最後あたりが村長さんに仲間がいるって印象がしないという点が狂っぽいって思った一因でもありますとりあえず対抗に関してはこんな感じですね～。とりあえずちょっと黙ってます＠１
1日目,青年ヨアヒム,人狼,軽くだけど占い師考察しとこ。とりあえずアルビンとシスターの二人は真寄りで村長は偽よりで見てるよ。アルはマイペースに思った事をズバズバと言う感じ、シスターは対抗考察しない辺り僕には真ぽく見えるなぁ。村長は目立たなさすぎ。占い師にしてノンビリかなぁと
1日目,青年ヨアヒム,人狼,軽くだけど占い師考察しとこ。とりあえずアルビンとシスターの二人は真寄りで村長は偽よりで見てるよ。アルはマイペースに思った事をズバズバと言う感じ、シスターは対抗考察しない辺り僕には真ぽく見えるなぁ。村長は目立たなさすぎ。占い師にしてノンビリかなぁと
1日目,青年ヨアヒム,人狼,軽くだけど占い師考察しとこ。とりあえずアルビンとシスターの二人は真寄りで村長は偽よりで見てるよ。アルはマイペースに思った事をズバズバと言う感じ、シスターは対抗考察しない辺り僕には真ぽく見えるなぁ。村長は目立たなさすぎ。占い師にしてノンビリかなぁと
1日目,村長ヴァルター,人狼,>>347その希望出し時間は私には少々厳しいな。できる限り努力はするが。発表順は商→修→長ということだな。続けて票数2番手のジムゾン君を見直していたのだが、>>259「フリーデルの片方発言は騙り出さない狼がしそうな発言」がよくわからない。騙り出さないも何も本人が騙りなんだが…フリーデル君狼前提の話になるが、下手に仲間を庇おうとした発言にも見えるな。私の今日の希望は●ジムゾン君にさせてもらう。
1日目,青年ヨアヒム,人狼,あ、死にたい無駄に発言してるやorz本決定までだまるよ。細かくはまた明日やるよー
1日目,少女リーザ,人狼,青1d>>328んーと、割合でって意味？　商：真≧狂＞＞狼かなあ。真と狂の差は前に言った通りパッションでしかないから、そんなに自信ないよぅ。このまま本決定って言葉見逃してた（汗）【本決定了解です】明日は喉ちゃんと節約するね！でもでも、希望出し〆切りと仮・本の時間はもうちょっと遅い方が嬉しいー。21時半だと日によっては考察どころか帰りも間に合わないかもと不安なの。
1日目,村長ヴァルター,人狼,ヨアヒム君、君が私を偽寄りと見ているのはよくわかったが何も3回も言わなくてもいいじゃないか。そんなに大事なことか？気を取り直して…他の発言も読み直してみたが、議題回答も考察も内容は全体に無難レベルに留まっているな。取り立てて白いと感じる部分も怪しいところもないというか。この手の素白さと身軽さのある者は狼なら後々動きがぶれてくるだろうと思うので、それまでは灰のまま様子見でもいいのではないかと思う。
1日目,パン屋オットー,村人,ある、あるよ、ヨアヒム。人間、すばやく動くと分身するらしいからね。君の鍛え上げられた肉体だからこそ、分身しちゃったんだよ。23時過ぎたから、仮決定がそのまま本決定移行ってことでいいのかな？って、リザちゃんが言ってくれてるね。とりあえず、ぼくはゲルトの顔でも拝んだ後眠りにつこうかな。あの楽天家の顔でも見れば、人狼がいるかもしれないなんて気持ちからは抜けられるように思うし。
