1日目,少年ペーター,村人,サイドからは丸わかりで真占襲撃の可能性がたかまるんだよねー。リナねえレベルならすぐにわかりそうなんだけどー。この辺どう思っての自由占い賛成なのかなー？。　　　旅青書村娘羊樵占一青神青青神年青占二書　　　妙妙　今トマおじちゃんの見えたから追加ー。間違ってたら修正してねー。
1日目,少女リーザ,村人,おそくなっちゃったーこんばんは！議事録ダイブしてくるねー。っと、その前に□7.統一占い希望ー。占い師ぱっくんちょ可能性考えると2占い結果見られる唯一のチャンスだとおもうから。あと、占い先は白狙いは必要ないともおもうー。吊り手余裕も少ないしー。あ、これおやつの残りなのー［バナナのタルト］［ベリーパイ］［ミルク］
1日目,羊飼いカタリナ,狩人,＞年　自由●の場合狂は真の判定が見えないよ。だから黒だしたらそこがご主人様でしたー。見たいな事はざらにあるんだよ。だから真狂なら自由●にしたほうがいいって事だよ。統一●よりも自由●の方が狂は判定を割り難いって事だね。あと第一候補とまではいかないかな？霊をみれば分かるけど、霊も真狂っぽく見えたから。単体の印象だけで占霊両方ともみて占真狂濃厚とまではまだ判断できてないね。今のとこ五分五分かなー。
1日目,木こりトーマス,霊能者,灰について！発言増えてきたところから優先的に見させてもらった。ディタ：灰に質問したいが灰の発言が少なくてやきもきしてる感じだな。そういう考え方は白要素だと思う。ディタ自身も多少当てはまってしまうのは残念だが。クララ：灰考察の時点でペーターを多弁枠に入れてるのはちょっと意外だったな。俺の印象では鋭いが多弁という感じではなった。確かにその後ペーターの発言は伸びているわけだが。
1日目,村長ヴァルター,狂人,全体をまた細部まで読み返す事が出来なかったのでいいたい事だけ補足しつつ置いておくよ。■4．●ヨアヒム混乱からの立ち上がりが遅め故占ってかr自身の行動をハッキリさせる事が出来るように○リーザ他の人がいなければ質問先行なのだろうが、現状そこが見えづらいと感じたため□7｡手数的に厳しいが完ロラするなら統一を希望。どこか決め打つ気なら完全自由占いを希望する＠２
1日目,木こりトーマス,霊能者,ペタ：戦術論で気になることは遠慮なく言うのは白要素だな。統一占いとか非スライドCOとかだな。灰考察に気になるところは特にない。表ありがとう。ただ俺は現状●ニコ○ヨアにしてる。リナ：同じく戦術論をはっきり言うのは白要素。能力者考察を優先してくれるのは構わない。ただ占狂でも自由占いOKはピンとこないな。統一より誤爆しやすいのは分かるが誤爆してもその時点では村にそれが分からないしなぁ。
1日目,少年ペーター,村人,リナねえ回答ありがとー。んー確霊してるわけでもないしねー。この村の場合、自由占いメリットは真占が一発で狼引き当てた時だけだなんだよね・・・・・・。ちょっとごめん、白くみえない。●羊でお願いするねー。第二はりーちゃんの発言まってから決めるー。＠4
1日目,少女リーザ,村人,□6.灰考察◆神>>291 確かにロケットは真狂要素ではあるけどもその裏をかく狼さんがいることを忘れちゃだめじゃないかな？気になった「村人」は他の人も突っ込んでたねーおｋ。でもねーこういう書き間違いぽいとこ突っ込んでも狼探しに役立った思い出ないんだよねー。「狼は1000にひとつの嘘をつく」みたいな感じー。あ、時間については７分あれば他の人も言ってたけど赤相談or余裕できるとおもったよー。　　　　　
1日目,少女リーザ,村人,◆ヨア兄表ありがとー。>>300「ご主人探ししてる狂人にみえる」ふむふむ。でも、「狼だったら～」で「狂≧真＞＞＞狼」は極論すぎないかなー？★狼の可能性低く見る根拠は何？　あと占い希望が白狙いっていうのもリーとは違うー。まとめさんできてもすぐぱっくんちょかもなの。◆羊　CO周辺の発言が早くて鋭いー。>>261とか自分の思考も開示しながらすばやい発言リーもみならいたい。轢殺がおじいちゃんのハートを　　
1日目,少女リーザ,村人,ずきゅーんだね。★>>385 「2-2が一番占機能持ちやすい」のはどうして？3dにぱっくんちょされにくい根拠、できたら教えてリナ姉ー。
1日目,ならず者ディーター,人狼,戻ったぜー。羊>>397少し誤解してるみたいなんだが、俺は占霊考察よりも灰考察を優先すべきって意味で言ったんだぜ。灰考察だけを強要してるように見えたならすまないな～。喉配分考えてくれるなら占霊考察は是非やってもらいたいぞ。□7.統一占い希望だ。占内訳がわからない以上、真狼だと好きな場所に黒出してきそうだ。初回黒でたら狂っぽいということで真贋判断もつけにくくなりそうなんだぜー。
1日目,ならず者ディーター,人狼,遅くなったが灰考察落とすぜー。羊：>>241で霊の数を見て占い回したかったから>>261の娘への質問は思考の流れとして理解。でも>>273で非占するか迷ったと言いながら非占は非霊した後に即してるんだな。だが、>>392で●年は理解出来る。理由としても白黒判断つけておきたいって感じだしな。発言的に村側なら心強いし、初日にここ占いはないぜー。年：>>373寡黙占いは賛同しかねるぜ。発言促してそれで
1日目,ならず者ディーター,人狼,も判断出来そうにない場合、寡黙は吊りで良いと思うんだが。>>370で俺と同じ黒狙いなのに寡黙も初日占い候補なのはちょっと違和感なんだぜ。>>400で占い回避したそうな感じもちょっと引っかかったしなー。今日の希望は●年かね。神：>>299の判断は早計だと思うんだぜ。開始２分でロケットする狼もたまにいるしなー。ここは発言増えねーとわからねぇ。そこまで疑ってはいないが喋れそうなのに喋らないってのは狼っ
1日目,ならず者ディーター,人狼,ぽくもあるんで占いはありなんだぜー。青：表まとめてくれるのは嬉しいんだが、夜出れないことわかってたなら喉もう少し自重すべきだろ。>>353は返答次第だが戦術論を白黒判断にあまり含めるつもりはない。>>355で出したように青の●神希望は自己判断出来るまとめ役を欲している青の考えとして理解し難いなぁ。占霊考察に比重置いて灰考察なしってのは黒要素なんだが…。狼だとしたらあからさますぎるよなー。どっちか
1日目,ならず者ディーター,人狼,というとSGにされそうなタイプだと見ているので初日占いは気が進まない。司：>>363>>364などの占霊雑感からして状況での判断に比重を置くタイプのように思う。だが、そう考えると>>360の年に対する質問はちょっと違和感だなー。状況を見て判断するタイプならスライド＆撤回くらい懸念しそうなんだが。灰考察としては特に気になる部分はないんだが>>376の言い方だとほんとに懸念してなかったみたいだしなぁ
1日目,ならず者ディーター,人狼,思考見えずらいしここ占いもありかねぇ。旅：>>382の理由で村長白視ってよくわからないんだが…長真よりと見ているということか？んで、前半は占襲撃懸念してるのに２日目占いで黒狙い？正直意味わからんぞ。占襲撃を懸念するなら初日から黒狙いすべきだろ…。ここは質問あてれば発言から白黒判断出来そうだ。言い方悪いかもしれないが、占いよりか吊り候補。今後の発言に期待してるぜー。仕：エルナは全体的に思考垂れ流
1日目,ならず者ディーター,人狼,しな感じ。それもあって>>362の後半は気になった。青白前提で話してるような感じを受ける。>>341で言っている黒狙いに比重した話も聞いてないし、青の発言の何処をどう解釈して神が狼探そうとしている人だという判断に至ったんだ？完全に誤認してたにも関わらず青を擁護した意味がわからん…と思っていたんだが>>367でそこをちゃんと補ってるんだな。姿勢としては狼探してる感じなんだが、疑われる要素を先に潰して
1日目,ならず者ディーター,人狼,る感じが少し気になった程度。思考オープンだし灰に切り込んでってくれそうなんで、ここも発言で判断するべきかな～。ここ占いは保留。妙：帰って来たみたいだな。ここは発言見てから判断させてもらうぜー。現時点では【●年○司】で提出する。妙＆神の考察次第で変えるかもしれん。てことで今のうちに風呂はいってくるんだぜ～。＠3
1日目,司書クララ,人狼,みなさん、こんばんわですわ。遅くなりました…帰ってきましたら女湯のトラップが破壊されていましたわ…とりあえず、モリ爺様の質問に答えておきますわ、変態への回答は不本意ですが…［ネタ］>>396発言力がありそうなのにだんまりなところが引っかかっての占希望ですわ。ただ、忙しいだけなのかもしれないのですが早めに判断つけないと後半に判断は難しいと思ったからですわ。続いて、羊妙雑感出しますわ。
1日目,神父ジムゾン,村人,どうもこんばんわ。どうも私、若干黒よりで疑われているようですね。ドキドキ。娘>>378　失敬、>>299で書いたつもりだったのですが、書き損じておりました。村長が真霊であった場合、いきなり周りの総意をとらずＣＯした場合、村人からの信頼を損ねる危険性があります。そのリスクを恐れず、第一声でＣＯしたということは、むしろ狂人が村のかく乱を狙って偽霊に名乗りをあげたのではないか、との印象を持ったのです。
1日目,木こりトーマス,霊能者,神父様：霊真狂っぽいとかさっさと言って、わざわざ可能性を狭めているのは少し白要素だな。もし村長と仲間で狼だとしても世論誘導できてないしな。来たみたいだからここから見る！リザ：もっと考察材料少ないな。ここもまだ見る！エル・ヨア・ニコは既に述べたところからあまり印象は変わっていない！ディタの発言が伸びたな！灰考察は自分で言うだけあって厚いな。特に違和感もない。
1日目,神父ジムゾン,村人,なんというか、私がもし狼だったと考えた場合、ロケットスタートって、「下手すると複数の狼が同時に偽ＣＯしちゃう」こともありうるから、かなりリスキーな作戦に思えてしまうんですよね。どうも私の村長に対する考察も、その思い込みが強くでてしまうようで。公平さに欠ける考察でした。
1日目,羊飼いカタリナ,狩人,やばーい眠たい、寝落ちしてたよ。＞☆妙　少し狩さんの動きにも触れるから、ちょっと迷ったけど、まあいいかなｗ2−2の状態だと霊はロラ要員だから、狩はほぼ占い師二人を護衛するからGJ率が高いし、襲撃リスクも高いから占機能が残りやすいってのがあるね。3−1や2−1は、占か霊を抜かないと狼が詰んでしまうから、それだけ襲撃リスクが高くなる。真占は三日目で墓行きが普通だし、けど2−2なら早期に襲撃しなくて
1日目,羊飼いカタリナ,狩人,も狼が詰まない、さらに霊に護衛がいかないから、護衛確率が高くて成功率が低い。ゆえに真占い師の生存確率が高いので、灰が順調に減るってのが大きいかな。個人的に霊より占重視なのもあってこっちの形態が私は好き。発言が増えてきた人たちは明日考察するかも・・・印象薄い人まで考察するかどうかはわかんない。＠2
1日目,少女リーザ,村人,◆服　おそくまでおしごとおつかれさまエル姉！リーが寝たあとたくさん喋ってくれた人。CO周辺の出来事考>>307の霊内訳予想はリー追従しちゃったよーパッション。灰考察もいっぱいして欲しいです。◆旅>>314 占い先希望理由がざんしんー。ニコ兄はイメージを大切にする人なのかなー。多分ララ姉の「高潔な人」はプロイメージからだとおもうしねー。あ、>>383で「リーも懐いていたから」かぁ！　　　　　　　　　
1日目,老人モーリッツ,人狼,☆司>>419：ふむ？クララは、ジムゾン狼なら意図的な様子見してると感じたん？クララは>>386の時点において、どこらへんからジムゾンのステルス感（？）を受け取ったの？具体的なジムゾンの発言指定、アンカー引っ張ってちょ。★神>>420：「私、若干黒よりで疑われているようですね」ってどっから感じたの？時間じゃ！旅の灰感想がまだなんじゃが、旅も老>>391と似たような理由で占いから外しとる。
1日目,少女リーザ,村人,　リーがララ姉だいすきなのはかくていてきにあきらかだけどねー、うーん...ん？でも>>384では変態だけどおじいちゃんが真なのー？◆年　すごく鋭そうなぺタくん。発言はやいー。>>372で長「協調性ないのはわかったー」評価とかリー思ってもなかなか言えないよー。うーん、でもこれって長の評判落としに取れなくもないのかな？すっごい言い掛かりなの自覚していってみる。
1日目,神父ジムゾン,村人,さて、占考察の方に行きたいと思います。パメラさん：皆様に引きずられる形ではありますが、ＣＯ当初のパメラさんの発言の使い方は少々無駄遣いが過ぎるように感じました。霊ＣＯがいきなり始まったからといって占ＣＯに走ったのも、個人的に疑いたいところです。潜伏が苦手というよりも、むしろコレを機に真占を引っ張り出そうという狼側の印象を受けました。モーリッツさん：>>325～333の考察、細かいところまでチェ
1日目,神父ジムゾン,村人,チェックしているのが村人側の印象を受けました。発言内容も場をしっかりおさえているようですし、かなり白よりでみています。
1日目,司書クララ,人狼,羊：どうやら、かなり出来る方のようですわ。者の言っていたことをスルーしたりと自分の考えを持った方ですね。切り込み方もまさにズバッという感じで気持ちいいですわね。★考察が出ている方々はカタリナ視点で気になっている方ということでよろしいですの？妙：これからの考察に期待していますわ。で、占希望ですが【●神о旅で提出ですわ】。神父様は前述していますが>>422が言い訳くさく見えてしまいました。ニコラス
1日目,司書クララ,人狼,に関しては考察苦手で思考を隠したいのかなと疑ってしまいましたわ。なんとなく言いがかりっぽいですが、初日のパッションも多少込みですわ。このどちらの方に当たっても異論はありませんわ。@4
1日目,少女リーザ,村人,あ、仮時間なのー。うー今ディタ兄の議事録読み始めたとこなの...急いで考えてくるちょっとだけまってー。羊>>423 お返事ありがとう！あとでじっくり読みます。
1日目,仕立て屋エルナ,村人,怖いけど鳩、ごめん今日もちょっとトラブルで夜明けまでに箱に戻れるか分からなくなっちゃったよー…一応占い希望だけ●司〇神で。全然読み込めてないんだけど理由は後で。無理なら明日…遅くても更新直後には戻れるから、そこから読み込みと灰考察するねーあ、鳩からチェックだけはするよー
1日目,村娘パメラ,占い師,神>>420　回答有難う。了解ー。ついでに★神>>429のモリさん「白より」ってまんまの意味の白？それとも真の間違い？えと、時間オーバーごめん。●神○書で提出。妙は普通に質問飛ばしたりしてて、発言で判断できそうなので外す。
1日目,神父ジムゾン,村人,老>>426　パメラさんの>>377の発言を見て、そう考えました。占考察を最初に行おうと思い、モーリッツさんとパメラさんの議事録を中心に追っていく中、目に留まりました。ああ、それと占希望ですが、【●旅○妙】でお願いします。どちらも発言が比較的少なく、質問の内容もいまいち踏み込んでいないのではというパッション込みで選ばせていただきました。
1日目,木こりトーマス,霊能者,まだ神父様やリザの発言を見ていたかったが……時間も押してるし【●ニコ○ヨア】は変更なしと宣言させてもらう！票まとめは俺は都合でできない。ただザッと見た感じだと神父様になりそうか。結構集まってるのがかえって気になるが……
1日目,老人モーリッツ,人狼,ディタは者>>252の指示出しとか者>>354の灰考察うながしが前のめりで白っぽかったんで外し。灰考察もわりと具体的じゃし。リザ子は読み中。増えた発言で疑いに敏感っぽかったのが年>>407、神>>420。占い希望理由がもやっとしてたのがクラランあたり。ひとまず【●年○神】で出すけど、青旅は占いたくないの。いま占い表集計しとる。そうそうパメちゃん、★占い結果は23時20分の同時発表できそう？
1日目,少年ペーター,村人,　　　旅青書村娘羊樵年者神妙爺服占一青神神青神年旅羊年旅＿年書占二書＿旅妙書＿青書書青＿神神間違ってたら指摘してねー！ぼくの第二はクラねえで。ちょっと判断つきにくそう。
1日目,少女リーザ,村人,遅刻ごめんなさい。【●年○青】かなりパッションー。あえていうなら理由は鋭いここ狼だったらこわいーくらい。ごめんねぺタくん。ヨア兄は白狙い希望したとこくらいとしかいえないやごめんなさいヨア兄。
1日目,村娘パメラ,占い師,　　　旅青書村羊樵者服娘神老妙占一青神神青年旅年書神旅年年占二書ー旅妙ー青書神書妙神青年>>438　表ありがとー。んで更新ね。老>>437　んー、1秒位のずれは勘弁してくれるなら多分いけるよー。
1日目,司書クララ,人狼,爺>>426>>366の間違いですの？この時点ではステルス感というよりは神>>298の発言での引っかかり程度ではあったのですけれど、神>>420のあたりが疑いに敏感に見えましたので改めて提出させていただきましたわ。@3
1日目,老人モーリッツ,人狼,リーザの発言を読み込む余裕がなかった。せっかくのロリーザが！貴重なロリが！モーリッツ魂の叫び。しかも、すでにペタ子パメちゃんが票集計しとったギャフン。きちんとポイント集計しとらんが、ざっと見、年神青（旅司）あたりに票が集まってる感じ？第二希望なんだけど、いまんとこワシはジムゾン占いたいの。暫定的に神セット中。☆パメちゃん>>440：ほい了解。じゃあ20分に同時発表でよろしくネ。＠１
1日目,木こりトーマス,霊能者,票はかなり割れたんだな！このままだとペタ占いか！神父様かペタかだと、俺の中では若干ペーター白寄りだがそこまで大差はないな。票を動かすつもりはない。リザから夜明けにされた質問に答えたんだが、返答はまだなのでちょっと気になってる。アンカーが引っ張れなくて悪いが。時間が空いたときでも見てくれ。
1日目,仕立て屋エルナ,村人,箱到着！うわーギリギリセーフ、いやアウトかな？ごめんよー。食事片手に急いで議事録追うねー。結局占いは年が4票で老希望、神が3票で娘希望？年でいいのかなーこれ。第二まで見たら神の方が多いけど老の第二希望か。統一占い希望が多いみたいだからセット確認だけお願いねー。
1日目,村娘パメラ,占い師,ごめん！>>440のやつ年を抜かしてしまった。　　　旅青書村羊樵者服娘神老年妙占一青神神青年旅年書神旅年羊年占二書ー旅妙ー青書神書妙神書青一応第1希望は年4票で1番多いね。【統一の●年】が本決定ってことで良いの？
1日目,村娘パメラ,占い師,え？ごめん、神でいいの？●神なら希望通りだから、反対しないよ。ってことで【神にセット】。
1日目,木こりトーマス,霊能者,ん？神父様でもペタでもいいが統一にはしてほしいな。爺さんは喉ないみたいだが、占い師２人で統一してほしいところだ。＠２
1日目,ならず者ディーター,人狼,戻ったぜ。服>>444戻れたか～。444とれたついでに占い理由も落としてもらえると嬉しいぞ。妙>>439んー。>>427>>439の理由が浅すぎるなぁ…。●年●神が３つ入って並んでるところに●年４票目か。まぁ希望通りなんで異論はないんだが最後の妙票は気になったんだぜー。娘＆年＞表サンキューな。
1日目,旅人ニコラス,村人,ああ、寝ちまったよ。ログ読んでくるよ。占い先希望はそのままさ。
1日目,少年ペーター,村人,ぼく最多かー。ぼくの統一占いでお願いしますー。割ったんでは意味ないからー。
1日目,仕立て屋エルナ,村人,個人的には年より神占って欲しいんだけど、まだ年の発言追えてないからなんとも…印象は白いっぽかったんだけどー。一応、●司の理由は発言が増えた後の発言の追従感。>>361とか>>376とか。全体的に無難な考察なことも加点。でも司神両狼はないかなーとも思ってるから微妙…。
1日目,村娘パメラ,占い師,え？年なの？ああ、もう！どうするの！？　後5分しかないよ！神？　年？　全員反応して！
1日目,老人モーリッツ,人狼,気がついた。パメちゃんの第一希望が●ジムゾンか。ううむ。そんでペタ子四票なんね。んーんーんー年>>450を見て迷うものの【占い先：ジムゾンにセット中】いまから必死に占い発表のネタを考えるじーちゃんであった＠０
1日目,少女リーザ,村人,え、●神なのー？わたし最後だから強くいえないけど多数決じゃないのー？
1日目,青年ヨアヒム,村人,ごめん、今帰った！！明日早いからあまりいられないと思うけどちょっと議事録見てくる！！　本当にごめん！　っていうかパッと見たけど占い先どっちかハッキリ決めようよ！　明日も吊り占いコロコロ変わったりするの僕嫌だよ？！
1日目,木こりトーマス,霊能者,まとめ役がいない以上、占い師同士で決めてもらうしかないだろう。他の人間が口を挟むのは難しいぞ！どちらを占ってもこの票差なら文句は出ないはずだ。
1日目,村娘パメラ,占い師,もう今から変えられるか微妙。【ジムさんにセット】、【23:20に発表します。】
1日目,少女リーザ,村人,●神確認しました。
1日目,木こりトーマス,霊能者,ゲルトォォォォ！！！＠０
1日目,司書クララ,人狼,了解です。それでいいと思いますわ。
2日目,村娘パメラ,占い師,防犯グッズの販売だよー。　今日はこの[スタンガン]だよ！これの使い方は簡単！メモリを合わせてー、スイッチオン！ジジジジジジ……「ぎゃあっ！」　[ジムゾンは失神したようだ]あらら、軟弱だねー。【ジムさんは人間】だったみたいだねー。
