3日目,司書クララ,村人,修>>741ありがとうございます。喉使わせてしまってすみません。んー、何でフリーデルさん引っかかるのかなーと考えていたのですが。フリーデルさんは単体考察も状況考察もお上手と思うのですが、兵狼も視野に入れているフリーデルさんが「潜った灰狼が2人とも占われそうな位置にいるとしたら、兵狼仮定占の乗っ取りに賭けた可能性」とかを考慮せずにひたすら白目位置に1wと言っているのがよくわからないのですよね。
3日目,ならず者ディーター,村人,>>737なんで占ロラが思考停止なんや?俺はがんばって考えたうえで占いロラのほうが村利だと思ったのだが…霊もいないわけだし思考停止とまで言ってしまうのは…言い方に違和感。
3日目,司書クララ,村人,で、兵狼の可能性を考慮すると、むしろ兵→偽黒打たれた場合でも抗弁力ある人、の方がいいかなと思えてきました。…皆さんの発言を見てると私が少数派なのですかね？GSの位置が高いなら白いでいいじゃんと思ってしまうのは、私が単体考察メインだからでしょうか…ちなみに言っておきますと、決め打ちを視野に入れてロラ開始というのは最終的に絶対決め打ちしたいという主張ではありません。
3日目,旅人ニコラス,村人,×この２人の中に　○この３人の中にと言いつつこれもロックかかり気味である事は否定できないのデ、うーンって感ジ。兵真８割論だシ正直僕目線村長襲撃にそこまで違和感がないのデそこから探しにくいんだけド。あの時点の村長の考察とか色々見直してくるネ、といいつつ僕は村長襲撃は、このまま話が進むと議論が不味い方に進みそうよりもなんかつれなそうだし能力もってそう、っていう噛み方に見えるから。どれだケ拾えるか
3日目,パン屋オットー,人狼,僕はロラは明日からを推す。占襲撃あるかもしれないし、100％完全に真切ってるって占師もいないから。霊襲撃通された上に占まで即こっちから手つけるのも癪だし、占襲撃しなかったツケは占われるリスクでもって払わせる的な。(囲いのチャンスを与えうるという面もあるけど)襲撃に関してだけど、占来なかった理由については、占怖くないっていうのは多少はあると思う。灰2ｗとして少なくとも、吊り縄遠くない位置+占をき
3日目,パン屋オットー,人狼,っかけにすぐ吊られちゃいそうみたいな組み合わせ(例えば年+者や修とかみたいな)は薄いか。それに加えて兵護衛ＧＪ避け+霊狙いギャンブル？正直、狼が長霊をどの程度見ていたのかっていうのも大きく関わってる気がして思考が進みにくい。>>669僕昨日時点、エルナ整理吊りかけたいと思ってたし。今日占3つ見れなかったり、判定割れたら占師と見比べたりして考えようと思ってたけど白確だったからその必要すら無くな
3日目,パン屋オットー,人狼,って良かったって話。>>671上記と被る部分もあるけど怪しいっていうか、何かしら整理にかけたいと思ってた。僕エルナ白いと思ってなかったし。怪しさ感じてたのはその通りニコラスの方。
3日目,神父ジムゾン,狩人,☆>>738トーマスさんまず、リーザさんから拾ってる非狼が大きいので、一つの狼要素だけではひっくり返らないというのがあります。あと、リーザさんはいわゆる理想の占い師像とは違っていますし、完璧タイプの動きをするわけでもないので、真でも２ｄ終盤の発言はあるかなと。なお本人の考える形で村とちゃんと向き合ってると思います。若干、挑発的なところはありますが、それは真ゆえの傲慢さとみています。
3日目,神父ジムゾン,狩人,狂的な要素も１ｄ序盤で拾っているので、真狂予想ですが、私としては、真目で見ていますね。シモンさんの方が理想の占い師っぽいのはわかりますけどね。なお、占い師は全体的に黒を引こうという気概を感じられない印象ではあります。書>>748中段には同意ですね。なんかＧＳ位置高いから黒いとかって今の段階でやることなんですかね。終盤戦でやる話な気がしております。
3日目,神父ジムゾン,狩人,書>>748下段にも同意ですね。そもそも明日、明後日と状況は変わるわけです。占いが襲撃で欠ければ、ロラでよいでしょう。誰が誰に何色を出すかを見ながら、考えていくことです。将来よりも明らかに情報量が少ない今日決めることではないです。なお、狩保護で今日からロラというのは一つの納得できる考え方と思います。ただ、狩保護でもペーターさん吊でいいんじゃないのと思ってますが。非狩だと思うので。
3日目,木こりトーマス,村人,ロラ、する、しない、メリット、デメリット、考える。ロラ、する、場合メリット、２人外、確実、落とせる。また、狼、縄、使わせたい。占、やや、噛まれにくい。真っぽい、占、判定、見れる、可能性、高まる。デメリット、１縄、確実、無駄になる。決め打つ、場合メリット、成功する、場合、２人外、吊る、真占、残る。デメリット、失敗する、場合、人外、残る。占、早く、噛まれる、可能性、ある。ただし、これ、メ
3日目,木こりトーマス,村人,リット、なり得る。噛み筋、情報、落ちる。また、縄、確実、浮く。結論、話す。ロラ、する、しない、今日、決める、必要、ない。ロラ、決め打ち、両方、視野、入れる。狼、噛み筋、考えさせる。希望、出す。占、吊る、場合【▼商】、灰、吊る、場合、後、出す。占希望、【兵→●年or神、商→●神、妙→●書】俺、ペーター、そこまで、怪しい、思わない。しかし、疑い、多く、向いてる。信用、高い、シモン、占わ
3日目,木こりトーマス,村人,せる。SG、保護する、狙う。黒、場合、問題ない。白位置、狼、いる、場合、ジムゾン、思う。ここ、色、見たい。妙真、場合、妙真兵狼商狂、思う。樵>>542、考える。ジムゾン、白くなる。残る、白狼候補、クララ。神>>753回答、ありがとう。★リーザ、真、どれくらい、見てる？もう一つ、リーザ、非狼要素、神>>421、指してる？他、あれば、聞きたい。
3日目,神父ジムゾン,狩人,☆>>758トーマスさん無理やり数値化すれば、妙真６０％くらい。兵真３５％くらいで、商真さん５％です。こういうときの５％は実はやたらと発生率が高いというマーフィーの法則的なものを思い出しましたが、あまり気にしないでおきます。神>>421で合ってます。あとは３ＣＯ目ってのも一応考えた記憶があるような。あまりアテにならないセオリーだとは思いますが。全体的に赤窓背負ってる雰囲気はないです
3日目,パン屋オットー,人狼,あ、言い忘れてたけど自由占でいいと思う☆書>>735それは>>261。ざっと見て・者商>>673>>674>>657ここのやりとりは強い切れ。者商切れについては断定しちゃっていいかな。者白商偽(狼)と見てるのでそちらも補強された。・神>>703　この占師アンケート見て少し「ん？」って思った。返答待たずに>>708で既にロラ希望について希望を出してるのを見るに、ロラ順決めるために聞いた訳で
3日目,パン屋オットー,人狼,もなさそうだし。白位置にいるのをいいことに好き勝手やって占の思考動き把握しようとしてる狼、っていうのが一瞬頭をよぎる。★神>>703の質問の意図は？・★書>>711　クララはディーター吊りたい(或いは吊りたいと思ってる時期があった)の？・年>>733>>737決めうち強く推進。結構年疑い集まってることは理解してると思うんだけど相変わらず独自路線マイペース。生存欲とか無さそうだけど、狼でも
3日目,パン屋オットー,人狼,こういう人いるからなあ…悩み所。・者>>739上段いい着眼点だと思った。兵商の狼要素か。兵狼ならべぐり懸念+霊ギャンブル、商狼ならばそれに加えてＧＪ避けってとこか。一旦投下。
3日目,神父ジムゾン,狩人,☆>>761オットーさん>>754中段でも言ってますが、単純に占い師から気概を感じないし、黒引ける自信ないならこっちから指定の方がいいかなとあと、私は占い師の自主性を尊重するタイプなので、回答のとおりにしてあげようと聞いただけですどこ疑ってるかはあんまり聞かないほうがよかったかもしれませんが、誰が誰を疑ってるのかもあんまり印象ないんですよねみなさん自分のことを機能と思ってるのでしょうか
3日目,神父ジムゾン,狩人,ペーターさんの黒要素としては、発言に対する意図（ようはアピ）が感じられるのと、思考の硬直化が見えます。一方で、村人にありがちな手探り感が低い感じがしておりますね。こういう村人もいるというのがトーマスさんの意見のようですし、それはありうるとは思うのですが、別段、他の村人より白いとは思いません。気が付けば＠４になりました。そろそろ温存に入ります。
3日目,司書クララ,村人,屋>>760ありがとうございます。それ以外にも何かあればと思いましたが。☆屋>>761吊りたいというより、現状白置きができないです。私が妙狼よりで見ているからというのもあります。単独感があるという意見はわかります。現在微白寄り灰にはなってます。★神>>763それが理由で私はリーザちゃんが一番真に見えていないのですが、ジムゾンさんはそんなことないですか？ってア…喉温存ですか…
3日目,神父ジムゾン,狩人,☆>>765クララさんまず、リーザさんは理想の占い師像タイプじゃないので、その要素はそこまで気にしてません。むしろ、優等生を目指してそうなシモンさんやアルビンさんの方が気になるくらいです。あと、リーザさんの１ｄ終盤の動き自体は娘占い（と者占い回避）に動いてて、何をしたいかの意思表示は相対的には一番強いくらいなところはあります。いよいよ喉がないですね。カレーが食べたいです。＠３
3日目,少女リーザ,占い師,>>703 ジムゾン今更かもしれないし、若干物議を醸しているようだけど一応答えておく？もう発言もないようなので返答は不要だけど。1. バラで指定するくらいなら自由かなー。統一ならそれはそれでなくはないけど。2. 自由となったらここかここかなーていうのああるけど、ヒミツ。3. あまりない。>>754明日以降自由になったらともかく、今朝までの統一占いでは黒引くだけが役割じゃないしね。
3日目,シスターフリーデル,人狼,>>746 占いそっかみきてないのに、むしろ逆にＳＧ位置に2匹とも狼いる～って考えられる思考のほうがすごいなと私は思うけど。ジムゾンの同意はもう便乗にしか見えなくなってきたから突っ込まないでおく。文字数たりない。霊能もいないのに占いの色みて判断しよう～とか結局それって決めうち思考なんだよね。灰精査する気なくて、占い機能に頼ってるだけ。じゃあ占いの発言だけ精査すれば？って思っちゃう。
3日目,ならず者ディーター,村人,ただいマンドリル。気になったことをいくつか。俺だけかもしれぬがぺたのロラは思考停止っていうのはなんだろって思ってる。他の言い方なかったのかな。しかもその発言進行役にアンカー飛んでる。ここ狼ならロラされたら困るのかな～って感じ。だからペタ狼なら灰の殴り合いで現状つられなさそうな神、書、樵あたりはかなり白くなると思った。
3日目,司書クララ,村人,神>>766ふーむなるほど…ありがとうございます。喉使わせてしまってすみません…（二度目）シモンさんは占先絞ろうとしているようには見えましたが、納得しました。現在のGSは白　樵>>>神>屋>者>旅>修>年　黒という感じでしょうか。旅あたりが純灰修>>768別にGS下位に2wいると確信しているわけではないですが。それを言い始めたら何のためのGSかと。
3日目,ならず者ディーター,村人,>>765あれクララに俺わりと疑いかけられてると思ったんだが…もういちどクララの発言みなおしてくるだ!
3日目,司書クララ,村人,あ、占い即噛みでなかったのがフリーデルさんの中ではかなり大きな要素だったということですか。それは理解できます。でもフリーデルさんって1dから長神書に1wいるという主張でしたよね。1d>>306「狼だったら吊れなさそうなところを占い先にしたい」から2d>>514「一匹は混じってそう」「灰考察や発言がしっかりしていて中身が不透明」に変化していってますが。何というか、結論ありきに見えました。
3日目,パン屋オットー,人狼,>>763　それならジムゾンから村全体やパメラにそう(指定占案)提言すればいいし、別に回答を得たところでジムゾンがその通りにしてあげられる訳ではないのでは。とりあえず質問の意図はわかった。占師から気概を感じられないというのは同意まあ村人ジムゾンとしてもおかしくない範囲の行動ではあるし、ここ議論しても水掛け論になりそうだから僕が大きく誤解しているとかでなければ返答不要>>765　昨日はディータ
3日目,パン屋オットー,人狼,ー怪しいって言ってた(>>484)のに今日はケア吊り枠と言ってる(>>711)のが何だと思って話聞いてみたけど今は白寄りなのか。何か見方変わるきっかけとかあった？
3日目,司書クララ,村人,☆屋>>774この発言が、というのは特にありませんが、単独感の積み重ねと萎縮してなさが。ディーターさんが狼なら、周りに疑惑を持たれたらもっと発言を躊躇いそうに思うので。あとは強い要素ではありませんが、妙者両狼仮定、妙>>491のディーターさん庇いは露骨すぎてやりにくそうではあるかなと。
3日目,仕立て屋エルナ,村人,>>723灰からの吊ペタ▼神父▽に変える。占ロラが思考停止とは思わないしペタ君何考えてるか見えてこない。これ灰占も同じくこのふたりで出しとく。@7
3日目,木こりトーマス,村人,神>>759回答、ありがとう。神>>472「そこまでリーザさんの真を押してるわけではありません」この後、ジムゾン、リーザ、真贋、触れる、神>>699のみ。いつ、リーザ、真目、なった？、感じた。質問した。回答、見た。ギリギリ、理解、できる、範囲？ここ、他灰、意見、あれば、聞きたい。ジムゾン、スキル、考える。狼、場合、やや迂闊、発言、思える。
3日目,木こりトーマス,村人,ジムゾン、リーザ、真目、言う。しかし、神>>699、リーザ、下げる、発言。占い師、リーザ、傾ける、意図、感じない。ジムゾン、発言、判断、難しい。やはり、占、当てたい。書>>770「GSは白　樵>>>神>屋>者>旅>修>年　黒」GS、オットー、位置、やや高い、感じる。★書>>591、以外、白要素、拾えてる？
3日目,司書クララ,村人,回答込みで灰考察☆樵>>778今日のオットーさんは狼を探そうという意思が見られたからです。書や神と白目と見られている位置にも殴りに行けるのは後ろめたさがないからかなと。ニコラスさんにはあまり感じられず。ジムゾンさんもオットーさんと比べると出力弱く感じますが、これまでの共感等の貯金からまだ上位。ペーター君は全然上がらず。何ならフリーデルさんが一番狼への殺意感じますが、違和感も強くてGS低く
3日目,司書クララ,村人,希望出し【▼灰希望】【兵商→●神、妙→●神以外】【灰なら▼年、占なら▼商】もし神白なら兵商から偽黒出にくそうだから、神黒なら妙黒かなと思うので妙は神以外。▼年はGS下位から。▼商に変わったのは神>>766にある程度納得したため。占い師さんたちは灰の希望を参考にしつつ自由占でいいかと。樵>>777スキルの高い狼が迂闊な発言をしないとは限らないと思います。
3日目,司書クララ,村人,また、神妙両狼仮定、他の人に言われるよりはと先に仲間が言った可能性はありますが（霊がいないので可能性は低いですが）、神の妙真視は理解できる範囲かなと思っています。性格要素を重視するのであれば。シモンさんについては納得できなかったので私は兵真視のままですけれども。これまでのジムゾンさんの発言に性格要素を重視する感じが見受けられるかどうかは確認しなければなりませんね。@3
3日目,負傷兵シモン,人狼,戻ったー神発言は相変わらず余裕が見える、樵書に比べれば後衛的な立ち回りというか。>>698>>699は白黒要素というよりも人物評に近いような。だから黒い、なのか、だから白い、なのかがはっきりしない感。まだ明言する段階にないってこと？こういう所は狼的だと思う>>670とは言ってるけど終盤に書樵辺りと戦う未来について無関心なのは白要素か。狼なら多少なりとも意識する部分では。逆にやや終盤を意識し
3日目,負傷兵シモン,人狼,逆にやや終盤を意識していそうなのは樵。行動だけ見ると樵の方が神より狼的か？ただ樵単体は白いなあ、状況考察然り。ここはちょっと白ロックかもしれない。書は思考の推移というか、振れ幅の大きさがやはり村的に映る。神樵とも思考の軸は基本動かないし、むしろコロコロ変わる方が通常は不自然なんだが、書の>>588もそうだし、個人的には>>628>>651とかも狼仮定やりにくい所じゃないかと。書のポジション
3日目,負傷兵シモン,人狼,書のポジションで決定動かしに行く必要を感じない。作ったブレには見えないというか、実際そう考えたんだろうなあと。狼なら村に相当入れ込むタイプで上手いわ。この中では書が神に視線向け始めてるけど、書狼で神を吊りたいなら、やや動き出しが早過ぎる感。灰吊にしろロラにしろ、盤面進んでからで良い気がする。現状吊られそうな年保護にも年の現状考えると多分ならないし。
3日目,負傷兵シモン,人狼,上位陣についてはこんな感じか。残りの考察してからだけど、村の盤面が進んでこの中に狼がいることが濃厚になるまでは手を付ける展開にはならなそう、というのが正直なところ。>>703自由占希望だけど妙商を縛るという意味で指定占もありか。黒引きの自信についてはまずまず。ある程度の狼は補足できると思うけど。村の終盤に有利な盤面を作れれば。機能とまでは思ってない、機能以上ではありたい
3日目,旅人ニコラス,村人,ただいマでス。村長のGSとか色々振り返ったんですけドやっぱり僕的にハ村長噛みは吊れない所噛み以上に取れなそうだったのでもっと他の方向を探してきまスと言いつつ時間少しかかるかモ、議事読み直してきまス
3日目,木こりトーマス,村人,娘>>623昨日、投票、見た。ニコラス、ペーター、お互い、入れあう。ペーター、占われる、可能性、十分、あった、旅年、キレ。また、クララ、第一希望、ジムゾン、第２希望、ペーター、投票する。ジムゾン、第２希望、しかし、投票時、ペーター、希望、集まってる。神年狼、場合、そこそこ、危険、行動。ただ、書or神、LW想定、切り演出、あり得る。年>>622エルナ、占わない、場合、ペーター、占われる。
3日目,木こりトーマス,村人,意見、弱め、しかし、反対してる。昨日、仮決定、反対、多かった。変更、可能性、十分、ありえた。年狼仮定、危険。一応、決死の白アピ、ある。しかし、占われる、黒出る、本末転倒。さらに、考える。ペーター、占われてもいい、思った。白アピ、する、黒出し占い師、印象、悪くする、狙い。しかし、決死の白アピ、場合、狼仲間、今日、この点、指摘した、思う。現在、霊、いない。ライン切り、メリット、大きく、下がった。
3日目,負傷兵シモン,人狼,黒狙え的なプレッシャーを感じたけど白要素ある所を削いでいった方が結果上手くいくこと多いんでそのままいく。屋>>669に対する>>751>>752は淀みない。屋自身の考えに沿って進んでいる感。>>760で者白押すのは屋狼者白なら結構危険な動き。>>761はそうだよなあと。年の生存欲低い感じは本人要素だろう。>>773の主張はわかるけど、神の姿勢的にそんなに疑問に思うポイントだったのか？とは思
3日目,負傷兵シモン,人狼,とは思う。しもへいには占を探りたい姿勢としては自然に見える。狼仮定でＳＧ枠を削る動き自体には非狼取れる、か。ただ年じゃないけど自分の首を絞める動きで非狼稼ぐのはよくあるから弱い書>>779★屋が殴りに行けるのは相方が良い位置にいるから、という線はない？
3日目,村娘パメラ,村人,こんばんは。せっかくの連休でしたが今日も天気が悪くて残念でした。でもだんだん秋らしくなってきて過ごしやすくなってきましたね。エルナお帰りなさい。まとめ役をやりたい時はいつでもおっしゃって下さいね。あと、ここまでの流れを読んでみた感じでは、今日は灰吊りを希望される方が多そうですね。灰吊りなら今日外すと今後ミスは許されません。狼を狙って一人一殺の気合いで▼希望を出していきましょう。
3日目,少年ペーター,村人,ただいま。襲撃考察世論的に村長白い位置だったし霊っぽかったので抜いたと思いますが、リスクが大きいように思えます。占い師襲撃しなかったのはGJ避けもあると思います。失敗しても吊り手増えるわけではないですが、もう一回GJで増えるので、リスクヘッジしたと思います。しかし、村長霊でない場合、確白ふえて灰が狭まるだけでこちらのリスクも大きいのが結構疑問です。狼側にとって一番の安全策はエルナ襲撃のはずです。
3日目,少年ペーター,村人,人狼側の考え方はどのようなものだったか、以下のように考えられる。1.　霊がほぼ透けていた2.　灰を狭める覚悟があるだけ、余裕がある3.　霊を襲撃しなければならないほど、余裕がない3.の可能性は限りなく低いと思います。灰の吊り候補といえば世論的に私とオットーが有力ですし、3日目時点で仕方なくリスクをとる必要はないです。2.が一番可能性が大きいと考えます。エルナ襲撃ではなく村長襲撃したのは
3日目,少年ペーター,村人,（続き）狼側の遊び心、ある程度余裕のある行動に思えます。村長襲撃は「狼の遊び心」が出た行動である。私は樵神旅屋に２狼と昨日から考えていますが、この遊び心を持ち合わせているとすれば旅屋２狼は考えられません。（加えて、>>561で指摘した旅と屋のライン切れも合わせます）。以上から樵神のどちらかが狼だと思います。樵神ですが、今のところトマ兄のほうが白いと思います。旅神？+妙予想。
