2日目,村娘パメラ,人狼,我の喜びは 輝る金！巡る鼓動に耳を澄まし 両の足で大地を踏める幸せ！朝と夜を迎え 今日という日に生きる事を幸せと心得よ！生命（いのち）の光よ今！ 解き放たれて明日を繋げ！ 煌け！！　—— 輝る金の庇護《ｸｫ･ﾙﾃﾞｨ･ﾚﾘｱﾝ》！！！うっ、この反応は！……痛い子を見る目で見られました。【クララさんは人間】　え？　ゲルトさん！　いやーーー！　
2日目,負傷兵シモン,村人,ゲルト冥福。お前の暢気な笑顔は俺の癒しだった･･･【書白確確認】俺の理解が及ばない存在だったから色判別できたのは助かる。★老：>>264村人が自分の色を薄くする必要があるのか？薄く＝白くってことか？影薄くしたいＬＷＣＯかと思ったぜｗ>>270話してくれないと村人も判断できないｗ頑張れ。
2日目,負傷兵シモン,村人,☆修：>>273内容寡黙も吊る意識だ。爺はＳＧにされやすいタイプの素黒とも見ている。強く出れる力はあるようだし>>268今後の変化次第だな。☆屋：回答thx>>271色が決まれば寡黙でも判断の必要がなくなる。斑なら寡黙＋斑吊りが出来ていいということか。納得した。昨日は忙しかったようだ。リア大事に頑張ってほしい。盤面は随時確認しているが、考察はまた夜に。
2日目,ならず者ディーター,霊能者,基本フリートーク派なんだが、いちお出しとくか。議題■1.占い師真贋　■2.灰考察　■3.占い希望と吊り希望■4.ここで一句
2日目,少年ペーター,人狼,んぁ。確白か……。いっそ割れてくれたら嬉しかったんだけど。昨日書ききれなかった分だけど、娘1d>>186、SG保護に占を使うのは珍しくなくとも、それを自分で言うのは悪目立ちだと思うなあ。そして兵1d>>245の僕評……この何とも言葉では表現し難い黒っぽい感じ……！ 僕も素黒同志の一員……！？(*ﾉﾉ)
2日目,老人モーリッツ,村人,おお、ゲルトやかわいそうに・・・【書白確認】じゃ今、考えてたことを。わしを占したいと言ってた人たちは白く感じたのう。シモンがいう通りこのままならＳＧにされそうとは自分でも思う。それなら占に持っていきたくない人が相対的に黒く感じる。ゆえに■1.パメラの方が若干真に見える。
2日目,司書クララ,村人,意外です。確定白ですか。
2日目,ならず者ディーター,霊能者,クララ＞確白おめおめでとうついでにお願いなんだが明日の仮決定出しお願いできるか？よく考えたら俺その時間無理っぽいんだわ･･･
2日目,司書クララ,村人,ディーターさんわかりました。朝には強くないですけどがんばってみます。
2日目,シスターフリーデル,村人,【クララ白確確認】■１、屋は質問中のところが気になるん。>>271の言い回しは寡黙や斑の吊主体で、自分が見れるはずの判定からの展開意識に感じないのよね。それに関して兵>>293が納得なのも気になる、のは屋の意見を聞いてからまた。あとは>>272かな。仮決で選択状態になってるのを認識している状態で本決定前に「夜が明ける頃にはまた帰ってくるよ」は占能力を忘れた偽要素と取っちゃうなぁ私は。ですわ！
2日目,青年ヨアヒム,村人,うーむごめん。朝が意外と寒くてダウンしてベッドに入ってたら起きれなかった。クララ占で結果は確定白か。昨日書いてたであろうことは、狂人の話題ついでに2-1って占狼の潜狂が一番怖そうとか、神父の返事は読んで意味解ったよとか、ペーターに読み込み浅くてわるかったねとか、かな。あとクララとモーリッツどっちもそんなに黒いと思ってなかったし仮決定どうリアクションしてたか自分でもわからん。
2日目,宿屋の女主人レジーナ,占い師,クララ確定白おめでとうだよ
2日目,シスターフリーデル,村人,娘は考察とか雑感とかも違和感ないし納得するところが多い。相対的にとかではなく個人で見ても今はパメラ真寄り意識かな。ですわ！寡黙吊希望一辺倒にならないためにも、レジーナ発言ほし～な。灰雑感でも、私は実は○○なんです略して私○～でも、議題■４、でも。
2日目,シスターフリーデル,村人,占内訳と潜伏狂に関して。今の所、真狂か真狼か判断寄りそうな材料は見てない。潜伏狂は基本的に吊手数考慮時に大丈夫か考えれば脅威は少ないのではないかと思う～。年>>280のように狂的挙動としてあげるなら分かるけど、占希望ごとに「怪しいけど狂か狼か分からない」とか、白判定ごとに「狂だったら」みたいなのに集中するのはマイナスになって嫌だなぁと思う。狂と狼では出てくる怪しさは違うと思うしね～。ですわ！
2日目,神父ジムゾン,村人,【クララ白確確認】。素晴らしい！同志の一人が疑いの連鎖から解き放たれたのだ。エイメン！そこで一句。■4. 白確を　クララにとられて　いと悔し★レジーナ＞うーむ。昨日パメラと私(他にもいたか？)は、寡黙で貴女を吊りにかける事を辞さず、と示唆していた訳だが、村側ならば吊り縄を浪費させる事に危機感はないか？さしあたって、1d灰雑感と占希望を誰にしていたか、今からでも聞きたいんだが。
2日目,村娘パメラ,人狼,あ、レジーナさん来てる。失踪しなくて良かったわー。でも、このままだと寡黙吊りになりかねないので、頑張ってー。ぺタ君>>295　まあ、「自分に占い希望を出してー」とか言ってるのは悪目立ちだとは思うけど、SG保護に占いを使うって思想の延長戦上だから、神父様の思考は理解できて、わたしはネタとは思わなかったんだけどね。んーと、結局、ぺタ君は、「自分を占え」って部分をネタだと思ったってことでOK？
2日目,村娘パメラ,人狼,シモンさん>>262　白狙い占いしても、偽黒出されてパンダになるかも知れない訳で、うーん。な感じ。昨日の占い希望みたいに、白黒どっちでもお得っぽいのなら理解できるんだけど。もしかして、初回占いでは偽黒は出ないと思ってた？CO論の部分は了解。★お爺ちゃん>>222「中立的とも言えるかも」＞クララさんって思考は読みにくかったけど、意見ははっきり出してたと思うのよね。どこを「中立的」と感じたの？
2日目,神父ジムゾン,村人,では初回占も出たし、占い師を見てみようか。占師オットー。早いCO。その時点でFO希望は何とか過半数超えてるか。>>198「優位に立ちたかったから」というが、積極的な動きが薄いのは何とも。占希望レジーナも然り。全体的に弱気な印象、とすれば先出しでは割らないか。「ちょっと弱気の狂＞リアル多忙の真＞＞占騙り狼」かね。★オットー>>198 先行COからどうやって優位に立とうと思っていた？
2日目,ならず者ディーター,霊能者,レジーナレジーナ～＞ずばり誰が狼だと思う？
2日目,神父ジムゾン,村人,占師パメラ。FO希望。白占いは嫌。即非霊。COもディタの指示通り。素早く灰に踏み込む。占希望ニコラス…か。大まかな流れでは非の打ち所がないな。今日は後出しでクララを割らず。「いい子の真≧普通に化けてる狼＞何か企んでる狂」というところか。んー、質問も出てこないな。ほっておいても発言出るし、とりあえず観察でよし。総合して「パメラ真、オットー狂」が現時点での妥当な線かね。
2日目,神父ジムゾン,村人,おまけ。1dで私狂視の声があったが、赤ログではどう見られていたのか。もし、赤で私狂の意見があったら、一般論として占に狼が出てきている目はありうるな。だが、現実の発言を追うと…。オットーのCOは、そうは感じない。パメラはCOタイミング的にはともかく、周りの>>112や>>143で自然に私を白視しているんだな。となると、上記の件は、パメラ狼を推す要因にはなりそうもない。まあ、参考までだ。
2日目,シスターフリーデル,村人,ペタ>>280をにゃるほどと思ったと言いつつ、実際に書白確した現状で考えてみると、書狂を狼的から判断付く場面はなさそうに感じる。その場合、この後とか狼にとって不利益な狂だなぁということになる。と、思うんだけど灰に狂と分かってる狼なら絞れるのかなぁ、神父様も居るから難しいような…というところ。状況で確定のＰＰとかじゃない限り「狂狼間の意思疎通が良ければ」タイプの戦略って確率低いと感じるなぁ。ですわ！
2日目,神父ジムゾン,村人,モーリッツを探ってみるか。>>223>>270を見ると、貴方は狼側の影響力を高く見ている感じがあるが、私はそうは思わん。村側は9人、狼は3匹(＋オマケ1人)なのだ。この戦力差はバカにならんぞ。村人全てが十分に考察し、発言する。この正攻法をこそまずは進めるべきと私は考える。質問もしてみようか。★老 >>222という事は、私の考えはその二人より読めたのだな。1dの私の意図をどう考えている？
2日目,少年ペーター,人狼,こんばんは。レジさんは来てくれたけど一言で去ってしまったのね……娘>>306　えっ。その部分の話だよね？ 違った？＜自分を占え単純なネタか、仮に何らかの意図があったとしても「SG保護のつもりで自占を推してる」訳ではないと思うよ。自分で自分の疑惑を晴らすつもりが無いって事になるものそれ。修>>312　占真狂なら杞憂な話ではあるんだけど、この場合は別に狼から判別できる必要は無いんだ。僕が気にし
2日目,少年ペーター,人狼,たのは狼からの認識ではなく、占手数の問題。狼らしからぬと思えてかつもし潜狂ならやりかねない挙動であった、というのは占を避けたい理由として間違ってないと僕自身は思うんだけれども。
2日目,少年ペーター,人狼,■１占師真贋・屋霊CO完了前の指示なしCOは、僕は別に問題でもなんでもないと思うよ。出来ればもう少し人の多い時間にCO開始してくれればよかったとは思うけど。序盤のCOなので、偽であっても最初から騙る気だったはずだけどCO前の発言からは特に情報はないね。無難な議題回答。ただ、早めの展開を望んでたっぽい所は率先してCOしてきた態度と齟齬が無いな。シスターも指摘してる1d>>272は僕もえええ！
2日目,少年ペーター,人狼,って一瞬思った。リアル事情自体はしょうがないことだけど真占っぽい焦りが全然見えなかったから。だけどその程度の用事なんだったら十分戻ってこれるだろうから、焦らなくて当然かも。ちょっと引き気味な態度は判断しにくいけど、騙りを無難にこなそうとオドオドしてるんだとしても、そういう性格なんだとしても不思議ではない感じ。・娘屋と比べると大分攻めの姿勢だね。
2日目,少年ペーター,人狼,1d>>242、宿占反対の理由が占を大切にしてる感があるかな。もし確白になって消えられたらたまった物じゃないよね。それ以外にも1d>>183みたいな霊確定云々で食いつくらへんは占師思考ではある。偽ならそんなやる気満々ぶりと、ほぼ霊確に近かった段階で出てきた点でやや狂っぽく見える。捨石上等ってことだから、こういう喋れるタイプの狼ならちょっと敬遠するかなと。相対的な真偽としては、娘の方が姿勢的に
2日目,少年ペーター,人狼,真らしく見えるけど、この段階の能力者って上手い方が上手いって感じだからね……悩ましい。所で娘1d>>234、屋1d>>260、占師が共に宿が喋れそうに見える評価を下しているのが面白いと思った。僕にはレジさんあんまよくわかんないや。
2日目,シスターフリーデル,村人,年>>314：うん、占真狼の話で。人狂が分からない書の前日発言は、現状狼を迷わせるだけではないかなという考え方。>>280時点で占避けたい理由としては全然正当なものだと思うよ、私もにゃるほどって思ったし老占希望だったし。ですわ！>>313神の質問は老の考え方を捉える良い質問だと感じた。なので、それを見て自分も判断したいと思ったし、同時に神父様の初日からの言動の流れに白さを感じて幻滅しましたわ！
2日目,神父ジムゾン,村人,あとは、ニコラス>>220の要望に答えようか。何でもいいというので、では灰評と質問を。正直、分析材料はあまりに少ない。コアずれは宿命だが、それと関係なく思考の型が見えにくい。野暮な意見だが…、RPの改善も一助となるかもしれん。それから、コピペでこれを貼っておこう。★旅＞貴方は自分の特性や能力を考慮した上で、どのように村の勝利に貢献しようと考えている？
2日目,神父ジムゾン,村人,同志シスター>>320 いやいや、何をバカな…。序盤の言動に目を取られてはいかん。>>154下段を見るんだ。私が5d辺りまで灰で生き残ったら真価を見せられるぞ。★修＞字数が余ったので、質問もしよう。シモン占希望は、主にシモンの白狙い占で貴女→希望ペーターという思考が原因か。私は貴女を>>154上段と評価しているんだが、他にシモンの発言で気になったところはあるか？これで、ひとまずさらば。
2日目,シスターフリーデル,村人,☆神：白狙い私に関しての会話は目に留めつつも特に判断材料には感じていませんわ。まずは私的にどう判断しようという考えが兵考察時に出てこなかったのが一点。そして>>251前文ですわ！兵がペーター占希望なことと、私の「年を挙げたら占になるかも～」は後者を単純に思っただけで、判断材料ではないですわ！後に>>263に了解しつつ>>293の私ではなく屋への返答に自分との返答理解の仕方の差を感じている所ですわ！
2日目,シスターフリーデル,村人,★青>>238：多弁の中でペタを挙げる理由は表記の通りとして「多弁攻めるなら」の希望理由を聞きたいな。書老旅ピンと来ないというのからスッキリ繋がらなかったので。ですわ！★年>>253：青>>239神への質問は私には普通に神に対して「発言にブレがないか見る行動」に見えたんだけど、これを他の事と合わせて「読み込めない人」と表現したのは何でかなぁ。ですわ！
2日目,老人モーリッツ,村人,パメラからの質問★クララについてじゃが１ｄ>>211ここがどうしても気になったんじゃ。狩人を探っている狼ではないか？とも取れるし、狩人フォローの立ち回りのどちらだろうかとな。あとは自分から灰考察は占希望周りのみじゃった。神父さまの１ｄの行動は村側なら狼側に対する狂人偽りともとれるの。とにかくリアクションからの考察だと考えたんじゃ。
2日目,老人モーリッツ,村人,ヨアヒムには質問があるわい。現時点でわしをどう思っておる？年はクララ占に意義ありを唱えてわしを占する事に抵抗を見せておらんかった。ＳＧとして残す意識は無いのか？って結論で白っぽい。ヨアヒムがわしをどう見るか知りたいわい。
2日目,旅人ニコラス,狩人,ゲルト……という者が死んだのか……。議事録を確認してくる……。
2日目,行商人アルビン,人狼,おす。皆飯は済んでっか？爺さんちゃんと食えよー。クララは白確判定おめでとーな。ゲルト･･･冥福の祈りが遅くなってすまねぇ。安らかに眠ってくれ。■1.☆オットーは初日から微妙に発言、少ないな。ＣＯの時と、周りからの質問に答えてるだけか。意思見えそうな発言っつったら>>198くらいか･･･。本人が言ってるように心が弱いとかじゃなく、すげー慎重なタイプって印象だ。今んとこ、対抗のパメラが積極的に
2日目,行商人アルビン,人狼,発言してんのに対して特に反応もないしなー。あんま喋ってねーから印象論になっちまうけどよ、もし偽占だとしたら、慎重過ぎて変にボロ出さないよう発言抑えてんのかも？って感じだぜ。あとは尼さんも言ってたけどよ、本決前にフラっと消えたのが怖かったよな。能力者の役割忘れてるみたいでよ。真占だとしたらかなりマイペースで可愛･･･いや、うーん、発言少ないんでまだ何とも言えねー。でも、コイツ偽だ！とも特に思えねー。
2日目,行商人アルビン,人狼,つまりよくわかんねｗｗｗ☆パメラ>>とにかく積極的ってな印象。ＣＯも躊躇なかったし、質疑の姿勢も黒狙いだよな。>>141仮決と本決の時間に気遣ってるシーンが何か俺的に好印象だったぜ。仮決に対する俺ら周りの反応をちゃんと見てから本決決めようとするっつーのは、村の総意ちゃんと確認して汲もうってな配慮の感じするからよ。こまめに質問出したりして探り入れてっけど、多弁な奴らの事はあんま黒視してないみてーだ
2日目,パン屋オットー,狂人,帰ったよ～。遅くなってゴメンよ…取りあえず、フリの質問に答えておくよ。あの発言は自分視点じゃなくて、みんなから見たらそういう判断にしやすいんじゃないかなと思ったんだよ～。自分で占った結果が黒なら自信持って推していくから。あと、あの退席は凡ミスです…すいませんです。
2日目,行商人アルビン,人狼,な。今んとこ穴がないような印象強ぇんだけど、偽占だとしたらそこが逆に準備バッチリ完璧な騙りモード！？って気がしないでもない。怖ぇー怖ぇー。あー、占真贋難しい･･･オットーにベラベラ喋って欲しいぜ。
2日目,少年ペーター,人狼,ただいまー。と言ってもまだちょっと腰を据えては読めない状況なので、ちょっとだけよ～ﾁﾗﾘ。あんおさわりはだーめっ☆ エッチなんだからあ☆所で凄ーくどうでもいいことなんだけど昨日の者>>255、「クララとレジーナが最多票～」って老も直前の表によれば普通に最多票だったような(笑)第一希望と第二希望の重み付けを考慮に入れればむしろトップ得票だったり。
2日目,旅人ニコラス,狩人,神父とすれ違うのは……こちらのせいだな。すまない……。【司書の白を確認した】、処刑の回数には限りがある……。処刑ミスが起きにくくなるのは・・・・・良いことだ。>>321、質問の答え……は、決定の時間帯にいられないので、夜にいる者とできるだけ意味のある会話をし、票を無駄にしないようにしていきたい……。といったところか……。
2日目,少年ペーター,人狼,神>>308、>>310オットー狼が薄いと感じているのはどういう流れで？ また同様に、パメラ狂もやや薄めのようだけどそれは今日後出しで割らなかったからでいいのかな？修>>324だってプロからの神父のスタンスを見れば、頑張ってるのに黒黒言いやがってﾁｸｼｮｰ!的なRPだって分かるじゃない、とか普通に思ったんだけどよく考えたらそう明言してる訳でもないしプロからのRPなんざ考察に入れるかって言わ
2日目,少年ペーター,人狼,れたらそれは決して責められるものではないので言い過ぎましたヨアさんごめんなさい。とか今思いました。あと修>>312だけど、潜狂が難しい戦略だろうということ自体は同意だよ～(そういう話じゃねーだったらごめんね)。2-1という状況的に潜狂もあり得るとは考えてはいるけど、高確率であり得るとは言い難いものだろうね。
2日目,行商人アルビン,人狼,■2.☆[神]自分を占えっつー宣言は大胆だったけどよ、その後の発言観ると結構シンプルだよな。クララについて>>235ピントずれてそう、と迄言ったのに、占い対象●モーリッツを変更しなかったのが引っかかるくらい。そんなに老気になったか･･･？その後モーリッツが>>257「質問してOK」サイン出すまでは特に突っ込みがねーあたり、もしかしたら赤ログでモーリッツ＆神父作戦会議☆なんて想像しちゃう、単純な俺。
2日目,パン屋オットー,狂人,神父様の質問に。優位に立つというよりは、不利な位置に立ちたくなかったからです。後からCOしてしまうとどうしても後追いに見られてしまいそうな気がしてました。
2日目,神父ジムゾン,村人,一瞬だけ登場。☆修>>323 了解、と言いつつ、内容は十分咀嚼できていない。また検討する。すまん。☆老>>325 まず「では私が狼側なら？」というツッコミ。そして、思考を見るために追加質問を仕掛けようかと思いきや、老から青へ質問が行ったな。その方が面白い。やり取りを見させてもらう。☆旅>>334　健闘を期待したいが、1dのペースでは成果が上がっているとは言いがたいのではないか？
2日目,神父ジムゾン,村人,☆年>>335 オトは覇気がない。占を騙る→三狼の中でオトが、という二重の選択を経て出てきたとは思いにくい。パメはその通り、灰への早い踏み込みも二義的な非狂要素視。私のプロは気にするな。勝負は1d開始から。商>>337 そうだろう、そうだろう、私を占いたくなっただろう。今からでも遅くないぞ。☆屋>>338 貴方は、現状すでに不利な位置に見える。どうやって払拭したい？それを有限実行するのだ。
2日目,行商人アルビン,人狼,灰考察始めたとこだが、さっきからどうも眠気に勝てねー。また明日か深夜にくるぜ。最悪でも議題の■3.には答えねーとな！
2日目,神父ジムゾン,村人,>>340 があっ！オト宛、「有限実行」→「有言実行」だ！頭の悪い日本語変換め！うおお、これだけでは発言がもったいない。何かないか、何かないか…。クララ＞決定時間を提示してくれ。ではまたさらば。次は明日の朝だ。@10
2日目,青年ヨアヒム,村人,モーリッツ＞「マイペース」じゃ分かりづらいか。今どう思ってるか書いとくよ。論客タイプではない、質問された時の回答に違和感は特に感知されん、独自思考もあって今日自分周りの目を気にして狼臭をかぎわける様子に村人っぽい警戒心はみられる、これは僕に質問する姿勢も含めてだね。僕は今のところじいさんに狼くささを感じてはいない。頼りになるとも思ってないけどね。
2日目,老人モーリッツ,村人,＞ヨアヒム回答どうも。今の時点で一番黒に近いのはだれかもよければおしえてくれんかの？
2日目,老人モーリッツ,村人,明日の本決定にはいられないから、出来る限りわしの意見、考えを落としておきたい。吊られてからでは遅いしのう。神父さまがもし狼なら、「こんな事できるのは狼じゃない」という心理を利用しようとしている位しか思いつかないわい。これを言い出したらそれこそきりが無い＋自占希望した神という濃い印象が付いてうま味はそんなにないと思う。
2日目,老人モーリッツ,村人,アルビンは神父とわしが繋がっているように見えるという割には神は老占を第一希望にしているところは見落としているのう？
