2日目,司書クララ,村人,>>560　正直読みづらくて目が滑るので後回しにしてました。3CO目って念のため騙りに出てきた狼の線みるんですけど（昨日時点ではそう）、ここ真だったら全私が泣きますよレベル、というのは流石に非情すぎるかなと思いつつ、でも言う。これは感覚的なもので申し訳ないんですが、滲み出る雰囲気ががちがちすぎる気が。真の緊張感なのか、偽が信用取らねば！と肩肘張ってる感なのかが掴みきれず。
2日目,神父ジムゾン,狩人,リーザ>リーザらしくて白いズラ。パメラのスカートの中は不思議の町な気がするズラ。
2日目,村娘パメラ,霊能者,どっちでもいいわー！　いっその事お前の毛を全部剥ぎ取って毛包帯にしてやる！！　そして中身はジンギスカンじゃー！！＞羊そしてそこのハゲ疑惑は自称助手を連れて謎解きでもやってな。人のスカートの中をなんだと思ってやがる…
2日目,老人モーリッツ,村人,やばいマジぎりぎりじゃ。遺言考察書：ネタを交えながら、考察をしてる部分は気軽な村っぽいと感じとる。内容は鋭いしの、白よりに見とるぞ。年：思考をきちんと発言してくれ取るし、質問も一番多角的（視野的にも、灰の人に対しても）に飛ばしてるの。ワシは今一番白いとおもっとる。兵：灰考察を見る限り彼独自の感覚があるっぽいの。本人もいっておったが、これからガンガン喋りそうな感じなので占いはちょっともったいな
2日目,司書クララ,村人,他占候補が真狼濃厚予想なので相対的に狂扱い。狂＞狼＞真神：年をかなり気にしているようですが、他灰にあまり目が向いてない感がするのと、>>435が黒塗りに見えてしまう。でもかなり白視取ってる年に黒視向けるのも狼としては妙な感じ。疑り深い性質なのかなあと思いつつ、発言密度も相まって、相対的に灰の中では黒位置に来てしまう。
2日目,老人モーリッツ,村人,青：書や羊がいっとるが、思考は出ているが結論ははっきりとはいっとらんの。じゃがワシは情報を吟味して思考してる最中？と勝手に思った。神：今日も要所要所では発言しとるし、質問も飛ばしとるんじゃが。灰考察などがなく、現状どう思っとるかもわかりづらいの。そういうスタンスなのかもしれんが。羊：結果をまずズバッといっとるの。>>382「商狂爺人のパターンを警戒してしまう」とかいっとるあたり、自分の中ではき
2日目,老人モーリッツ,村人,自分の中ではきちんと思考しとるみたいじゃの。ただやはり、思考が見えないのが怖いの。（ワシの読解力不足だったらすまん）妙：今日は忙しいみたいで、あまり発言がなかったの。なので印象も昨日のままじゃ。屋：何じゃろう。彼に関しては本当にパッションなんじゃが、白いと思っとるワシがいる。>>549ちょっくら逝ってくるぞい！（ワシ渾身のネタ）GS　白　年＞屋＞妙≧書＞青＝兵＞神≧羊　黒
2日目,村娘パメラ,霊能者,シャレにならん！！＞じぃじ、逝ってくる。
2日目,シスターフリーデル,占い師,そういうスカートの話題からは一番縁遠い私。まあスカートと言うよりローブですからね。これ。どうにも女性として扱われてないような雰囲気を感じますが・・・きっと気のせいですよね？なんだか私に近づくととんでもないことに遭うみたいな空気を感じるんですが・・・。とりあえずちょっと喉かわいたのでお水飲んできますね。さてと。＠０
2日目,羊飼いカタリナ,村人,＠・ω）おじじは流石に考察が遅いというか、そんな考察が昨日から出てたら占わなかったのに、とも思った。今更だが。ってかそこでネタ挟んでるのはちょっち白いかも（爆
2日目,村長ヴァルター,人狼,カタリナ君は昨日も今日も灰の一部にしか目が行っていなさそうなのが引っかかる。気になるところだけ掘り下げるタイプなのかもしれないが、上手く仲間の考察を出さないようにしている狼の可能性も考えてしまうな。今日の夜明け直後の▼ご老体希望もセオリーだけが理由のようで、占真贋やご老体単体の白黒を考えている様子があまり見えない。その中での>>509の追従も薄気味悪さを感じた。だが疑われることを恐れないような動
2日目,パン屋オットー,村人,>>568　この村にならず者がいたらねぇ…座布団運び役たのんだけど…。＜山田くーん、パン屋に座布団みせたげてー！！　…あ、意外とサテンっぽい…>>570　不思議の町…かぁ。不思議は発見しないとね。>>572老　パッション！逝ってらっしゃい！
2日目,村長ヴァルター,人狼,きには非狼感も感じるし、まさにそこを白視している者が多いのも見ている。灰全体に対しての考えが見れたら私からのカタリナ君評価も動くと思う。む、そういえば明日の判定発表順はどこかで指示が出ていたか？指示なしなら、生きていたら夜明け直後に速攻で発表するがいいか？今日は判定文まで着手する余裕はない…@4
2日目,老人モーリッツ,村人,処刑まで若干時間と発言があるので、だらだら喋らせてもらうぞ。あ、そうじゃ。余計な混乱を招かぬように言っておくが、ワシの▼先は商にしてある。せめてもの抵抗じゃな。最後にパメラに突っ込んでもらえて、ワシは幸せじゃああああああああ。
2日目,青年ヨアヒム,人狼,危ない危ない…【本決定了解】鳩が墜落してやばかった。後半まともに参加しなくてごめんね。明日は神出鬼没になるけど頑張るよー。
2日目,羊飼いカタリナ,村人,＠・ω）ぎゃーーーやーめーれーー！＞ジンギスカン確かにデ○タは山○君っぽいな。ってかちゃっかり座布団自分のものにしてんなよ、オットー。
2日目,神父ジムゾン,狩人,ふーむ、私白ならヨアヒム黒とオットーが言いますか。明日はこのあたり見るズラ。パメラ>(スカートの中の)真実はいつもひとつ！
2日目,少女リーザ,人狼,落ち込む事もあるけれど、私は元気です。村長さんは、秘書さんに仕事を任せすぎであんまり印象が良くないの。秘書さんが占い師さんだったら真度はもうちょっと上がったと思うの。ロリコンは、私の事を可愛いって言うけれど、それは子ども特有の可愛さって奴だと思うの。私も後5年もすればパメラおねーちゃんみたいな立派なツッコミ娘になるんだけどな。属性ばかり重視してると、将来損をすると思うの。ヨアおにーちゃんは
2日目,少女リーザ,人狼,、リーザの事守るよとか言ってくれるのがカッコいいんだけど、私なんかよりも他にもっと守るべき人がいると思うの。後ねヨアおにーちゃん家の食費が心配。神父さま、リーザはこの世に一人しかいないよ。【パン屋さんのMに目覚めたCO確認したの】
3日目,シスターフリーデル,占い師,狼明酒作り直しました。…味大丈夫かな？ｺﾞｸ…ふふふふ、しもんさぁ～ん？男ならぁ♪樽いっぱいのお酒飲み干せますよねっ♪クス♪じゃ、飲み干してもらおっかなっ♪シモンさぁぁぁぁぁぁぁん！！［リデルはシモンを持ち上げ逆さまにし狼明酒が入った樽にぶちこんだ］～三時間後～う～…頭が、え？あ？シモンさん何で酒樽に逆さまで入ってるんですか、あぁ作り直しだ…だれがこんな事を…でも【シモンさんは人間ですね】
3日目,少女リーザ,人狼,え、あれ。噓。霊護衛だと思ってたのに。
3日目,行商人アルビン,狂人,さて、皆様お楽しみ。わざわざ峠を越えてやってきたこの村で、人狼探しなんて素敵な余興と出会えるなんてなんて光栄。せっかくなので皆様で楽しみましょう？隠し立てはご法度、願わくは、悪夢よりは祈りを。なんていってもあたしは行商人。売るものは真実だってなんだって。・・・。って、あれ？シモンさん意外とガード堅いですね。僕っこはお嫌いですか？それともロリｋ・・・【シモンさんは人間】
3日目,村長ヴァルター,人狼,すまん、パメラ君襲撃に凍り付いて判定を発言する手が止まった。【シモン君は人間だ】随分度胸のある襲撃をしてくる狼だな…
3日目,パン屋オットー,村人,まさかのー、確霊抜きかっ…。突っ込み不在のこの村、かなり混沌としてきたね。おじいちゃんの白黒も不明、占い真偽も不明…。ちょっと頭落ち着いてないんだけど…、今日はどうする？占いローラーな方向ってのはありなの？
3日目,司書クララ,村人,【兵確白確認】ちょ、斑吊りの日に確霊が抜かれた、だと…？！
3日目,パン屋オットー,村人,とりあえず【シモン確定白確認】。占いロラっていったけど、よくよく考えたらロラったら吊り手の余裕０の可能性ありか…。
3日目,少年ペーター,村人,うわぁ；パメラおねーちゃん！スカートめくってズボンずりおろす奥義会得したら一番に試そうと思ってたのに！！【シモンにーちゃん白確認】まとめってシモンにーちゃんにこれから頼んでいいんじゃないかと思ったんだけどどう？
3日目,行商人アルビン,狂人,あれ、これ僕まだ真獲得頑張るターンですか？あれぇ？？？ま、まぁラッキーです。何考えてんだ人狼。とりあえずは【残り１狼】【真占生きてます】。僕生きてる限りは詰みますので、ご安心ください。
3日目,負傷兵シモン,村人,昨日はみんな好き勝手ネタ発言しやがって・・・俺ももっと参加したかったじゃねーーか！！泣ってパメラ抜かれてるし・・・これは胃が痛くなる展開だな。。んで【俺の白確定確認】安心したけど。。まとめ嫌だーーーパメラーーー助けてーーー(シモンの人格は崩壊した)オホンッ、狩人の話はあまりしない方がいいぞと言っておくぜ。なぁに、そんなに責めることはない。で、議題出した方がいいだろうか？
3日目,青年ヨアヒム,人狼,まじか【諸々確認】というかじいちゃんの判定見たくてじいちゃん吊りにしたのに。そこ霊護衛鉄板だと思ってた。
3日目,少女リーザ,人狼,【ロリコンの白確定確認です】あと、誰か私を殴って欲しいよ。とにかく、パメラおねーちゃんおつかれさまでした…。ロリコン、お願いします…。現時点ではロリコンしかいないもん。
3日目,神父ジムゾン,狩人,ち、違うズラ！パメラのスカートの中は不思議の村だったズラ！にしても霊判定なしで酷いズラ。シモン白確認ズラ。
3日目,行商人アルビン,狂人,11>9>7>5>3>EPロラっても１手失敗できます。皆さん視点ですともう失敗できませんが。うーんこれどうしましょう・・・。すんごく嫌ですが安全ならロラ開始？途中で占襲撃来たらラッキーですね。とりま、頭落ち着けてきます。シモンさん疑ってごめんなさい、まとめお願いします。
3日目,シスターフリーデル,占い師,すいません、判定出した後ちょっと席を外していました。う～ん；霊能抜きですか。正直困りましたね；とにかく、老の判定が不明の以上、現状村としては「老白」前提で話を進めていくことが一番だと私は思います。それと大変でしょうがシモンさん纏めよろしくお願いいたします。
3日目,司書クララ,村人,疑ってたシモンさんが白でかなりほっとしているというか、昨日の兵の灰考察見てかなり納得するとこが多くて占い希望に挙げたことを後悔していたことを告白。シモンさん確白なのでまとめお願いしたいです。>>597 議題はなくても皆さん喋れると思いますが。聞きたいことを聞いてください。何かどっと疲れたのですいません、寝てきます……
3日目,負傷兵シモン,村人,議題一応出しておくな。答えるかどうかは個人にまかせる、議論の参考程度に思ってくれ。■１、占い師考察/■２、灰考察/■３、占い希望■４、吊り希望(灰と占い師両方からがいいだろうか？)□５、パメラへの思い/□６、シモンへの思い(女性限定)【仮決定22:30/本決定23:30の予定だぜ】希望は早めにしてくれるとうれしいぜ。老の白黒が大問題だが・・・これについては今日議論すべきではなさそうだな。
3日目,羊飼いカタリナ,村人,＠・ω）いや襲撃あってからつり手計算する僕も僕だけど３−１って占い護衛する余裕すらないのね。うんごめん。ハッキリ言うけど狩人出て来い…っと今出てくる意味は、灰狭め以外には皆無か。クララの「どっと疲れた」は非素村要素だと思うです。狩人か狼なら今回の襲撃は勝負どころで疲れるのも分かる。一方素村は何にも出来ることが無い訳で、結果だけみてポカーン、だと思うんだよね。ま、ゆっくり考えよう。お休み。
3日目,村長ヴァルター,人狼,考えるほど確霊襲撃は痛すぎる…占真贋が判明する機会も失われてしまったな。対抗がシモン君の判定を割って来なかったことだけは不幸中の幸いだな。今日は彼を中心に方針を決めるのがベストだろう。早速議題も出してくれたようだしよろしく頼む。本当に誰だ、こんな襲撃してくる狼は…もうしばらく議事録読み返して考えてるよ。
3日目,少年ペーター,村人,羊>>605この発言すごい気になったんだけど…村ならありえないよ、その発言。僕絶対そんな事言わないよ。ただのうっかり？？長>>606の最後の一行もなんか付け足したみたいに見えて気になる。僕が村長疑ってるからかもしれないけど。まあ僕も今日は寝るよ。
3日目,青年ヨアヒム,人狼,うーこれはじいちゃんの判定見て本気出すとか思った罰なのか…占い師内訳がわかんないのは痛い。これは占いロラも頭にいれなきゃ駄目なのかな。でもどうせなら今日は灰吊り灰占いでも良いような。明日占い師候補が残ってる保証はないけどね。でもシモンが確定白なのはでかいかな。それだけはよかった。とりあえずまた明日にするねー。
3日目,羊飼いカタリナ,村人,＠・ω）ペタ＞うっかりに見える？狩人出て来いは滅茶苦茶本気だったけど。今なら１COなら確定するってオプションつき。これから２GJって絶望的だろうしヘタに潜伏される→灰襲撃→１COなのに信用出来ない！なんて恐れもある。そんなら素直に灰狭めで十分じゃん。しかしこのメンバーだったら灰襲撃あったほうが美味しいだろうなと思って止めた。全員が全員「白い！」という灰がいない。
3日目,羊飼いカタリナ,村人,灰襲撃くらって勿体無いとか思える灰が居ないなら、狼さまに灰狭めてもらうのもアリかな。ところで、僕に「うっかり？」とか聞いてどーすんの？「僕ならそんなこと言わない」って言われても困るんだが。考察とか発言のスタイル全然違うのは自明だろうし一緒にされてもと。今度こそ寝る。
3日目,少女リーザ,人狼,今日も帰りが遅くなるかもだから今のうちにと思って書いたら何この長文…。でも昨日みたいな中途半端は駄目だから一気に。商の真贋が分かったら考察しやすいと思ってたのもあって、灰考察を今日に持ち越したんだけど当てが外れたかも…。皆の発言読んで、改めて状況を考えたらかなり村ピンチだって分かって焦ってきたの。占いロラより、真決め打ちした方が吊り手増えていいんじゃないのー？って思うんだけど、やっぱり占いロラが
3日目,少女リーザ,人狼,安全策なのかな。■１　昨日の黒出しは狂アピール説に納得したから商：狂＞狼＞＞真。修が一番真っぽく見える。娘への助言とか色々、村の事考えてくれてるなーって。白アピと取れなくもないけど、今日の長の発言に違和感が。なんだろー、わざとらしさ？GJ覚悟の確霊襲撃って割と見かけるから普通にあると思ってたの。長の真度が下がって修の真度があがった。つまり、商修長：狂真狼かな、って思うの。でも、老の白黒から考え
3日目,少女リーザ,人狼,ると、老狼なら商真？とか。その場合の修長の内訳はちょっと分からない。ただ、老2d>>533で商の黒要素見つけられなかったって言ってるのが…狼なら、こじつけでも何でも黒要素上げようとするんじゃないかなって。村人でも、自分視点で偽確定してる商の黒要素は無理矢理にでも上げるはずと思うんだけど、それをしないというのは老は凄く正直な人なのかなって感じた。その裏をかいて…いや、さすがにないよね…やっぱり老人か
3日目,少女リーザ,人狼,なって結論。修決め打ちしたいけど、賢い狼や狂の可能性も捨てきれないし、長はそういう真かなとも考えられるし早いかな。うー。■２　司：確霊抜かれてガクッと来ちゃったって感じが、すごく村っぽいと思う。これまでの発言を見ていても、黒っぽいと感じる所はなかった。読みづらくて目が滑るとか、感覚的、とか正直に物を言ってる印象が強いの。白寄り。年：積極的に質問を重ねてるところとか、狼探してる…って感じがしてた
3日目,少女リーザ,人狼,んだけど、SG探しにもとれるってふと思ったら分かんなくなって来た。前に私「根拠はないけど白印象」って書いたけど、今は「白印象なんだけど狼もありえるかも」って感じ。白寄り灰。青：考察内容とかなるほどと思う。そこは年も同じなんだけど、青はどことなく不思議な雰囲気がする。深く突っ込んでないって誰かが言ってた気がするけど、言われてみればそうかもって思い始めた。黒根拠はないんだけど、白要素も特になくて黒寄
3日目,少女リーザ,人狼,り灰。神：なんか難しい。抜き出して見ると発言が他の人に比べて少ない…。初日からそこそこ占い希望されていたし、村人ならもうちょっと考察出して欲しいって思うんだけど、狼だとしたら焦って喋るんじゃあと思うと白くなっちゃう。余裕を感じる、というのは初日から変わらないの。不思議な人。灰。羊：難しい人その2。「こんな狼いない…ううん、それを狙って…」と、どちらとも取れる…。今日はなんだか攻撃的でちょっと怖
3日目,少女リーザ,人狼,かった…。「狩人何してるの」って感情かなあとも思ったんだけど、狩人が誰か探ろうとしてる狼もありえるなあって思った。どちらにしても村のための行動って感じはしない。黒寄り灰。屋：この人が狼だったら怖い系。黒要素は特に見当たらないし、考察内容はなるほどと思うし、白寄りに見てるけど…うん、結局白寄りで。一応GSも。白　司屋年神青羊　黒■３　●神○羊　難しくて判断しにくい所から。■４　占なら▼商　灰
3日目,少女リーザ,人狼,なら▼羊　商は偽だと思うから。修長は、修真寄りだけどそこまで自信ないからまず商かなって。羊は、灰考察してたら一番黒寄りになったから。□５　パメラおねーちゃんに、おじーちゃん吊りは無駄じゃないって言ってパンダ吊り支持したのをちょっと後悔してる…かと言って他にどうしたら良かったかっていうと、ないの。□６　人狼じゃなくて良かった。懐柔は考え過ぎでした、ごめんなさい。
3日目,負傷兵シモン,村人,リーザは律儀に□６に答えてくれてありがとうな。俺は猛烈に喜んでいるぞ！□６には何度答えてもOKだからな～占い、吊り先に関してひとつ言っておくと、単純多数決にはしないでおこうと思っているぜ。もちろん独断もしないつもりだ、全員の希望に沿うことはもちろんできないだろうが、できる限り納得のいく理由を添えてくれればうれしいぜ。その理由によって判断しようと今は考えている。だけど自信がない・・・＠17
3日目,パン屋オットー,村人,おはよ、寝坊してちょっとピンチなぼくです。とりあえず、狩とか非狩が透けそうな発言はやめようぜぃ。｢どこ護衛鉄板でしょ｣とか、｢狩出てきて｣とか。吊りたい灰がいれば、狼から真占いたべてこなけりゃロラしない方向もありかなと思ってきた。ただでさえ情報少ないし…。ただ、決め打ちしたいけど実際怖いんだよねぇ…。
3日目,行商人アルビン,狂人,ぽっぽ。>>620えーそれ修真決め打ちで村負けコースが見えるんですけどー……。後で余裕あったら書きますけど僕、修狼決めうち気味なんですよ。軽く襲撃に触れると。まぁ判定隠しでしょうかねー。霊護衛確率高い中の特攻はよほど追い詰められていると考えると怪しいのは神ですけどそれだと昨日オトさんに指摘された部分を崩さなきゃならないですね。ついでよほど騙りが護衛勝ち取ってないと出来ません。長狼なら捨て身過ぎ
3日目,少年ペーター,村人,■1.尼真/商狂/長狼…これが僕の中ではいちばんしっくりくるかなー。商は>>596などが真アピに見えちゃう。そして昨日のおじーちゃんがどうしても黒く見えないからその分商の黒判定が信用できなくなった。尼は最初から落ち着いてたし今は疑うところあまりない。気になったのは昨日と一昨日の希望が商とかぶってたってところくらい。そうなると長がやっぱり狼なのかな？って。でももし尼狼ならここが狂になるかな。
3日目,行商人アルビン,狂人,とりあえず、朝の反応で違和感を覚えたお二方を。★>>603クラさん「どっと疲れた」心境を詳しくお聞かせください。霊抜きに疲れたのか、シモンさんへの疑惑が晴れてすっきりしたのか、どちらが先に立ったのでしょうか。どうもこれすっきりしなくて。>>605リナさん　村なら迂闊すぎる発言ですね。狩考察してどうするのかと。>>610も妙に攻撃的ですね。たぶんちょっとペタ君の意図とすれちがってます。
3日目,少年ペーター,村人,どっちにしろ長真の感じはほとんど感じられない。なんでだかよくわからないけど…この辺はまた夜ログ見てみるね。灰）▼羊▽保留　占）▼長▽は保留（商真尼狼の可能性と商狼の可能性が低い事から迷う）商＞正解。そして羊さんが気づいてないのが最黒要素。
3日目,行商人アルビン,狂人,とりあえず、提言ALL＞★今日真占抜かなかったのはなんでだと思います？僕真でも護衛はついていない。仮に僕偽でも霊特攻は博打すぎる。ついで僕狂の場合でも、狼からして僕を残しておく意味は皆無です。真取れてるわけでもないですし。（ちょっと凹んでますよ状況だけで狂なの。）ロラするしないもこの辺の考察が分かれ目かと。
