3日目,村長ヴァルター,狂人,しかし若干眠いので、結果だけ見たのと今までの思考の雑感を残して寝たい。占い師陣はニコラスと仲間だったらもう少しフォローできそうな気がする。トーマスは昨日手数関連に関して感情含めて話してたところから狼としては突っ込んでいくタイプではなく奥手そう。ニコラスと仲間っぽそうなのは現状トーマスかなと思っている。まだ雑感レベルなので考察時には占い師とのラインも精査する予定だ。おやすみ、諸君@17
3日目,青年ヨアヒム,村人,あと、【占結果確認】【霊結果確認】ごめん、色々考えてみたけど、今日はもう寝ます…　おやすみなさい…
3日目,羊飼いカタリナ,狩人,そういえば気になったんだけど、年で黒が出ると思っていた人、って私もそうなんだけど。(途中から少し白くも見えてきたけど)なんで吊り希望までは出さなかったの？驚くほど強く思っていたなら吊り希望出すべきじゃないかなと思うんだけど？私が変なのかな？霊ロラ優先の者はまだ分かるけど、灰▼優先の人たちはちょっと気になるんだけど？んじゃお休み。＠17
3日目,司書クララ,人狼,寝る前にミス発見…【長旅黒確認ですわ】喉がもったいないですわ…とりあえず、眠い頭でペタ君襲撃はGJ避けだと思いますわ。精査はまた明日。今度こそお休みなさい。
3日目,少女リーザ,村人,リーも今日はねます。明日は昼は来られません、鳩さんで可能な限り議事録チェックして夜はやく発言できるようにがんばりますー。おやすみなさい。気分転換にはあまいものがいいんだってー。おやつ置いておきます。［チェリーマフィン］［マロングラッセ］［ミルク］
3日目,老人モーリッツ,人狼,じーちゃんお風呂わかし中。ニコ狼なら展開ラクになれるんじゃが、ビミョーに樵真寄りなのと、ニコから自然体な素白っぽさ感じてたんでちと懐疑的。旅白だったらおそらく灰に2狼生存、キツいの。ここはもちっと旅樵長の発言精査してから考えたい。あとロリーザよ、ワシだって喉60個くらいあったらずっと変態RPしたいよヽ( `Д')ノウワワン！！今日はがっつり考察したいんで喉温存気味、女湯いってくるわい＠１７
3日目,木こりトーマス,霊能者,正直ニコの白要素挙げは厳しい！でも一応挙げる！ニコは初日の●も○も白狙いとか、初日>>383クラのプロRPや昨日の俺や爺さんのRPまで考察材料にするのは、正直狼にしてはぶっ飛んでる！と思うんだが……>>591の３日目から全ロラ発言もなぁ……狼がそんな手順を表で言うのか？「マイペース過ぎる爺さんが真にしか見えない」とか悪目立ち過ぎる……結局どれも「怪し過ぎて狼っぽくない」要素なんだよな……
3日目,木こりトーマス,霊能者,あと>>610でパメラも言ってたが>>608のニコの数少ない灰考察。その中のディタ考察だが、要約すると「ディタは昨日、ニコは▼候補と言っていたのに今日になって▼村長にするのはおかしい」村視点でも村長とニコは切れてるから村長をかばう発言ではない。狼なら自分を吊り希望しないことで相手を疑うとは思えん。とりあえず現状見つかる限りのニコの白要素を挙げたつもりだ。残りは宿題にさせてくれ！
3日目,木こりトーマス,霊能者,■2.うーん、村長は占い師から相対的に狂寄りに見てたが、今日の襲撃と判定は狼要素か。ペタ襲撃はGJ避けだと思うが、狂占い師に判定割らせたくなかった可能性もある。村長が狂人なら、ニコ黒は誤爆が怖くて結構出しにくいところだと思うんだが……俺もニコ疑ってたしな。狂人の線もまだ捨てていない。占い師をもう一回精査したい。■3.昨日言った通り▼村長を希望する。霊ロラ希望でなく決め打ち希望だ！
3日目,神父ジムゾン,村人,そろそろ私も寝ようとおもいます。それと、明日は【仮決定22:00、本決定22:45】としたいと思います。前回だと●▼対象から情報を得るためには時間が短すぎたのではないかと感じたからです。あと、能力者はどちらかというと灰考察についてをメインに行っていただけると嬉しいです。では、おやすみなさい。
3日目,神父ジムゾン,村人,それと、まとめ役がしゃしゃりでるのはイクナイと教本に書いてあったのですが、気になることがあったので一つ。長>>726　「ニコラスと仲間っぽそうなのは現状トーマス」とありますが、１日目、２日目と、樵さんは占いや吊の希望先に幾度か旅人さんを挙げております。また、樵さんの旅人さんへ対する疑惑は初日から何度も挙げられております。正直、トーマスさんとニコラスさんが仲間という印象は私、全くもてないのですが。
3日目,羊飼いカタリナ,狩人,おはよう。今日はすいませんが早くても20、遅くて21時過ぎるかもしれません。申し訳ないです。霊の二人は今日になっていきなり対抗が狼予想ですかー。
3日目,村長ヴァルター,狂人,ふむ、おはよう諸君。神父>>736＞昨日の雑感は娘老樵のうちだれが狼なら「人物的に」当てはまりそうか、という人物考察由来のものであるな。よってその辺まだ考慮してない。あと、ライン切りに見せる行動の有用性はその人物を見てから行う気でいる。そして、今回は有用だと思うぞ。あと、白確も「権利乱用」みたいにならなけれ純粋に考える人手だとおもうが、まとめ時の思考とは切り離すのをお勧めする。
3日目,村長ヴァルター,狂人,おはよう、カタリナ。それと襲撃に関してであるが、この襲撃は「気弱な狼」の象徴であるように私は見えるな。まとめとしての発言が既にあり決定に関する質問をされている状態の神父のほうが、他に確定白が出来るより操作の目があるとみられた可能性がある。昨日トーマスも>>694「神父様の考えが入っていたようで安心」とあるので、ＧＪ避けとこのような観点が原因にありそうだ。
3日目,村長ヴァルター,狂人,ライン見能力者編　全体に言えることと個別とニコラスニコラス単体と全体に言える事：恐らくニコラスが寡黙であり発言力が弱めなのは狼にとってあまり序盤からの意識ではなかったのではないかと思う。彼は能力者ＣＯが大体終わるころに現れたので、少なくともごく初期の私のロケット時にはいなかった可能性が高い。本人も灰考察苦手という発言もあったし、捨て駒として語るなら自分という意識があったのかもしれない。しかし
3日目,村長ヴァルター,狂人,全く違う展開になった故>>305「村長さんにはもうチョットみんなの意見でてからCOして欲しかった」また同発言内の「ロケットするって赤い声を残せばいいだけ」は実際にそういう状態だったからあっさり予測して喋れたのだろうと見る。他の部分に比べるとやけにハッキリしているからな。さて、このように「旅は喋るのが苦手と判っていたが出られず」「狼はフォローが必要なのが分かってた状態」と仮定してみていく
3日目,村長ヴァルター,狂人,あと、ニコラスは「古めのセオリーがインプットされている状態」だったように思う。昨日本人に質問したような手数の間違いまで含め、狼がどう動くかを一昔前のレベルで知っていて、応用がまだ効かない人物だったと見る。旅娘：潜伏に自信がないと言っているが、狼なら逆に最初から能力者として出れば信頼を稼げると踏んでいた事になりそうだ。序盤からニコラスを庇っているが、ヨアヒム考察にくっつけての白視であるな。
3日目,村長ヴァルター,狂人,ニコラス本人は戦術的定石は知ってそうなのでパメラを常に偽寄りに置いてるのは特にラインでも違和感なし。逆にパメラがニコラスをかばってるのが気になるが、昨日の神父へ質問だけはニコラス庇いより神父の特性を探るのが目的の可能性が高い。襲撃もパメラのペーター考察を見ると白確定や斑にするよりは喰いそうだと思うので、全体として否定要素は少く、でも若干の引っかかりがあると言った程度。
3日目,村長ヴァルター,狂人,旅老：モーリッツがこの状態での定石もある程度知っていそうなのであまりニコラスと繋がっている感じはしない。ニコラスはちょくちょくスルーする事があるけど、モーリッツの場合>>329と>>606をがっつりスルーされてるのが気になる。発言としてはやりやすそうな所だけに、そこを無視して他の質問に答えてるのは素直に非ライン要素。というかこのラインで考えると否定要素しか見つからなかった。スルー対象？
3日目,村長ヴァルター,狂人,一番しっくりくるのはやはりトーマスになるかな否定要素はニコラスの>>589。トーマス狼であれば、対抗の私はもっと私に余裕を持って斬りかかれたのに突っつく程度になっている。議事読み込みでついた優先度は　旅樵≧旅娘＞旅老　となる。旅樵ラインと旅娘ラインの比重はどこに重みづけするかで変わりそうだ。
3日目,村長ヴァルター,狂人,灰考察はお昼以降、旅老ラインはかなり薄めと判断したので旅娘ラインと旅樵ラインでの整合性なんかで見ていくつもりである。ただ、発言数が微妙なためあっさりになるかもしれない事をご了承願いたい。ふむ、下男が珍しい羊をふるまってくれたので、朝食のおかずにおすそわけしておこう。では行ってくるよ諸君@8つ【羊肉のカルパッチョ】【羊肉の塩漬け】
3日目,老人モーリッツ,人狼,じーちゃん寝坊。気になったとこ突付いてラヂオ体操に出発。★青>>646：ヨアは昨日の本決定が▼青になった場合、自分の霊判定が割れる可能性どれくらい予想してたんじゃ？★羊>>717：「旅狼はそれなりにある」というのはどうしてじゃ？羊は旅の発言から黒っぽさ取ってたん？それとも「霊考察から長真寄り→旅黒寄り」という思考？☆長>>743：ニコは老>>329の返答を旅>>336でしてくれてるぞい。
3日目,村長ヴァルター,狂人,チラ見えしたらこたえるのも村長の務めである>>747　ふむ、私が言っていたのは>>329下段のつもりだったが、そっちも今見返すと>>382で返答していたな。素直に読み込みミスである。申し訳ない。という事で帰ってからもう少し読み込み強化する。確定情報が先だってあまりしっかり見れていなかったようだな。今日の残りは灰重視するがまた明日能力者ライン追加読み込みし直そう
3日目,青年ヨアヒム,村人,おはようございます…　昨日の夜明け前はごめんなさい…先に質問見えたから答えますね。☆老>>747昨日の時点では霊は真狂だと思っていたからきっと狂アピで割ってくるって思ってた。どっちが割るかは正直わからなかったけど…。結構みんなから疑われていたみたいだし、狂人からしたらいい狂アピになるんじゃないかなって。なんか文がめちゃくちゃ読みにくくてごめんなさい。
3日目,青年ヨアヒム,村人,あと、自分なりに今日の襲撃とかについて考えてみたんだけど、狼って普通占い師を食べに行くと思うんだ。でも食べなかった。それから昨日の時点では能力者の真偽ってみんなバラバラだった。もし占内訳が真狼だったら迷わず食べに行ける状況だったと思うんだ。でも、食べに行かなかったって事は狼にも占い師の内訳が付いていない。白確の神父様は狩人が守っているかもしれないから食べにくい。だから、能力者の内訳って本当は占
3日目,青年ヨアヒム,村人,だから能力者の内訳って本当は占真狂、霊真狼なんじゃないのかなって思ったよ。霊能者を食べなかったのは霊ロラになった時の手数稼ぎとして残したとして考えれば襲われなかったのも納得できるし。もしそうなら霊ロラしたら確実に狼は一匹吊れる事になるよね。うん、思っただけ。今日は２１時くらいには来れると思う。それまでにもう少し頭冷えているといいんだけど…＠１４
3日目,仕立て屋エルナ,村人,おはよ。寝落ちってたー。とりあえず二日目加味した灰考察からちょっとづつ頑張る。の前に、★村 >>713年占い希望してたのに「妥当すぎる」なの？>>714も見てるけど。>>726って旅樵ライン考察はここで終わり？神>>736吊占希望は考慮しないの？後にあるライン考察に旅樵がないから旅樵狼を印象付けたいように見えちゃう。
3日目,村長ヴァルター,狂人,エルナ>>752☆私的で間抜けに気付いた、ありがとう且つ、読んでくれていた人には本当にすまない、>>744と>>745の間に以下の文章が入る旅樵：ニコラスが喋るの苦手と（赤で）明言していたならこの切り方はむしろ妥当に見える範囲であるな。初日占は切りたい時の定石であるし、その翌日の吊り希望も寡黙扱いされてた人を無理にかばうのは信用に響くため難しいだろう。
3日目,村長ヴァルター,狂人,トーマスの発言でよく引用する>>518だが基本的に「決め打ってくれ」で構成されててきちんとした手順を話し信用を得る方式ではない。ニコラスの応用の利かなさをフォロー出来ない状態で一番しっくりくるのはやはりトーマスになるかな否定要素はニコラスの>>589。トーマス狼であれば、対抗の私はもっと私に余裕を持って斬りかかれたのに突っつく程度になっている。と、言う風に合間に入るはずだった。すまぬ@5
3日目,仕立て屋エルナ,村人,一日遅れの灰考察ー。□者：一度書いたけど能力者への質問や考察、>>544とか同じ事聞いてるし…気になるのはロラ希望が強くて灰吊りに敏感なほど占保護を重視してるとこ。>>631とか見るとあんまり推理に自信ないのかな？って気も。エルナはあるのかよって聞かれたら…まあ…ない…。占真狼の目が強い場合、例えば狂視が強い娘が抜かれた場合老吊りで、老が抜かれた場合一旦放置して霊が残ってたら霊吊りとか思って
3日目,仕立て屋エルナ,村人,たので、その考え方の違いが間違ってたら正してほしいかなー。と思う程には白視してるー。□青：自吊り発言が目立ちすぎだねー。人を疑わない(疑えない)のは狼要素でもあるけどやりすぎ感。まあ、白要素かなー。だから、いくら疑えなくても確実に灰狼はいるし、取っ掛かりを見つけて探してほしい。服黒いとかならいくら言っても私は傷つかないし気を悪くしないぞーただ今日の初発言は反応早すぎる気がしたね。うーん…。
3日目,仕立て屋エルナ,村人,□妙：結構喋ってるし考察も出来てると思うんだけどなんか判断しにくいなーと思ったら昨日の灰考察が白主体だからどこ疑ってるのか分かりにくいからかーと思った。あとはよく引き合いに出されてるから服さん微妙な心境。まいっか。占霊真贋は年老狼主体で老偽視かな？年白からの今日の発言に期待。□司：大体昨日言った感じー、ただ案外考えが似てて色見えづらいのかなって思った。ちょっと能力者考察が浅いから今日に期待
3日目,仕立て屋エルナ,村人,□羊：何だか徐々に黒く見えてきてる。意見が違うからだろうけど。内訳予測付かないのにロラ推す長が真って考えがあんまり納得いかない。>>602とか見ると灰考察・質問殆どなしで疑うポイント見つけたらそこからロックオンする感じなのかな。その辺もちょっと分からない。情報広げようとしない感じが黒く映ってるのかなー。★樵のロラ周りの発言で真なら自然に出ないってなんで？ 旅狼理由は…老が聞いてるからいいや。
3日目,仕立て屋エルナ,村人,まあ現状■羊<妙司<青<<者□こんな感じ。司妙は白視してるところ追従感が気になる。この辺占いならいいよ。ただちょっとづつ司は盛り返してきてる感。というわけで●羊○司or妙。灰考察より。▼村 後述するけど霊狼真の目も考えて、霊ロラも考慮。まーそこはちゃんと能力者考察した際に。じゃまた後でー。
3日目,仕立て屋エルナ,村人,☆村 あーありがとってえ、それ素抜け？そんなとこ抜けるのはまずいでしょー。内容はまあ、そうだねえ。後でまとめよう。>>741 「実際にそういう状態だった」って、いやそれだと旅狼で赤で村のロケットCO見たみたいな言い方ですやん…まあ質問しといてなんだけどその喉ペースはやばい。他の返答いいから真なら灰狼精査に全力お願いー。吊り希望に上げてるけど真の目捨ててるわけじゃないからー。
3日目,仕立て屋エルナ,村人,あと詐欺。正直スルーする気だったけど羊の疑問にだけ答えるー。羊がすっきりするか分からないけど私はすっきりする。>>602 者は吊占当たらないでしょ。白視してる分狼だったらやだ。年は個人的印象。論調強いしそういう人苦手だし。あと年は個人しか見てなかったー。まあ印象論。>>728 吊るほど黒くも思ってなかったし、年に関しては占で黒出た方が良くない？占考察的に。黒「判定」が出そうだなーと思ってた
3日目,司書クララ,人狼,みなさん、おはようございます。よく寝る女、クララですわ。今日は布団の魔力に負けて二度寝ですわ。議事読み直して考察落としていきますわ。ダイブ、ですわ！
3日目,村娘パメラ,占い師,こんにちは。昨日言いそびれた。ニコさん、ペタ君お疲れ様。神>>735　時間了解。あとね、ジムさんのこと天然狂人だなんて思っていないよ。ただ昨日のは、村の総意には村の一員であるジムさんの意見も入れてほしいって思ったのと、ジムさんからはどう見えているのか知りたかっただけなんだ。ジムさんは人が確定しているからね、そのジムさんの意見ならすんなり受け入れられることもあると思ったんだよ。まとめ役押し付け
3日目,村娘パメラ,占い師,うな形なのにごめんね。言ってなかったけど、まとめ役引き受けてくれて嬉しかったよ。ありがとう。☆服>>702　昨日の>>707は「時間ねえええ！」ってなってかなり端的になっちゃってごめん。もう、不慣れだからとかじゃなかったんだよね。言い方悪いかもしれないけど、潜伏狼っていうのは騙り狼を土台にして逃げ切る者だって思ってる。けどニコさんは>>569で自分への吊希望より村長、と言うか霊への吊希望に反
3日目,村娘パメラ,占い師,対してる。特に霊なんて真贋関係なしにロラで吊られること多いのに、それでも自分へのフォローより村への情報を優先しようとしているのが見えるよね。こういうところが狼っぽくない、人っぽいって思ったんだよ。で、今でもやっぱりニコさん人にしか見えないんだよね。まあ、これでニコさん狼なら私こそがこの村の天然狂人で決まりなんだけどね！次は、夕方以降にくるよ。
3日目,木こりトーマス,霊能者,■1.現状の灰考察だな！昨日の最後と近いものになる！今日の発言が増えたら考察し直すつもりだ。疑ってる順番に厚くなるのを許してくれ。リナ：初日は戦術論とか強く主張し白かった。だが昨日、▼ペタ発言したあと、ペタの白要素拾って、今日も>>728「途中から少し白くも見えてきたけど」結局他に吊りたい人がいないとして吊り希望してる。前後するが>>724「年は普通に吊れると思うし、ていうか私は（続く）
3日目,木こりトーマス,霊能者,嬉々として吊ったと思うんだよね」ちょっと白見えてきた人間を斑でも「嬉々として」吊るのか？このあたりが、本当は年の白を知っているがSGにせざるを得ないからこそのブレだと感じた。>>728で●ペタの人が▼ペタじゃなかったことに突っ込んでいるが、俺にはみんながペタをそこまで黒視していたようには見えん。少なくとも初日に比べて迷いはあったと思う。逆に吊れなかったせいで襲撃せざるを得なかった（続く）
3日目,木こりトーマス,霊能者,という狼の心情が出てるのではないか。ペタにもし確白が出たらリナ狼なら厳しいはずだ。もし占い師が真狼なら好きに斑にできるわけだから、リナが狼なら占狂要素になるか。仮にペタが斑になっても、あの論調の強さは狼にとって怖いと思うから確定とは言えん。リナは時に狼側の目線でも考察している。「狂人はむしろロラ推さない」とか「ペタは吊れるところ」とか。スキル矛盾はないが多少視点漏れを疑う。強い要素ではない。
3日目,木こりトーマス,霊能者,ヨア：リナとは全く違った意味で疑っている。まず人を疑うことを是としない、挙げ句に自吊り発言。疑えない村人は確かにいるが、日を追うにつれて疑心暗鬼になって白い人も狼なんじゃないかと思考が変化していくと思う。クララなんかはそういう印象を受ける。同じ人が狼だったら、村人を疑えないのは白を知っているからだ。つまりいつまでたっても人を疑うことができない。これがヨア全体からの印象。個別の点では（続く）
3日目,木こりトーマス,霊能者,初日の俺の発言について>>302『「対抗が」じゃなく「ロケットＣＯが」って言い切ってるところ』俺は「ロケットCO」という単語は使っていないと指摘して勘違いだったと言ってもらえた。ただ違和感は残る。同じく俺の考察を>>302から>>317で真＞狼＞＞＞狂から真＞狂＞＞＞狼に訂正してる。「最初からロケットＣＯが出たら霊騙りをしようとしていた狼」から「ロケットＣＯが出たら対抗しよう（続く）
3日目,木こりトーマス,霊能者,と思っていた狂人」へ。俺が指摘しての訂正なんだが、訂正前もちゃんと考えて発言している様子だったのに、訂正理由は「勘違い」だけなのが拍子抜けだった。押せば引っ込む感じはヨアらしいと言えばヨアらしいが、そこから先は内わけに関係なく占狼霊狂でずっと固まっている様子。ヨアの灰を疑えない姿勢や他人とのやりとりを見てると、このあたりに矛盾を感じるんだ。二人に喉使い過ぎたのを謝る！残りも簡潔に出す！
3日目,司書クララ,人狼,まずは、灰考察からですわね。妙：昨日からあまり変わりありませんわね。そして、やはり可愛いは正義ですわ。ただ、投票とか考察に追従感が見え隠れしているのが若干気になり始めましたわ…スキル高めに見ていた補正もあいまって違和感を感じ始めましたわね。黒より灰でしょうか。吊よりは占ですわね。青：昨日の自吊り発言は思考の外に置いときますわ。ここも変わりはそんなにないですわね。自吊りを思考外においたにしても考
