プロローグ,楽天家ゲルト,村人,人狼なんているわけないじゃん。みんな大げさだなあ
プロローグ,パン屋オットー,村人,ちーす1番乗りなんかしばらく始まらなそうだけどとりあえず赤の扉を選ぶぜ!
プロローグ,パン屋オットー,村人,夜明けに始まる確率は3%
プロローグ,ならず者ディーター,人狼,じゃあその3%にBETだ
プロローグ,パン屋オットー,村人,さすがならずものディーターその大穴狙いは尊敬に値するぜ
プロローグ,パン屋オットー,村人,そして俺は97%にBETだ!
プロローグ,ならず者ディーター,人狼,だいたいの漫画の主人公が「1%有れば・・・」って言いながら成功するんだ3%っていうとだいたいその３倍だぜ？俺が主人公なら、この賭け　負けるはずがない
プロローグ,ならず者ディーター,人狼,「今日始まる」に俺の魂を賭けよう。今日始まらなかったら俺はただの脇役だったってことだな。
プロローグ,ならず者ディーター,人狼,>>6　ちょ、おま
プロローグ,パン屋オットー,村人,物語の主人公は主人公たる宿命を持ち宿命とはすなわちディスティニーディーターがそのディスティニーを宿しているかどうかは今日始まるかどうかで決定される
プロローグ,パン屋オットー,村人,あと始まらなかったら俺が主人公ということでよろ
プロローグ,パン屋オットー,村人,主人公特権その1!最終生存論(Final survival theory)主人公は最終日まで吊られないし襲撃されない!だからどんなにアホなことを言ってもOKだ!
プロローグ,ならず者ディーター,人狼,>>11 その時はオットー吊って俺が主人公の座を奪ってやる！
プロローグ,パン屋オットー,村人,物語の主人公は最後まで死なない(ただし例外は多々ある)
プロローグ,ならず者ディーター,人狼,主人公が死んでも、その魂は受け継がれていくんだぜ
プロローグ,負傷兵シモン,村人,上から来るぞ！気をつけろ！
プロローグ,パン屋オットー,村人,また1人主人公候補が現れたか……ちなみに俺の名前はオットーコードネームはコンバットオットーだ
プロローグ,負傷兵シモン,村人,3%に魂を賭ける夢追い人がいると聞いて参上したぜ二人ともよろしくな
プロローグ,負傷兵シモン,村人,こっちだぁ！オットー！おっと、そういえばゲルトもよろしくな
プロローグ,パン屋オットー,村人,＼パフ♪／
プロローグ,ならず者ディーター,人狼,主人公候補がまた１人これは今日始まる予感………！
プロローグ,ならず者ディーター,人狼,>>17コードネームに本名が入ってるんですがそれは
プロローグ,パン屋オットー,村人,いつからオットーが本名だと錯覚していた？
プロローグ,ならず者ディーター,人狼,なん・・・だと・・・
プロローグ,パン屋オットー,村人,俺の真の名はパン屋だ!
プロローグ,パン屋オットー,村人,幼稚園児がパン屋さんになりたいーっていうのはつまるところ俺になりたいってことだ!
プロローグ,負傷兵シモン,村人,つまりあれか「パン屋オットー」は「本名コードネーム」なわけか
プロローグ,パン屋オットー,村人,えっとそういうことになるのかな？
プロローグ,負傷兵シモン,村人,さて賭けの時間が近づいているわけだが始まるか始まらないかドキドキするな（目逸らし）
プロローグ,パン屋オットー,村人,始まらなかったら練習で人狼やろうぜ最初は俺が人狼な
プロローグ,負傷兵シモン,村人,じゃあ俺狂人な！
プロローグ,ならず者ディーター,人狼,開幕RPPやんけ・・・
プロローグ,負傷兵シモン,村人,オシカッタナー
プロローグ,負傷兵シモン,村人,ディーターのツッコミが冴えわたってるな
プロローグ,パン屋オットー,村人,よーし練習で人狼開始だな!狼はディーターだ!間違いない!
プロローグ,旅人ニコラス,村人,GoodEvening・・・諸君俺のmy carで高速を走り抜けてたらGuardRailとDeepKissをしちまってな・・・気づいたらこんなところに来ちまったぜ・・・冗談じゃねぇ
プロローグ,少年ペーター,村人,ハムスターにんげんです。占わないでね！
プロローグ,少年ペーター,村人,▼者セットしたですあ、ちょっと集まらなさすぎて見てられなくての入村なのでコアタイムが皆とずれるかもです迷惑かからないようにするのでよろしくです
プロローグ,負傷兵シモン,村人,来てくれて嬉しいぜお二人さん早速だが●ペーター希望だ>>36　youからdangerousでcoolな気配がするぜ…
プロローグ,パン屋オットー,村人,男ばっかじゃねーか!もうすぐクリスマスなのに!クリスマスなのに!
プロローグ,農夫ヤコブ,村人,男臭いそれがいい
プロローグ,農夫ヤコブ,村人,自分もコアタイムずれてるけど、人が集まらなさすぎだから来てみたよ
プロローグ,パン屋オットー,村人,コアタイムズレまくるならいつもの投票じゃなくて自由投票でもいいかもな一度やってみたかったしどっちの陣営が有利になるとかは分からんけど
プロローグ,パン屋オットー,村人,占いも最初から自由占いで
プロローグ,農夫ヤコブ,村人,基本的には何をするにも賛成するよそういうことをするにあたって議論する時間が取れない可能性もあるだろうから、村が始まる前に決まれば一番良いね
プロローグ,旅人ニコラス,村人,>>39Greatな評価、ありがとうよ…しかしこの村、Men's Partyとなりそうで楽しみだぜ…俺も一風変わったRuehlとかは賛成だ、いつもと違ったSurpriseが待っているからな…
プロローグ,旅人ニコラス,村人,（まず俺のキャラ付けがおかしいのは内緒にしてくれ）
プロローグ,負傷兵シモン,村人,お、ヤコブいらっしゃい自由占い自由投票、か反対派がいないならいいと思うぜ？
プロローグ,仕立て屋エルナ,占い師,む、むさ苦しい……。せっかくこしらえた[ミニスカサンタ服]の使い道がないじゃないのさー。男？  [赤ふんどし]で寒中水泳でもやってれば？
プロローグ,仕立て屋エルナ,占い師,あ、ちなみにアタシもコアズレ陣営だよ。自由投票、自由占い、いいんじゃないかな。
プロローグ,少女リーザ,狂人,うーうーよろしくね
プロローグ,少女リーザ,狂人,面白そうな匂いがしたから入っちゃったー狼はいるよ！うーうー！
プロローグ,少女リーザ,狂人,面白そうな匂いがしたから入っちゃったー狼はいるよ！うーうー！
プロローグ,仕立て屋エルナ,占い師,後1人ね。今日始まるかな？>リーザ大事なことなので2回（ryいらっしゃい、リーザ。早速だけど、かわいい服があるのよ。着てみない？つ[ミニスカサンタ服]
プロローグ,宿屋の女主人レジーナ,霊能者,こら、リーザ。うーうー言うのは止めなさい皆さん、ごめんなさいね。うちの子狼がいるんだって言ってきかないんですよ…
プロローグ,宿屋の女主人レジーナ,霊能者,いきなり報告なんですけど、私今日の夜は立ち会えないんですよ。迷惑かけてごめんなさいでも明日以降は大丈夫だから許してくださいね自由占い等に関してはリーザと同じ意見にしておいてください。個人的には賛成なんですけどね。
プロローグ,神父ジムゾン,村人,クリスマス？仕事（礼拝・ミサ）ですが何か
プロローグ,神父ジムゾン,村人,自由投票・占いの流れなので飛び込んでみた、同じくコアずれ勢です。決して、エルナさんがリーザさんをミニスカサンタにしようとしているのに釣られたからとかそんなことはありませんよ、ええ。
プロローグ,少年ペーター,村人,反対しないですただ昨日から入村している人っちの意見は重視するですよ
プロローグ,少女リーザ,狂人,>>54エルナお姉ちゃん、ありがとう。でもちょっと寒いかも！うーうーママ、狼はいるもん！うー！自由占い自由投票に異議なしだよ、詳しくは始まってからだね！
プロローグ,行商人アルビン,狩人,今年のクリスマスは予算達成できるかな？
プロローグ,旅人ニコラス,村人,俺も反対はしないぜ・・・Freeな占い、Freeな投票しようぜ・・・
プロローグ,行商人アルビン,狩人,アルビンだ。コードネームはグリーンジャケット。今日は立ち会い出来るか不明。自由占いでも自由投票でも男だらけのクリスマスパーティでもミニスカサンタでも赤フンでもチキンでもオードブルでもシャンパンでもなんでもこい！全部売り捌いてやる！
プロローグ,行商人アルビン,狩人,(Ruehlってなんだろう…)
プロローグ,青年ヨアヒム,村人,最近ニートなんですよねー
プロローグ,青年ヨアヒム,村人,みなさんよろしく！
プロローグ,青年ヨアヒム,村人,自由占い、自由投票はお任せしますね
プロローグ,木こりトーマス,村人,みんなよろしく
プロローグ,木こりトーマス,村人,木ばっか切っててあんまり慣れてませんがお手柔らかに
プロローグ,木こりトーマス,村人,あと ルールに関しては特にどうなろうが構わない
プロローグ,宿屋の女主人レジーナ,霊能者,リーザ！止めなさいって言ってるでしょ！>>アルビンさんそういえば…、もうすぐクリスマスなんですね…。(サンタクロースか…)
プロローグ,羊飼いカタリナ,人狼,わおーん
プロローグ,羊飼いカタリナ,人狼,僕もお邪魔させてもらうよ。コアずれかもしれないけど、よろしくね。
プロローグ,神父ジムゾン,村人,覗きに来たら人が増えていて嬉しいです。皆さんよろしくお願いしますね。しかし今日は寒いですね。皆さん良かったら如何です？っ[スパイス入りホットワイン]っ[生姜入り紅茶]っ[はちみついりミルク]リーザさんとペーター君は紅茶かミルクですよ。
プロローグ,旅人ニコラス,村人,>>64 Ruleの誤字だぜ・・・申し訳ねぇ・・・ちなみに読み方は同じルールなんだぜ、Ruehlの方は服のBrandだけどな・・・
プロローグ,農夫ヤコブ,村人,とりあえずジムゾンが変態なのか変態紳士なのかが議論ポイントですね(変態紳士の元ネタの橘某の誕生日に肖り)個人的にはミニスカサンタしてもしなくても女性は美しいと思いますよハハハヨアヒムとニートしたい
プロローグ,羊飼いカタリナ,人狼,>>74ジムゾン僕も寒くて震えているの。羊ちゃんをもふもふして温まるんだ～
プロローグ,農夫ヤコブ,村人,ジムゾン飲み物ありがとう紅茶を戴くよ
プロローグ,旅人ニコラス,村人,>>ALLみんなよろしく頼むぜ…>>74俺は【生姜入り紅茶】を選ばせてもらう冷える夜にはHotTeaが一番だぜ
プロローグ,羊飼いカタリナ,人狼,>>76ヤコブジムゾンさんって変態なの？（こてん
プロローグ,青年ヨアヒム,村人,ジムソンさんありがとう僕も生姜入り紅茶をもらいたいな
プロローグ,宿屋の女主人レジーナ,霊能者,ジムゾンさん、ありがとう。ワインいただくわね…ふぅ。最近頭が痛くて参るわね…
プロローグ,農夫ヤコブ,村人,カタリナが僕っ娘……だと……(碇某の腕組姿)ふむ、素晴らしいと思わんかね紳士諸君
プロローグ,農夫ヤコブ,村人,>>リーザジムゾンは紳士だよ(良い笑顔)
プロローグ,負傷兵シモン,村人,よ、皆よろしく！これもミニスカのおかげか…相変わらずエレナは良い仕事をするな！
プロローグ,宿屋の女主人レジーナ,霊能者,ヤコブは何を言ってるのかしら…？深く考えたらもっと頭が痛くなりそうだからスルーが安定ね。うん
プロローグ,農夫ヤコブ,村人,リーザとカタリナ間違えたことはスルーして下さいカタリナごめんよ!!
プロローグ,羊飼いカタリナ,人狼,>>83ヤコブヤコブさん、ちょっと、なんか目が怖いよ……レジーナさん助けて～[ふるふるとふるえつつ>>86レジーナの後ろへ隠れた]
プロローグ,負傷兵シモン,村人,>>74ジムゾン【ワイン】ありがたくいただくぜ
プロローグ,宿屋の女主人レジーナ,霊能者,さてと…、そろそろ約束の時間ね。それじゃあ、皆さんまた明日会いましょう。今日がよい夜になることを祈ってるわ
プロローグ,農夫ヤコブ,村人,深く考えたらそこで試合終了ですよレジーナ嬢気にしないのが一番ですカタリナ、落ち着くんだ、落ち着こう、そう落ち着くのが大事だおじちゃんと一緒にご飯でも一緒に食べよう大丈夫、なにもし(省略
プロローグ,旅人ニコラス,村人,>>90最近外は物騒と聞いている、気をつけてくれ・・・
プロローグ,羊飼いカタリナ,人狼,>>91ヤコブ……ほんと？[ひょこりと顔を覗かせる]
プロローグ,宿屋の女主人レジーナ,霊能者,出掛ける前にひとつ。カタリナに手を出した奴には鉛玉をブチ込むからそのつもりでね。こどもたちは私が守るっ！！**
プロローグ,農夫ヤコブ,村人,>>93カタリナおじちゃん嘘はつかないよハハハ今日はシチューだからね。みんなで食べよう。【シチュー】
プロローグ,羊飼いカタリナ,人狼,>>94レジーナレジーナさんかっこいいの！[ほわわ]
プロローグ,旅人ニコラス,村人,>>95ヤコブ・・・後ろにいる俺からその左手に隠してる怪しい瓶が丸見えだぞ・・・何かする気にしか見えんぞ・・・
プロローグ,羊飼いカタリナ,人狼,>>95ヤコブほんと？なら、ちょっとだけ……[ヤコブのシチューを貰おうとしたところで、ニコラス>>97が聞こえる]……やっぱり怖い、の。[レジーナの後ろへ戻った]
プロローグ,農夫ヤコブ,村人,>>97……ニコラス、これはワインだ、ワインだ、ワインナンダヨ!?そっそんな人がおかしくなるような危険な危ないものをおじちゃんが、もっ持つわけないじゃないかっハハハッだっだいじょうぶほらにんずうぶんあるしあんぜんあんぜん
プロローグ,羊飼いカタリナ,人狼,100は僕が貰い受けるよ。
プロローグ,羊飼いカタリナ,人狼,100やった！！！これも羊ちゃんたちのおかげだよ～　もふもふ。[羊を連れてレジーナの後へ着いていった]**
プロローグ,旅人ニコラス,村人,やれやれ・・・人狼・・・Werewolfよりも男の中にある獣のほうが厄介が気がするぜ・・・さて、俺も少しの間、村の隅にて休ませてもらおうか・・・
プロローグ,司書クララ,人狼,コアずれ自由も可と聞いて
プロローグ,農夫ヤコブ,村人,それを言っちゃおしまいよじゃあおじちゃんも一回休むとするかな
プロローグ,神父ジムゾン,村人,ちょっと目を離したら私が変態扱いされていたｗｗｗ>>76実は妙齢の女性のミニスカートは見た目が寒そうで苦手です…。脚を寒さで赤くしてまで素足って大丈夫かなとか。子供がミニスカートで走り回っているのは元気があっていいと思うのですけれどね。[こういうことを言うから変態と言われるのには気づいていない]
プロローグ,仕立て屋エルナ,占い師,>>60リーザあら、アタシとしたことが。体を冷やしちゃ大変だね。（黒タイツとブーツを渡しつつ）>>71レジーナ貴女も娘さんと一緒にどうだい……って出掛けてしまったようだね。親子サンタでいい宣材になると思ったんだけどなー。とりあえず、コレはレジーナがわかるところに置いておこうかね。つ[リーザのより攻めてるミニスカサンタ服］
プロローグ,神父ジムゾン,村人,そして>>94の鉛玉を飴玉と見間違って、なんだか可愛いなと思った私は多分眼精疲労です。あー、カタリナさん。とりあえず私は危険人物じゃありませんから安心してください。言い忘れましたが私も更新時間前後はおりません。
プロローグ,神父ジムゾン,村人,クララさんこんばんは。おや、フルメンだ。嬉しいのでお祝いしましょう。[シャンメリーとスパークリングワインを並べる]そうですね、各自つつきながら話せるように料理も置いておきましょうか。っ[ビーフシチュー][ポトフ][ぜんざい]
プロローグ,神父ジムゾン,村人,パンはオットーさん任せました。パン屋を名乗るオットーは人狼率が高いとか聞いた気がしますけど、細かいことは気にしない。おっと、ヤコブさんもシチューを持ち寄られていた。おいしそうですねー。私もいただきましょう（もぐもぐ）なんだか体が凄くホカホカします。んー…？
プロローグ,仕立て屋エルナ,占い師,というか、いつの間にかフルメンじゃないの。アタシと同じく、コアズレ自由につられてきた皆、よろしくねー。僕っ娘に眼鏡っ娘も来て、宣材のバリエーションとしては充分だわ。女性にミニスカサンタを着せることを強いられているのよ！>カタリナ＆クララつ[ミニスカサンタ服]きっと似合うと思うわよー？
プロローグ,仕立て屋エルナ,占い師,さて、冷えてきたし神父さん>>108のポトフでも頂こうかね。はふー。ヤコブのシチューは……（>>109を見て）後で頂こうかね。o0（神父さんが熱のこもった目でヤコブを見てるけど、大丈夫かしら？）
プロローグ,神父ジムゾン,村人,>>111いやいや、みんなで私を変態に仕立て上げないでｗ男色の趣味はありませんよ！エルナさんはサンタ服着ないのですか？
プロローグ,仕立て屋エルナ,占い師,>>112あ、あらら？ 口に出ちゃってたみたいね。そうね、神父さんは紳士だものね。アタシもかー。あんまりスタイルとか自信ないけど、言い出しっぺが着ないわけにはいかないねー。E:[サンタ服]（ちゃっかりスカートは長めのようだ）
プロローグ,農夫ヤコブ,村人,ただいまおじちゃんだよおじちゃんのシチューは滋養強壮に良いからねしょうがないね別に変な成分入ってないからね!!おじちゃんの趣味は可愛いおにゃにょこだよ
プロローグ,農夫ヤコブ,村人,始まりそうだけどもディーターがまだ来てないようだけど大丈夫かなちょっと不安だな
プロローグ,ならず者ディーター,人狼,不安を感じてる農夫が居ると聞いて
プロローグ,ならず者ディーター,人狼,俺が居ない間にフルメンか後一日集まるのが早かったら俺も賭けに勝てたんだけどなーま、いいや。みんなヨロシク
プロローグ,ならず者ディーター,人狼,んで？自由投票自由占いだぁ？まあ更新立ち会えないんじゃ仕方ねーんじゃねーの？折角の機会だし変則型を楽しんでみるのもいいかもな
プロローグ,ならず者ディーター,人狼,ちなみに俺コア日によってバラバラだから。でも更新は毎日立ち会えるよってことはここに記しておく。
プロローグ,仕立て屋エルナ,占い師,>>114全文から危険臭がただよってるんだけど、それは。ジムゾンとヤコブの二大紳士向けにこれ置いてくわね。つ[ネクタイ＆靴下]（どちらも赤と白のクリスマスカラー）
プロローグ,仕立て屋エルナ,占い師,ディーターやっほー。これでしっかりフルメンね。アタシも日によって変わるけど、コアは20時〜24時ってとこねー。大体更新には立ち会えそうよ。
プロローグ,青年ヨアヒム,村人,僕も更新には立ち会えると思うよコアは20時～23時かなぁ来れるときはがんがん来るつもりだよ
プロローグ,負傷兵シモン,村人,お、フルメンじゃねーか！ディーターお帰り俺も基本的には更新立ち会えるぜようにしとくぜ
プロローグ,負傷兵シモン,村人,コアずれ？なに心配ないさコアタイムがずれてたって友情は深められる
プロローグ,神父ジムゾン,村人,>>113凄く目線が訴えてました。…紳士かどうかは、よくわかりませんが（くびかしげディーターさん来てくださったんですね、良かった！よろしくお願いしますね。私のコアタイムは22時〜23時半、昼間覗きます。更新前後はどうしても抜けられない教会の用事があるので、席を外している事がほとんどです。今日は大丈夫だと思います、多分。
プロローグ,農夫ヤコブ,村人,よかったディーターよろしく!!おじちゃんは更新前までは居れるけどそのあとは朝になっちゃうかな。ただ時間さえあれば見に来るから朝から21時がコアタイムかな今日は更新後居られるし、出来るだけ更新後居れるようにはするよ
プロローグ,農夫ヤコブ,村人,>>120エルナ……ありがたくもらっておくよ☆[装着]本当に危なくなんてないんだからね!!
プロローグ,パン屋オットー,村人,いつのまにかフルメンになっててわろたwこの中から真の主人公が選ばれるのか……
プロローグ,神父ジムゾン,村人,[>>120から靴下をもらって履き替えた]…ネクタイどうしましょう？法衣に襟は無いですし…。丸めて胸に差しますか。[胸ポケットからしましまネクタイちらり]
プロローグ,負傷兵シモン,村人,この時期は視覚的に賑やかでいいなエルナ姐さん、いっちょ俺にもなんか見立ててくれないか？
プロローグ,旅人ニコラス,村人,なんだが…賑やかなことになってるな俺も今もどったぜ
プロローグ,負傷兵シモン,村人,>>131ニコラスおかえり車は大丈夫そうなのか？
プロローグ,パン屋オットー,村人,フルメンっつーのは久しぶりのような気がするぜ!コアタイムズレとか気にするな!明日は我が身だ!
プロローグ,旅人ニコラス,村人,>>132だめだな、完全におしゃかだ・・・でも、心配してくれてありがとうよちなみに俺のコアタイムは20時～22時になりそうださすがにトバしている時に裸に近い状態で踊ってる奴が道の途中にいたせいでよそ見してしまったからな・・・無茶もない・・・・・・今思うとジムソンに似ていなくもなかったような・・・？
プロローグ,負傷兵シモン,村人,>>134やはりジムゾンの奴…あれなのか、あれなんだな
プロローグ,神父ジムゾン,村人,待てお前らwww
プロローグ,パン屋オットー,村人,ちょい風呂入ってくるぜ!レジーナ、お金は後払いでいいよな？夜明けまでに戻る予定だけど状況次第では遅れるかもしれん
プロローグ,農夫ヤコブ,村人,ジムゾン……おじちゃんみたいな将来はよくないと思うけどな
プロローグ,司書クララ,人狼,すいません日によっては17:30~22:30頃は音信不通になったりします。ご迷惑を。>>シモンさんではこの靴下をあげしょう。すいません、狼騒ぎで簡単なものしか作れませんでした。
プロローグ,司書クララ,人狼,あ、何とかして票変えはするようにはします。
プロローグ,仕立て屋エルナ,占い師,神父さん……紳士スタイルは屋内だけにしとくべきだよー？ヤコブは……うん☆>>130シモンそうさねぇ……(奥のクローゼットをごそごそ)あ、これとかいいかな。つ[マジシャン衣装]これでパーティーを盛り上げとくれよー？
プロローグ,負傷兵シモン,村人,>>120クララありがとな、大切に履かせてもらうぜうん、靴下だけでかなりあたたかいな>>141さてこの右手にありますのは種も仕掛けもない硬貨、…って俺は兵士なんだが！？まあ、パーティー芸の際に使わせてもらうぜありがとよ、姐さん
