プロローグ,楽天家ゲルト,村人,人狼なんているわけないじゃん。みんな大げさだなあ
プロローグ,旅人ニコラス,占い師,こんにちは。
プロローグ,少女リーザ,村人,こんにちはーリーザだよ
プロローグ,村長ヴァルター,狩人,やあ、こんにちは。ずっと雨で気が滅入るな。河川や用水路にはうかつに近寄らないように。人狼騒ぎも単なる噂だと良いが…。
プロローグ,宿屋の女主人レジーナ,村人,はいいらっしゃいこんにちは。こんなに雨が続くと流石に滅入るねえ。カビも心配だし…
プロローグ,負傷兵シモン,村人,わたしはシモンだ。雨が降ると古傷が痛んで、憂鬱だな。
プロローグ,宿屋の女主人レジーナ,村人,おっと忘れてた。宿帳を置いておくよ。■1.コアタイム■2.希望仮／本決定時間■3.やりたいこと／やりたくないこと□4.フリースペース
プロローグ,宿屋の女主人レジーナ,村人,シモンもいらっしゃい。ジメジメしてるけど、まあゆっくりしていきな。私はまだ野暮用があるので、またあとにくるよ。
プロローグ,少年ペーター,人狼,だれか僕の宿題手伝ってくれない？
プロローグ,少年ペーター,人狼,■1.22：45～■2.23：30／00：00■3.皆で楽しいお話したい／突然死はしないよ□4.僕昆虫大好き。夏休みの宿題だれか手伝って～！
プロローグ,少年ペーター,人狼,レジーナ、ここで宿題やっていい？涼しくて気持ちいいんだもん。それと、カルピスあったらちょうだい！人狼？それ夏休みの自由研究にしようかな？
プロローグ,旅人ニコラス,占い師,■1.11:00～■2.お任せ■3.なるべく村の集まりには顔を出したいな□4.虫や魚を探して世界中を旅しているんだ。ペーター君とは趣味が合いそうだね。
プロローグ,ならず者ディーター,人狼,人狼？借金取りより怖いもんなんてねーよ。
プロローグ,ならず者ディーター,人狼,■1 21:00以降■2 任せた■3 流行り病には気をつけよーぜ□4 ギャンブルで有り金スッた上、借金取りから逃亡中だぜ。仕事募集中。なんでもやるが、金庫番とかオススメだぜ！
プロローグ,少女リーザ,村人,あぅ…また寝ちゃったのゲルトさん、ニコラスさん、村長さん、レジーナさん、シモンさん、ペーター君、ディーターさんよろしくなの宿帳になんか書いてあるの！私はね…■1.22時以降なの■2.おまかせするの■3.みんなと仲良くしたいの□4.リーザはリーザだよ？みんなよろしくね。ペーター君、一緒に宿題しよー。私はね、さんせいう？について調べるんだ！雨が降ったらポンポロロン♪
プロローグ,老人モーリッツ,人狼,おじいちゃんじゃよ久しぶりにこの村に帰ってきたら人狼じゃと？怖いのぅ恐ろしいのぅ■1.23時頃■2.皆に任せるわぃ■3.長期に渡る村は久しぶりじゃわぃお手柔らかにお願いするわぃ□4.楽しくわぃわぃ出来たらいいんだがのぅ…
プロローグ,農夫ヤコブ,村人,俺のとこの畑があああああああ！
プロローグ,農夫ヤコブ,村人,■1.日によりまちまち。夜多め■2.仮2時間前、本1時間前ぐらい？■3.みんなが居るときに顔だしてえな□4.雨続きで畑がダメになってしもうた…orz
プロローグ,行商人アルビン,村人,ここは雨が多いな。かき氷は売れんかあ
プロローグ,行商人アルビン,村人,ちょっと傘仕入れて来るわ。また後でな
プロローグ,少女リーザ,村人,おじいちゃん、ヤコブちゃん、アルビンさんよろしくね。
プロローグ,農夫ヤコブ,村人,よろし…って、いやいやいやいや。リィなんで俺だけちゃんづけ？！ペーターでさえくんなのに…！おじいちゃんで間違っただけだよな、そうだと言って！アル＞大根の種くれ。雨ニモ負ケヌやつ
プロローグ,少女リーザ,村人,あれっ間違っ……ううん私間違えてないよ！ヤコブちゃんはヤコブちゃんなの。かわいいの。私が間違えるなんてないの。(ほんとは間違えちゃったの。ごめんなさい。でももうこのまま通すしかないの)
プロローグ,羊飼いカタリナ,村人,こうも雨が続くと羊さんたちが可哀想草はあーんなにあるのに
プロローグ,羊飼いカタリナ,村人,小屋の中に押し込めっぱなししまいっぱなし私はなーんにもすることがないのよでは、また後でおやすみなさい
プロローグ,木こりトーマス,村人,こんにちは人狼が恐ろしくて仕事にならないぜ
プロローグ,農夫ヤコブ,村人,.o0(通す…だと…！？何気に畑仕事で脱いだら凄いおらが…！)　あ、リィはトマもちゃん付けだったっけな、な？（無茶振り）　　トマ＞仕事しろ、超仕事しろ。その筋肉は張りぼてか。　　リナは可愛いから仕事してなくても許す。
プロローグ,老人モーリッツ,人狼,雨止まぬのぅ腰痛いのぅ暑いのぅ誰か揉んでくれんかのぅ？とりあえず外に出ないとご飯も食べられないんじゃわぃばあさまをはよぅに亡くして一人なんじゃさて飲みにでも行ってくるとするかのぅ
プロローグ,木こりトーマス,村人,■1.夜が多いな■2.任せるぞ■3.みんな仲良くしてくれや□4.もっと鍛えて、狼人などぶちのめしてやるぜ
プロローグ,少女リーザ,村人,カタリナさん、トーマスちゃ…ん？よろしくなの（やっぱりトーマスちゃんは無理があるよーいかついの。）おじいちゃん帰ってきたら揉んであげるの。いつもパパにリーザは揉むのうまいなって誉められてるの。
プロローグ,村長ヴァルター,狩人,お、人が集まってきたみたいだな。みんなよろしく。■1．21：00～。日によってまちまちだ。■2．仮23：15　本0：00くらいでどうかな■3．奇策を打つならなぜそれが陣営のためになるかきちんと説明することを約束してほしい。それと、雰囲気の良い村にしたいな。□4．ヤコブ、畑の様子を見に行くときは十分に気を付けてくれよ。危ないからな。
プロローグ,老人モーリッツ,人狼,おぉリザちゃん優しいのぅ揉むのがうまいのかぃ？じゃあちょっとこっちにきて揉んでくれんかのぅ？あ、いやもっと下じゃ、もっと下じゃ股間のあた（ｒｙふぅ…リザちゃんうまいのぅ…
プロローグ,神父ジムゾン,霊能者,今晩は。雨も降っていますし家で暇なら教会へ来てくださいね。 ■1.10時以降でしょう。■2.まとめ役に任せますが本決定は30分前からいが希望ですね■3.凸が一番怖いですね。□4.こう見えて喋るの好きなんです。楽しく出来れば本望ですね
プロローグ,農夫ヤコブ,村人,( ´ﾟдﾟ｀)ｴｰ、俺だって脱いだら凄いんだぜ？　なのに。。　じゃあ、オットーかヨアヒムが来たらちゃん付けで、で！！そんちょ、ありがと！だが村の食料危機は農夫の名にかけて回避してみせる！！んじゃ、俺、も１回畑見てくる。
プロローグ,農夫ヤコブ,村人,手がすべっったああああああああああああああああああああ！∈━⊂( ･∀･) 彡[...はどこからともなくクワを取り出して、モーリッツに振りかざした]ふぅ、今度こそ畑いこ
プロローグ,シスターフリーデル,狂人,ここでアマちゃん登場！いぃぃぃぃぃぃぃやぁぁぁぁぁぁふぅ！！！！！　え？　うんうん、もちろんこれが平常運転ですよ！老>>32 腰が痛いときには伸ばすといいよ！ちょうどここに十字に組んだ木があるから、手足結んであげるよ！遠慮しないで！さぁ！なんなら釘で打ちつけてもいいから！！神>>33 辛いよ！カラいよ！くらいじゃなくてカラいよ！
プロローグ,少女リーザ,村人,えへん、私うまいでしょ。腰痛いの治まったかなきゃあああああおじいちゃんがーーー大丈夫？？おじいちゃん…これは…事件なの…
プロローグ,少女リーザ,村人,神父さん、シスターちゃんよろしくね
プロローグ,シスターフリーデル,狂人,擬態！解凍！するよ！■1.22時すぎたら本気出すよ！■2.仮2300／本2330■3.いいじゃん！いいじゃん！／流行病はダメじゃん！ダメじゃん！□4.あまちゃんだよ！空気は読まずに吸う派です。
プロローグ,シスターフリーデル,狂人,リーザだよ！リーザがいたよ！ちょっと頭なでさせて！（がしがしがしがしがしがしがし）
プロローグ,青年ヨアヒム,村人,飴は要らんかねー、飴は要らんかねー雨が降ってるから飴屋でバイト始めたよ
プロローグ,シスターフリーデル,狂人,あ！なんかわが主が！僕（しもべ）のこと呼んでるよ！**
プロローグ,少女リーザ,村人,あわわわわわあそんなにしたら頭とれちゃうの。もっとやさしくなででほしいなヨアヒムちゃんがきたの。よろしくね。飴！飴が欲しいの！！！すっごく甘いのが欲しいの！
プロローグ,青年ヨアヒム,村人,■1.基本は夜だねぇ■2.仮本の間に30分くらいあればいつでも■3.のんびり行こうじゃない、流行病にだけご注意□4.飴屋ヨアヒムだよ、飴は要らんかね？つ[わたあめ][リンゴ飴]
プロローグ,青年ヨアヒム,村人,>>43よしよし、この[ペロキャン]をあげよう他のも欲しかったらもっていっていいぞお代？村長につけとこう>>32じっちゃん…。あんたにはこれだなつ[サルミアッキ]なに、癖になるさ、きっとな。
プロローグ,村長ヴァルター,狩人,16人、フルメンバーだな。ヤコブは畑の様子を見に行ったのか。流されてないといいが…。やあヨアヒム。リンゴ飴を頂こう。（ヨアヒムはまたバイトか…。そろそろ定職につく気はないのだろうか。多めにお代おいておこう。）シスターは子供好きだな。老人にも気遣いを忘れないようだし、良いことだ。
プロローグ,少女リーザ,村人,ヨアヒムちゃんありがとう！！[ぺロキャン]ﾍﾟﾛﾍﾟﾛんー甘くておいしいの。わたあめもりんご飴もおいしそうなの。じー…[わたあめ][りんご飴]フルメンなの。嬉しいのー
プロローグ,青年ヨアヒム,村人,>>46(くっ、なんて優しい目をしたそんちょだ、まぶしくて前が見えないっ)毎度ありー、まぁ商売が軌道に乗ったら飴屋乗っ取るっていう夢があるからね！頑張るさー。目指せ！100万ゲルト！
プロローグ,ならず者ディーター,人狼,お、いつの間にかフルメンじゃねーか。よろしく頼むぜ。そうそう、ゲルトの家で金庫番の仕事をもらえたぜ。やっこさん、寝てばかりだから盗みや……もとい守る意味が薄いと思うんだがな。
プロローグ,農夫ヤコブ,村人,野菜は実らないが、草は生えてるんだぜ…　　　　　 _, ._　　（ ・ω・）　　○=｛=｝〇,　 　|:::::::::＼, ', ´.ｗｗし ｗ`（.＠）ｗｗｗｗ青>>48おー、ヨア！よくぞ、来たな！～いい年の男がちゃん付けの世界へようこそ～飴屋って…何か他にも甘いもんないのかよ！取り合えず、リィの分も合わせて綿菓子おくれ
プロローグ,農夫ヤコブ,村人,者>>49　あー、ゲルトに雇われたかー。そんちょが雇ったらどうしてやろうか、もとい…どうしようか、とか思ってたから丁度いいやな！　いちおー、忠告しておくとだな。ゲルトの金庫は破ろうとするとだな……おっと、誰か来たようだ。
プロローグ,青年ヨアヒム,村人,農>>50雨の中大変だねぇ。とりあえず、つ[わたあめ]そうか、飴以外も売ればいいのか。飴をメインにしつつ飴を使った甘味を売り出してみるとしよう。試作品つ[大学芋][ステンドグラスクッキー][金平糖]
プロローグ,青年ヨアヒム,村人,者>>49やぁ、ディーターよろしくゲルトの金庫か、何ゲルト入ってるんだろうな？というか通貨は何でゲルトなんだろうな。…知ったら消される気しかしないから、そっとしておこう。
プロローグ,少女リーザ,村人,他の村にあったの。これでいいのかな・●：占い第一希望　○：占い第二希望・▼：吊り第一希望　▽：吊り第二希望・■：議題　□：ネタ議題　・【　】：…宣言や決定等、強調したい発言。・［ ］：RP上の食べ物やアイテム、ト書に使用。・★：質問や強調したい事　☆：回答略語・CO：自分が能力者であることを公表すること。・FO：フルオープンの略。初日に占い師も霊能者もCOすること。
プロローグ,少女リーザ,村人,・GJ：グッドジョブの略。狩人の護衛成功などに使う。・LW：ラストウルフの略。最後に残る人狼のこと。・GS：グレースケールの略。自分以外の灰を、白っぽい（村人っぽい）人から黒っぽい（人狼っぽい）人まで順に並べたもの。・SG：スケープゴードの略。狼の代わりに吊られる村人の意。・RP：ロールプレイの略。ペルソナ（役を演じる、または演じてる役）
プロローグ,少女リーザ,村人,・アンカー：日付・時刻を用いて発言を引用すること。>>1　とか、1d01:15　など・黒即白３：占い結果が黒ならすぐに白なら夜明け３分後に発表する方法。　黒１白３は結果が黒なら1分後、白なら3分後に発表すること。・灰：能力者COしておらず、人間とも人狼とも判別されていない人物のこと。・ベーグル、ベグる:人狼が真贋不明の占い師候補の片方を噛む戦術のこと。・ライン：狼同士のつながり。
プロローグ,少女リーザ,村人,・鳩：携帯電話またはスマホの事。・箱：パソコンのこと。あとよく使うのってあったら教えてね　
プロローグ,村長ヴァルター,狩人,リーザありがとう。青>>48　稼げるようになったらちゃんと村に税金を納めるようにな。滞納はダメだぞ。
プロローグ,ならず者ディーター,人狼,>妙こりゃありがてぇ。なんの略語はわからないが、近々役に立ちそうな気がするぜ。>>51農　村長の家の金庫はかなり貯まってそうだな……覚えておこう。>>53青　確かにそこは気になるところだ。俺の生活がかかってるからな。……今夜あたり確認してみるかね。
プロローグ,農夫ヤコブ,村人,リィは勉強熱心だなあ。甘いものでも喰うか？つ［わたあめ］ペタは宿題終わってんのか？まあ、休憩がてら喰っとけ～［わたあめ］>>52青＞ステンドグラスクッキー＞ステンドグラスクッキー＞ステンドグラスクッキー
プロローグ,農夫ヤコブ,村人,者>>59 そんちょの金庫狙ったら…[...はどこからともなく鍬を取り出した]　　ディタはどっか別のとこに雇われたって聞いたけど、はてどこだったか…　
プロローグ,青年ヨアヒム,村人,リーザ＞リザありがとう。お礼にココアを挙げよう。長>>58あいあい、年何ゲルト？売上の1割とかそんなん？者>>59気になるけどやめといた方が…、あっ>>61農>>60どしたん？好物だったりする？仕方がない口に放り込んでやろう(ステンドグラスクッキーいわゆる飴をのせたクッキーのことである、飴がステンドグラスのように見えることからその名前がついたとされていると思うよ！)
プロローグ,村長ヴァルター,狩人,者>>59　狙うのは勝手だが・・・>>61青>>62冗談だ。この村の村民は誰も何も納めていないからな。色々必要なものは村長のポケットマネーから出ているのだ。だから金庫の中身なんて空っぽに近いのさ。本当だぞ。
プロローグ,少女リーザ,村人,者>>59私も何の事だかさっぱりなの。急に隣の村から電波がビビビッてきたの農>>60わーいヤコブちゃんありがとー大好き！！[リーザはわたあめを手に入れた]青>>62ヨアヒムちゃんもありがとー大好き！！[リーザはココアを手に入れた]おいしいものがいっぱいで嬉しいのー
プロローグ,農夫ヤコブ,村人,青>>62 そそそそんな！超喰いてええええ！とか思ってないぜよ！男は黙って、麦焼酎…って［口に放り込まれる］　うっまーーい！！ヽ(*´∀`)ノ｡+.ﾟ（（ぱああ））　んぐんぐんが(訳：ヨアは何でこんな器用なのにニ…じゃなかったフリーターやってん？)　>>63長　現物支給でも貰っとかなきゃ！俺は野菜を提供してるけど今年は不作…。レジーナのとこにも野菜届けられないぜ！
プロローグ,羊飼いカタリナ,村人,ふぁーあ、おはようもっとねていい？コアは、どうかしら。大体夜だと思うの。決定は、大体ずれこむから1時間前には決めておいたほうがいいんじゃないかな。ええと、同時発表はやりたくないなーって一応言っておくね。私自身が多分対応できないし、やるべき人が可能だとしても、数秒ずれたからどうだとかあーだとか、そゆことどうでもいいもの。
プロローグ,羊飼いカタリナ,村人,後は楽しくやれればいーなーって思うの。あと、そうね。私だいぶ眠たがりだから時間的に夜が明けたらおやすみなさい、すると思うの。意識があるうちに「げるとー」なりなんなり一声呻くから、はやり病とかの心配はされないよう、注意するね。
プロローグ,羊飼いカタリナ,村人,そんな感じかな。かな。あとは夜があけるまでゆらゆらうとうとしているのよー
プロローグ,旅人ニコラス,占い師,僕も同時発表は難しい気がするな。まぁ発表する人ができるならやってもいいと思うよ。
プロローグ,青年ヨアヒム,村人,長>>63あれ？そうなん？地税くらいは納めるんじゃないんかと思ったんだけどな農>>65不景気で雇ってくれるとこないんよ。だから事業を起こすことにした。まずは手始めにバイトでノウハウを盗み、飴屋を興すことにした羊>>66こんばん、飴いるか？おｋ把握。まぁ厳密なことは始まってからでいいとは思うが、その時は誰からがいいとか希望募ったほうがいい気はするね、まとめいればそこに任せばいいとは思うが
プロローグ,羊飼いカタリナ,村人,飴いるー！いるー！あ、まあそれ以上は何もないうちから言ってもしょうがないからもう言わないよーシステム（とはちがうかな？）的なことなのでいっておいただけっ（あむっ）これ、なにあひ？（あむあむ）
プロローグ,農夫ヤコブ,村人,羊、旅＞お、大根いるかね？そさね。同時発表は難しいだろうな。箱とか鳩とかにも寄るし。青>>70にまるっと追従で、まとめが居たらまとめの方針でええと思うな。　　ははあ。まあ、農業も決して儲かってはいねえがな…（遠い目）　
プロローグ,羊飼いカタリナ,村人,大根ー♪大根はことこと煮込んじゃおうねぇ夏は冷たくてもおいしーし！
プロローグ,青年ヨアヒム,村人,まぁ数秒で云々言われるのは世知辛いからな(遠い目羊>>71ジンギスカン(キャラメル)ではなく鼈甲飴です。
プロローグ,羊飼いカタリナ,村人,羊さんは飴じゃないほうがおいしいもん鼈甲飴♪飴ー♪（からころころころ）
プロローグ,村長ヴァルター,狩人,カタリナにニコラス、こんばんは。青>>70　「気持ち」や寄付金はもらっているぞ（微笑）。農>>65　いつも美味しくいただいているぞ。今年は不作みたいだが豊作の時は加工したりして販売するのはどうだ？発表についてはみんなに合わせよう。ちなみに私は同時発表でも対応可能ではあると言っておく。
プロローグ,農夫ヤコブ,村人,羊>>73 俺の畑の名物野菜その１！［どっこい大根］はひき抜くと凄い速さで逃げようとするから捕まえるの大変だぜよ！　たまーに、捕まえた後でも逃げるやついるから気ぃつけて調理してくれよな！ま、まとめになった人がちらっと参考に貰えたらいいべな。（クッキー頬張りつつ）
プロローグ,旅人ニコラス,占い師,だいこんは豚肉と一緒に煮るとおいしいね。そういえば、狼の肉っておいしいのかな？
プロローグ,青年ヨアヒム,村人,ニコラスもこんばんはだ。暑いから[冷やし飴]をあげよう、味が苦手なら言ってくれい長>>76なるほどね(苦笑じゃあそのうち「気持ち」ぐらい受け取ってもらおう店が建ったらかもしれないけど
プロローグ,村長ヴァルター,狩人,農>>77なあ、その大根って引っこ抜くときに絶叫したりしないか？
プロローグ,旅人ニコラス,占い師,ヨアヒム君、こんばんは。冷やし飴もおいしいね。ぺろぺろ
プロローグ,羊飼いカタリナ,村人,じゃあ私は煮えたぎった鍋を用意して待ってるから誰かよろしくね狼肉はどうかなあもうすぐ、食べられる、かも？
プロローグ,農夫ヤコブ,村人,>>80長よく知ってるだーね！絶叫するヤツは喰えないから放置してっからトマあたりが駆除してんじゃねえかな？「ありがとーー」っていいながら走っていくヤツは美味しい大根だぜ！　旅＞「ありがとー」って叫んでた大根、どうぞ。豚もいいけどブリと煮付けるのも美味いよな！　調理は…レジとかリナ辺りに任せた方が美味しいべよ。俺のは男の料理！だからなあ　
プロローグ,旅人ニコラス,占い師,ブリ大根！昔日本という国で食べたなぁ。各地の料理を食べるのも旅の楽しみの1つだね。
プロローグ,村長ヴァルター,狩人,農>>83　その大根って本当にだいｋ…野暮なことは聞くまい。美味しいは正義だからな。しかし村長は大根はあまり好きではないのである。人狼騒ぎ以前に村の中にとんでもないものがあることが発覚してしまったな。もしかしてほかの野菜も…
プロローグ,少女リーザ,村人,大根はスライサーで薄くしたのをお鍋に入れて食べるのが好きなの
プロローグ,青年ヨアヒム,村人,ヤコヴァルの会話聞いて＞ここは魔境だったのか(棒雨が止まないから突然変異でも起きてるんじゃないかこの村のダイコンはただのダイコンに罪はない、美味いし
プロローグ,農夫ヤコブ,村人,＞そんちょ好き嫌いは良くないぜよ！俺のところの自慢の…枝豆とかならどうだべ？あ、この枝豆の調理前の注意は…床に落とすと、そのまま地面までめりこんで、凄い速さで成長して雲まで届く豆…が、ときどきあるから落とさないように茹だったお湯に直に入れるのがオススメだべ。　　>>84 旅旅はいいなあ！いろんな野菜との出会いもあるべな！
プロローグ,羊飼いカタリナ,村人,他の野菜はどうかなー？かぼちゃが馬車に変身したり茄子ときゅうりから足が生えたりしないかな？
プロローグ,ならず者ディーター,人狼,カタリナにニコラスもきて賑やかになってきたな！>>61農ハハ、冗談だよ、冗談。ディーター様は賭けごと以外じゃ人から物は奪わん主義よ。o0(ったく、とんだバイオレンスファーマーがいたもんだぜ。ゲルトから前金はもらったし、しばらく大人しくしておくか……)
プロローグ,ならず者ディーター,人狼,この村の農作物はどうなってんだ……。あ、でも雲まで届く枝豆は気になるな。宝の匂いがするぜ。
