プロローグ,楽天家ゲルト,村人,人狼なんているわけないじゃん。みんな大げさだなあ
プロローグ,パン屋オットー,人狼,パン屋だからといってパンばかりを売ってると思うなよ
プロローグ,司書クララ,人狼,司書だからって本ばかり見てると思わないでください
プロローグ,神父ジムゾン,村人,神父だからってクリスチャンと思っていたら大きな間違いです。
プロローグ,農夫ヤコブ,村人,農夫だからって畑仕事ばかりやってると思っちゃだめだべさ
プロローグ,少女リーザ,狂人,少女だからおままごとしてると思ったら大間違いだよ
プロローグ,行商人アルビン,霊能者,商人だからって物を売ってばかりとは限らないよ
プロローグ,羊飼いカタリナ,村人,カタリナだからといって女だと思ったらやけどすんぜ？
プロローグ,青年ヨアヒム,占い師,青年だからって青いとは限らないよ。
プロローグ,木こりトーマス,村人,木こりだからって木ばっか切ってると思ってたら痛い目見るわよ
プロローグ,ならず者ディーター,人狼,ならず者だからって暴力的だとは限らないよ？
プロローグ,村長ヴァルター,村人,村長だからって人望があると思ったら大間違いなんだからね
プロローグ,負傷兵シモン,村人,よろしくー
プロローグ,負傷兵シモン,村人,負傷兵だからといって流れを見てるとは限らないんだぜ…(>_<)
プロローグ,老人モーリッツ,狩人,老人だからって語尾がじゃになったり、ボケたりしないんだぜ！
プロローグ,農夫ヤコブ,村人,議題の投下だっぺ■1．コアタイム(発言できる主な時間)■2．仮決定時間・本決定時間の希望■3．やりたいこと/やりたくないこと
プロローグ,農夫ヤコブ,村人,■1．オイラ朝昼は基本的に畑仕事だから20時以降だー■2．仮1時間前からの本30分前がちょうどいいんだっぺ■3．野菜くいてぇだぁ/人間の肉は食いたくねぇだなぁ
プロローグ,パン屋オットー,人狼,>>16□1.たぶん、夜はいますの□2.本は30分～1時間前、仮はまかせますの□3.ますの！！
プロローグ,パン屋オットー,人狼,ちなみにわたくし、フライパン屋を営業してますの！！フライパンには無限の可能性がありますの！！なめてはいけませんの！！
プロローグ,少年ペーター,村人,少年だからってヒーローに憧れてるわけじゃないんだぜっ！
プロローグ,少年ペーター,村人,ヤコブにーちゃん議題ありがとー>>16□1.朝と昼は家の用事とか済ませてるからお話しできるのは夜だよ！大体7時～8時くらいから25時くらいまでー□2.仮22:45/本23:15ぐらいがいいかなー。余裕あると、いいね！□3.みんな楽しくにっこにこー/やりたくないことは、本気の喧嘩とかー。痛いの、やだもん
プロローグ,パン屋オットー,人狼,そして、わたくし皆さんの第一声に対して突っ込みたくてうずうずしてますのどう落とし前つけてくれますの？そこの下僕のペーターさん
プロローグ,仕立て屋エルナ,村人,盆休み（盆休みではない）
プロローグ,仕立て屋エルナ,村人,仕立て屋が空気を仕立てると思ったら大間違いなんだぜ…正直すまなかった。どうぞよろしく。
プロローグ,仕立て屋エルナ,村人,■1．更新前後■2．1時間前/30分前■3．面白いゲーム/面白くないゲームどうでもいいが。答えるときの議題記号は□だったかね。調べたらネタ議題が□とあったんだが。まぁ。意味がわかればいいのか。
プロローグ,村長ヴァルター,村人,フルメン、いや、フル○ンだ！議題ありがとう、早速答えるぞい。■1．18：00～19：00ぐらいまでと、20：00以降かな？昼間にちょくちょく顔出すかも■2．１時間前・30分前■3　これといってやりたいことはないけど、本気の喧嘩は勘弁ですぞ
プロローグ,少年ペーター,村人,>>22そ、そんなぁ！師匠、僕はただ周りの皆さんに合わせただけで…！(おろおろ>>25んー？どっちだったかな？記号の意味はいろいろと混在してて勉強した時間違えて覚えてきちゃったかもー？
プロローグ,パン屋オットー,人狼,●：占い第一希望　○：占い第二希望▼：処刑第一希望　▽：処刑第二希望★：質問　☆：回答▲：襲撃　【】：重要事項(各種宣言、決定確認など)　■：議題　□：ネタ・任意回答議題@：残喉(残り発言回数)　CO：カミングアウト、役職者であることを宣言すること正直言いますわ……素で間違えましたのどうしてくれるんですの？この下僕！！責任とって謝罪なさい
プロローグ,負傷兵シモン,村人,議題の回答エルナと一緒ってことでよろしく（ものぐさ
プロローグ,司書クララ,人狼,あれ…お昼寝してる間に人がいっぱい来ていましたね■１．更新前後１時間ほど＋不定期■２．仮１H前/本３０ｍ前■３．楽しいこと/楽しくないこと
プロローグ,ならず者ディーター,人狼,議題ありがとうな■1．昼頃少し、がっつりは19時以降かな■2．1時間前/30分前■3．相手が人だと言う事は忘れない、愛のある殴り合いがしたいな
プロローグ,木こりトーマス,村人,ヤコちゃん議題ありがとう！■1．20時くらいからかしら。昼はぽっぽちゃん使って議事読みはしてるかもしれないわ。■2．仮1時間、本30分前■3．そうねぇみんなで仲良くマカロンでも食べたいわねぇ/凸死とギスギスはいやね人がいっぱいでアタシほんとに嬉しいわ！オトちゃんも>>28丁寧にありがとね！ただ>>22に関しては第一声でイケメン感出してたフライパン屋さんが二言目にはアタシ
プロローグ,木こりトーマス,村人,と同じ匂いのする雰囲気に変わっててそれの方がツッコみたくてアタシうずうずしちゃう。
プロローグ,仕立て屋エルナ,村人,オットーは素で間違えたのか。そいつは吊りだな。おーいペーター、一緒にオットー吊ろうぜ。>>31者愛のある殴り合いか。よしきた。愛しているからあなたを殺すってヤツだな？ヤンデレはいいモンだ。
プロローグ,少年ペーター,村人,>>28わーん師匠ごめんなさーい！>>34師匠を吊るすなんて僕にはおそれ多くてできないよ…！！
プロローグ,老人モーリッツ,狩人,こんばんわだぜ！■1．夜中心だぜ。■2．１時間前・30分前希望だぜ。■3．たまに見かける、初日開始後相談時間を設けるやつをちょっとやりたいけど、反対の人間が一人でもいたらやらなくていいかなと思うぜ。
プロローグ,行商人アルビン,霊能者,おおフルメンになったんだね。議題もありがとう。農>>16■1．不定期■2．仮1時間前・本30分前■3．皆で健康的に全力疾走しようぜ！何かフライパン屋さん第一声とキャラ変わってない？
プロローグ,仕立て屋エルナ,村人,>>35年マジか。オットーってトーマスとキャラ被ってるぜ？それも突然>>32>>33ややこしいじゃねえか。オットー吊ろうぜ（愛のある誘導）
プロローグ,仕立て屋エルナ,村人,ん。初日開始後相談時間を設けるってなんだ？
プロローグ,ならず者ディーター,人狼,>>34服　お、なんか触れちゃいかない所に触れてしまった気もするがよろしく頼む>>36老　俺は賛成だな、正直最初に最速COしないと…とか個人の都合とかも多少あるだろうし、CO時間による推理とか余り好きじゃないからな
プロローグ,行商人アルビン,霊能者,おう、木こりちゃんと気になる所がかぶったな。老>>36私個人としては、国のルールや必要なマナー以外に決まり事があるのが苦手かも。あと更新時間遅いので寝落ちしそう（）すまない。
プロローグ,老人モーリッツ,狩人,＞エル初日夜明け後１０分発言禁止とか、初日夜明け後３０分CO禁止とかだぜ。一週間ぐらい拘束されるんだから、狼陣営の誰がCOするかとか、ある程度納得行った状態で行われるように、話し合い時間を作る感じだぜ。なぜか語尾にワイルドだろ～って付けたくなってきだぜ。
プロローグ,ならず者ディーター,人狼,>>39　服　老じゃないが、例えば初日更新日時跨いでから最初の１５分間は全員完全沈黙にするのさ、そうするともし初心者の狼とかいても相談の時間がある程度取れて、騙りやすくなったり、初めての占い師や狂人も落ち着いてCOできると
プロローグ,ならず者ディーター,人狼,おっと、ワイルドな爺さんが既に答えてたな
プロローグ,パン屋オットー,人狼,なんだか村中にラブフェロモンがぷんぷん溢れていますわーー！！下僕、わたくしたちは愛の天使になるべく動きますわよ手始めに紳士なならず者さんと、kyだぜだぜ系の仕立て屋さんのために人肌脱ぎますわよそれとも……おい、へんな流れをつくってんなよ流れに乗り切れなくて、何人かへんなことになってるぜ特に神父、あんたクリスチャンだから神父なのってんだろ？それは髪への冒涜ってやつだぜ、なあじじい？
プロローグ,木こりトーマス,村人,あらやだアルちゃん気が合うわね、マカロン食べる？スギちゃ(ry おじいちゃんの意見アタシは合わせられるわよー、ただアルちゃんと同じくあんまり時間長いと落ちちゃうから、やるなら10～30分くらいかしらね～。
プロローグ,老人モーリッツ,狩人,＞アル回答ありがとだぜ！まあ後付けルールだからな了解だぜ！＞ディタ補足ありがとだぜ！なんかこの口調エルとかぶってるっぽいぜ！けど気にしないぜ！
プロローグ,仕立て屋エルナ,村人,>>42老>>43者へー。2人ともサンキュー。今そういうのやってんのな。狼に対してやけに紳士的だな。俺は構わねぇよ。10分くらいなら付き合う。関係ない上にどうでもいいが、モリじいさんのキャラ途中で息切れしそうだな。
プロローグ,パン屋オットー,人狼,こんな感じではなしたほうがいいのかい？みなさん、キャラを迷走してはだめですわ！！そんなことしてますと絡ませづらいじゃありませんか。16人村……わたくしと下僕の人数を抜いて14人なんと、7組も掛け合わすことができますの！！すんばらしいですの！！今から興奮しますの！！とりあえず、下僕は私に仲が良さそうなペアをおいいなさい私がその掛け合わせを見極めますわ
プロローグ,司書クララ,人狼,。０〇（取りあえず乗っかったらなんか流れができてて、私よりも更に濃い人たちが集まってきてどうしようってなってたなんて今更言えない……）相談時間を設けることについては賛成です。０時ちょうどからとかがキリ良くていいかもしれませんね
プロローグ,農夫ヤコブ,村人,>>36老アンタの案オイラも賛成するっぺ！みんなの意見的に10分ぐらいがいいだな！
プロローグ,老人モーリッツ,狩人,相談時間は、もしあれだったら協力していいって人だけ１０分間沈黙って感じでもいいぜ！言いだしっぺだし俺は１５分間は沈黙してもいいぜ！ワイルドだろ～。ちなみにキャラの息切れは全員候補だと思うぜ～。
プロローグ,司書クララ,人狼,10分沈黙でも全く構いませんすでにキャラの息切れが始まっているのでお昼寝でもしましょうそうしましょう
プロローグ,少年ペーター,村人,師匠のキャラは愛に生きるタイプなのかー…？？？>>38ええー、んー…キャラ被りはまれによくあるから愛と根性とノリで見分けが付けばいいかなって下僕は思うよーこのエルナおねーさんガンガン行こうぜタイプだー！ 
プロローグ,パン屋オットー,人狼,ちなみに、灰考察なんてやってる最中にキャラのまま動いてみろ？俺なんて「ですわ」か「ですの」だけだ３文字無駄に、！マークなんてつけてたらそれこそ、疲れるわ……ですの！！
プロローグ,仕立て屋エルナ,村人,KY？空気は切り刻むもの。つうかオットーが一番迷走している件。あー。じゃ、付き合ってもいい奴だけ任意で0分～15分沈黙ってカンジかね。特に反対意見がなければ、そういう解釈をさせてもらうぜ。>>52老真っ先に息切れする奴が誰になるか賭けようぜ。俺はオットーに10円。
プロローグ,仕立て屋エルナ,村人,0分で草。沈黙する気ねえ。>>56は「10分～15分」、な。
プロローグ,行商人アルビン,霊能者,樵>>46おう、マカロンサンキュー。老>>52うん、喋りたい人は喋って、待ちたい人は待つって感じでいいんじゃないかね。私は多分適当に喋って眠くなったら寝る。フライパン屋さん面白いな。というか今更だけど皆キャラ濃いね。楽しい村になりそうだね。
プロローグ,老人モーリッツ,狩人,協力してくれるって言ってくれたみんなありがとだぜ！じゃあ【初日夜明け１０分間完全沈黙（強制ではない）】って感じで協力してくれる人よろしくだぜ！＞エルむしろオトは迷走キャラというキャラが確立されつつあるぜ！俺はディタか最初の発言以降ならず者によって言ってると思うぜ！それもまたキャラなのかもだけどな！
プロローグ,老人モーリッツ,狩人,＞アル意見ありがとだぜ！そんな感じで緩めに行こう！ってところで一旦離席するぜ！だんだん口調が強くなってきてる気がするが気のせいだぜ！ノシ
プロローグ,パン屋オットー,人狼,>>56突き合ってもいい…………なにをいっているんですの！？    ためですの、それは動物の道徳に反してますわ！！そんな腐ってないで、戻って来ないとだめですの！！ちなみに、私は村長✖老人という貫禄がある掛け合わせもいいと思いますの？★みなさんはどう思います？あ、あとエルナさんは私の中ではもうディーターさんと掛け合わさってますの！！だからみなさんはディータさんとエルナさんを見守ってほしいですの
プロローグ,少年ペーター,村人,んっんー。沈黙時間とかどうとかはどっちでもだから、下僕的にはやるならやろうぜーって感じ？一応みんなの略称置いておくよー？これで呼んでくれ的ななにかがあればいってほしいなーパン屋：屋、司書：書、神父：神、農夫：農、少女：妙、行商人：商、羊飼い：羊、青年：青、木こり：樵、村長：長、負傷兵：兵、老人：老、少年：年、仕立て屋：服で、合ってるはずー
プロローグ,負傷兵シモン,村人,シモンは総受けクララは総攻めそういうもの
プロローグ,負傷兵シモン,村人,１０分沈黙ありありだけど、ビンビンアルビンだけがしゃべってる状況にもしたくないから様子見て沈黙解除するつもりーもしかしたらアルビンとシモンの二人っきりの時間が作られるかもしれない…素敵…
プロローグ,パン屋オットー,人狼,>>56それではだめですわ！！やるなら皆で統一してやらなければおもしろくありませんの！、なので、全員統一するのがいいと思いますわとりあえず、【全員更新から沈黙時間は5～10分】ただし【役職判定とまとめ役の議事の投稿はその限りではありません】のまた、初心者COとかもだめですの！！もちろん異論は認めますの！！
プロローグ,パン屋オットー,人狼,>>下僕この口調のときは師匠ではなく【お姉さま】もしくは【お兄様】と呼びなさい>>63勝手に矢印の方向を決めてはだめですの！！むしろシモンさんは戦場の気に当てられて、表面上はさばさば系とみせかけて、内に熱いパトスを迸らせているタイプですの！！その秘めたパトスはいたいけなトーマスねえ様をおそってしまいますの！！つまり、兵×樵ですの！！ 正直、疲れましたの！！
プロローグ,少年ペーター,村人,んっんー。僕も師匠に賛成かなー。やるならやる、やらないならやらないで統一したほうが後々めんどくさいことにならないと思うんだー。具体的に言えば、「あの時この人はCOしたけどこの人は沈黙しててー」みたいな在籍時間推理なのかなんなのかわからない微妙な要素が出てきたりとかねで、もしやりたい人だけが沈黙時間採用ってするんなら今宣言しておいたほうが楽じゃないかなって思ったりする
プロローグ,行商人アルビン,霊能者,屋>>65悪いけど、明確に反対する。↓の8に国主様（ninjin氏）の見解が書かれてる。http://wolfbbs.jp/%A5%DE%A5%CA%A1%BC%A4%CB%B4%D8%A4%B9%A4%EB%B5%C4%CF%C0.html
プロローグ,行商人アルビン,霊能者,喋りたい人は喋っていいし、待ちたい人は待ってていい。どちらも強制する権利はない。と、私は思ってるのだけど。どうだろう。
プロローグ,老人モーリッツ,狩人,アルが言うとおり国主様が「もそも特殊ルールの提案自体無差別に人が入ってくるここですべきではないよね。全員が文句ないならまあいいかな、程度で。」って言ってるみたいだな。「夜明け後即全員発言しろ」って決まりがあるわけでもないから、黙りたい人が黙るぐらいがちょうどいいと思うぜ！俺も普通に寝落ちで朝まで沈黙するかもだしな！
プロローグ,少年ペーター,村人,んー、アルビンおにーさんのやつはみたよー。でも、師匠、ってかお姉さまは「そういうルールやるなら統一した方がいいとおもう」っていう提案だからマナー云々はまた別じゃないかなっておもうよ？変なこといってたらごめんねー。でも、うん。そゆことだからまー下僕は個人的には統一した方がめんどくさくないけどやりたい人だけーっていうならそっちで全然いいとはおもうよ
プロローグ,パン屋オットー,人狼,>>68商確かに、特殊ルールの提案はするべきではないと記載はされているね、なら強制はできないかな？なら【やらない人はやらなくてもいいし、強制もしない】ただ、やる人はやる以上、役職COのタイミングが早い、遅いとかのタイミングの追及や、発言順番の追及とかはしたらいけない。あと、早めに発言したから発言数がないとかもできるだけやめてね
プロローグ,少年ペーター,村人,ああ、うん。そゆことねぇ提案自体があんまりよくないよーってところは見落としてたね。ごめんごめん
プロローグ,老人モーリッツ,狩人,＞ペタ提案したのは俺だけどな！自分が悪くないのに謝るとはえらいな！アルとオトとペタなんか変な空気にして悪かったな！謝罪の意味を込めて、ちょっと村の周りを走ってくるぜ！！
プロローグ,負傷兵シモン,村人,さくら～ふぶ～きの～～～
プロローグ,負傷兵シモン,村人,サライ～～～のなかで～～～～～～～
プロローグ,負傷兵シモン,村人,若干歌詞まちがえてましたｗ
プロローグ,老人モーリッツ,狩人,２４時間走れってことか！？
プロローグ,行商人アルビン,霊能者,皆すまないね。こんなギャーギャー言っといて、私も普通に寝落ちて発言が朝になっちゃうかもしれない！そうなったら恥ずかしい！老>>74いや、一番空気を悪くしてるのは確実に私！私も村の周り走ってくる！
プロローグ,パン屋オットー,人狼,例えばの話、真占霊が沈黙反対でFO希望の場合、早々に役職COするでしょ？で、狼側が沈黙推奨をしていた場合、狼側が必然的に遅く占霊のCOするわけよ。そうした場合、「お前ら赤ログで話あってたんだろ～？あやしいんだぜ！！」とかはなしだよって言いたいのよまあ、あくまでも仮定の話ですの！！私も強制はしませんの。また、そこらへんは皆さんに任せますの。というより、正直私はどっちでもいいですの！！
プロローグ,神父ジムゾン,村人,こんばんは。真言宗シーア派の神父です。直近、なにか話があったようですが気にせずにメシフロ離脱します。みなさまに御仏の御加護がありますように。南無阿弥陀仏南無阿弥陀仏。**
プロローグ,羊飼いカタリナ,村人,きびきび走れよー
プロローグ,老人モーリッツ,狩人,なんかスポ根になってきたな！嫌いじゃないぜ！！
プロローグ,少年ペーター,村人,んー？夜明け以降で変なすれ違い起こしたくないからよかったといえばよかったかなーっておもうよー？>>74えへへー、僕偉いー？(にこにこ>>79健康マラソンが流行してるのかなぁ。下僕的にはなにも気にしてないんだけど、まあ、うん。気がすむならそれでいいんだー
プロローグ,パン屋オットー,人狼,>>78なにを言ってますのは……モーリッシさん。24時間どころか365日あなたは走るべきですの！！はしる～はしる～ですの！！そして、その熱い思いを村長にぶつけますの！！
プロローグ,農夫ヤコブ,村人,オイラは沈黙しないことにしたよ。やるならみんなでやらねーとあかんだべさそれにしてもみんな個性あるだなぁえ?
プロローグ,少年ペーター,村人,下僕はそうだなあ、うん。多分沈黙しないかなー？ってことをおいてゆるゆるー、っとな。夜明け後にまたねー**
プロローグ,負傷兵シモン,村人,しゃべる人がたくさん居るならシモンはしゃべらない…あまのじゃくなシモン…る～るるる～～～～
プロローグ,パン屋オットー,人狼,私の考えはすべて下僕がしゃべってくれますのだから私もまったりしますのまた、恋の悩みも聞きますのですの
プロローグ,少女リーザ,狂人,たっだいまー沈黙時間？やだよそんなの更新直後にいる意味ないって事じゃんね私は早く陣形固めてとっとこ寝たいの
プロローグ,木こりトーマス,村人,ご飯食べてきたわ、みんなただいま～そうね、考え方は十人十色ね、絶対やりたい！って人もいないみたいだし、今回は沈黙無しでよさそうね。アタシも沈黙無しで多分出ちゃうわね～お風呂入ってなければ～マカロンでも食べてゆるゆるいきましょ　つ[マカロン]
プロローグ,少女リーザ,狂人,しゃけのハラスを炭火焼きで食べたいな
プロローグ,木こりトーマス,村人,>>89　あら、恋のお話？いいわねぇところで、オトちゃんは恋のお悩みないのかしら？うふふ
プロローグ,農夫ヤコブ,村人,>>93あんたは恋の悩みねぇのかい?
プロローグ,仕立て屋エルナ,村人,【悲報】エルナ氏、更新時間を1時間見誤って入村していたことが発覚【▼服】突然の発言コマンド消失にビビってたらG1646だった件。結局、一周回って沈黙時間とやらはナシなんかね。まぁどちらでも構わんが（愛のある中立）
プロローグ,仕立て屋エルナ,村人,>>59老迷走にキャラ逃げすんのは反則だな。これはもう▼屋しかねぇわ（愛のある誘導）>>61屋☆ホモはノーセンキュー。どうしてもってんなら服は右に置いてほしい所存。恋のバトルとやらには期待。ゆるゆる観戦させていただく構え。
